alternative_id;nazwa;topsis_score;topsis_rank
03;RYBACTWO;0.5118249825533119;1.0
02;LEŚNICTWO I POZYSKIWANIE DREWNA;0.46764703667297514;2.0
51;TRANSPORT LOTNICZY;0.4656585909466941;3.0
64;FINANSOWA DZIAŁALNOŚĆ USŁUGOWA, Z WYŁĄCZENIEM UBEZPIECZEŃ I FUNDUSZY EMERYTALNYCH;0.4618609049332271;4.0
94;DZIAŁALNOŚĆ ORGANIZACJI CZŁONKOWSKICH;0.4577143988183304;5.0
70;DZIAŁALNOŚĆ CENTRAL (HEAD OFFICES) ORAZ DORADZTWO ZWIĄZANE Z ZARZĄDZANIEM;0.4115648839615842;6.0
58;DZIAŁALNOŚĆ WYDAWNICZA;0.4111365336251753;7.0
87;POMOC SPOŁECZNA Z ZAKWATEROWANIEM;0.40427390415298287;8.0
77;WYNAJEM I DZIERŻAWA;0.399183553890158;9.0
19;WYTWARZANIE I PRZETWARZANIE KOKSU I PRODUKTÓW RAFINACJI ROPY NAFTOWEJ;0.39885897406948095;10.0
85;EDUKACJA;0.3805286172988132;11.0
05;WYDOBYWANIE WĘGLA KAMIENNEGO I WĘGLA BRUNATNEGO (LIGNITU);0.37801483244768025;12.0
08;POZOSTAŁE GÓRNICTWO I WYDOBYWANIE;0.37308265977965593;13.0
79;DZIAŁALNOŚĆ ORGANIZATORÓW TURYSTYKI, AGENTÓW TURYSTYCZNYCH ORAZ POZOSTAŁA DZIAŁALNOŚĆ USŁUGOWA W ZAKRESIE REZERWACJI I DZIAŁALNOŚCI Z NIĄ ZWIĄZANE;0.3726034041322936;14.0
21;PRODUKCJA PODSTAWOWYCH SUBSTANCJI FARMACEUTYCZNYCH ORAZ LEKÓW I POZOSTAŁYCH WYROBÓW FARMACEUTYCZNYCH;0.3710903470300224;15.0
69;DZIAŁALNOŚĆ PRAWNICZA, RACHUNKOWO-KSIĘGOWA I DORADZTWO PODATKOWE;0.3658024364054247;16.0
63;DZIAŁALNOŚĆ USŁUGOWA W ZAKRESIE INFRASTRUKTURY OBLICZENIOWEJ, PRZETWARZANIA DANYCH, ZARZĄDZANIA STRONAMI INTERNETOWYMI (HOSTING) I POZOSTAŁA DZIAŁALNOŚĆ USŁUGOWA W ZAKRESIE INFORMACJI;0.36456718347957584;17.0
96;DZIAŁALNOŚĆ USŁUGOWA INDYWIDUALNA;0.3632668953162898;18.0
42;ROBOTY ZWIĄZANE Z BUDOWĄ OBIEKTÓW INŻYNIERII LĄDOWEJ I WODNEJ;0.3563097761408514;19.0
93;DZIAŁALNOŚĆ SPORTOWA, ROZRYWKOWA I REKREACYJNA;0.3557666809501843;20.0
14;PRODUKCJA ODZIEŻY;0.35480016519335456;21.0
59;DZIAŁALNOŚĆ ZWIĄZANA Z PRODUKCJĄ FILMÓW, NAGRAŃ WIDEO, PROGRAMÓW TELEWIZYJNYCH, NAGRAŃ DŹWIĘKOWYCH I MUZYCZNYCH;0.3543629725088419;22.0
01;UPRAWY ROLNE, CHÓW I HODOWLA ZWIERZĄT, ŁOWIECTWO, W TYM DZIAŁALNOŚĆ USŁUGOWA;0.3540989552687677;23.0
82;DZIAŁALNOŚĆ ZWIĄZANA Z ADMINISTRACYJNĄ OBSŁUGĄ BIURA I POZOSTAŁA DZIAŁALNOŚĆ WSPOMAGAJĄCA PROWADZENIE DZIAŁALNOŚCI GOSPODARCZEJ;0.3537561954268153;24.0
09;DZIAŁALNOŚĆ USŁUGOWA WSPOMAGAJĄCA GÓRNICTWO I WYDOBYWANIE;0.3537417447175788;25.0
60;NADAWANIE PROGRAMÓW OGÓLNODOSTĘPNYCH I ABONAMENTOWYCH, DZIAŁALNOŚĆ AGENCJI INFORMACYJNYCH I POZOSTAŁA DZIAŁALNOŚĆ ZWIĄZANA Z DYSTRYBUCJĄ TREŚCI;0.3526882689669622;26.0
55;ZAKWATEROWANIE;0.3502730516930944;27.0
11;PRODUKCJA NAPOJÓW;0.34410485910016775;28.0
43;ROBOTY BUDOWLANE SPECJALISTYCZNE;0.34346884741011247;29.0
90;DZIAŁALNOŚĆ TWÓRCZA I DZIAŁALNOŚĆ ZWIĄZANA Z WYSTAWIANIEM PRZEDSTAWIEŃ ARTYSTYCZNYCH;0.3422771105136952;30.0
38;DZIAŁALNOŚĆ ZWIĄZANA ZE ZBIERANIEM, ODZYSKIEM I UNIESZKODLIWIANIEM ODPADÓW;0.34185497754188837;31.0
62;DZIAŁALNOŚĆ ZWIĄZANA Z PROGRAMOWANIEM, DORADZTWEM W ZAKRESIE INFORMATYKI I DZIAŁALNOŚCI POWIĄZANE;0.3414802156138317;32.0
56;DZIAŁALNOŚĆ USŁUGOWA ZWIĄZANA Z WYŻYWIENIEM;0.3413366333846959;33.0
81;DZIAŁALNOŚĆ USŁUGOWA ZWIĄZANA Z UTRZYMANIEM PORZĄDKU W BUDYNKACH I ZAGOSPODAROWANIEM TERENÓW ZIELENI;0.3402223455701812;34.0
78;DZIAŁALNOŚĆ ZWIĄZANA Z ZATRUDNIENIEM;0.338249292216907;35.0
91;DZIAŁALNOŚĆ BIBLIOTEK, ARCHIWÓW, MUZEÓW ORAZ POZOSTAŁA DZIAŁALNOŚĆ ZWIĄZANA Z KULTURĄ;0.33656470237128094;36.0
18;POLIGRAFIA I REPRODUKCJA ZAPISANYCH NOŚNIKÓW INFORMACJI;0.33534417510687003;37.0
66;DZIAŁALNOŚĆ WSPOMAGAJĄCA USŁUGI FINANSOWE, UBEZPIECZENIA I FUNDUSZE EMERYTALNE;0.3324691800074272;38.0
22;PRODUKCJA WYROBÓW Z GUMY I TWORZYW SZTUCZNYCH;0.3319540902324412;39.0
32;POZOSTAŁA PRODUKCJA WYROBÓW;0.3317439631104003;40.0
61;TELEKOMUNIKACJA;0.3310710607456421;41.0
52;MAGAZYNOWANIE, PRZECHOWYWANIE I DZIAŁALNOŚĆ USŁUGOWA WSPOMAGAJĄCA TRANSPORT;0.33040961246311285;42.0
23;PRODUKCJA WYROBÓW Z POZOSTAŁYCH MINERALNYCH SUROWCÓW NIEMETALICZNYCH;0.33009887381913255;43.0
13;PRODUKCJA WYROBÓW TEKSTYLNYCH;0.3300465296666157;44.0
73;DZIAŁALNOŚĆ W ZAKRESIE REKLAMY, BADANIA RYNKU I PUBLIC RELATIONS;0.3297740343555376;45.0
41;ROBOTY BUDOWLANE ZWIĄZANE ZE WZNOSZENIEM BUDYNKÓW MIESZKALNYCH I NIEMIESZKALNYCH;0.3296766447281439;46.0
86;OPIEKA ZDROWOTNA;0.32703980986433057;47.0
25;PRODUKCJA METALOWYCH WYROBÓW GOTOWYCH, Z WYŁĄCZENIEM MASZYN I URZĄDZEŃ;0.32424050264456905;48.0
71;"DZIAŁALNOŚĆ W ZAKRESIE ARCHITEKTURY I INŻYNIERII; BADANIA I ANALIZY TECHNICZNE";0.3238957307005808;49.0
17;PRODUKCJA PAPIERU I WYROBÓW Z PAPIERU;0.3236829378102613;50.0
10;PRODUKCJA ARTYKUŁÓW SPOŻYWCZYCH;0.32346577482674194;51.0
39;DZIAŁALNOŚĆ ZWIĄZANA Z REKULTYWACJĄ I POZOSTAŁA DZIAŁALNOŚĆ USŁUGOWA ZWIĄZANA Z GOSPODARKĄ ODPADAMI;0.3234656351281742;52.0
92;DZIAŁALNOŚĆ ZWIĄZANA Z GRAMI HAZARDOWYMI;0.3228036407511419;53.0
31;PRODUKCJA MEBLI;0.3222063610447971;54.0
74;POZOSTAŁA DZIAŁALNOŚĆ PROFESJONALNA, NAUKOWA I TECHNICZNA;0.3214139646175164;55.0
28;PRODUKCJA MASZYN I URZĄDZEŃ, GDZIE INDZIEJ NIESKLASYFIKOWANA;0.3208449390730662;56.0
06;GÓRNICTWO ROPY NAFTOWEJ I GAZU ZIEMNEGO;0.3188826236062481;57.0
30;PRODUKCJA POZOSTAŁEGO SPRZĘTU TRANSPORTOWEGO;0.3174605178651442;58.0
65;DZIAŁALNOŚĆ W ZAKRESIE UBEZPIECZEŃ, REASEKURACJI ORAZ FUNDUSZY EMERYTALNYCH, Z WYŁĄCZENIEM OBOWIĄZKOWEGO UBEZPIECZENIA SPOŁECZNEGO;0.31704576059654255;59.0
99;ORGANIZACJE I ZESPOŁY EKSTERYTORIALNE;0.316855937097743;60.0
97;GOSPODARSTWA DOMOWE ZATRUDNIAJĄCE PRACOWNIKÓW;0.31682789456565824;61.5
98;GOSPODARSTWA DOMOWE PRODUKUJĄCE WYROBY I ŚWIADCZĄCE USŁUGI NA WŁASNE POTRZEBY;0.31682789456565824;61.5
07;GÓRNICTWO RUD METALI;0.3164163028962059;63.0
84;"ADMINISTRACJA PUBLICZNA I OBRONA NARODOWA; OBOWIĄZKOWE UBEZPIECZENIA SPOŁECZNE";0.3154745433466214;64.0
50;TRANSPORT WODNY;0.31541374877096223;65.0
26;PRODUKCJA KOMPUTERÓW, WYROBÓW ELEKTRONICZNYCH I OPTYCZNYCH;0.3131037222943341;66.0
80;DZIAŁALNOŚĆ DETEKTYWISTYCZNA I OCHRONIARSKA;0.31300509116664793;67.0
68;DZIAŁALNOŚĆ ZWIĄZANA Z OBSŁUGĄ RYNKU NIERUCHOMOŚCI;0.3116784991953644;68.0
49;TRANSPORT LĄDOWY ORAZ TRANSPORT RUROCIĄGOWY;0.30888407781060295;69.0
95;NAPRAWA I KONSERWACJA KOMPUTERÓW, ARTYKUŁÓW UŻYTKU OSOBISTEGO I DOMOWEGO ORAZ POJAZDÓW SILNIKOWYCH, W TYM MOTOCYKLI;0.30861797189608775;70.0
46;HANDEL HURTOWY;0.30570929565726546;71.0
16;"PRODUKCJA WYROBÓW Z DREWNA I KORKA, Z WYŁĄCZENIEM MEBLI; PRODUKCJA WYROBÓW ZE SŁOMY I MATERIAŁÓW UŻYWANYCH DO WYPLATANIA";0.3055318446954138;72.0
15;PRODUKCJA SKÓR I WYROBÓW ZE SKÓR WYPRAWIONYCH, PRODUKCJA PODOBNYCH WYROBÓW Z INNYCH MATERIAŁÓW;0.30524978909345474;73.0
33;NAPRAWA, KONSERWACJA I INSTALOWANIE MASZYN I URZĄDZEŃ;0.3024377483399727;74.0
27;PRODUKCJA URZĄDZEŃ ELEKTRYCZNYCH;0.30028181592551567;75.0
12;PRODUKCJA WYROBÓW TYTONIOWYCH;0.30006833043908854;76.0
47;HANDEL DETALICZNY;0.2969577901731228;77.0
88;POMOC SPOŁECZNA BEZ ZAKWATEROWANIA;0.2920896897043304;78.0
29;PRODUKCJA POJAZDÓW SILNIKOWYCH, PRODUKCJA PRZYCZEP I NACZEP;0.29053703709241746;79.0
75;DZIAŁALNOŚĆ WETERYNARYJNA;0.28830390683205137;80.0
35;WYTWARZANIE I ZAOPATRYWANIE W ENERGIĘ ELEKTRYCZNĄ, GAZ, PARĘ WODNĄ I POWIETRZE DO UKŁADÓW KLIMATYZACYJNYCH;0.2875665506957061;81.0
53;DZIAŁALNOŚĆ POCZTOWA I KURIERSKA;0.2855294969367162;82.0
37;ODPROWADZANIE I OCZYSZCZANIE ŚCIEKÓW;0.2837745003639833;83.0
20;PRODUKCJA CHEMIKALIÓW I WYROBÓW CHEMICZNYCH;0.2768988171611484;84.0
24;PRODUKCJA METALI;0.27656193549756425;85.0
36;POBÓR, UZDATNIANIE I DOSTARCZANIE WODY;0.25863188994031167;86.0
72;BADANIA NAUKOWE I PRACE ROZWOJOWE;0.16356002223627122;87.0
