alternative_id;nazwa;monte_carlo_score;monte_carlo_rank
94;DZIAŁALNOŚĆ ORGANIZACJI CZŁONKOWSKICH;0.5713101283872712;1.0
03;RYBACTWO;0.5404665561357035;2.0
58;DZIAŁALNOŚĆ WYDAWNICZA;0.48626295102678907;3.0
02;LEŚNICTWO I POZYSKIWANIE DREWNA;0.48311530178529793;4.0
51;TRANSPORT LOTNICZY;0.4808288337103519;5.0
05;WYDOBYWANIE WĘGLA KAMIENNEGO I WĘGLA BRUNATNEGO (LIGNITU);0.47912622186796433;6.0
85;EDUKACJA;0.4789166623973713;7.0
66;DZIAŁALNOŚĆ WSPOMAGAJĄCA USŁUGI FINANSOWE, UBEZPIECZENIA I FUNDUSZE EMERYTALNE;0.4692321495542148;8.0
77;WYNAJEM I DZIERŻAWA;0.4574504193754264;9.0
50;TRANSPORT WODNY;0.45602998530169364;10.0
14;PRODUKCJA ODZIEŻY;0.45150922405999205;11.0
63;DZIAŁALNOŚĆ USŁUGOWA W ZAKRESIE INFRASTRUKTURY OBLICZENIOWEJ, PRZETWARZANIA DANYCH, ZARZĄDZANIA STRONAMI INTERNETOWYMI (HOSTING) I POZOSTAŁA DZIAŁALNOŚĆ USŁUGOWA W ZAKRESIE INFORMACJI;0.4496760755744525;12.0
08;POZOSTAŁE GÓRNICTWO I WYDOBYWANIE;0.4467404771524767;13.0
64;FINANSOWA DZIAŁALNOŚĆ USŁUGOWA, Z WYŁĄCZENIEM UBEZPIECZEŃ I FUNDUSZY EMERYTALNYCH;0.4381493006187159;14.0
82;DZIAŁALNOŚĆ ZWIĄZANA Z ADMINISTRACYJNĄ OBSŁUGĄ BIURA I POZOSTAŁA DZIAŁALNOŚĆ WSPOMAGAJĄCA PROWADZENIE DZIAŁALNOŚCI GOSPODARCZEJ;0.4368189873784279;15.0
75;DZIAŁALNOŚĆ WETERYNARYJNA;0.43461913735909385;16.0
38;DZIAŁALNOŚĆ ZWIĄZANA ZE ZBIERANIEM, ODZYSKIEM I UNIESZKODLIWIANIEM ODPADÓW;0.43446086107679843;17.0
01;UPRAWY ROLNE, CHÓW I HODOWLA ZWIERZĄT, ŁOWIECTWO, W TYM DZIAŁALNOŚĆ USŁUGOWA;0.43244916589993115;18.0
69;DZIAŁALNOŚĆ PRAWNICZA, RACHUNKOWO-KSIĘGOWA I DORADZTWO PODATKOWE;0.42728270956683634;19.0
62;DZIAŁALNOŚĆ ZWIĄZANA Z PROGRAMOWANIEM, DORADZTWEM W ZAKRESIE INFORMATYKI I DZIAŁALNOŚCI POWIĄZANE;0.42720268133319145;20.0
19;WYTWARZANIE I PRZETWARZANIE KOKSU I PRODUKTÓW RAFINACJI ROPY NAFTOWEJ;0.42698488046299954;21.0
32;POZOSTAŁA PRODUKCJA WYROBÓW;0.42632595803979667;22.0
18;POLIGRAFIA I REPRODUKCJA ZAPISANYCH NOŚNIKÓW INFORMACJI;0.4261347016949959;23.0
79;DZIAŁALNOŚĆ ORGANIZATORÓW TURYSTYKI, AGENTÓW TURYSTYCZNYCH ORAZ POZOSTAŁA DZIAŁALNOŚĆ USŁUGOWA W ZAKRESIE REZERWACJI I DZIAŁALNOŚCI Z NIĄ ZWIĄZANE;0.42557517771288744;24.0
42;ROBOTY ZWIĄZANE Z BUDOWĄ OBIEKTÓW INŻYNIERII LĄDOWEJ I WODNEJ;0.4249216759820798;25.0
52;MAGAZYNOWANIE, PRZECHOWYWANIE I DZIAŁALNOŚĆ USŁUGOWA WSPOMAGAJĄCA TRANSPORT;0.42488044348780524;26.0
87;POMOC SPOŁECZNA Z ZAKWATEROWANIEM;0.4246263237784297;27.0
09;DZIAŁALNOŚĆ USŁUGOWA WSPOMAGAJĄCA GÓRNICTWO I WYDOBYWANIE;0.4231527556123146;28.0
61;TELEKOMUNIKACJA;0.42313779967102216;29.0
22;PRODUKCJA WYROBÓW Z GUMY I TWORZYW SZTUCZNYCH;0.4216106099096763;30.0
43;ROBOTY BUDOWLANE SPECJALISTYCZNE;0.42137945953452627;31.0
81;DZIAŁALNOŚĆ USŁUGOWA ZWIĄZANA Z UTRZYMANIEM PORZĄDKU W BUDYNKACH I ZAGOSPODAROWANIEM TERENÓW ZIELENI;0.4207078665889857;32.0
17;PRODUKCJA PAPIERU I WYROBÓW Z PAPIERU;0.42020936002985065;33.0
37;ODPROWADZANIE I OCZYSZCZANIE ŚCIEKÓW;0.41975721324559195;34.0
13;PRODUKCJA WYROBÓW TEKSTYLNYCH;0.41875890404630295;35.0
31;PRODUKCJA MEBLI;0.41503623155408953;36.0
23;PRODUKCJA WYROBÓW Z POZOSTAŁYCH MINERALNYCH SUROWCÓW NIEMETALICZNYCH;0.4138416362453068;37.0
10;PRODUKCJA ARTYKUŁÓW SPOŻYWCZYCH;0.4134442980030545;38.0
11;PRODUKCJA NAPOJÓW;0.4129807391738407;39.0
56;DZIAŁALNOŚĆ USŁUGOWA ZWIĄZANA Z WYŻYWIENIEM;0.41206622167676593;40.0
96;DZIAŁALNOŚĆ USŁUGOWA INDYWIDUALNA;0.411211153297562;41.0
39;DZIAŁALNOŚĆ ZWIĄZANA Z REKULTYWACJĄ I POZOSTAŁA DZIAŁALNOŚĆ USŁUGOWA ZWIĄZANA Z GOSPODARKĄ ODPADAMI;0.4106476179449467;42.0
71;"DZIAŁALNOŚĆ W ZAKRESIE ARCHITEKTURY I INŻYNIERII; BADANIA I ANALIZY TECHNICZNE";0.4104163811325443;43.0
41;ROBOTY BUDOWLANE ZWIĄZANE ZE WZNOSZENIEM BUDYNKÓW MIESZKALNYCH I NIEMIESZKALNYCH;0.4098100619650436;44.0
26;PRODUKCJA KOMPUTERÓW, WYROBÓW ELEKTRONICZNYCH I OPTYCZNYCH;0.40842503769284433;45.0
59;DZIAŁALNOŚĆ ZWIĄZANA Z PRODUKCJĄ FILMÓW, NAGRAŃ WIDEO, PROGRAMÓW TELEWIZYJNYCH, NAGRAŃ DŹWIĘKOWYCH I MUZYCZNYCH;0.40731050075902936;46.0
28;PRODUKCJA MASZYN I URZĄDZEŃ, GDZIE INDZIEJ NIESKLASYFIKOWANA;0.4068377725765404;47.0
78;DZIAŁALNOŚĆ ZWIĄZANA Z ZATRUDNIENIEM;0.4063320047806935;48.0
25;PRODUKCJA METALOWYCH WYROBÓW GOTOWYCH, Z WYŁĄCZENIEM MASZYN I URZĄDZEŃ;0.40621018223015;49.0
74;POZOSTAŁA DZIAŁALNOŚĆ PROFESJONALNA, NAUKOWA I TECHNICZNA;0.40396445932944436;50.0
93;DZIAŁALNOŚĆ SPORTOWA, ROZRYWKOWA I REKREACYJNA;0.40335019315979725;51.0
86;OPIEKA ZDROWOTNA;0.4012577079190753;52.0
16;"PRODUKCJA WYROBÓW Z DREWNA I KORKA, Z WYŁĄCZENIEM MEBLI; PRODUKCJA WYROBÓW ZE SŁOMY I MATERIAŁÓW UŻYWANYCH DO WYPLATANIA";0.4002130681144577;53.0
73;DZIAŁALNOŚĆ W ZAKRESIE REKLAMY, BADANIA RYNKU I PUBLIC RELATIONS;0.39840542123634604;54.0
65;DZIAŁALNOŚĆ W ZAKRESIE UBEZPIECZEŃ, REASEKURACJI ORAZ FUNDUSZY EMERYTALNYCH, Z WYŁĄCZENIEM OBOWIĄZKOWEGO UBEZPIECZENIA SPOŁECZNEGO;0.39673443073017156;55.0
95;NAPRAWA I KONSERWACJA KOMPUTERÓW, ARTYKUŁÓW UŻYTKU OSOBISTEGO I DOMOWEGO ORAZ POJAZDÓW SILNIKOWYCH, W TYM MOTOCYKLI;0.3962996251359531;56.0
07;GÓRNICTWO RUD METALI;0.39623955955821233;57.0
84;"ADMINISTRACJA PUBLICZNA I OBRONA NARODOWA; OBOWIĄZKOWE UBEZPIECZENIA SPOŁECZNE";0.3957537261303712;58.0
30;PRODUKCJA POZOSTAŁEGO SPRZĘTU TRANSPORTOWEGO;0.39546737178608077;59.0
49;TRANSPORT LĄDOWY ORAZ TRANSPORT RUROCIĄGOWY;0.39484851501499985;60.0
06;GÓRNICTWO ROPY NAFTOWEJ I GAZU ZIEMNEGO;0.3940821112047908;61.0
46;HANDEL HURTOWY;0.392950011037802;62.0
97;GOSPODARSTWA DOMOWE ZATRUDNIAJĄCE PRACOWNIKÓW;0.3927589445651677;63.0
99;ORGANIZACJE I ZESPOŁY EKSTERYTORIALNE;0.39262459665547567;64.0
98;GOSPODARSTWA DOMOWE PRODUKUJĄCE WYROBY I ŚWIADCZĄCE USŁUGI NA WŁASNE POTRZEBY;0.39260590016391056;65.0
80;DZIAŁALNOŚĆ DETEKTYWISTYCZNA I OCHRONIARSKA;0.3913343175122991;66.0
27;PRODUKCJA URZĄDZEŃ ELEKTRYCZNYCH;0.38987874385406857;67.0
21;PRODUKCJA PODSTAWOWYCH SUBSTANCJI FARMACEUTYCZNYCH ORAZ LEKÓW I POZOSTAŁYCH WYROBÓW FARMACEUTYCZNYCH;0.3895820096824899;68.0
15;PRODUKCJA SKÓR I WYROBÓW ZE SKÓR WYPRAWIONYCH, PRODUKCJA PODOBNYCH WYROBÓW Z INNYCH MATERIAŁÓW;0.3886302044718174;69.0
35;WYTWARZANIE I ZAOPATRYWANIE W ENERGIĘ ELEKTRYCZNĄ, GAZ, PARĘ WODNĄ I POWIETRZE DO UKŁADÓW KLIMATYZACYJNYCH;0.3862453798385525;70.0
60;NADAWANIE PROGRAMÓW OGÓLNODOSTĘPNYCH I ABONAMENTOWYCH, DZIAŁALNOŚĆ AGENCJI INFORMACYJNYCH I POZOSTAŁA DZIAŁALNOŚĆ ZWIĄZANA Z DYSTRYBUCJĄ TREŚCI;0.3833070678889917;71.0
33;NAPRAWA, KONSERWACJA I INSTALOWANIE MASZYN I URZĄDZEŃ;0.38229018205945;72.0
24;PRODUKCJA METALI;0.3822886493153806;73.0
90;DZIAŁALNOŚĆ TWÓRCZA I DZIAŁALNOŚĆ ZWIĄZANA Z WYSTAWIANIEM PRZEDSTAWIEŃ ARTYSTYCZNYCH;0.38078416429908984;74.0
88;POMOC SPOŁECZNA BEZ ZAKWATEROWANIA;0.38013249106588193;75.0
47;HANDEL DETALICZNY;0.37470016310634974;76.0
55;ZAKWATEROWANIE;0.3726190293414151;77.0
92;DZIAŁALNOŚĆ ZWIĄZANA Z GRAMI HAZARDOWYMI;0.36810478158373505;78.0
91;DZIAŁALNOŚĆ BIBLIOTEK, ARCHIWÓW, MUZEÓW ORAZ POZOSTAŁA DZIAŁALNOŚĆ ZWIĄZANA Z KULTURĄ;0.36761931449143576;79.0
29;PRODUKCJA POJAZDÓW SILNIKOWYCH, PRODUKCJA PRZYCZEP I NACZEP;0.3644927785432091;80.0
20;PRODUKCJA CHEMIKALIÓW I WYROBÓW CHEMICZNYCH;0.35176191237854554;81.0
12;PRODUKCJA WYROBÓW TYTONIOWYCH;0.3491304142193269;82.0
68;DZIAŁALNOŚĆ ZWIĄZANA Z OBSŁUGĄ RYNKU NIERUCHOMOŚCI;0.33961779289502403;83.0
53;DZIAŁALNOŚĆ POCZTOWA I KURIERSKA;0.33791269963329235;84.0
36;POBÓR, UZDATNIANIE I DOSTARCZANIE WODY;0.33229018274603955;85.0
72;BADANIA NAUKOWE I PRACE ROZWOJOWE;0.3239029704997772;86.0
70;DZIAŁALNOŚĆ CENTRAL (HEAD OFFICES) ORAZ DORADZTWO ZWIĄZANE Z ZARZĄDZANIEM;0.3163775190199531;87.0
