alternative_id;nazwa;monte_carlo_score;monte_carlo_rank
75;DZIAŁALNOŚĆ WETERYNARYJNA;0.45031150404702297;1.0
92;DZIAŁALNOŚĆ ZWIĄZANA Z GRAMI HAZARDOWYMI;0.4398759075639371;2.0
94;DZIAŁALNOŚĆ ORGANIZACJI CZŁONKOWSKICH;0.4110442897067737;3.0
05;WYDOBYWANIE WĘGLA KAMIENNEGO I WĘGLA BRUNATNEGO (LIGNITU);0.40499188915953516;4.0
64;FINANSOWA DZIAŁALNOŚĆ USŁUGOWA, Z WYŁĄCZENIEM UBEZPIECZEŃ I FUNDUSZY EMERYTALNYCH;0.4009489990185842;5.0
70;DZIAŁALNOŚĆ CENTRAL (HEAD OFFICES) ORAZ DORADZTWO ZWIĄZANE Z ZARZĄDZANIEM;0.365240198533218;6.0
51;TRANSPORT LOTNICZY;0.36289092443285587;7.0
77;WYNAJEM I DZIERŻAWA;0.34737371142410384;8.0
91;DZIAŁALNOŚĆ BIBLIOTEK, ARCHIWÓW, MUZEÓW ORAZ POZOSTAŁA DZIAŁALNOŚĆ ZWIĄZANA Z KULTURĄ;0.34616536118141195;9.0
69;DZIAŁALNOŚĆ PRAWNICZA, RACHUNKOWO-KSIĘGOWA I DORADZTWO PODATKOWE;0.3391344446605388;10.0
53;DZIAŁALNOŚĆ POCZTOWA I KURIERSKA;0.32305315836713205;11.0
55;ZAKWATEROWANIE;0.3229981228600759;12.0
50;TRANSPORT WODNY;0.31957670337032146;13.0
03;RYBACTWO;0.3133001280744507;14.0
37;ODPROWADZANIE I OCZYSZCZANIE ŚCIEKÓW;0.3099931163078969;15.0
96;DZIAŁALNOŚĆ USŁUGOWA INDYWIDUALNA;0.3080624048869326;16.0
58;DZIAŁALNOŚĆ WYDAWNICZA;0.3063086750636658;17.0
59;DZIAŁALNOŚĆ ZWIĄZANA Z PRODUKCJĄ FILMÓW, NAGRAŃ WIDEO, PROGRAMÓW TELEWIZYJNYCH, NAGRAŃ DŹWIĘKOWYCH I MUZYCZNYCH;0.30155147829692086;18.0
35;WYTWARZANIE I ZAOPATRYWANIE W ENERGIĘ ELEKTRYCZNĄ, GAZ, PARĘ WODNĄ I POWIETRZE DO UKŁADÓW KLIMATYZACYJNYCH;0.29799389808018656;19.0
68;DZIAŁALNOŚĆ ZWIĄZANA Z OBSŁUGĄ RYNKU NIERUCHOMOŚCI;0.2979708465778135;20.0
15;PRODUKCJA SKÓR I WYROBÓW ZE SKÓR WYPRAWIONYCH, PRODUKCJA PODOBNYCH WYROBÓW Z INNYCH MATERIAŁÓW;0.2975964762202721;21.0
02;LEŚNICTWO I POZYSKIWANIE DREWNA;0.29718133720418954;22.0
63;DZIAŁALNOŚĆ USŁUGOWA W ZAKRESIE INFRASTRUKTURY OBLICZENIOWEJ, PRZETWARZANIA DANYCH, ZARZĄDZANIA STRONAMI INTERNETOWYMI (HOSTING) I POZOSTAŁA DZIAŁALNOŚĆ USŁUGOWA W ZAKRESIE INFORMACJI;0.291559907357888;23.0
01;UPRAWY ROLNE, CHÓW I HODOWLA ZWIERZĄT, ŁOWIECTWO, W TYM DZIAŁALNOŚĆ USŁUGOWA;0.2905189880361808;24.0
73;DZIAŁALNOŚĆ W ZAKRESIE REKLAMY, BADANIA RYNKU I PUBLIC RELATIONS;0.2901440676200614;25.0
08;POZOSTAŁE GÓRNICTWO I WYDOBYWANIE;0.2874499203171706;26.0
87;POMOC SPOŁECZNA Z ZAKWATEROWANIEM;0.28739020974742385;27.0
09;DZIAŁALNOŚĆ USŁUGOWA WSPOMAGAJĄCA GÓRNICTWO I WYDOBYWANIE;0.28685913905261806;28.0
17;PRODUKCJA PAPIERU I WYROBÓW Z PAPIERU;0.2854076406467765;29.0
61;TELEKOMUNIKACJA;0.28488136078375953;30.0
74;POZOSTAŁA DZIAŁALNOŚĆ PROFESJONALNA, NAUKOWA I TECHNICZNA;0.28472934232416325;31.0
23;PRODUKCJA WYROBÓW Z POZOSTAŁYCH MINERALNYCH SUROWCÓW NIEMETALICZNYCH;0.2822820681294209;32.0
56;DZIAŁALNOŚĆ USŁUGOWA ZWIĄZANA Z WYŻYWIENIEM;0.2785382464269187;33.0
19;WYTWARZANIE I PRZETWARZANIE KOKSU I PRODUKTÓW RAFINACJI ROPY NAFTOWEJ;0.2770183291677447;34.0
62;DZIAŁALNOŚĆ ZWIĄZANA Z PROGRAMOWANIEM, DORADZTWEM W ZAKRESIE INFORMATYKI I DZIAŁALNOŚCI POWIĄZANE;0.276782016635622;35.0
20;PRODUKCJA CHEMIKALIÓW I WYROBÓW CHEMICZNYCH;0.27677682817492044;36.0
28;PRODUKCJA MASZYN I URZĄDZEŃ, GDZIE INDZIEJ NIESKLASYFIKOWANA;0.2763495971193454;37.0
14;PRODUKCJA ODZIEŻY;0.27526838969004064;38.0
88;POMOC SPOŁECZNA BEZ ZAKWATEROWANIA;0.275122056968224;39.0
60;NADAWANIE PROGRAMÓW OGÓLNODOSTĘPNYCH I ABONAMENTOWYCH, DZIAŁALNOŚĆ AGENCJI INFORMACYJNYCH I POZOSTAŁA DZIAŁALNOŚĆ ZWIĄZANA Z DYSTRYBUCJĄ TREŚCI;0.2750670333763872;40.0
18;POLIGRAFIA I REPRODUKCJA ZAPISANYCH NOŚNIKÓW INFORMACJI;0.27293762460076676;41.0
71;"DZIAŁALNOŚĆ W ZAKRESIE ARCHITEKTURY I INŻYNIERII; BADANIA I ANALIZY TECHNICZNE";0.2703165062548565;42.0
36;POBÓR, UZDATNIANIE I DOSTARCZANIE WODY;0.2677863559599279;43.0
11;PRODUKCJA NAPOJÓW;0.26223343717304476;44.0
21;PRODUKCJA PODSTAWOWYCH SUBSTANCJI FARMACEUTYCZNYCH ORAZ LEKÓW I POZOSTAŁYCH WYROBÓW FARMACEUTYCZNYCH;0.2618619069985869;45.0
32;POZOSTAŁA PRODUKCJA WYROBÓW;0.2613820075130359;46.0
66;DZIAŁALNOŚĆ WSPOMAGAJĄCA USŁUGI FINANSOWE, UBEZPIECZENIA I FUNDUSZE EMERYTALNE;0.2606481370630368;47.0
22;PRODUKCJA WYROBÓW Z GUMY I TWORZYW SZTUCZNYCH;0.2601290044080952;48.0
07;GÓRNICTWO RUD METALI;0.2598539504616438;49.0
30;PRODUKCJA POZOSTAŁEGO SPRZĘTU TRANSPORTOWEGO;0.2596618191104962;50.0
43;ROBOTY BUDOWLANE SPECJALISTYCZNE;0.25930493674671684;51.0
16;"PRODUKCJA WYROBÓW Z DREWNA I KORKA, Z WYŁĄCZENIEM MEBLI; PRODUKCJA WYROBÓW ZE SŁOMY I MATERIAŁÓW UŻYWANYCH DO WYPLATANIA";0.25877060734746915;52.0
38;DZIAŁALNOŚĆ ZWIĄZANA ZE ZBIERANIEM, ODZYSKIEM I UNIESZKODLIWIANIEM ODPADÓW;0.258053676767797;53.0
49;TRANSPORT LĄDOWY ORAZ TRANSPORT RUROCIĄGOWY;0.2578886061463752;54.0
33;NAPRAWA, KONSERWACJA I INSTALOWANIE MASZYN I URZĄDZEŃ;0.25643364915265726;55.0
85;EDUKACJA;0.2559602309694353;56.0
06;GÓRNICTWO ROPY NAFTOWEJ I GAZU ZIEMNEGO;0.2554072304350961;57.0
98;GOSPODARSTWA DOMOWE PRODUKUJĄCE WYROBY I ŚWIADCZĄCE USŁUGI NA WŁASNE POTRZEBY;0.25540543750766487;58.0
97;GOSPODARSTWA DOMOWE ZATRUDNIAJĄCE PRACOWNIKÓW;0.2553318254470062;59.0
65;DZIAŁALNOŚĆ W ZAKRESIE UBEZPIECZEŃ, REASEKURACJI ORAZ FUNDUSZY EMERYTALNYCH, Z WYŁĄCZENIEM OBOWIĄZKOWEGO UBEZPIECZENIA SPOŁECZNEGO;0.25521115244601833;60.0
99;ORGANIZACJE I ZESPOŁY EKSTERYTORIALNE;0.2552087438820577;61.0
84;"ADMINISTRACJA PUBLICZNA I OBRONA NARODOWA; OBOWIĄZKOWE UBEZPIECZENIA SPOŁECZNE";0.2551449635354646;62.0
25;PRODUKCJA METALOWYCH WYROBÓW GOTOWYCH, Z WYŁĄCZENIEM MASZYN I URZĄDZEŃ;0.2527754630104042;63.0
81;DZIAŁALNOŚĆ USŁUGOWA ZWIĄZANA Z UTRZYMANIEM PORZĄDKU W BUDYNKACH I ZAGOSPODAROWANIEM TERENÓW ZIELENI;0.2525773077969903;64.0
31;PRODUKCJA MEBLI;0.2507633065282266;65.0
79;DZIAŁALNOŚĆ ORGANIZATORÓW TURYSTYKI, AGENTÓW TURYSTYCZNYCH ORAZ POZOSTAŁA DZIAŁALNOŚĆ USŁUGOWA W ZAKRESIE REZERWACJI I DZIAŁALNOŚCI Z NIĄ ZWIĄZANE;0.24989571861938;66.0
41;ROBOTY BUDOWLANE ZWIĄZANE ZE WZNOSZENIEM BUDYNKÓW MIESZKALNYCH I NIEMIESZKALNYCH;0.24905554286024476;67.0
12;PRODUKCJA WYROBÓW TYTONIOWYCH;0.24798769610181678;68.0
13;PRODUKCJA WYROBÓW TEKSTYLNYCH;0.24703744898583385;69.0
42;ROBOTY ZWIĄZANE Z BUDOWĄ OBIEKTÓW INŻYNIERII LĄDOWEJ I WODNEJ;0.24539055385918512;70.0
72;BADANIA NAUKOWE I PRACE ROZWOJOWE;0.24344215025100044;71.0
10;PRODUKCJA ARTYKUŁÓW SPOŻYWCZYCH;0.24251615431449616;72.0
24;PRODUKCJA METALI;0.23918032321656008;73.0
29;PRODUKCJA POJAZDÓW SILNIKOWYCH, PRODUKCJA PRZYCZEP I NACZEP;0.23633972725611851;74.0
39;DZIAŁALNOŚĆ ZWIĄZANA Z REKULTYWACJĄ I POZOSTAŁA DZIAŁALNOŚĆ USŁUGOWA ZWIĄZANA Z GOSPODARKĄ ODPADAMI;0.23433489696316595;75.0
47;HANDEL DETALICZNY;0.23395860622341266;76.0
86;OPIEKA ZDROWOTNA;0.2338516670796058;77.0
52;MAGAZYNOWANIE, PRZECHOWYWANIE I DZIAŁALNOŚĆ USŁUGOWA WSPOMAGAJĄCA TRANSPORT;0.23247344184207433;78.0
26;PRODUKCJA KOMPUTERÓW, WYROBÓW ELEKTRONICZNYCH I OPTYCZNYCH;0.2323311182109992;79.0
80;DZIAŁALNOŚĆ DETEKTYWISTYCZNA I OCHRONIARSKA;0.23041578810730684;80.0
46;HANDEL HURTOWY;0.22926286377101981;81.0
95;NAPRAWA I KONSERWACJA KOMPUTERÓW, ARTYKUŁÓW UŻYTKU OSOBISTEGO I DOMOWEGO ORAZ POJAZDÓW SILNIKOWYCH, W TYM MOTOCYKLI;0.22517059795279112;82.0
82;DZIAŁALNOŚĆ ZWIĄZANA Z ADMINISTRACYJNĄ OBSŁUGĄ BIURA I POZOSTAŁA DZIAŁALNOŚĆ WSPOMAGAJĄCA PROWADZENIE DZIAŁALNOŚCI GOSPODARCZEJ;0.21963731076915702;83.0
78;DZIAŁALNOŚĆ ZWIĄZANA Z ZATRUDNIENIEM;0.21620756725152673;84.0
27;PRODUKCJA URZĄDZEŃ ELEKTRYCZNYCH;0.214365901555638;85.0
90;DZIAŁALNOŚĆ TWÓRCZA I DZIAŁALNOŚĆ ZWIĄZANA Z WYSTAWIANIEM PRZEDSTAWIEŃ ARTYSTYCZNYCH;0.21411095620530965;86.0
93;DZIAŁALNOŚĆ SPORTOWA, ROZRYWKOWA I REKREACYJNA;0.16363988608308508;87.0
