alternative_id;nazwa;vikor_score;vikor_rank
03;RYBACTWO;0.840474205689157;1.0
60;NADAWANIE PROGRAMÓW OGÓLNODOSTĘPNYCH I ABONAMENTOWYCH, DZIAŁALNOŚĆ AGENCJI INFORMACYJNYCH I POZOSTAŁA DZIAŁALNOŚĆ ZWIĄZANA Z DYSTRYBUCJĄ TREŚCI;0.7190784238191282;2.0
94;DZIAŁALNOŚĆ ORGANIZACJI CZŁONKOWSKICH;0.7149939934758421;3.0
96;DZIAŁALNOŚĆ USŁUGOWA INDYWIDUALNA;0.7146845462587816;4.0
77;WYNAJEM I DZIERŻAWA;0.6842459063452802;5.0
21;PRODUKCJA PODSTAWOWYCH SUBSTANCJI FARMACEUTYCZNYCH ORAZ LEKÓW I POZOSTAŁYCH WYROBÓW FARMACEUTYCZNYCH;0.669763126268595;6.0
63;DZIAŁALNOŚĆ USŁUGOWA W ZAKRESIE INFRASTRUKTURY OBLICZENIOWEJ, PRZETWARZANIA DANYCH, ZARZĄDZANIA STRONAMI INTERNETOWYMI (HOSTING) I POZOSTAŁA DZIAŁALNOŚĆ USŁUGOWA W ZAKRESIE INFORMACJI;0.6429270157390727;7.0
85;EDUKACJA;0.5964063681071686;8.0
01;UPRAWY ROLNE, CHÓW I HODOWLA ZWIERZĄT, ŁOWIECTWO, W TYM DZIAŁALNOŚĆ USŁUGOWA;0.5854242245200127;9.0
17;PRODUKCJA PAPIERU I WYROBÓW Z PAPIERU;0.5833246418882987;10.0
56;DZIAŁALNOŚĆ USŁUGOWA ZWIĄZANA Z WYŻYWIENIEM;0.5717171099241075;11.0
51;TRANSPORT LOTNICZY;0.5711995548803195;12.0
23;PRODUKCJA WYROBÓW Z POZOSTAŁYCH MINERALNYCH SUROWCÓW NIEMETALICZNYCH;0.5702686436459334;13.0
50;TRANSPORT WODNY;0.561342512323896;14.0
39;DZIAŁALNOŚĆ ZWIĄZANA Z REKULTYWACJĄ I POZOSTAŁA DZIAŁALNOŚĆ USŁUGOWA ZWIĄZANA Z GOSPODARKĄ ODPADAMI;0.5481367367785699;15.0
08;POZOSTAŁE GÓRNICTWO I WYDOBYWANIE;0.5468980385957427;16.0
18;POLIGRAFIA I REPRODUKCJA ZAPISANYCH NOŚNIKÓW INFORMACJI;0.5414233693383516;17.0
22;PRODUKCJA WYROBÓW Z GUMY I TWORZYW SZTUCZNYCH;0.5216444832551115;18.0
14;PRODUKCJA ODZIEŻY;0.520679527616229;19.0
37;ODPROWADZANIE I OCZYSZCZANIE ŚCIEKÓW;0.5191906568841758;20.0
38;DZIAŁALNOŚĆ ZWIĄZANA ZE ZBIERANIEM, ODZYSKIEM I UNIESZKODLIWIANIEM ODPADÓW;0.5179804903697338;21.0
32;POZOSTAŁA PRODUKCJA WYROBÓW;0.5179181609038505;22.0
61;TELEKOMUNIKACJA;0.5121507903480707;23.0
13;PRODUKCJA WYROBÓW TEKSTYLNYCH;0.5119872700491501;24.0
87;POMOC SPOŁECZNA Z ZAKWATEROWANIEM;0.5108115715503897;25.0
86;OPIEKA ZDROWOTNA;0.5048542903352986;26.0
16;"PRODUKCJA WYROBÓW Z DREWNA I KORKA, Z WYŁĄCZENIEM MEBLI; PRODUKCJA WYROBÓW ZE SŁOMY I MATERIAŁÓW UŻYWANYCH DO WYPLATANIA";0.49737442618850436;27.0
05;WYDOBYWANIE WĘGLA KAMIENNEGO I WĘGLA BRUNATNEGO (LIGNITU);0.49215546926381737;28.0
93;DZIAŁALNOŚĆ SPORTOWA, ROZRYWKOWA I REKREACYJNA;0.482098314853161;29.0
31;PRODUKCJA MEBLI;0.4795243134624084;30.0
59;DZIAŁALNOŚĆ ZWIĄZANA Z PRODUKCJĄ FILMÓW, NAGRAŃ WIDEO, PROGRAMÓW TELEWIZYJNYCH, NAGRAŃ DŹWIĘKOWYCH I MUZYCZNYCH;0.47292537142622715;31.0
64;FINANSOWA DZIAŁALNOŚĆ USŁUGOWA, Z WYŁĄCZENIEM UBEZPIECZEŃ I FUNDUSZY EMERYTALNYCH;0.47203216659110336;32.0
11;PRODUKCJA NAPOJÓW;0.4717306274266405;33.0
55;ZAKWATEROWANIE;0.4702634652862926;34.0
49;TRANSPORT LĄDOWY ORAZ TRANSPORT RUROCIĄGOWY;0.45397581368097495;35.0
28;PRODUKCJA MASZYN I URZĄDZEŃ, GDZIE INDZIEJ NIESKLASYFIKOWANA;0.4493354510399691;36.0
10;PRODUKCJA ARTYKUŁÓW SPOŻYWCZYCH;0.44745225877019656;37.0
09;DZIAŁALNOŚĆ USŁUGOWA WSPOMAGAJĄCA GÓRNICTWO I WYDOBYWANIE;0.4436426176927477;38.0
65;DZIAŁALNOŚĆ W ZAKRESIE UBEZPIECZEŃ, REASEKURACJI ORAZ FUNDUSZY EMERYTALNYCH, Z WYŁĄCZENIEM OBOWIĄZKOWEGO UBEZPIECZENIA SPOŁECZNEGO;0.43875576347167144;39.0
25;PRODUKCJA METALOWYCH WYROBÓW GOTOWYCH, Z WYŁĄCZENIEM MASZYN I URZĄDZEŃ;0.4359363187612286;40.0
36;POBÓR, UZDATNIANIE I DOSTARCZANIE WODY;0.427263283799028;41.0
84;"ADMINISTRACJA PUBLICZNA I OBRONA NARODOWA; OBOWIĄZKOWE UBEZPIECZENIA SPOŁECZNE";0.42427932110167954;42.0
69;DZIAŁALNOŚĆ PRAWNICZA, RACHUNKOWO-KSIĘGOWA I DORADZTWO PODATKOWE;0.4236675423638081;43.0
66;DZIAŁALNOŚĆ WSPOMAGAJĄCA USŁUGI FINANSOWE, UBEZPIECZENIA I FUNDUSZE EMERYTALNE;0.4228578580202327;44.0
91;DZIAŁALNOŚĆ BIBLIOTEK, ARCHIWÓW, MUZEÓW ORAZ POZOSTAŁA DZIAŁALNOŚĆ ZWIĄZANA Z KULTURĄ;0.4207224565339722;45.0
07;GÓRNICTWO RUD METALI;0.41191234417955713;46.0
62;DZIAŁALNOŚĆ ZWIĄZANA Z PROGRAMOWANIEM, DORADZTWEM W ZAKRESIE INFORMATYKI I DZIAŁALNOŚCI POWIĄZANE;0.4091433127257892;47.0
58;DZIAŁALNOŚĆ WYDAWNICZA;0.40363708774823426;48.0
06;GÓRNICTWO ROPY NAFTOWEJ I GAZU ZIEMNEGO;0.39402401996842373;49.0
99;ORGANIZACJE I ZESPOŁY EKSTERYTORIALNE;0.39178360253891087;50.0
98;GOSPODARSTWA DOMOWE PRODUKUJĄCE WYROBY I ŚWIADCZĄCE USŁUGI NA WŁASNE POTRZEBY;0.3916355733915331;51.5
97;GOSPODARSTWA DOMOWE ZATRUDNIAJĄCE PRACOWNIKÓW;0.3916355733915331;51.5
71;"DZIAŁALNOŚĆ W ZAKRESIE ARCHITEKTURY I INŻYNIERII; BADANIA I ANALIZY TECHNICZNE";0.3794463057363858;53.0
82;DZIAŁALNOŚĆ ZWIĄZANA Z ADMINISTRACYJNĄ OBSŁUGĄ BIURA I POZOSTAŁA DZIAŁALNOŚĆ WSPOMAGAJĄCA PROWADZENIE DZIAŁALNOŚCI GOSPODARCZEJ;0.37463597811088667;54.0
52;MAGAZYNOWANIE, PRZECHOWYWANIE I DZIAŁALNOŚĆ USŁUGOWA WSPOMAGAJĄCA TRANSPORT;0.3674454039505055;55.0
75;DZIAŁALNOŚĆ WETERYNARYJNA;0.35425741201948613;56.0
43;ROBOTY BUDOWLANE SPECJALISTYCZNE;0.3462933678197917;57.0
27;PRODUKCJA URZĄDZEŃ ELEKTRYCZNYCH;0.343944964591135;58.0
74;POZOSTAŁA DZIAŁALNOŚĆ PROFESJONALNA, NAUKOWA I TECHNICZNA;0.3431123256676172;59.0
15;PRODUKCJA SKÓR I WYROBÓW ZE SKÓR WYPRAWIONYCH, PRODUKCJA PODOBNYCH WYROBÓW Z INNYCH MATERIAŁÓW;0.34193417662354175;60.0
79;DZIAŁALNOŚĆ ORGANIZATORÓW TURYSTYKI, AGENTÓW TURYSTYCZNYCH ORAZ POZOSTAŁA DZIAŁALNOŚĆ USŁUGOWA W ZAKRESIE REZERWACJI I DZIAŁALNOŚCI Z NIĄ ZWIĄZANE;0.32884887782376193;61.0
46;HANDEL HURTOWY;0.3146014782496317;62.0
26;PRODUKCJA KOMPUTERÓW, WYROBÓW ELEKTRONICZNYCH I OPTYCZNYCH;0.3050314955851312;63.0
81;DZIAŁALNOŚĆ USŁUGOWA ZWIĄZANA Z UTRZYMANIEM PORZĄDKU W BUDYNKACH I ZAGOSPODAROWANIEM TERENÓW ZIELENI;0.304917023055262;64.0
41;ROBOTY BUDOWLANE ZWIĄZANE ZE WZNOSZENIEM BUDYNKÓW MIESZKALNYCH I NIEMIESZKALNYCH;0.30387763969363824;65.0
35;WYTWARZANIE I ZAOPATRYWANIE W ENERGIĘ ELEKTRYCZNĄ, GAZ, PARĘ WODNĄ I POWIETRZE DO UKŁADÓW KLIMATYZACYJNYCH;0.2934944185643569;66.0
47;HANDEL DETALICZNY;0.28682321946399514;67.0
92;DZIAŁALNOŚĆ ZWIĄZANA Z GRAMI HAZARDOWYMI;0.2789283423915607;68.0
20;PRODUKCJA CHEMIKALIÓW I WYROBÓW CHEMICZNYCH;0.2779885823600008;69.0
19;WYTWARZANIE I PRZETWARZANIE KOKSU I PRODUKTÓW RAFINACJI ROPY NAFTOWEJ;0.2728232948189171;70.0
29;PRODUKCJA POJAZDÓW SILNIKOWYCH, PRODUKCJA PRZYCZEP I NACZEP;0.2622047021253826;71.0
90;DZIAŁALNOŚĆ TWÓRCZA I DZIAŁALNOŚĆ ZWIĄZANA Z WYSTAWIANIEM PRZEDSTAWIEŃ ARTYSTYCZNYCH;0.2602065890507552;72.0
12;PRODUKCJA WYROBÓW TYTONIOWYCH;0.25971042910990894;73.0
68;DZIAŁALNOŚĆ ZWIĄZANA Z OBSŁUGĄ RYNKU NIERUCHOMOŚCI;0.2537332319363865;74.0
88;POMOC SPOŁECZNA BEZ ZAKWATEROWANIA;0.24820440906373764;75.0
53;DZIAŁALNOŚĆ POCZTOWA I KURIERSKA;0.24061194594397528;76.0
95;NAPRAWA I KONSERWACJA KOMPUTERÓW, ARTYKUŁÓW UŻYTKU OSOBISTEGO I DOMOWEGO ORAZ POJAZDÓW SILNIKOWYCH, W TYM MOTOCYKLI;0.23760359835377254;77.0
30;PRODUKCJA POZOSTAŁEGO SPRZĘTU TRANSPORTOWEGO;0.23469579867772417;78.0
24;PRODUKCJA METALI;0.22638893007177963;79.0
78;DZIAŁALNOŚĆ ZWIĄZANA Z ZATRUDNIENIEM;0.2259679465815343;80.0
33;NAPRAWA, KONSERWACJA I INSTALOWANIE MASZYN I URZĄDZEŃ;0.2234938115081031;81.0
42;ROBOTY ZWIĄZANE Z BUDOWĄ OBIEKTÓW INŻYNIERII LĄDOWEJ I WODNEJ;0.21786479117778879;82.0
72;BADANIA NAUKOWE I PRACE ROZWOJOWE;0.1618288136811954;83.0
73;DZIAŁALNOŚĆ W ZAKRESIE REKLAMY, BADANIA RYNKU I PUBLIC RELATIONS;0.15552835546894483;84.0
70;DZIAŁALNOŚĆ CENTRAL (HEAD OFFICES) ORAZ DORADZTWO ZWIĄZANE Z ZARZĄDZANIEM;0.12650090817975745;85.0
80;DZIAŁALNOŚĆ DETEKTYWISTYCZNA I OCHRONIARSKA;0.08864573678650989;86.0
02;LEŚNICTWO I POZYSKIWANIE DREWNA;0.08793438896611616;87.0
