alternative_id;nazwa;ensemble_score;ensemble_rank
96;DZIAŁALNOŚĆ USŁUGOWA INDYWIDUALNA;0.6281359802733676;1.0
37;ODPROWADZANIE I OCZYSZCZANIE ŚCIEKÓW;0.6160166678632073;2.0
77;WYNAJEM I DZIERŻAWA;0.5819935997522969;3.0
36;POBÓR, UZDATNIANIE I DOSTARCZANIE WODY;0.5385284905905265;4.0
64;FINANSOWA DZIAŁALNOŚĆ USŁUGOWA, Z WYŁĄCZENIEM UBEZPIECZEŃ I FUNDUSZY EMERYTALNYCH;0.5331632724051436;5.0
94;DZIAŁALNOŚĆ ORGANIZACJI CZŁONKOWSKICH;0.5328691700605768;6.0
60;NADAWANIE PROGRAMÓW OGÓLNODOSTĘPNYCH I ABONAMENTOWYCH, DZIAŁALNOŚĆ AGENCJI INFORMACYJNYCH I POZOSTAŁA DZIAŁALNOŚĆ ZWIĄZANA Z DYSTRYBUCJĄ TREŚCI;0.5246777511679294;7.0
90;DZIAŁALNOŚĆ TWÓRCZA I DZIAŁALNOŚĆ ZWIĄZANA Z WYSTAWIANIEM PRZEDSTAWIEŃ ARTYSTYCZNYCH;0.5117100540728298;8.0
01;UPRAWY ROLNE, CHÓW I HODOWLA ZWIERZĄT, ŁOWIECTWO, W TYM DZIAŁALNOŚĆ USŁUGOWA;0.5100574700592324;9.0
61;TELEKOMUNIKACJA;0.4972847363204538;10.0
63;DZIAŁALNOŚĆ USŁUGOWA W ZAKRESIE INFRASTRUKTURY OBLICZENIOWEJ, PRZETWARZANIA DANYCH, ZARZĄDZANIA STRONAMI INTERNETOWYMI (HOSTING) I POZOSTAŁA DZIAŁALNOŚĆ USŁUGOWA W ZAKRESIE INFORMACJI;0.4873738592162231;11.0
55;ZAKWATEROWANIE;0.4777103115990131;12.0
69;DZIAŁALNOŚĆ PRAWNICZA, RACHUNKOWO-KSIĘGOWA I DORADZTWO PODATKOWE;0.46828614602905083;13.0
03;RYBACTWO;0.46763023346453075;14.0
08;POZOSTAŁE GÓRNICTWO I WYDOBYWANIE;0.4588542078651227;15.0
23;PRODUKCJA WYROBÓW Z POZOSTAŁYCH MINERALNYCH SUROWCÓW NIEMETALICZNYCH;0.4584566799649832;16.0
17;PRODUKCJA PAPIERU I WYROBÓW Z PAPIERU;0.4551168242225714;17.0
56;DZIAŁALNOŚĆ USŁUGOWA ZWIĄZANA Z WYŻYWIENIEM;0.44850875078329444;18.0
91;DZIAŁALNOŚĆ BIBLIOTEK, ARCHIWÓW, MUZEÓW ORAZ POZOSTAŁA DZIAŁALNOŚĆ ZWIĄZANA Z KULTURĄ;0.44817747043867356;19.0
50;TRANSPORT WODNY;0.44465896030533597;20.0
58;DZIAŁALNOŚĆ WYDAWNICZA;0.44005925560704245;21.0
38;DZIAŁALNOŚĆ ZWIĄZANA ZE ZBIERANIEM, ODZYSKIEM I UNIESZKODLIWIANIEM ODPADÓW;0.4378166689797294;22.0
15;PRODUKCJA SKÓR I WYROBÓW ZE SKÓR WYPRAWIONYCH, PRODUKCJA PODOBNYCH WYROBÓW Z INNYCH MATERIAŁÓW;0.4257996144652324;23.0
32;POZOSTAŁA PRODUKCJA WYROBÓW;0.4252467665544628;24.0
20;PRODUKCJA CHEMIKALIÓW I WYROBÓW CHEMICZNYCH;0.42122890463703605;25.0
18;POLIGRAFIA I REPRODUKCJA ZAPISANYCH NOŚNIKÓW INFORMACJI;0.4211570485397417;26.0
22;PRODUKCJA WYROBÓW Z GUMY I TWORZYW SZTUCZNYCH;0.415143989770844;27.0
25;PRODUKCJA METALOWYCH WYROBÓW GOTOWYCH, Z WYŁĄCZENIEM MASZYN I URZĄDZEŃ;0.4128394822789152;28.0
86;OPIEKA ZDROWOTNA;0.412206743985585;29.0
16;"PRODUKCJA WYROBÓW Z DREWNA I KORKA, Z WYŁĄCZENIEM MEBLI; PRODUKCJA WYROBÓW ZE SŁOMY I MATERIAŁÓW UŻYWANYCH DO WYPLATANIA";0.4070682015954106;30.0
31;PRODUKCJA MEBLI;0.40665190897030135;31.0
87;POMOC SPOŁECZNA Z ZAKWATEROWANIEM;0.40446161029443334;32.0
11;PRODUKCJA NAPOJÓW;0.40071700493698015;33.0
49;TRANSPORT LĄDOWY ORAZ TRANSPORT RUROCIĄGOWY;0.3988287229905685;34.0
14;PRODUKCJA ODZIEŻY;0.39607093132339255;35.0
68;DZIAŁALNOŚĆ ZWIĄZANA Z OBSŁUGĄ RYNKU NIERUCHOMOŚCI;0.39445203459692846;36.0
28;PRODUKCJA MASZYN I URZĄDZEŃ, GDZIE INDZIEJ NIESKLASYFIKOWANA;0.39313359490762545;37.0
21;PRODUKCJA PODSTAWOWYCH SUBSTANCJI FARMACEUTYCZNYCH ORAZ LEKÓW I POZOSTAŁYCH WYROBÓW FARMACEUTYCZNYCH;0.3898233375331749;38.0
59;DZIAŁALNOŚĆ ZWIĄZANA Z PRODUKCJĄ FILMÓW, NAGRAŃ WIDEO, PROGRAMÓW TELEWIZYJNYCH, NAGRAŃ DŹWIĘKOWYCH I MUZYCZNYCH;0.3863332536490354;39.0
19;WYTWARZANIE I PRZETWARZANIE KOKSU I PRODUKTÓW RAFINACJI ROPY NAFTOWEJ;0.3856839362867478;40.0
13;PRODUKCJA WYROBÓW TEKSTYLNYCH;0.3845677652973735;41.0
52;MAGAZYNOWANIE, PRZECHOWYWANIE I DZIAŁALNOŚĆ USŁUGOWA WSPOMAGAJĄCA TRANSPORT;0.37169637722185;42.0
72;BADANIA NAUKOWE I PRACE ROZWOJOWE;0.37162026544869375;43.0
10;PRODUKCJA ARTYKUŁÓW SPOŻYWCZYCH;0.3705955336042837;44.0
75;DZIAŁALNOŚĆ WETERYNARYJNA;0.36894328367815654;45.0
84;"ADMINISTRACJA PUBLICZNA I OBRONA NARODOWA; OBOWIĄZKOWE UBEZPIECZENIA SPOŁECZNE";0.36724750328554906;46.0
85;EDUKACJA;0.3651158291177366;47.0
39;DZIAŁALNOŚĆ ZWIĄZANA Z REKULTYWACJĄ I POZOSTAŁA DZIAŁALNOŚĆ USŁUGOWA ZWIĄZANA Z GOSPODARKĄ ODPADAMI;0.3650248881775682;48.0
71;"DZIAŁALNOŚĆ W ZAKRESIE ARCHITEKTURY I INŻYNIERII; BADANIA I ANALIZY TECHNICZNE";0.36475558253199214;49.0
74;POZOSTAŁA DZIAŁALNOŚĆ PROFESJONALNA, NAUKOWA I TECHNICZNA;0.36446859260423137;50.0
65;DZIAŁALNOŚĆ W ZAKRESIE UBEZPIECZEŃ, REASEKURACJI ORAZ FUNDUSZY EMERYTALNYCH, Z WYŁĄCZENIEM OBOWIĄZKOWEGO UBEZPIECZENIA SPOŁECZNEGO;0.3639457582351371;51.0
93;DZIAŁALNOŚĆ SPORTOWA, ROZRYWKOWA I REKREACYJNA;0.3609331807593794;52.0
41;ROBOTY BUDOWLANE ZWIĄZANE ZE WZNOSZENIEM BUDYNKÓW MIESZKALNYCH I NIEMIESZKALNYCH;0.35551635320732333;53.0
30;PRODUKCJA POZOSTAŁEGO SPRZĘTU TRANSPORTOWEGO;0.3549271513743039;54.0
66;DZIAŁALNOŚĆ WSPOMAGAJĄCA USŁUGI FINANSOWE, UBEZPIECZENIA I FUNDUSZE EMERYTALNE;0.3536421451684522;55.0
35;WYTWARZANIE I ZAOPATRYWANIE W ENERGIĘ ELEKTRYCZNĄ, GAZ, PARĘ WODNĄ I POWIETRZE DO UKŁADÓW KLIMATYZACYJNYCH;0.353065104369528;56.0
24;PRODUKCJA METALI;0.35294103194224913;57.0
09;DZIAŁALNOŚĆ USŁUGOWA WSPOMAGAJĄCA GÓRNICTWO I WYDOBYWANIE;0.3525461341800993;58.0
88;POMOC SPOŁECZNA BEZ ZAKWATEROWANIA;0.35215827611897615;59.0
62;DZIAŁALNOŚĆ ZWIĄZANA Z PROGRAMOWANIEM, DORADZTWEM W ZAKRESIE INFORMATYKI I DZIAŁALNOŚCI POWIĄZANE;0.3503305878808256;60.0
82;DZIAŁALNOŚĆ ZWIĄZANA Z ADMINISTRACYJNĄ OBSŁUGĄ BIURA I POZOSTAŁA DZIAŁALNOŚĆ WSPOMAGAJĄCA PROWADZENIE DZIAŁALNOŚCI GOSPODARCZEJ;0.34884535454182264;61.0
06;GÓRNICTWO ROPY NAFTOWEJ I GAZU ZIEMNEGO;0.347422821235282;62.0
07;GÓRNICTWO RUD METALI;0.34723844191532083;63.0
98;GOSPODARSTWA DOMOWE PRODUKUJĄCE WYROBY I ŚWIADCZĄCE USŁUGI NA WŁASNE POTRZEBY;0.3446422359240875;64.0
99;ORGANIZACJE I ZESPOŁY EKSTERYTORIALNE;0.3446370015650826;65.0
97;GOSPODARSTWA DOMOWE ZATRUDNIAJĄCE PRACOWNIKÓW;0.34462664387943664;66.0
29;PRODUKCJA POJAZDÓW SILNIKOWYCH, PRODUKCJA PRZYCZEP I NACZEP;0.33761019032665246;67.0
42;ROBOTY ZWIĄZANE Z BUDOWĄ OBIEKTÓW INŻYNIERII LĄDOWEJ I WODNEJ;0.3363511560797182;68.0
81;DZIAŁALNOŚĆ USŁUGOWA ZWIĄZANA Z UTRZYMANIEM PORZĄDKU W BUDYNKACH I ZAGOSPODAROWANIEM TERENÓW ZIELENI;0.3354513634819637;69.0
73;DZIAŁALNOŚĆ W ZAKRESIE REKLAMY, BADANIA RYNKU I PUBLIC RELATIONS;0.3269548724129813;70.0
33;NAPRAWA, KONSERWACJA I INSTALOWANIE MASZYN I URZĄDZEŃ;0.31993244483882793;71.0
70;DZIAŁALNOŚĆ CENTRAL (HEAD OFFICES) ORAZ DORADZTWO ZWIĄZANE Z ZARZĄDZANIEM;0.31860169876264616;72.0
92;DZIAŁALNOŚĆ ZWIĄZANA Z GRAMI HAZARDOWYMI;0.318140406755351;73.0
43;ROBOTY BUDOWLANE SPECJALISTYCZNE;0.3169458235111859;74.0
47;HANDEL DETALICZNY;0.3122564229371648;75.0
46;HANDEL HURTOWY;0.30728281740869834;76.0
51;TRANSPORT LOTNICZY;0.30663805318812576;77.0
27;PRODUKCJA URZĄDZEŃ ELEKTRYCZNYCH;0.30602417662316767;78.0
12;PRODUKCJA WYROBÓW TYTONIOWYCH;0.30462531493526257;79.0
78;DZIAŁALNOŚĆ ZWIĄZANA Z ZATRUDNIENIEM;0.2970915814577811;80.0
02;LEŚNICTWO I POZYSKIWANIE DREWNA;0.2768284654566482;81.0
26;PRODUKCJA KOMPUTERÓW, WYROBÓW ELEKTRONICZNYCH I OPTYCZNYCH;0.2749342729318916;82.0
53;DZIAŁALNOŚĆ POCZTOWA I KURIERSKA;0.2689742111412049;83.0
95;NAPRAWA I KONSERWACJA KOMPUTERÓW, ARTYKUŁÓW UŻYTKU OSOBISTEGO I DOMOWEGO ORAZ POJAZDÓW SILNIKOWYCH, W TYM MOTOCYKLI;0.263380217136829;84.0
79;DZIAŁALNOŚĆ ORGANIZATORÓW TURYSTYKI, AGENTÓW TURYSTYCZNYCH ORAZ POZOSTAŁA DZIAŁALNOŚĆ USŁUGOWA W ZAKRESIE REZERWACJI I DZIAŁALNOŚCI Z NIĄ ZWIĄZANE;0.2588899299449856;85.0
80;DZIAŁALNOŚĆ DETEKTYWISTYCZNA I OCHRONIARSKA;0.19387906687929835;86.0
05;WYDOBYWANIE WĘGLA KAMIENNEGO I WĘGLA BRUNATNEGO (LIGNITU);0.16805877812107622;87.0
