alternative_id;nazwa;topsis_score;topsis_rank
77;WYNAJEM I DZIERŻAWA;0.6292733686655824;1.0
59;DZIAŁALNOŚĆ ZWIĄZANA Z PRODUKCJĄ FILMÓW, NAGRAŃ WIDEO, PROGRAMÓW TELEWIZYJNYCH, NAGRAŃ DŹWIĘKOWYCH I MUZYCZNYCH;0.6228170548492797;2.0
61;TELEKOMUNIKACJA;0.6214938239857243;3.0
36;POBÓR, UZDATNIANIE I DOSTARCZANIE WODY;0.5726999594713547;4.0
39;DZIAŁALNOŚĆ ZWIĄZANA Z REKULTYWACJĄ I POZOSTAŁA DZIAŁALNOŚĆ USŁUGOWA ZWIĄZANA Z GOSPODARKĄ ODPADAMI;0.5716229437026498;5.0
37;ODPROWADZANIE I OCZYSZCZANIE ŚCIEKÓW;0.5682517678436131;6.0
94;DZIAŁALNOŚĆ ORGANIZACJI CZŁONKOWSKICH;0.5572904822047415;7.0
12;PRODUKCJA WYROBÓW TYTONIOWYCH;0.5446427601252458;8.0
91;DZIAŁALNOŚĆ BIBLIOTEK, ARCHIWÓW, MUZEÓW ORAZ POZOSTAŁA DZIAŁALNOŚĆ ZWIĄZANA Z KULTURĄ;0.5312918533012376;9.0
60;NADAWANIE PROGRAMÓW OGÓLNODOSTĘPNYCH I ABONAMENTOWYCH, DZIAŁALNOŚĆ AGENCJI INFORMACYJNYCH I POZOSTAŁA DZIAŁALNOŚĆ ZWIĄZANA Z DYSTRYBUCJĄ TREŚCI;0.5271961589086569;10.0
87;POMOC SPOŁECZNA Z ZAKWATEROWANIEM;0.5210912507765422;11.0
55;ZAKWATEROWANIE;0.5159208318394486;12.0
56;DZIAŁALNOŚĆ USŁUGOWA ZWIĄZANA Z WYŻYWIENIEM;0.4901200995441716;13.0
93;DZIAŁALNOŚĆ SPORTOWA, ROZRYWKOWA I REKREACYJNA;0.47886605500913687;14.0
64;FINANSOWA DZIAŁALNOŚĆ USŁUGOWA, Z WYŁĄCZENIEM UBEZPIECZEŃ I FUNDUSZY EMERYTALNYCH;0.4771563630376135;15.0
51;TRANSPORT LOTNICZY;0.4721920850873264;16.0
09;DZIAŁALNOŚĆ USŁUGOWA WSPOMAGAJĄCA GÓRNICTWO I WYDOBYWANIE;0.4646944415742296;17.0
86;OPIEKA ZDROWOTNA;0.4621543309229371;18.0
70;DZIAŁALNOŚĆ CENTRAL (HEAD OFFICES) ORAZ DORADZTWO ZWIĄZANE Z ZARZĄDZANIEM;0.45503662970540637;19.0
01;UPRAWY ROLNE, CHÓW I HODOWLA ZWIERZĄT, ŁOWIECTWO, W TYM DZIAŁALNOŚĆ USŁUGOWA;0.45175064658607594;20.0
63;DZIAŁALNOŚĆ USŁUGOWA W ZAKRESIE INFRASTRUKTURY OBLICZENIOWEJ, PRZETWARZANIA DANYCH, ZARZĄDZANIA STRONAMI INTERNETOWYMI (HOSTING) I POZOSTAŁA DZIAŁALNOŚĆ USŁUGOWA W ZAKRESIE INFORMACJI;0.45011820087258514;21.0
72;BADANIA NAUKOWE I PRACE ROZWOJOWE;0.4497392043992736;22.0
03;RYBACTWO;0.44738227284154136;23.0
38;DZIAŁALNOŚĆ ZWIĄZANA ZE ZBIERANIEM, ODZYSKIEM I UNIESZKODLIWIANIEM ODPADÓW;0.44518023154572917;24.0
16;"PRODUKCJA WYROBÓW Z DREWNA I KORKA, Z WYŁĄCZENIEM MEBLI; PRODUKCJA WYROBÓW ZE SŁOMY I MATERIAŁÓW UŻYWANYCH DO WYPLATANIA";0.43992516949138644;25.0
50;TRANSPORT WODNY;0.4350039792415411;26.0
23;PRODUKCJA WYROBÓW Z POZOSTAŁYCH MINERALNYCH SUROWCÓW NIEMETALICZNYCH;0.4299140534429017;27.0
21;PRODUKCJA PODSTAWOWYCH SUBSTANCJI FARMACEUTYCZNYCH ORAZ LEKÓW I POZOSTAŁYCH WYROBÓW FARMACEUTYCZNYCH;0.42897170800098394;28.0
17;PRODUKCJA PAPIERU I WYROBÓW Z PAPIERU;0.4282254572709787;29.0
08;POZOSTAŁE GÓRNICTWO I WYDOBYWANIE;0.42707020299088516;30.0
58;DZIAŁALNOŚĆ WYDAWNICZA;0.4197285038882424;31.0
52;MAGAZYNOWANIE, PRZECHOWYWANIE I DZIAŁALNOŚĆ USŁUGOWA WSPOMAGAJĄCA TRANSPORT;0.41585806283367094;32.0
68;DZIAŁALNOŚĆ ZWIĄZANA Z OBSŁUGĄ RYNKU NIERUCHOMOŚCI;0.41566293797645343;33.0
66;DZIAŁALNOŚĆ WSPOMAGAJĄCA USŁUGI FINANSOWE, UBEZPIECZENIA I FUNDUSZE EMERYTALNE;0.4093302028338308;34.0
20;PRODUKCJA CHEMIKALIÓW I WYROBÓW CHEMICZNYCH;0.4091759808527406;35.0
24;PRODUKCJA METALI;0.4085889291509952;36.0
49;TRANSPORT LĄDOWY ORAZ TRANSPORT RUROCIĄGOWY;0.4014359565631473;37.0
22;PRODUKCJA WYROBÓW Z GUMY I TWORZYW SZTUCZNYCH;0.3946508544687084;38.0
05;WYDOBYWANIE WĘGLA KAMIENNEGO I WĘGLA BRUNATNEGO (LIGNITU);0.39384100138162426;39.0
13;PRODUKCJA WYROBÓW TEKSTYLNYCH;0.3938267183363696;40.0
18;POLIGRAFIA I REPRODUKCJA ZAPISANYCH NOŚNIKÓW INFORMACJI;0.3934917271707501;41.0
10;PRODUKCJA ARTYKUŁÓW SPOŻYWCZYCH;0.3915890796702126;42.0
85;EDUKACJA;0.39073339626452536;43.0
32;POZOSTAŁA PRODUKCJA WYROBÓW;0.3860322639183914;44.0
71;"DZIAŁALNOŚĆ W ZAKRESIE ARCHITEKTURY I INŻYNIERII; BADANIA I ANALIZY TECHNICZNE";0.3798331062901184;45.0
31;PRODUKCJA MEBLI;0.3762577088252533;46.0
96;DZIAŁALNOŚĆ USŁUGOWA INDYWIDUALNA;0.3754801059041975;47.0
42;ROBOTY ZWIĄZANE Z BUDOWĄ OBIEKTÓW INŻYNIERII LĄDOWEJ I WODNEJ;0.3749183310813812;48.0
14;PRODUKCJA ODZIEŻY;0.3731002019515021;49.0
90;DZIAŁALNOŚĆ TWÓRCZA I DZIAŁALNOŚĆ ZWIĄZANA Z WYSTAWIANIEM PRZEDSTAWIEŃ ARTYSTYCZNYCH;0.3714016191178776;50.0
74;POZOSTAŁA DZIAŁALNOŚĆ PROFESJONALNA, NAUKOWA I TECHNICZNA;0.3706262122128315;51.0
26;PRODUKCJA KOMPUTERÓW, WYROBÓW ELEKTRONICZNYCH I OPTYCZNYCH;0.36705870546809455;52.0
69;DZIAŁALNOŚĆ PRAWNICZA, RACHUNKOWO-KSIĘGOWA I DORADZTWO PODATKOWE;0.36671949349772964;53.0
28;PRODUKCJA MASZYN I URZĄDZEŃ, GDZIE INDZIEJ NIESKLASYFIKOWANA;0.36582463558314665;54.0
65;DZIAŁALNOŚĆ W ZAKRESIE UBEZPIECZEŃ, REASEKURACJI ORAZ FUNDUSZY EMERYTALNYCH, Z WYŁĄCZENIEM OBOWIĄZKOWEGO UBEZPIECZENIA SPOŁECZNEGO;0.3627462476961222;55.0
25;PRODUKCJA METALOWYCH WYROBÓW GOTOWYCH, Z WYŁĄCZENIEM MASZYN I URZĄDZEŃ;0.3620588298108553;56.0
84;"ADMINISTRACJA PUBLICZNA I OBRONA NARODOWA; OBOWIĄZKOWE UBEZPIECZENIA SPOŁECZNE";0.3599017007458513;57.0
07;GÓRNICTWO RUD METALI;0.35987450463500004;58.0
81;DZIAŁALNOŚĆ USŁUGOWA ZWIĄZANA Z UTRZYMANIEM PORZĄDKU W BUDYNKACH I ZAGOSPODAROWANIEM TERENÓW ZIELENI;0.35977505093745704;59.0
06;GÓRNICTWO ROPY NAFTOWEJ I GAZU ZIEMNEGO;0.35928962722145347;60.0
98;GOSPODARSTWA DOMOWE PRODUKUJĄCE WYROBY I ŚWIADCZĄCE USŁUGI NA WŁASNE POTRZEBY;0.3589224259677064;61.0
97;GOSPODARSTWA DOMOWE ZATRUDNIAJĄCE PRACOWNIKÓW;0.3588216728025904;62.0
99;ORGANIZACJE I ZESPOŁY EKSTERYTORIALNE;0.35820014852829596;63.0
35;WYTWARZANIE I ZAOPATRYWANIE W ENERGIĘ ELEKTRYCZNĄ, GAZ, PARĘ WODNĄ I POWIETRZE DO UKŁADÓW KLIMATYZACYJNYCH;0.3566418894744752;64.0
27;PRODUKCJA URZĄDZEŃ ELEKTRYCZNYCH;0.3563136461956538;65.0
62;DZIAŁALNOŚĆ ZWIĄZANA Z PROGRAMOWANIEM, DORADZTWEM W ZAKRESIE INFORMATYKI I DZIAŁALNOŚCI POWIĄZANE;0.3553962735002589;66.0
19;WYTWARZANIE I PRZETWARZANIE KOKSU I PRODUKTÓW RAFINACJI ROPY NAFTOWEJ;0.3518808249215234;67.0
80;DZIAŁALNOŚĆ DETEKTYWISTYCZNA I OCHRONIARSKA;0.34623751303044425;68.0
43;ROBOTY BUDOWLANE SPECJALISTYCZNE;0.34158881123970813;69.0
33;NAPRAWA, KONSERWACJA I INSTALOWANIE MASZYN I URZĄDZEŃ;0.33931646456812875;70.0
15;PRODUKCJA SKÓR I WYROBÓW ZE SKÓR WYPRAWIONYCH, PRODUKCJA PODOBNYCH WYROBÓW Z INNYCH MATERIAŁÓW;0.3387797866071615;71.0
11;PRODUKCJA NAPOJÓW;0.3381363946144252;72.0
47;HANDEL DETALICZNY;0.33762435805440866;73.0
82;DZIAŁALNOŚĆ ZWIĄZANA Z ADMINISTRACYJNĄ OBSŁUGĄ BIURA I POZOSTAŁA DZIAŁALNOŚĆ WSPOMAGAJĄCA PROWADZENIE DZIAŁALNOŚCI GOSPODARCZEJ;0.33521444816069396;74.0
46;HANDEL HURTOWY;0.3322217895422303;75.0
41;ROBOTY BUDOWLANE ZWIĄZANE ZE WZNOSZENIEM BUDYNKÓW MIESZKALNYCH I NIEMIESZKALNYCH;0.33065498511292674;76.0
95;NAPRAWA I KONSERWACJA KOMPUTERÓW, ARTYKUŁÓW UŻYTKU OSOBISTEGO I DOMOWEGO ORAZ POJAZDÓW SILNIKOWYCH, W TYM MOTOCYKLI;0.32884119262891437;77.0
30;PRODUKCJA POZOSTAŁEGO SPRZĘTU TRANSPORTOWEGO;0.327644803174977;78.0
53;DZIAŁALNOŚĆ POCZTOWA I KURIERSKA;0.32684356336048553;79.0
78;DZIAŁALNOŚĆ ZWIĄZANA Z ZATRUDNIENIEM;0.32678726441156797;80.0
92;DZIAŁALNOŚĆ ZWIĄZANA Z GRAMI HAZARDOWYMI;0.31343877038918466;81.0
29;PRODUKCJA POJAZDÓW SILNIKOWYCH, PRODUKCJA PRZYCZEP I NACZEP;0.309351163560398;82.0
02;LEŚNICTWO I POZYSKIWANIE DREWNA;0.30638746222668717;83.0
73;DZIAŁALNOŚĆ W ZAKRESIE REKLAMY, BADANIA RYNKU I PUBLIC RELATIONS;0.3037564087746231;84.0
88;POMOC SPOŁECZNA BEZ ZAKWATEROWANIA;0.29244737262124654;85.0
75;DZIAŁALNOŚĆ WETERYNARYJNA;0.2779168006040456;86.0
79;DZIAŁALNOŚĆ ORGANIZATORÓW TURYSTYKI, AGENTÓW TURYSTYCZNYCH ORAZ POZOSTAŁA DZIAŁALNOŚĆ USŁUGOWA W ZAKRESIE REZERWACJI I DZIAŁALNOŚCI Z NIĄ ZWIĄZANE;0.25086993008508;87.0
