alternative_id;nazwa;vikor_score;vikor_rank
77;WYNAJEM I DZIERŻAWA;0.9901236651646427;1.0
61;TELEKOMUNIKACJA;0.9756606900759245;2.0
37;ODPROWADZANIE I OCZYSZCZANIE ŚCIEKÓW;0.8759174264850658;3.0
36;POBÓR, UZDATNIANIE I DOSTARCZANIE WODY;0.8753788384892136;4.0
59;DZIAŁALNOŚĆ ZWIĄZANA Z PRODUKCJĄ FILMÓW, NAGRAŃ WIDEO, PROGRAMÓW TELEWIZYJNYCH, NAGRAŃ DŹWIĘKOWYCH I MUZYCZNYCH;0.8234965297634209;5.0
63;DZIAŁALNOŚĆ USŁUGOWA W ZAKRESIE INFRASTRUKTURY OBLICZENIOWEJ, PRZETWARZANIA DANYCH, ZARZĄDZANIA STRONAMI INTERNETOWYMI (HOSTING) I POZOSTAŁA DZIAŁALNOŚĆ USŁUGOWA W ZAKRESIE INFORMACJI;0.814855178092807;6.0
91;DZIAŁALNOŚĆ BIBLIOTEK, ARCHIWÓW, MUZEÓW ORAZ POZOSTAŁA DZIAŁALNOŚĆ ZWIĄZANA Z KULTURĄ;0.7927452064150835;7.0
60;NADAWANIE PROGRAMÓW OGÓLNODOSTĘPNYCH I ABONAMENTOWYCH, DZIAŁALNOŚĆ AGENCJI INFORMACYJNYCH I POZOSTAŁA DZIAŁALNOŚĆ ZWIĄZANA Z DYSTRYBUCJĄ TREŚCI;0.7897594899370154;8.0
55;ZAKWATEROWANIE;0.7677615536872449;9.0
39;DZIAŁALNOŚĆ ZWIĄZANA Z REKULTYWACJĄ I POZOSTAŁA DZIAŁALNOŚĆ USŁUGOWA ZWIĄZANA Z GOSPODARKĄ ODPADAMI;0.7267429415065245;10.0
94;DZIAŁALNOŚĆ ORGANIZACJI CZŁONKOWSKICH;0.7180983934449441;11.0
93;DZIAŁALNOŚĆ SPORTOWA, ROZRYWKOWA I REKREACYJNA;0.7125081946824168;12.0
87;POMOC SPOŁECZNA Z ZAKWATEROWANIEM;0.7038011687760539;13.0
56;DZIAŁALNOŚĆ USŁUGOWA ZWIĄZANA Z WYŻYWIENIEM;0.6848462462447094;14.0
64;FINANSOWA DZIAŁALNOŚĆ USŁUGOWA, Z WYŁĄCZENIEM UBEZPIECZEŃ I FUNDUSZY EMERYTALNYCH;0.6697246211801684;15.0
12;PRODUKCJA WYROBÓW TYTONIOWYCH;0.6612162600921903;16.0
86;OPIEKA ZDROWOTNA;0.656235194431639;17.0
01;UPRAWY ROLNE, CHÓW I HODOWLA ZWIERZĄT, ŁOWIECTWO, W TYM DZIAŁALNOŚĆ USŁUGOWA;0.6348716024659635;18.0
70;DZIAŁALNOŚĆ CENTRAL (HEAD OFFICES) ORAZ DORADZTWO ZWIĄZANE Z ZARZĄDZANIEM;0.631215884598938;19.0
38;DZIAŁALNOŚĆ ZWIĄZANA ZE ZBIERANIEM, ODZYSKIEM I UNIESZKODLIWIANIEM ODPADÓW;0.6283786903097499;20.0
16;"PRODUKCJA WYROBÓW Z DREWNA I KORKA, Z WYŁĄCZENIEM MEBLI; PRODUKCJA WYROBÓW ZE SŁOMY I MATERIAŁÓW UŻYWANYCH DO WYPLATANIA";0.6206056109306596;21.0
68;DZIAŁALNOŚĆ ZWIĄZANA Z OBSŁUGĄ RYNKU NIERUCHOMOŚCI;0.6133439094590194;22.0
17;PRODUKCJA PAPIERU I WYROBÓW Z PAPIERU;0.6025907270942934;23.0
23;PRODUKCJA WYROBÓW Z POZOSTAŁYCH MINERALNYCH SUROWCÓW NIEMETALICZNYCH;0.5897065721370643;24.0
03;RYBACTWO;0.5880676089985335;25.0
09;DZIAŁALNOŚĆ USŁUGOWA WSPOMAGAJĄCA GÓRNICTWO I WYDOBYWANIE;0.5825212840208702;26.0
58;DZIAŁALNOŚĆ WYDAWNICZA;0.5668616554188163;27.0
52;MAGAZYNOWANIE, PRZECHOWYWANIE I DZIAŁALNOŚĆ USŁUGOWA WSPOMAGAJĄCA TRANSPORT;0.5625334753265069;28.0
20;PRODUKCJA CHEMIKALIÓW I WYROBÓW CHEMICZNYCH;0.5576643482374068;29.0
21;PRODUKCJA PODSTAWOWYCH SUBSTANCJI FARMACEUTYCZNYCH ORAZ LEKÓW I POZOSTAŁYCH WYROBÓW FARMACEUTYCZNYCH;0.553709929220247;30.0
08;POZOSTAŁE GÓRNICTWO I WYDOBYWANIE;0.5195614700898682;31.0
13;PRODUKCJA WYROBÓW TEKSTYLNYCH;0.50590409959285;32.0
10;PRODUKCJA ARTYKUŁÓW SPOŻYWCZYCH;0.4930911251800949;33.0
24;PRODUKCJA METALI;0.4924958964498929;34.0
22;PRODUKCJA WYROBÓW Z GUMY I TWORZYW SZTUCZNYCH;0.49067086842282215;35.0
18;POLIGRAFIA I REPRODUKCJA ZAPISANYCH NOŚNIKÓW INFORMACJI;0.4882671123899973;36.0
32;POZOSTAŁA PRODUKCJA WYROBÓW;0.4808102239608467;37.0
85;EDUKACJA;0.46273200840812023;38.0
72;BADANIA NAUKOWE I PRACE ROZWOJOWE;0.46079826978886085;39.0
49;TRANSPORT LĄDOWY ORAZ TRANSPORT RUROCIĄGOWY;0.45968522278630686;40.0
31;PRODUKCJA MEBLI;0.4389183357053692;41.0
69;DZIAŁALNOŚĆ PRAWNICZA, RACHUNKOWO-KSIĘGOWA I DORADZTWO PODATKOWE;0.426691501213182;42.0
96;DZIAŁALNOŚĆ USŁUGOWA INDYWIDUALNA;0.41136912894100264;43.0
50;TRANSPORT WODNY;0.4068920748651801;44.0
14;PRODUKCJA ODZIEŻY;0.40395277005223695;45.0
11;PRODUKCJA NAPOJÓW;0.39600615686732143;46.0
25;PRODUKCJA METALOWYCH WYROBÓW GOTOWYCH, Z WYŁĄCZENIEM MASZYN I URZĄDZEŃ;0.3815216006531186;47.0
71;"DZIAŁALNOŚĆ W ZAKRESIE ARCHITEKTURY I INŻYNIERII; BADANIA I ANALIZY TECHNICZNE";0.3764844995571436;48.0
74;POZOSTAŁA DZIAŁALNOŚĆ PROFESJONALNA, NAUKOWA I TECHNICZNA;0.3733202498062881;49.0
65;DZIAŁALNOŚĆ W ZAKRESIE UBEZPIECZEŃ, REASEKURACJI ORAZ FUNDUSZY EMERYTALNYCH, Z WYŁĄCZENIEM OBOWIĄZKOWEGO UBEZPIECZENIA SPOŁECZNEGO;0.36382267739180874;50.0
07;GÓRNICTWO RUD METALI;0.3627140358006671;51.0
06;GÓRNICTWO ROPY NAFTOWEJ I GAZU ZIEMNEGO;0.3616124091630606;52.0
28;PRODUKCJA MASZYN I URZĄDZEŃ, GDZIE INDZIEJ NIESKLASYFIKOWANA;0.3608379161664218;53.0
98;GOSPODARSTWA DOMOWE PRODUKUJĄCE WYROBY I ŚWIADCZĄCE USŁUGI NA WŁASNE POTRZEBY;0.3596688165046382;54.0
97;GOSPODARSTWA DOMOWE ZATRUDNIAJĄCE PRACOWNIKÓW;0.35868939535253164;55.0
84;"ADMINISTRACJA PUBLICZNA I OBRONA NARODOWA; OBOWIĄZKOWE UBEZPIECZENIA SPOŁECZNE";0.3586455119590799;56.0
99;ORGANIZACJE I ZESPOŁY EKSTERYTORIALNE;0.3564090845454717;57.0
42;ROBOTY ZWIĄZANE Z BUDOWĄ OBIEKTÓW INŻYNIERII LĄDOWEJ I WODNEJ;0.3537277958520375;58.0
30;PRODUKCJA POZOSTAŁEGO SPRZĘTU TRANSPORTOWEGO;0.3507276150086841;59.0
35;WYTWARZANIE I ZAOPATRYWANIE W ENERGIĘ ELEKTRYCZNĄ, GAZ, PARĘ WODNĄ I POWIETRZE DO UKŁADÓW KLIMATYZACYJNYCH;0.3405347556386906;60.0
27;PRODUKCJA URZĄDZEŃ ELEKTRYCZNYCH;0.32617265519910665;61.0
19;WYTWARZANIE I PRZETWARZANIE KOKSU I PRODUKTÓW RAFINACJI ROPY NAFTOWEJ;0.3252493929513274;62.0
62;DZIAŁALNOŚĆ ZWIĄZANA Z PROGRAMOWANIEM, DORADZTWEM W ZAKRESIE INFORMATYKI I DZIAŁALNOŚCI POWIĄZANE;0.3198203809017701;63.0
66;DZIAŁALNOŚĆ WSPOMAGAJĄCA USŁUGI FINANSOWE, UBEZPIECZENIA I FUNDUSZE EMERYTALNE;0.31466153796112706;64.0
15;PRODUKCJA SKÓR I WYROBÓW ZE SKÓR WYPRAWIONYCH, PRODUKCJA PODOBNYCH WYROBÓW Z INNYCH MATERIAŁÓW;0.3098100401262063;65.0
47;HANDEL DETALICZNY;0.30148822310375223;66.0
81;DZIAŁALNOŚĆ USŁUGOWA ZWIĄZANA Z UTRZYMANIEM PORZĄDKU W BUDYNKACH I ZAGOSPODAROWANIEM TERENÓW ZIELENI;0.2990056912627126;67.0
82;DZIAŁALNOŚĆ ZWIĄZANA Z ADMINISTRACYJNĄ OBSŁUGĄ BIURA I POZOSTAŁA DZIAŁALNOŚĆ WSPOMAGAJĄCA PROWADZENIE DZIAŁALNOŚCI GOSPODARCZEJ;0.29407142090425487;68.0
46;HANDEL HURTOWY;0.2900052108340083;69.0
33;NAPRAWA, KONSERWACJA I INSTALOWANIE MASZYN I URZĄDZEŃ;0.2773309631551697;70.0
53;DZIAŁALNOŚĆ POCZTOWA I KURIERSKA;0.27468987364010755;71.0
78;DZIAŁALNOŚĆ ZWIĄZANA Z ZATRUDNIENIEM;0.2680258296381568;72.0
26;PRODUKCJA KOMPUTERÓW, WYROBÓW ELEKTRONICZNYCH I OPTYCZNYCH;0.265299252421465;73.0
29;PRODUKCJA POJAZDÓW SILNIKOWYCH, PRODUKCJA PRZYCZEP I NACZEP;0.2617273443053554;74.0
43;ROBOTY BUDOWLANE SPECJALISTYCZNE;0.2405607488580781;75.0
95;NAPRAWA I KONSERWACJA KOMPUTERÓW, ARTYKUŁÓW UŻYTKU OSOBISTEGO I DOMOWEGO ORAZ POJAZDÓW SILNIKOWYCH, W TYM MOTOCYKLI;0.22464067324914994;76.0
41;ROBOTY BUDOWLANE ZWIĄZANE ZE WZNOSZENIEM BUDYNKÓW MIESZKALNYCH I NIEMIESZKALNYCH;0.22234319153580828;77.0
73;DZIAŁALNOŚĆ W ZAKRESIE REKLAMY, BADANIA RYNKU I PUBLIC RELATIONS;0.1952537641665788;78.0
80;DZIAŁALNOŚĆ DETEKTYWISTYCZNA I OCHRONIARSKA;0.17908557405678283;79.0
79;DZIAŁALNOŚĆ ORGANIZATORÓW TURYSTYKI, AGENTÓW TURYSTYCZNYCH ORAZ POZOSTAŁA DZIAŁALNOŚĆ USŁUGOWA W ZAKRESIE REZERWACJI I DZIAŁALNOŚCI Z NIĄ ZWIĄZANE;0.14875829588472267;80.0
05;WYDOBYWANIE WĘGLA KAMIENNEGO I WĘGLA BRUNATNEGO (LIGNITU);0.139739585310223;81.0
90;DZIAŁALNOŚĆ TWÓRCZA I DZIAŁALNOŚĆ ZWIĄZANA Z WYSTAWIANIEM PRZEDSTAWIEŃ ARTYSTYCZNYCH;0.13034993269513873;82.0
88;POMOC SPOŁECZNA BEZ ZAKWATEROWANIA;0.13024982104467475;83.0
75;DZIAŁALNOŚĆ WETERYNARYJNA;0.12169740229994397;84.0
51;TRANSPORT LOTNICZY;0.1135572867415543;85.0
92;DZIAŁALNOŚĆ ZWIĄZANA Z GRAMI HAZARDOWYMI;0.04977209394839521;86.0
02;LEŚNICTWO I POZYSKIWANIE DREWNA;0.0432209091708291;87.0
