alternative_id;nazwa;ensemble_score;ensemble_rank
60;NADAWANIE PROGRAMÓW OGÓLNODOSTĘPNYCH I ABONAMENTOWYCH, DZIAŁALNOŚĆ AGENCJI INFORMACYJNYCH I POZOSTAŁA DZIAŁALNOŚĆ ZWIĄZANA Z DYSTRYBUCJĄ TREŚCI;0.8027416375410263;1.0
77;WYNAJEM I DZIERŻAWA;0.7635841635084971;2.0
87;POMOC SPOŁECZNA Z ZAKWATEROWANIEM;0.7192935179254644;3.0
37;ODPROWADZANIE I OCZYSZCZANIE ŚCIEKÓW;0.7032758311440008;4.0
36;POBÓR, UZDATNIANIE I DOSTARCZANIE WODY;0.7010807594243049;5.0
55;ZAKWATEROWANIE;0.6986956403030347;6.0
91;DZIAŁALNOŚĆ BIBLIOTEK, ARCHIWÓW, MUZEÓW ORAZ POZOSTAŁA DZIAŁALNOŚĆ ZWIĄZANA Z KULTURĄ;0.6910832868915776;7.0
93;DZIAŁALNOŚĆ SPORTOWA, ROZRYWKOWA I REKREACYJNA;0.6792228529710893;8.0
63;DZIAŁALNOŚĆ USŁUGOWA W ZAKRESIE INFRASTRUKTURY OBLICZENIOWEJ, PRZETWARZANIA DANYCH, ZARZĄDZANIA STRONAMI INTERNETOWYMI (HOSTING) I POZOSTAŁA DZIAŁALNOŚĆ USŁUGOWA W ZAKRESIE INFORMACJI;0.6593238428532138;9.0
56;DZIAŁALNOŚĆ USŁUGOWA ZWIĄZANA Z WYŻYWIENIEM;0.6446887915887817;10.0
94;DZIAŁALNOŚĆ ORGANIZACJI CZŁONKOWSKICH;0.6344571773015708;11.0
64;FINANSOWA DZIAŁALNOŚĆ USŁUGOWA, Z WYŁĄCZENIEM UBEZPIECZEŃ I FUNDUSZY EMERYTALNYCH;0.6310433459815632;12.0
61;TELEKOMUNIKACJA;0.6296140730752369;13.0
01;UPRAWY ROLNE, CHÓW I HODOWLA ZWIERZĄT, ŁOWIECTWO, W TYM DZIAŁALNOŚĆ USŁUGOWA;0.5911016408373686;14.0
50;TRANSPORT WODNY;0.5879584969509255;15.0
86;OPIEKA ZDROWOTNA;0.5864226071762346;16.0
68;DZIAŁALNOŚĆ ZWIĄZANA Z OBSŁUGĄ RYNKU NIERUCHOMOŚCI;0.5854051757153866;17.0
32;POZOSTAŁA PRODUKCJA WYROBÓW;0.5831034005216099;18.0
23;PRODUKCJA WYROBÓW Z POZOSTAŁYCH MINERALNYCH SUROWCÓW NIEMETALICZNYCH;0.5810668347406751;19.0
85;EDUKACJA;0.579400827459855;20.0
39;DZIAŁALNOŚĆ ZWIĄZANA Z REKULTYWACJĄ I POZOSTAŁA DZIAŁALNOŚĆ USŁUGOWA ZWIĄZANA Z GOSPODARKĄ ODPADAMI;0.5615432846708559;21.0
38;DZIAŁALNOŚĆ ZWIĄZANA ZE ZBIERANIEM, ODZYSKIEM I UNIESZKODLIWIANIEM ODPADÓW;0.5603678815272022;22.0
31;PRODUKCJA MEBLI;0.5580101985635191;23.0
03;RYBACTWO;0.555187190369806;24.0
09;DZIAŁALNOŚĆ USŁUGOWA WSPOMAGAJĄCA GÓRNICTWO I WYDOBYWANIE;0.5550301865282121;25.0
19;WYTWARZANIE I PRZETWARZANIE KOKSU I PRODUKTÓW RAFINACJI ROPY NAFTOWEJ;0.5463441378160226;26.0
17;PRODUKCJA PAPIERU I WYROBÓW Z PAPIERU;0.5449287656111278;27.0
59;DZIAŁALNOŚĆ ZWIĄZANA Z PRODUKCJĄ FILMÓW, NAGRAŃ WIDEO, PROGRAMÓW TELEWIZYJNYCH, NAGRAŃ DŹWIĘKOWYCH I MUZYCZNYCH;0.5426781304311143;28.0
24;PRODUKCJA METALI;0.5382194967733065;29.0
08;POZOSTAŁE GÓRNICTWO I WYDOBYWANIE;0.5278336804082464;30.0
49;TRANSPORT LĄDOWY ORAZ TRANSPORT RUROCIĄGOWY;0.5264834937815364;31.0
58;DZIAŁALNOŚĆ WYDAWNICZA;0.5258878759108739;32.0
70;DZIAŁALNOŚĆ CENTRAL (HEAD OFFICES) ORAZ DORADZTWO ZWIĄZANE Z ZARZĄDZANIEM;0.5240504998460939;33.0
11;PRODUKCJA NAPOJÓW;0.5201801847339157;34.0
30;PRODUKCJA POZOSTAŁEGO SPRZĘTU TRANSPORTOWEGO;0.5199493131690974;35.0
10;PRODUKCJA ARTYKUŁÓW SPOŻYWCZYCH;0.5098718196345258;36.0
16;"PRODUKCJA WYROBÓW Z DREWNA I KORKA, Z WYŁĄCZENIEM MEBLI; PRODUKCJA WYROBÓW ZE SŁOMY I MATERIAŁÓW UŻYWANYCH DO WYPLATANIA";0.5095325464002952;37.0
95;NAPRAWA I KONSERWACJA KOMPUTERÓW, ARTYKUŁÓW UŻYTKU OSOBISTEGO I DOMOWEGO ORAZ POJAZDÓW SILNIKOWYCH, W TYM MOTOCYKLI;0.507195960528975;38.0
96;DZIAŁALNOŚĆ USŁUGOWA INDYWIDUALNA;0.5066242794436574;39.0
13;PRODUKCJA WYROBÓW TEKSTYLNYCH;0.5044705465452856;40.0
73;DZIAŁALNOŚĆ W ZAKRESIE REKLAMY, BADANIA RYNKU I PUBLIC RELATIONS;0.5021029304398192;41.0
42;ROBOTY ZWIĄZANE Z BUDOWĄ OBIEKTÓW INŻYNIERII LĄDOWEJ I WODNEJ;0.5001685897629616;42.0
25;PRODUKCJA METALOWYCH WYROBÓW GOTOWYCH, Z WYŁĄCZENIEM MASZYN I URZĄDZEŃ;0.49177082800078786;43.0
82;DZIAŁALNOŚĆ ZWIĄZANA Z ADMINISTRACYJNĄ OBSŁUGĄ BIURA I POZOSTAŁA DZIAŁALNOŚĆ WSPOMAGAJĄCA PROWADZENIE DZIAŁALNOŚCI GOSPODARCZEJ;0.49165670790328475;44.0
18;POLIGRAFIA I REPRODUKCJA ZAPISANYCH NOŚNIKÓW INFORMACJI;0.4912810028210595;45.0
52;MAGAZYNOWANIE, PRZECHOWYWANIE I DZIAŁALNOŚĆ USŁUGOWA WSPOMAGAJĄCA TRANSPORT;0.4883774495436263;46.0
20;PRODUKCJA CHEMIKALIÓW I WYROBÓW CHEMICZNYCH;0.4836893344240073;47.0
21;PRODUKCJA PODSTAWOWYCH SUBSTANCJI FARMACEUTYCZNYCH ORAZ LEKÓW I POZOSTAŁYCH WYROBÓW FARMACEUTYCZNYCH;0.4826119155698559;48.0
14;PRODUKCJA ODZIEŻY;0.47531192895458424;49.0
22;PRODUKCJA WYROBÓW Z GUMY I TWORZYW SZTUCZNYCH;0.4716172591887624;50.0
72;BADANIA NAUKOWE I PRACE ROZWOJOWE;0.47112057484503783;51.0
92;DZIAŁALNOŚĆ ZWIĄZANA Z GRAMI HAZARDOWYMI;0.4617133610792537;52.0
47;HANDEL DETALICZNY;0.4523817486682691;53.0
35;WYTWARZANIE I ZAOPATRYWANIE W ENERGIĘ ELEKTRYCZNĄ, GAZ, PARĘ WODNĄ I POWIETRZE DO UKŁADÓW KLIMATYZACYJNYCH;0.4483639345311121;54.0
97;GOSPODARSTWA DOMOWE ZATRUDNIAJĄCE PRACOWNIKÓW;0.4471327607223099;55.0
84;"ADMINISTRACJA PUBLICZNA I OBRONA NARODOWA; OBOWIĄZKOWE UBEZPIECZENIA SPOŁECZNE";0.44713055550778935;56.0
07;GÓRNICTWO RUD METALI;0.44712084194948476;57.0
98;GOSPODARSTWA DOMOWE PRODUKUJĄCE WYROBY I ŚWIADCZĄCE USŁUGI NA WŁASNE POTRZEBY;0.4471162415332477;58.0
65;DZIAŁALNOŚĆ W ZAKRESIE UBEZPIECZEŃ, REASEKURACJI ORAZ FUNDUSZY EMERYTALNYCH, Z WYŁĄCZENIEM OBOWIĄZKOWEGO UBEZPIECZENIA SPOŁECZNEGO;0.4470946197258471;59.0
99;ORGANIZACJE I ZESPOŁY EKSTERYTORIALNE;0.4470930865226691;60.0
06;GÓRNICTWO ROPY NAFTOWEJ I GAZU ZIEMNEGO;0.4470603997927317;61.0
26;PRODUKCJA KOMPUTERÓW, WYROBÓW ELEKTRONICZNYCH I OPTYCZNYCH;0.4434472669774452;62.0
62;DZIAŁALNOŚĆ ZWIĄZANA Z PROGRAMOWANIEM, DORADZTWEM W ZAKRESIE INFORMATYKI I DZIAŁALNOŚCI POWIĄZANE;0.44328988764063393;63.0
88;POMOC SPOŁECZNA BEZ ZAKWATEROWANIA;0.44026881485184466;64.0
28;PRODUKCJA MASZYN I URZĄDZEŃ, GDZIE INDZIEJ NIESKLASYFIKOWANA;0.4394989136113411;65.0
46;HANDEL HURTOWY;0.4303621450041002;66.0
81;DZIAŁALNOŚĆ USŁUGOWA ZWIĄZANA Z UTRZYMANIEM PORZĄDKU W BUDYNKACH I ZAGOSPODAROWANIEM TERENÓW ZIELENI;0.4286602096630586;67.0
29;PRODUKCJA POJAZDÓW SILNIKOWYCH, PRODUKCJA PRZYCZEP I NACZEP;0.4269838676342049;68.0
27;PRODUKCJA URZĄDZEŃ ELEKTRYCZNYCH;0.4193925064734042;69.0
78;DZIAŁALNOŚĆ ZWIĄZANA Z ZATRUDNIENIEM;0.4098966491562694;70.0
41;ROBOTY BUDOWLANE ZWIĄZANE ZE WZNOSZENIEM BUDYNKÓW MIESZKALNYCH I NIEMIESZKALNYCH;0.4070908474124183;71.0
43;ROBOTY BUDOWLANE SPECJALISTYCZNE;0.4017213726905291;72.0
71;"DZIAŁALNOŚĆ W ZAKRESIE ARCHITEKTURY I INŻYNIERII; BADANIA I ANALIZY TECHNICZNE";0.39616749347515057;73.0
74;POZOSTAŁA DZIAŁALNOŚĆ PROFESJONALNA, NAUKOWA I TECHNICZNA;0.38990449439047253;74.0
69;DZIAŁALNOŚĆ PRAWNICZA, RACHUNKOWO-KSIĘGOWA I DORADZTWO PODATKOWE;0.38397218325179006;75.0
15;PRODUKCJA SKÓR I WYROBÓW ZE SKÓR WYPRAWIONYCH, PRODUKCJA PODOBNYCH WYROBÓW Z INNYCH MATERIAŁÓW;0.3835958892976674;76.0
33;NAPRAWA, KONSERWACJA I INSTALOWANIE MASZYN I URZĄDZEŃ;0.3821740748755295;77.0
53;DZIAŁALNOŚĆ POCZTOWA I KURIERSKA;0.37949588666926826;78.0
12;PRODUKCJA WYROBÓW TYTONIOWYCH;0.3752090693029231;79.0
80;DZIAŁALNOŚĆ DETEKTYWISTYCZNA I OCHRONIARSKA;0.37353781494846094;80.0
75;DZIAŁALNOŚĆ WETERYNARYJNA;0.3601208796972867;81.0
05;WYDOBYWANIE WĘGLA KAMIENNEGO I WĘGLA BRUNATNEGO (LIGNITU);0.3534133183752055;82.0
90;DZIAŁALNOŚĆ TWÓRCZA I DZIAŁALNOŚĆ ZWIĄZANA Z WYSTAWIANIEM PRZEDSTAWIEŃ ARTYSTYCZNYCH;0.3512209672905451;83.0
02;LEŚNICTWO I POZYSKIWANIE DREWNA;0.3158367153517903;84.0
66;DZIAŁALNOŚĆ WSPOMAGAJĄCA USŁUGI FINANSOWE, UBEZPIECZENIA I FUNDUSZE EMERYTALNE;0.3098069917350318;85.0
79;DZIAŁALNOŚĆ ORGANIZATORÓW TURYSTYKI, AGENTÓW TURYSTYCZNYCH ORAZ POZOSTAŁA DZIAŁALNOŚĆ USŁUGOWA W ZAKRESIE REZERWACJI I DZIAŁALNOŚCI Z NIĄ ZWIĄZANE;0.2957988663769808;86.0
51;TRANSPORT LOTNICZY;0.1385849633163851;87.0
