alternative_id;nazwa;ensemble_score;ensemble_rank
94;DZIAŁALNOŚĆ ORGANIZACJI CZŁONKOWSKICH;0.6547225190176645;1.0
75;DZIAŁALNOŚĆ WETERYNARYJNA;0.5730279726538;2.0
63;DZIAŁALNOŚĆ USŁUGOWA W ZAKRESIE INFRASTRUKTURY OBLICZENIOWEJ, PRZETWARZANIA DANYCH, ZARZĄDZANIA STRONAMI INTERNETOWYMI (HOSTING) I POZOSTAŁA DZIAŁALNOŚĆ USŁUGOWA W ZAKRESIE INFORMACJI;0.4633063283547242;3.0
09;DZIAŁALNOŚĆ USŁUGOWA WSPOMAGAJĄCA GÓRNICTWO I WYDOBYWANIE;0.46180095681270994;4.0
08;POZOSTAŁE GÓRNICTWO I WYDOBYWANIE;0.44426960956401096;5.0
15;PRODUKCJA SKÓR I WYROBÓW ZE SKÓR WYPRAWIONYCH, PRODUKCJA PODOBNYCH WYROBÓW Z INNYCH MATERIAŁÓW;0.4371549444140357;6.0
03;RYBACTWO;0.42579332838611367;7.0
62;DZIAŁALNOŚĆ ZWIĄZANA Z PROGRAMOWANIEM, DORADZTWEM W ZAKRESIE INFORMATYKI I DZIAŁALNOŚCI POWIĄZANE;0.42517654689074325;8.0
64;FINANSOWA DZIAŁALNOŚĆ USŁUGOWA, Z WYŁĄCZENIEM UBEZPIECZEŃ I FUNDUSZY EMERYTALNYCH;0.42443317446426343;9.0
59;DZIAŁALNOŚĆ ZWIĄZANA Z PRODUKCJĄ FILMÓW, NAGRAŃ WIDEO, PROGRAMÓW TELEWIZYJNYCH, NAGRAŃ DŹWIĘKOWYCH I MUZYCZNYCH;0.40482663870072744;10.0
02;LEŚNICTWO I POZYSKIWANIE DREWNA;0.4008182983994254;11.0
58;DZIAŁALNOŚĆ WYDAWNICZA;0.39587795436258705;12.0
14;PRODUKCJA ODZIEŻY;0.395684476644655;13.0
85;EDUKACJA;0.3912695016302258;14.0
37;ODPROWADZANIE I OCZYSZCZANIE ŚCIEKÓW;0.38969039384048954;15.0
51;TRANSPORT LOTNICZY;0.3790416304094595;16.0
21;PRODUKCJA PODSTAWOWYCH SUBSTANCJI FARMACEUTYCZNYCH ORAZ LEKÓW I POZOSTAŁYCH WYROBÓW FARMACEUTYCZNYCH;0.374320257523238;17.0
72;BADANIA NAUKOWE I PRACE ROZWOJOWE;0.37123136830124126;18.0
36;POBÓR, UZDATNIANIE I DOSTARCZANIE WODY;0.3685612508772492;19.0
69;DZIAŁALNOŚĆ PRAWNICZA, RACHUNKOWO-KSIĘGOWA I DORADZTWO PODATKOWE;0.36497790788216344;20.0
31;PRODUKCJA MEBLI;0.35697670140608095;21.0
91;DZIAŁALNOŚĆ BIBLIOTEK, ARCHIWÓW, MUZEÓW ORAZ POZOSTAŁA DZIAŁALNOŚĆ ZWIĄZANA Z KULTURĄ;0.35396711863230523;22.0
74;POZOSTAŁA DZIAŁALNOŚĆ PROFESJONALNA, NAUKOWA I TECHNICZNA;0.345250728339274;23.0
17;PRODUKCJA PAPIERU I WYROBÓW Z PAPIERU;0.3413766396674087;24.0
96;DZIAŁALNOŚĆ USŁUGOWA INDYWIDUALNA;0.3379504608812532;25.0
71;"DZIAŁALNOŚĆ W ZAKRESIE ARCHITEKTURY I INŻYNIERII; BADANIA I ANALIZY TECHNICZNE";0.3367362570724489;26.0
23;PRODUKCJA WYROBÓW Z POZOSTAŁYCH MINERALNYCH SUROWCÓW NIEMETALICZNYCH;0.3299362767714038;27.0
01;UPRAWY ROLNE, CHÓW I HODOWLA ZWIERZĄT, ŁOWIECTWO, W TYM DZIAŁALNOŚĆ USŁUGOWA;0.3274020910716815;28.0
88;POMOC SPOŁECZNA BEZ ZAKWATEROWANIA;0.3256560759600586;29.0
77;WYNAJEM I DZIERŻAWA;0.32312515882112447;30.0
28;PRODUKCJA MASZYN I URZĄDZEŃ, GDZIE INDZIEJ NIESKLASYFIKOWANA;0.3230006657974873;31.0
43;ROBOTY BUDOWLANE SPECJALISTYCZNE;0.3204874580154952;32.0
66;DZIAŁALNOŚĆ WSPOMAGAJĄCA USŁUGI FINANSOWE, UBEZPIECZENIA I FUNDUSZE EMERYTALNE;0.31929300202417976;33.0
19;WYTWARZANIE I PRZETWARZANIE KOKSU I PRODUKTÓW RAFINACJI ROPY NAFTOWEJ;0.31475966316536125;34.0
41;ROBOTY BUDOWLANE ZWIĄZANE ZE WZNOSZENIEM BUDYNKÓW MIESZKALNYCH I NIEMIESZKALNYCH;0.3131625922228065;35.0
18;POLIGRAFIA I REPRODUKCJA ZAPISANYCH NOŚNIKÓW INFORMACJI;0.3053399399252013;36.0
87;POMOC SPOŁECZNA Z ZAKWATEROWANIEM;0.30271244135841474;37.0
81;DZIAŁALNOŚĆ USŁUGOWA ZWIĄZANA Z UTRZYMANIEM PORZĄDKU W BUDYNKACH I ZAGOSPODAROWANIEM TERENÓW ZIELENI;0.30132090834095704;38.0
68;DZIAŁALNOŚĆ ZWIĄZANA Z OBSŁUGĄ RYNKU NIERUCHOMOŚCI;0.3010842244877153;39.0
25;PRODUKCJA METALOWYCH WYROBÓW GOTOWYCH, Z WYŁĄCZENIEM MASZYN I URZĄDZEŃ;0.29846744925127644;40.0
32;POZOSTAŁA PRODUKCJA WYROBÓW;0.2978114244713478;41.0
61;TELEKOMUNIKACJA;0.296632701610677;42.0
52;MAGAZYNOWANIE, PRZECHOWYWANIE I DZIAŁALNOŚĆ USŁUGOWA WSPOMAGAJĄCA TRANSPORT;0.29584080474302055;43.0
84;"ADMINISTRACJA PUBLICZNA I OBRONA NARODOWA; OBOWIĄZKOWE UBEZPIECZENIA SPOŁECZNE";0.29169105165135734;44.0
92;DZIAŁALNOŚĆ ZWIĄZANA Z GRAMI HAZARDOWYMI;0.2915785182426355;45.0
65;DZIAŁALNOŚĆ W ZAKRESIE UBEZPIECZEŃ, REASEKURACJI ORAZ FUNDUSZY EMERYTALNYCH, Z WYŁĄCZENIEM OBOWIĄZKOWEGO UBEZPIECZENIA SPOŁECZNEGO;0.29132739155027787;46.0
30;PRODUKCJA POZOSTAŁEGO SPRZĘTU TRANSPORTOWEGO;0.2879706787017329;47.0
49;TRANSPORT LĄDOWY ORAZ TRANSPORT RUROCIĄGOWY;0.28749567129089026;48.0
22;PRODUKCJA WYROBÓW Z GUMY I TWORZYW SZTUCZNYCH;0.285063210606167;49.0
07;GÓRNICTWO RUD METALI;0.28122179181646473;50.0
10;PRODUKCJA ARTYKUŁÓW SPOŻYWCZYCH;0.27986932937400444;51.0
06;GÓRNICTWO ROPY NAFTOWEJ I GAZU ZIEMNEGO;0.2788545475806894;52.0
38;DZIAŁALNOŚĆ ZWIĄZANA ZE ZBIERANIEM, ODZYSKIEM I UNIESZKODLIWIANIEM ODPADÓW;0.2783364809517771;53.0
20;PRODUKCJA CHEMIKALIÓW I WYROBÓW CHEMICZNYCH;0.2782414625314582;54.0
99;ORGANIZACJE I ZESPOŁY EKSTERYTORIALNE;0.2759347939867339;55.0
33;NAPRAWA, KONSERWACJA I INSTALOWANIE MASZYN I URZĄDZEŃ;0.27584902222278895;56.0
98;GOSPODARSTWA DOMOWE PRODUKUJĄCE WYROBY I ŚWIADCZĄCE USŁUGI NA WŁASNE POTRZEBY;0.27576706818919056;57.0
97;GOSPODARSTWA DOMOWE ZATRUDNIAJĄCE PRACOWNIKÓW;0.27574926630854146;58.0
24;PRODUKCJA METALI;0.27545622803533243;59.0
56;DZIAŁALNOŚĆ USŁUGOWA ZWIĄZANA Z WYŻYWIENIEM;0.27494758063645874;60.0
55;ZAKWATEROWANIE;0.27436651468736173;61.0
78;DZIAŁALNOŚĆ ZWIĄZANA Z ZATRUDNIENIEM;0.27401969971700557;62.0
26;PRODUKCJA KOMPUTERÓW, WYROBÓW ELEKTRONICZNYCH I OPTYCZNYCH;0.2664382308515876;63.0
42;ROBOTY ZWIĄZANE Z BUDOWĄ OBIEKTÓW INŻYNIERII LĄDOWEJ I WODNEJ;0.2651561602767947;64.0
11;PRODUKCJA NAPOJÓW;0.2625453370122297;65.0
95;NAPRAWA I KONSERWACJA KOMPUTERÓW, ARTYKUŁÓW UŻYTKU OSOBISTEGO I DOMOWEGO ORAZ POJAZDÓW SILNIKOWYCH, W TYM MOTOCYKLI;0.26140480457913157;66.0
16;"PRODUKCJA WYROBÓW Z DREWNA I KORKA, Z WYŁĄCZENIEM MEBLI; PRODUKCJA WYROBÓW ZE SŁOMY I MATERIAŁÓW UŻYWANYCH DO WYPLATANIA";0.25566502243383077;67.0
27;PRODUKCJA URZĄDZEŃ ELEKTRYCZNYCH;0.25499336957596486;68.0
82;DZIAŁALNOŚĆ ZWIĄZANA Z ADMINISTRACYJNĄ OBSŁUGĄ BIURA I POZOSTAŁA DZIAŁALNOŚĆ WSPOMAGAJĄCA PROWADZENIE DZIAŁALNOŚCI GOSPODARCZEJ;0.2537258467620076;69.0
73;DZIAŁALNOŚĆ W ZAKRESIE REKLAMY, BADANIA RYNKU I PUBLIC RELATIONS;0.24657772930682414;70.0
46;HANDEL HURTOWY;0.24612106776459797;71.0
47;HANDEL DETALICZNY;0.24234625284316902;72.0
13;PRODUKCJA WYROBÓW TEKSTYLNYCH;0.23779902598827934;73.0
80;DZIAŁALNOŚĆ DETEKTYWISTYCZNA I OCHRONIARSKA;0.23682709884989162;74.0
70;DZIAŁALNOŚĆ CENTRAL (HEAD OFFICES) ORAZ DORADZTWO ZWIĄZANE Z ZARZĄDZANIEM;0.23632574330268097;75.0
29;PRODUKCJA POJAZDÓW SILNIKOWYCH, PRODUKCJA PRZYCZEP I NACZEP;0.23627937444582747;76.0
86;OPIEKA ZDROWOTNA;0.22573128254718075;77.0
60;NADAWANIE PROGRAMÓW OGÓLNODOSTĘPNYCH I ABONAMENTOWYCH, DZIAŁALNOŚĆ AGENCJI INFORMACYJNYCH I POZOSTAŁA DZIAŁALNOŚĆ ZWIĄZANA Z DYSTRYBUCJĄ TREŚCI;0.21640642701623697;78.0
53;DZIAŁALNOŚĆ POCZTOWA I KURIERSKA;0.21468210343658034;79.0
35;WYTWARZANIE I ZAOPATRYWANIE W ENERGIĘ ELEKTRYCZNĄ, GAZ, PARĘ WODNĄ I POWIETRZE DO UKŁADÓW KLIMATYZACYJNYCH;0.20893959305116466;80.0
05;WYDOBYWANIE WĘGLA KAMIENNEGO I WĘGLA BRUNATNEGO (LIGNITU);0.20306429038208829;81.0
12;PRODUKCJA WYROBÓW TYTONIOWYCH;0.19273358652872352;82.0
90;DZIAŁALNOŚĆ TWÓRCZA I DZIAŁALNOŚĆ ZWIĄZANA Z WYSTAWIANIEM PRZEDSTAWIEŃ ARTYSTYCZNYCH;0.1854834908829119;83.0
39;DZIAŁALNOŚĆ ZWIĄZANA Z REKULTYWACJĄ I POZOSTAŁA DZIAŁALNOŚĆ USŁUGOWA ZWIĄZANA Z GOSPODARKĄ ODPADAMI;0.1831759935819221;84.0
50;TRANSPORT WODNY;0.17743450559708282;85.0
93;DZIAŁALNOŚĆ SPORTOWA, ROZRYWKOWA I REKREACYJNA;0.15790378848668668;86.0
79;DZIAŁALNOŚĆ ORGANIZATORÓW TURYSTYKI, AGENTÓW TURYSTYCZNYCH ORAZ POZOSTAŁA DZIAŁALNOŚĆ USŁUGOWA W ZAKRESIE REZERWACJI I DZIAŁALNOŚCI Z NIĄ ZWIĄZANE;0.12713552818740204;87.0
