alternative_id;nazwa;topsis_score;topsis_rank
94;DZIAŁALNOŚĆ ORGANIZACJI CZŁONKOWSKICH;0.5830279523695192;1.0
03;RYBACTWO;0.468125692320538;2.0
64;FINANSOWA DZIAŁALNOŚĆ USŁUGOWA, Z WYŁĄCZENIEM UBEZPIECZEŃ I FUNDUSZY EMERYTALNYCH;0.42536145749641463;3.0
58;DZIAŁALNOŚĆ WYDAWNICZA;0.41699662115355246;4.0
02;LEŚNICTWO I POZYSKIWANIE DREWNA;0.4060150076434332;5.0
08;POZOSTAŁE GÓRNICTWO I WYDOBYWANIE;0.3644887362896194;6.0
90;DZIAŁALNOŚĆ TWÓRCZA I DZIAŁALNOŚĆ ZWIĄZANA Z WYSTAWIANIEM PRZEDSTAWIEŃ ARTYSTYCZNYCH;0.3551418357624572;7.0
21;PRODUKCJA PODSTAWOWYCH SUBSTANCJI FARMACEUTYCZNYCH ORAZ LEKÓW I POZOSTAŁYCH WYROBÓW FARMACEUTYCZNYCH;0.3532502392389102;8.0
85;EDUKACJA;0.35026556941024056;9.0
77;WYNAJEM I DZIERŻAWA;0.3486534668257084;10.0
66;DZIAŁALNOŚĆ WSPOMAGAJĄCA USŁUGI FINANSOWE, UBEZPIECZENIA I FUNDUSZE EMERYTALNE;0.33511668872509565;11.0
01;UPRAWY ROLNE, CHÓW I HODOWLA ZWIERZĄT, ŁOWIECTWO, W TYM DZIAŁALNOŚĆ USŁUGOWA;0.3334760711412285;12.0
69;DZIAŁALNOŚĆ PRAWNICZA, RACHUNKOWO-KSIĘGOWA I DORADZTWO PODATKOWE;0.33335416330613815;13.0
96;DZIAŁALNOŚĆ USŁUGOWA INDYWIDUALNA;0.33096104599125686;14.0
19;WYTWARZANIE I PRZETWARZANIE KOKSU I PRODUKTÓW RAFINACJI ROPY NAFTOWEJ;0.3263321341912441;15.0
70;DZIAŁALNOŚĆ CENTRAL (HEAD OFFICES) ORAZ DORADZTWO ZWIĄZANE Z ZARZĄDZANIEM;0.32433093438079785;16.0
51;TRANSPORT LOTNICZY;0.3167644747050594;17.0
38;DZIAŁALNOŚĆ ZWIĄZANA ZE ZBIERANIEM, ODZYSKIEM I UNIESZKODLIWIANIEM ODPADÓW;0.3086443626313772;18.0
63;DZIAŁALNOŚĆ USŁUGOWA W ZAKRESIE INFRASTRUKTURY OBLICZENIOWEJ, PRZETWARZANIA DANYCH, ZARZĄDZANIA STRONAMI INTERNETOWYMI (HOSTING) I POZOSTAŁA DZIAŁALNOŚĆ USŁUGOWA W ZAKRESIE INFORMACJI;0.3070535930609188;19.0
61;TELEKOMUNIKACJA;0.3038627591174686;20.0
62;DZIAŁALNOŚĆ ZWIĄZANA Z PROGRAMOWANIEM, DORADZTWEM W ZAKRESIE INFORMATYKI I DZIAŁALNOŚCI POWIĄZANE;0.30146161184887577;21.0
14;PRODUKCJA ODZIEŻY;0.297939423660372;22.0
55;ZAKWATEROWANIE;0.29620091461492204;23.0
39;DZIAŁALNOŚĆ ZWIĄZANA Z REKULTYWACJĄ I POZOSTAŁA DZIAŁALNOŚĆ USŁUGOWA ZWIĄZANA Z GOSPODARKĄ ODPADAMI;0.2933396458487207;24.0
79;DZIAŁALNOŚĆ ORGANIZATORÓW TURYSTYKI, AGENTÓW TURYSTYCZNYCH ORAZ POZOSTAŁA DZIAŁALNOŚĆ USŁUGOWA W ZAKRESIE REZERWACJI I DZIAŁALNOŚCI Z NIĄ ZWIĄZANE;0.2929558641450527;25.0
82;DZIAŁALNOŚĆ ZWIĄZANA Z ADMINISTRACYJNĄ OBSŁUGĄ BIURA I POZOSTAŁA DZIAŁALNOŚĆ WSPOMAGAJĄCA PROWADZENIE DZIAŁALNOŚCI GOSPODARCZEJ;0.2914345913067569;26.0
91;DZIAŁALNOŚĆ BIBLIOTEK, ARCHIWÓW, MUZEÓW ORAZ POZOSTAŁA DZIAŁALNOŚĆ ZWIĄZANA Z KULTURĄ;0.2911167439656337;27.0
60;NADAWANIE PROGRAMÓW OGÓLNODOSTĘPNYCH I ABONAMENTOWYCH, DZIAŁALNOŚĆ AGENCJI INFORMACYJNYCH I POZOSTAŁA DZIAŁALNOŚĆ ZWIĄZANA Z DYSTRYBUCJĄ TREŚCI;0.2905863611101841;28.0
81;DZIAŁALNOŚĆ USŁUGOWA ZWIĄZANA Z UTRZYMANIEM PORZĄDKU W BUDYNKACH I ZAGOSPODAROWANIEM TERENÓW ZIELENI;0.28294816513528515;29.0
43;ROBOTY BUDOWLANE SPECJALISTYCZNE;0.2793536630416915;30.0
42;ROBOTY ZWIĄZANE Z BUDOWĄ OBIEKTÓW INŻYNIERII LĄDOWEJ I WODNEJ;0.27852858262659785;31.0
23;PRODUKCJA WYROBÓW Z POZOSTAŁYCH MINERALNYCH SUROWCÓW NIEMETALICZNYCH;0.2770950916681623;32.0
11;PRODUKCJA NAPOJÓW;0.27675294436887693;33.0
52;MAGAZYNOWANIE, PRZECHOWYWANIE I DZIAŁALNOŚĆ USŁUGOWA WSPOMAGAJĄCA TRANSPORT;0.2767346288388782;34.0
56;DZIAŁALNOŚĆ USŁUGOWA ZWIĄZANA Z WYŻYWIENIEM;0.27626479126056286;35.0
59;DZIAŁALNOŚĆ ZWIĄZANA Z PRODUKCJĄ FILMÓW, NAGRAŃ WIDEO, PROGRAMÓW TELEWIZYJNYCH, NAGRAŃ DŹWIĘKOWYCH I MUZYCZNYCH;0.27195283613736243;36.0
32;POZOSTAŁA PRODUKCJA WYROBÓW;0.2659833888363529;37.0
84;"ADMINISTRACJA PUBLICZNA I OBRONA NARODOWA; OBOWIĄZKOWE UBEZPIECZENIA SPOŁECZNE";0.2657044268107294;38.0
65;DZIAŁALNOŚĆ W ZAKRESIE UBEZPIECZEŃ, REASEKURACJI ORAZ FUNDUSZY EMERYTALNYCH, Z WYŁĄCZENIEM OBOWIĄZKOWEGO UBEZPIECZENIA SPOŁECZNEGO;0.2651852773045328;39.0
73;DZIAŁALNOŚĆ W ZAKRESIE REKLAMY, BADANIA RYNKU I PUBLIC RELATIONS;0.26435490824807123;40.0
18;POLIGRAFIA I REPRODUKCJA ZAPISANYCH NOŚNIKÓW INFORMACJI;0.2631650446542433;41.0
17;PRODUKCJA PAPIERU I WYROBÓW Z PAPIERU;0.2618960691485462;42.0
37;ODPROWADZANIE I OCZYSZCZANIE ŚCIEKÓW;0.2609878213409197;43.0
50;TRANSPORT WODNY;0.25851625119961624;44.0
22;PRODUKCJA WYROBÓW Z GUMY I TWORZYW SZTUCZNYCH;0.2579517835367496;45.0
80;DZIAŁALNOŚĆ DETEKTYWISTYCZNA I OCHRONIARSKA;0.2564981411590324;46.0
93;DZIAŁALNOŚĆ SPORTOWA, ROZRYWKOWA I REKREACYJNA;0.2551403558509619;47.0
87;POMOC SPOŁECZNA Z ZAKWATEROWANIEM;0.255073629379361;48.0
28;PRODUKCJA MASZYN I URZĄDZEŃ, GDZIE INDZIEJ NIESKLASYFIKOWANA;0.2549759781140403;49.0
16;"PRODUKCJA WYROBÓW Z DREWNA I KORKA, Z WYŁĄCZENIEM MEBLI; PRODUKCJA WYROBÓW ZE SŁOMY I MATERIAŁÓW UŻYWANYCH DO WYPLATANIA";0.25449864456294;50.0
41;ROBOTY BUDOWLANE ZWIĄZANE ZE WZNOSZENIEM BUDYNKÓW MIESZKALNYCH I NIEMIESZKALNYCH;0.2533236678876885;51.0
25;PRODUKCJA METALOWYCH WYROBÓW GOTOWYCH, Z WYŁĄCZENIEM MASZYN I URZĄDZEŃ;0.25319469463982297;52.0
31;PRODUKCJA MEBLI;0.25304483152605245;53.0
74;POZOSTAŁA DZIAŁALNOŚĆ PROFESJONALNA, NAUKOWA I TECHNICZNA;0.252573529235315;54.0
26;PRODUKCJA KOMPUTERÓW, WYROBÓW ELEKTRONICZNYCH I OPTYCZNYCH;0.2512638650089326;55.0
95;NAPRAWA I KONSERWACJA KOMPUTERÓW, ARTYKUŁÓW UŻYTKU OSOBISTEGO I DOMOWEGO ORAZ POJAZDÓW SILNIKOWYCH, W TYM MOTOCYKLI;0.25056630627995435;56.0
86;OPIEKA ZDROWOTNA;0.2494609935163617;57.0
13;PRODUKCJA WYROBÓW TEKSTYLNYCH;0.2494338404701763;58.0
07;GÓRNICTWO RUD METALI;0.2487195719589576;59.0
06;GÓRNICTWO ROPY NAFTOWEJ I GAZU ZIEMNEGO;0.24708549623454926;60.0
78;DZIAŁALNOŚĆ ZWIĄZANA Z ZATRUDNIENIEM;0.24677484312571915;61.0
71;"DZIAŁALNOŚĆ W ZAKRESIE ARCHITEKTURY I INŻYNIERII; BADANIA I ANALIZY TECHNICZNE";0.24613044093325687;62.0
10;PRODUKCJA ARTYKUŁÓW SPOŻYWCZYCH;0.2451855723432676;63.0
68;DZIAŁALNOŚĆ ZWIĄZANA Z OBSŁUGĄ RYNKU NIERUCHOMOŚCI;0.2436254375481986;64.0
36;POBÓR, UZDATNIANIE I DOSTARCZANIE WODY;0.243009805543691;65.0
98;GOSPODARSTWA DOMOWE PRODUKUJĄCE WYROBY I ŚWIADCZĄCE USŁUGI NA WŁASNE POTRZEBY;0.2416110091464072;66.0
97;GOSPODARSTWA DOMOWE ZATRUDNIAJĄCE PRACOWNIKÓW;0.2397718533803422;67.0
99;ORGANIZACJE I ZESPOŁY EKSTERYTORIALNE;0.23969760865358097;68.0
72;BADANIA NAUKOWE I PRACE ROZWOJOWE;0.23862068643490572;69.0
30;PRODUKCJA POZOSTAŁEGO SPRZĘTU TRANSPORTOWEGO;0.23537868185172184;70.0
33;NAPRAWA, KONSERWACJA I INSTALOWANIE MASZYN I URZĄDZEŃ;0.23294779870948845;71.0
15;PRODUKCJA SKÓR I WYROBÓW ZE SKÓR WYPRAWIONYCH, PRODUKCJA PODOBNYCH WYROBÓW Z INNYCH MATERIAŁÓW;0.23291998347530635;72.0
53;DZIAŁALNOŚĆ POCZTOWA I KURIERSKA;0.23138514429310147;73.0
46;HANDEL HURTOWY;0.22312763290686213;74.0
49;TRANSPORT LĄDOWY ORAZ TRANSPORT RUROCIĄGOWY;0.22294160286220344;75.0
88;POMOC SPOŁECZNA BEZ ZAKWATEROWANIA;0.22271948275219655;76.0
29;PRODUKCJA POJAZDÓW SILNIKOWYCH, PRODUKCJA PRZYCZEP I NACZEP;0.2208280458347507;77.0
20;PRODUKCJA CHEMIKALIÓW I WYROBÓW CHEMICZNYCH;0.22072722484709417;78.0
12;PRODUKCJA WYROBÓW TYTONIOWYCH;0.21997090378010195;79.0
35;WYTWARZANIE I ZAOPATRYWANIE W ENERGIĘ ELEKTRYCZNĄ, GAZ, PARĘ WODNĄ I POWIETRZE DO UKŁADÓW KLIMATYZACYJNYCH;0.21721348188051426;80.0
47;HANDEL DETALICZNY;0.21668672563643135;81.0
27;PRODUKCJA URZĄDZEŃ ELEKTRYCZNYCH;0.216505023787212;82.0
24;PRODUKCJA METALI;0.20819314243140546;83.0
92;DZIAŁALNOŚĆ ZWIĄZANA Z GRAMI HAZARDOWYMI;0.20356606207677086;84.0
09;DZIAŁALNOŚĆ USŁUGOWA WSPOMAGAJĄCA GÓRNICTWO I WYDOBYWANIE;0.20266794403393626;85.0
75;DZIAŁALNOŚĆ WETERYNARYJNA;0.19923794577837764;86.0
05;WYDOBYWANIE WĘGLA KAMIENNEGO I WĘGLA BRUNATNEGO (LIGNITU);0.15224715004422584;87.0
