alternative_id;nazwa;ensemble_score;ensemble_rank
94;DZIAŁALNOŚĆ ORGANIZACJI CZŁONKOWSKICH;0.7024389774693267;1.0
03;RYBACTWO;0.6254895522501418;2.0
70;DZIAŁALNOŚĆ CENTRAL (HEAD OFFICES) ORAZ DORADZTWO ZWIĄZANE Z ZARZĄDZANIEM;0.5489136701551351;3.0
02;LEŚNICTWO I POZYSKIWANIE DREWNA;0.5238513505143341;4.0
50;TRANSPORT WODNY;0.5212710326918857;5.0
05;WYDOBYWANIE WĘGLA KAMIENNEGO I WĘGLA BRUNATNEGO (LIGNITU);0.5138606494887166;6.0
90;DZIAŁALNOŚĆ TWÓRCZA I DZIAŁALNOŚĆ ZWIĄZANA Z WYSTAWIANIEM PRZEDSTAWIEŃ ARTYSTYCZNYCH;0.511770086656448;7.0
58;DZIAŁALNOŚĆ WYDAWNICZA;0.4725490871535247;8.0
75;DZIAŁALNOŚĆ WETERYNARYJNA;0.468176794606426;9.0
64;FINANSOWA DZIAŁALNOŚĆ USŁUGOWA, Z WYŁĄCZENIEM UBEZPIECZEŃ I FUNDUSZY EMERYTALNYCH;0.4678035029388566;10.0
01;UPRAWY ROLNE, CHÓW I HODOWLA ZWIERZĄT, ŁOWIECTWO, W TYM DZIAŁALNOŚĆ USŁUGOWA;0.4621193584745586;11.0
19;WYTWARZANIE I PRZETWARZANIE KOKSU I PRODUKTÓW RAFINACJI ROPY NAFTOWEJ;0.45443710279728666;12.0
51;TRANSPORT LOTNICZY;0.4500689037544242;13.0
21;PRODUKCJA PODSTAWOWYCH SUBSTANCJI FARMACEUTYCZNYCH ORAZ LEKÓW I POZOSTAŁYCH WYROBÓW FARMACEUTYCZNYCH;0.44720056375506956;14.0
38;DZIAŁALNOŚĆ ZWIĄZANA ZE ZBIERANIEM, ODZYSKIEM I UNIESZKODLIWIANIEM ODPADÓW;0.43960382419443844;15.0
55;ZAKWATEROWANIE;0.4393549207685408;16.0
85;EDUKACJA;0.4373351130161862;17.0
08;POZOSTAŁE GÓRNICTWO I WYDOBYWANIE;0.4356522396813082;18.0
69;DZIAŁALNOŚĆ PRAWNICZA, RACHUNKOWO-KSIĘGOWA I DORADZTWO PODATKOWE;0.43468263642533883;19.0
62;DZIAŁALNOŚĆ ZWIĄZANA Z PROGRAMOWANIEM, DORADZTWEM W ZAKRESIE INFORMATYKI I DZIAŁALNOŚCI POWIĄZANE;0.43346273276034974;20.0
16;"PRODUKCJA WYROBÓW Z DREWNA I KORKA, Z WYŁĄCZENIEM MEBLI; PRODUKCJA WYROBÓW ZE SŁOMY I MATERIAŁÓW UŻYWANYCH DO WYPLATANIA";0.4328514603687539;21.0
96;DZIAŁALNOŚĆ USŁUGOWA INDYWIDUALNA;0.43270176448707814;22.0
72;BADANIA NAUKOWE I PRACE ROZWOJOWE;0.4309121044061551;23.0
74;POZOSTAŁA DZIAŁALNOŚĆ PROFESJONALNA, NAUKOWA I TECHNICZNA;0.43049312137224816;24.0
32;POZOSTAŁA PRODUKCJA WYROBÓW;0.42333727909540153;25.0
91;DZIAŁALNOŚĆ BIBLIOTEK, ARCHIWÓW, MUZEÓW ORAZ POZOSTAŁA DZIAŁALNOŚĆ ZWIĄZANA Z KULTURĄ;0.41370100027076306;26.0
24;PRODUKCJA METALI;0.40617197627447676;27.0
52;MAGAZYNOWANIE, PRZECHOWYWANIE I DZIAŁALNOŚĆ USŁUGOWA WSPOMAGAJĄCA TRANSPORT;0.403033139254991;28.0
23;PRODUKCJA WYROBÓW Z POZOSTAŁYCH MINERALNYCH SUROWCÓW NIEMETALICZNYCH;0.4001274410222515;29.0
41;ROBOTY BUDOWLANE ZWIĄZANE ZE WZNOSZENIEM BUDYNKÓW MIESZKALNYCH I NIEMIESZKALNYCH;0.3962955610791561;30.0
14;PRODUKCJA ODZIEŻY;0.39618139143535347;31.0
25;PRODUKCJA METALOWYCH WYROBÓW GOTOWYCH, Z WYŁĄCZENIEM MASZYN I URZĄDZEŃ;0.39427039360979127;32.0
17;PRODUKCJA PAPIERU I WYROBÓW Z PAPIERU;0.39020828904896143;33.0
28;PRODUKCJA MASZYN I URZĄDZEŃ, GDZIE INDZIEJ NIESKLASYFIKOWANA;0.3897945898604001;34.0
18;POLIGRAFIA I REPRODUKCJA ZAPISANYCH NOŚNIKÓW INFORMACJI;0.388721610775891;35.0
77;WYNAJEM I DZIERŻAWA;0.3847072302821628;36.0
82;DZIAŁALNOŚĆ ZWIĄZANA Z ADMINISTRACYJNĄ OBSŁUGĄ BIURA I POZOSTAŁA DZIAŁALNOŚĆ WSPOMAGAJĄCA PROWADZENIE DZIAŁALNOŚCI GOSPODARCZEJ;0.38086098962083226;37.0
31;PRODUKCJA MEBLI;0.37936033899413746;38.0
36;POBÓR, UZDATNIANIE I DOSTARCZANIE WODY;0.3792736982380056;39.0
43;ROBOTY BUDOWLANE SPECJALISTYCZNE;0.3788341442349994;40.0
15;PRODUKCJA SKÓR I WYROBÓW ZE SKÓR WYPRAWIONYCH, PRODUKCJA PODOBNYCH WYROBÓW Z INNYCH MATERIAŁÓW;0.3780217283680297;41.0
22;PRODUKCJA WYROBÓW Z GUMY I TWORZYW SZTUCZNYCH;0.37713175100079227;42.0
81;DZIAŁALNOŚĆ USŁUGOWA ZWIĄZANA Z UTRZYMANIEM PORZĄDKU W BUDYNKACH I ZAGOSPODAROWANIEM TERENÓW ZIELENI;0.3765822204064212;43.0
60;NADAWANIE PROGRAMÓW OGÓLNODOSTĘPNYCH I ABONAMENTOWYCH, DZIAŁALNOŚĆ AGENCJI INFORMACYJNYCH I POZOSTAŁA DZIAŁALNOŚĆ ZWIĄZANA Z DYSTRYBUCJĄ TREŚCI;0.3763156978417902;44.0
61;TELEKOMUNIKACJA;0.3745667711865577;45.0
66;DZIAŁALNOŚĆ WSPOMAGAJĄCA USŁUGI FINANSOWE, UBEZPIECZENIA I FUNDUSZE EMERYTALNE;0.3722977594747614;46.0
95;NAPRAWA I KONSERWACJA KOMPUTERÓW, ARTYKUŁÓW UŻYTKU OSOBISTEGO I DOMOWEGO ORAZ POJAZDÓW SILNIKOWYCH, W TYM MOTOCYKLI;0.3716918281631354;47.0
79;DZIAŁALNOŚĆ ORGANIZATORÓW TURYSTYKI, AGENTÓW TURYSTYCZNYCH ORAZ POZOSTAŁA DZIAŁALNOŚĆ USŁUGOWA W ZAKRESIE REZERWACJI I DZIAŁALNOŚCI Z NIĄ ZWIĄZANE;0.3714165434195031;48.0
73;DZIAŁALNOŚĆ W ZAKRESIE REKLAMY, BADANIA RYNKU I PUBLIC RELATIONS;0.3712186211194517;49.0
26;PRODUKCJA KOMPUTERÓW, WYROBÓW ELEKTRONICZNYCH I OPTYCZNYCH;0.3686263874199626;50.0
78;DZIAŁALNOŚĆ ZWIĄZANA Z ZATRUDNIENIEM;0.3672578988356464;51.0
12;PRODUKCJA WYROBÓW TYTONIOWYCH;0.36629728250836513;52.0
20;PRODUKCJA CHEMIKALIÓW I WYROBÓW CHEMICZNYCH;0.36619866182483174;53.0
56;DZIAŁALNOŚĆ USŁUGOWA ZWIĄZANA Z WYŻYWIENIEM;0.365414790688236;54.0
59;DZIAŁALNOŚĆ ZWIĄZANA Z PRODUKCJĄ FILMÓW, NAGRAŃ WIDEO, PROGRAMÓW TELEWIZYJNYCH, NAGRAŃ DŹWIĘKOWYCH I MUZYCZNYCH;0.3645387035299809;55.0
10;PRODUKCJA ARTYKUŁÓW SPOŻYWCZYCH;0.3642802001833588;56.0
07;GÓRNICTWO RUD METALI;0.36413130663440973;57.0
65;DZIAŁALNOŚĆ W ZAKRESIE UBEZPIECZEŃ, REASEKURACJI ORAZ FUNDUSZY EMERYTALNYCH, Z WYŁĄCZENIEM OBOWIĄZKOWEGO UBEZPIECZENIA SPOŁECZNEGO;0.3639861804219574;58.0
68;DZIAŁALNOŚĆ ZWIĄZANA Z OBSŁUGĄ RYNKU NIERUCHOMOŚCI;0.36398148612264414;59.0
42;ROBOTY ZWIĄZANE Z BUDOWĄ OBIEKTÓW INŻYNIERII LĄDOWEJ I WODNEJ;0.36359257734576744;60.0
84;"ADMINISTRACJA PUBLICZNA I OBRONA NARODOWA; OBOWIĄZKOWE UBEZPIECZENIA SPOŁECZNE";0.36311756276036067;61.0
37;ODPROWADZANIE I OCZYSZCZANIE ŚCIEKÓW;0.3626542437173678;62.0
46;HANDEL HURTOWY;0.3621316878599312;63.0
63;DZIAŁALNOŚĆ USŁUGOWA W ZAKRESIE INFRASTRUKTURY OBLICZENIOWEJ, PRZETWARZANIA DANYCH, ZARZĄDZANIA STRONAMI INTERNETOWYMI (HOSTING) I POZOSTAŁA DZIAŁALNOŚĆ USŁUGOWA W ZAKRESIE INFORMACJI;0.3600645096754294;64.0
92;DZIAŁALNOŚĆ ZWIĄZANA Z GRAMI HAZARDOWYMI;0.3598484978850084;65.0
06;GÓRNICTWO ROPY NAFTOWEJ I GAZU ZIEMNEGO;0.3598003232737297;66.0
80;DZIAŁALNOŚĆ DETEKTYWISTYCZNA I OCHRONIARSKA;0.35869974937734106;67.0
49;TRANSPORT LĄDOWY ORAZ TRANSPORT RUROCIĄGOWY;0.35862336044161647;68.0
11;PRODUKCJA NAPOJÓW;0.35845592217334155;69.0
13;PRODUKCJA WYROBÓW TEKSTYLNYCH;0.35839553981343686;70.0
53;DZIAŁALNOŚĆ POCZTOWA I KURIERSKA;0.35769835217135204;71.0
88;POMOC SPOŁECZNA BEZ ZAKWATEROWANIA;0.35605023986551193;72.0
86;OPIEKA ZDROWOTNA;0.3550644014752158;73.0
99;ORGANIZACJE I ZESPOŁY EKSTERYTORIALNE;0.3545760347934849;74.0
97;GOSPODARSTWA DOMOWE ZATRUDNIAJĄCE PRACOWNIKÓW;0.354486884221022;75.0
98;GOSPODARSTWA DOMOWE PRODUKUJĄCE WYROBY I ŚWIADCZĄCE USŁUGI NA WŁASNE POTRZEBY;0.35448274532889834;76.0
30;PRODUKCJA POZOSTAŁEGO SPRZĘTU TRANSPORTOWEGO;0.35320785873271676;77.0
27;PRODUKCJA URZĄDZEŃ ELEKTRYCZNYCH;0.35298087593126015;78.0
71;"DZIAŁALNOŚĆ W ZAKRESIE ARCHITEKTURY I INŻYNIERII; BADANIA I ANALIZY TECHNICZNE";0.3508344352085068;79.0
39;DZIAŁALNOŚĆ ZWIĄZANA Z REKULTYWACJĄ I POZOSTAŁA DZIAŁALNOŚĆ USŁUGOWA ZWIĄZANA Z GOSPODARKĄ ODPADAMI;0.3505241566793137;80.0
33;NAPRAWA, KONSERWACJA I INSTALOWANIE MASZYN I URZĄDZEŃ;0.3504300468153174;81.0
29;PRODUKCJA POJAZDÓW SILNIKOWYCH, PRODUKCJA PRZYCZEP I NACZEP;0.34854692439889384;82.0
93;DZIAŁALNOŚĆ SPORTOWA, ROZRYWKOWA I REKREACYJNA;0.34824330582782864;83.0
47;HANDEL DETALICZNY;0.3432528541400739;84.0
35;WYTWARZANIE I ZAOPATRYWANIE W ENERGIĘ ELEKTRYCZNĄ, GAZ, PARĘ WODNĄ I POWIETRZE DO UKŁADÓW KLIMATYZACYJNYCH;0.3403408176881181;85.0
87;POMOC SPOŁECZNA Z ZAKWATEROWANIEM;0.31897290760908065;86.0
09;DZIAŁALNOŚĆ USŁUGOWA WSPOMAGAJĄCA GÓRNICTWO I WYDOBYWANIE;0.10435695583475196;87.0
