alternative_id;nazwa;topsis_score;topsis_rank
77;WYNAJEM I DZIERŻAWA;0.573453162137653;1.0
88;POMOC SPOŁECZNA BEZ ZAKWATEROWANIA;0.5508303322117564;2.0
36;POBÓR, UZDATNIANIE I DOSTARCZANIE WODY;0.5006386068769454;3.0
37;ODPROWADZANIE I OCZYSZCZANIE ŚCIEKÓW;0.4973843766209608;4.0
03;RYBACTWO;0.4890745329411612;5.0
93;DZIAŁALNOŚĆ SPORTOWA, ROZRYWKOWA I REKREACYJNA;0.48759258219023305;6.0
61;TELEKOMUNIKACJA;0.4781124316774014;7.0
94;DZIAŁALNOŚĆ ORGANIZACJI CZŁONKOWSKICH;0.47172898081152465;8.0
64;FINANSOWA DZIAŁALNOŚĆ USŁUGOWA, Z WYŁĄCZENIEM UBEZPIECZEŃ I FUNDUSZY EMERYTALNYCH;0.4659425049820674;9.0
92;DZIAŁALNOŚĆ ZWIĄZANA Z GRAMI HAZARDOWYMI;0.4620010627853605;10.0
63;DZIAŁALNOŚĆ USŁUGOWA W ZAKRESIE INFRASTRUKTURY OBLICZENIOWEJ, PRZETWARZANIA DANYCH, ZARZĄDZANIA STRONAMI INTERNETOWYMI (HOSTING) I POZOSTAŁA DZIAŁALNOŚĆ USŁUGOWA W ZAKRESIE INFORMACJI;0.4545486085780293;11.0
60;NADAWANIE PROGRAMÓW OGÓLNODOSTĘPNYCH I ABONAMENTOWYCH, DZIAŁALNOŚĆ AGENCJI INFORMACYJNYCH I POZOSTAŁA DZIAŁALNOŚĆ ZWIĄZANA Z DYSTRYBUCJĄ TREŚCI;0.4490882310692306;12.0
55;ZAKWATEROWANIE;0.43874877768541415;13.0
27;PRODUKCJA URZĄDZEŃ ELEKTRYCZNYCH;0.4310531731019931;14.0
87;POMOC SPOŁECZNA Z ZAKWATEROWANIEM;0.42813033194475264;15.0
35;WYTWARZANIE I ZAOPATRYWANIE W ENERGIĘ ELEKTRYCZNĄ, GAZ, PARĘ WODNĄ I POWIETRZE DO UKŁADÓW KLIMATYZACYJNYCH;0.4192159157707582;16.0
16;"PRODUKCJA WYROBÓW Z DREWNA I KORKA, Z WYŁĄCZENIEM MEBLI; PRODUKCJA WYROBÓW ZE SŁOMY I MATERIAŁÓW UŻYWANYCH DO WYPLATANIA";0.41447036620227934;17.0
13;PRODUKCJA WYROBÓW TEKSTYLNYCH;0.41269106176952547;18.0
52;MAGAZYNOWANIE, PRZECHOWYWANIE I DZIAŁALNOŚĆ USŁUGOWA WSPOMAGAJĄCA TRANSPORT;0.39808021880566935;19.0
01;UPRAWY ROLNE, CHÓW I HODOWLA ZWIERZĄT, ŁOWIECTWO, W TYM DZIAŁALNOŚĆ USŁUGOWA;0.3951723567781844;20.0
39;DZIAŁALNOŚĆ ZWIĄZANA Z REKULTYWACJĄ I POZOSTAŁA DZIAŁALNOŚĆ USŁUGOWA ZWIĄZANA Z GOSPODARKĄ ODPADAMI;0.3918686485098617;21.0
91;DZIAŁALNOŚĆ BIBLIOTEK, ARCHIWÓW, MUZEÓW ORAZ POZOSTAŁA DZIAŁALNOŚĆ ZWIĄZANA Z KULTURĄ;0.3890760262360903;22.0
56;DZIAŁALNOŚĆ USŁUGOWA ZWIĄZANA Z WYŻYWIENIEM;0.3855732380176136;23.0
21;PRODUKCJA PODSTAWOWYCH SUBSTANCJI FARMACEUTYCZNYCH ORAZ LEKÓW I POZOSTAŁYCH WYROBÓW FARMACEUTYCZNYCH;0.3829565798904799;24.0
82;DZIAŁALNOŚĆ ZWIĄZANA Z ADMINISTRACYJNĄ OBSŁUGĄ BIURA I POZOSTAŁA DZIAŁALNOŚĆ WSPOMAGAJĄCA PROWADZENIE DZIAŁALNOŚCI GOSPODARCZEJ;0.3821885089667712;25.0
09;DZIAŁALNOŚĆ USŁUGOWA WSPOMAGAJĄCA GÓRNICTWO I WYDOBYWANIE;0.3736493163734302;26.0
17;PRODUKCJA PAPIERU I WYROBÓW Z PAPIERU;0.3664053755709153;27.0
86;OPIEKA ZDROWOTNA;0.36544678044091855;28.0
68;DZIAŁALNOŚĆ ZWIĄZANA Z OBSŁUGĄ RYNKU NIERUCHOMOŚCI;0.36401658077173027;29.0
20;PRODUKCJA CHEMIKALIÓW I WYROBÓW CHEMICZNYCH;0.36017599965310726;30.0
73;DZIAŁALNOŚĆ W ZAKRESIE REKLAMY, BADANIA RYNKU I PUBLIC RELATIONS;0.3598773425035067;31.0
22;PRODUKCJA WYROBÓW Z GUMY I TWORZYW SZTUCZNYCH;0.35779343209323194;32.0
58;DZIAŁALNOŚĆ WYDAWNICZA;0.3577520803053236;33.0
70;DZIAŁALNOŚĆ CENTRAL (HEAD OFFICES) ORAZ DORADZTWO ZWIĄZANE Z ZARZĄDZANIEM;0.35769116185062616;34.0
38;DZIAŁALNOŚĆ ZWIĄZANA ZE ZBIERANIEM, ODZYSKIEM I UNIESZKODLIWIANIEM ODPADÓW;0.35396493945290924;35.0
05;WYDOBYWANIE WĘGLA KAMIENNEGO I WĘGLA BRUNATNEGO (LIGNITU);0.3530419896408843;36.0
11;PRODUKCJA NAPOJÓW;0.34707144477055946;37.0
23;PRODUKCJA WYROBÓW Z POZOSTAŁYCH MINERALNYCH SUROWCÓW NIEMETALICZNYCH;0.3445172981679875;38.0
79;DZIAŁALNOŚĆ ORGANIZATORÓW TURYSTYKI, AGENTÓW TURYSTYCZNYCH ORAZ POZOSTAŁA DZIAŁALNOŚĆ USŁUGOWA W ZAKRESIE REZERWACJI I DZIAŁALNOŚCI Z NIĄ ZWIĄZANE;0.3431570931849198;39.0
69;DZIAŁALNOŚĆ PRAWNICZA, RACHUNKOWO-KSIĘGOWA I DORADZTWO PODATKOWE;0.3430055452573834;40.0
29;PRODUKCJA POJAZDÓW SILNIKOWYCH, PRODUKCJA PRZYCZEP I NACZEP;0.3410179175454388;41.0
85;EDUKACJA;0.3399620923061339;42.0
12;PRODUKCJA WYROBÓW TYTONIOWYCH;0.33912330732515134;43.0
28;PRODUKCJA MASZYN I URZĄDZEŃ, GDZIE INDZIEJ NIESKLASYFIKOWANA;0.3389021720348402;44.0
24;PRODUKCJA METALI;0.3379404235276197;45.0
32;POZOSTAŁA PRODUKCJA WYROBÓW;0.330838299834915;46.0
18;POLIGRAFIA I REPRODUKCJA ZAPISANYCH NOŚNIKÓW INFORMACJI;0.3306882212313559;47.0
14;PRODUKCJA ODZIEŻY;0.3302785486605982;48.0
02;LEŚNICTWO I POZYSKIWANIE DREWNA;0.32961528091612396;49.0
74;POZOSTAŁA DZIAŁALNOŚĆ PROFESJONALNA, NAUKOWA I TECHNICZNA;0.3290795622331119;50.0
10;PRODUKCJA ARTYKUŁÓW SPOŻYWCZYCH;0.3258192047860442;51.0
49;TRANSPORT LĄDOWY ORAZ TRANSPORT RUROCIĄGOWY;0.3249329164689324;52.0
31;PRODUKCJA MEBLI;0.31733072569624926;53.0
66;DZIAŁALNOŚĆ WSPOMAGAJĄCA USŁUGI FINANSOWE, UBEZPIECZENIA I FUNDUSZE EMERYTALNE;0.3094562355289295;54.0
59;DZIAŁALNOŚĆ ZWIĄZANA Z PRODUKCJĄ FILMÓW, NAGRAŃ WIDEO, PROGRAMÓW TELEWIZYJNYCH, NAGRAŃ DŹWIĘKOWYCH I MUZYCZNYCH;0.30923653596692086;55.0
25;PRODUKCJA METALOWYCH WYROBÓW GOTOWYCH, Z WYŁĄCZENIEM MASZYN I URZĄDZEŃ;0.3063084932899661;56.0
08;POZOSTAŁE GÓRNICTWO I WYDOBYWANIE;0.30455547859563575;57.0
72;BADANIA NAUKOWE I PRACE ROZWOJOWE;0.3018770824705566;58.0
46;HANDEL HURTOWY;0.2965776259131582;59.0
71;"DZIAŁALNOŚĆ W ZAKRESIE ARCHITEKTURY I INŻYNIERII; BADANIA I ANALIZY TECHNICZNE";0.2951772043227171;60.0
84;"ADMINISTRACJA PUBLICZNA I OBRONA NARODOWA; OBOWIĄZKOWE UBEZPIECZENIA SPOŁECZNE";0.29178369687109396;61.0
99;ORGANIZACJE I ZESPOŁY EKSTERYTORIALNE;0.29125304059987367;62.0
06;GÓRNICTWO ROPY NAFTOWEJ I GAZU ZIEMNEGO;0.2901546456266746;63.0
65;DZIAŁALNOŚĆ W ZAKRESIE UBEZPIECZEŃ, REASEKURACJI ORAZ FUNDUSZY EMERYTALNYCH, Z WYŁĄCZENIEM OBOWIĄZKOWEGO UBEZPIECZENIA SPOŁECZNEGO;0.290139320570906;64.0
98;GOSPODARSTWA DOMOWE PRODUKUJĄCE WYROBY I ŚWIADCZĄCE USŁUGI NA WŁASNE POTRZEBY;0.28988361646402283;65.5
97;GOSPODARSTWA DOMOWE ZATRUDNIAJĄCE PRACOWNIKÓW;0.28988361646402283;65.5
07;GÓRNICTWO RUD METALI;0.2897459178473724;67.0
19;WYTWARZANIE I PRZETWARZANIE KOKSU I PRODUKTÓW RAFINACJI ROPY NAFTOWEJ;0.28942378827807774;68.0
15;PRODUKCJA SKÓR I WYROBÓW ZE SKÓR WYPRAWIONYCH, PRODUKCJA PODOBNYCH WYROBÓW Z INNYCH MATERIAŁÓW;0.28563196346747755;69.0
78;DZIAŁALNOŚĆ ZWIĄZANA Z ZATRUDNIENIEM;0.28544716859680186;70.0
62;DZIAŁALNOŚĆ ZWIĄZANA Z PROGRAMOWANIEM, DORADZTWEM W ZAKRESIE INFORMATYKI I DZIAŁALNOŚCI POWIĄZANE;0.2819157421394275;71.0
81;DZIAŁALNOŚĆ USŁUGOWA ZWIĄZANA Z UTRZYMANIEM PORZĄDKU W BUDYNKACH I ZAGOSPODAROWANIEM TERENÓW ZIELENI;0.27892520652407543;72.0
47;HANDEL DETALICZNY;0.27815137637766196;73.0
50;TRANSPORT WODNY;0.2736039420131196;74.0
43;ROBOTY BUDOWLANE SPECJALISTYCZNE;0.2678064289740553;75.0
30;PRODUKCJA POZOSTAŁEGO SPRZĘTU TRANSPORTOWEGO;0.26641329448593115;76.0
33;NAPRAWA, KONSERWACJA I INSTALOWANIE MASZYN I URZĄDZEŃ;0.26608738438092705;77.0
95;NAPRAWA I KONSERWACJA KOMPUTERÓW, ARTYKUŁÓW UŻYTKU OSOBISTEGO I DOMOWEGO ORAZ POJAZDÓW SILNIKOWYCH, W TYM MOTOCYKLI;0.26168641884366756;78.0
41;ROBOTY BUDOWLANE ZWIĄZANE ZE WZNOSZENIEM BUDYNKÓW MIESZKALNYCH I NIEMIESZKALNYCH;0.26101613796778483;79.0
90;DZIAŁALNOŚĆ TWÓRCZA I DZIAŁALNOŚĆ ZWIĄZANA Z WYSTAWIANIEM PRZEDSTAWIEŃ ARTYSTYCZNYCH;0.2603880649089082;80.0
51;TRANSPORT LOTNICZY;0.24153812715841105;81.0
75;DZIAŁALNOŚĆ WETERYNARYJNA;0.23656532128256827;82.0
96;DZIAŁALNOŚĆ USŁUGOWA INDYWIDUALNA;0.23366108315263573;83.0
80;DZIAŁALNOŚĆ DETEKTYWISTYCZNA I OCHRONIARSKA;0.2313153916049172;84.0
26;PRODUKCJA KOMPUTERÓW, WYROBÓW ELEKTRONICZNYCH I OPTYCZNYCH;0.2294934942249696;85.0
53;DZIAŁALNOŚĆ POCZTOWA I KURIERSKA;0.2185306425254213;86.0
42;ROBOTY ZWIĄZANE Z BUDOWĄ OBIEKTÓW INŻYNIERII LĄDOWEJ I WODNEJ;0.1688962512970217;87.0
