alternative_id;nazwa;vikor_score;vikor_rank
94;DZIAŁALNOŚĆ ORGANIZACJI CZŁONKOWSKICH;1.0;1.0
75;DZIAŁALNOŚĆ WETERYNARYJNA;0.8000589987377251;2.0
55;ZAKWATEROWANIE;0.5978120912276157;3.0
72;BADANIA NAUKOWE I PRACE ROZWOJOWE;0.5804846677866378;4.0
15;PRODUKCJA SKÓR I WYROBÓW ZE SKÓR WYPRAWIONYCH, PRODUKCJA PODOBNYCH WYROBÓW Z INNYCH MATERIAŁÓW;0.5697768702621278;5.0
58;DZIAŁALNOŚĆ WYDAWNICZA;0.5582138859592498;6.0
62;DZIAŁALNOŚĆ ZWIĄZANA Z PROGRAMOWANIEM, DORADZTWEM W ZAKRESIE INFORMATYKI I DZIAŁALNOŚCI POWIĄZANE;0.5554023529564949;7.0
03;RYBACTWO;0.5456307100562119;8.0
63;DZIAŁALNOŚĆ USŁUGOWA W ZAKRESIE INFRASTRUKTURY OBLICZENIOWEJ, PRZETWARZANIA DANYCH, ZARZĄDZANIA STRONAMI INTERNETOWYMI (HOSTING) I POZOSTAŁA DZIAŁALNOŚĆ USŁUGOWA W ZAKRESIE INFORMACJI;0.5392289504042949;9.0
01;UPRAWY ROLNE, CHÓW I HODOWLA ZWIERZĄT, ŁOWIECTWO, W TYM DZIAŁALNOŚĆ USŁUGOWA;0.519727418351493;10.0
02;LEŚNICTWO I POZYSKIWANIE DREWNA;0.5034679484885448;11.0
14;PRODUKCJA ODZIEŻY;0.5008816352323008;12.0
08;POZOSTAŁE GÓRNICTWO I WYDOBYWANIE;0.5008329185576401;13.0
51;TRANSPORT LOTNICZY;0.48174986146562215;14.0
32;POZOSTAŁA PRODUKCJA WYROBÓW;0.4724207770098868;15.0
59;DZIAŁALNOŚĆ ZWIĄZANA Z PRODUKCJĄ FILMÓW, NAGRAŃ WIDEO, PROGRAMÓW TELEWIZYJNYCH, NAGRAŃ DŹWIĘKOWYCH I MUZYCZNYCH;0.4633718983387475;16.0
23;PRODUKCJA WYROBÓW Z POZOSTAŁYCH MINERALNYCH SUROWCÓW NIEMETALICZNYCH;0.46014600815851336;17.0
36;POBÓR, UZDATNIANIE I DOSTARCZANIE WODY;0.4600193123163443;18.0
21;PRODUKCJA PODSTAWOWYCH SUBSTANCJI FARMACEUTYCZNYCH ORAZ LEKÓW I POZOSTAŁYCH WYROBÓW FARMACEUTYCZNYCH;0.4570638873860008;19.0
37;ODPROWADZANIE I OCZYSZCZANIE ŚCIEKÓW;0.4522783577932604;20.0
87;POMOC SPOŁECZNA Z ZAKWATEROWANIEM;0.44806526101871136;21.0
28;PRODUKCJA MASZYN I URZĄDZEŃ, GDZIE INDZIEJ NIESKLASYFIKOWANA;0.44803887500990924;22.0
69;DZIAŁALNOŚĆ PRAWNICZA, RACHUNKOWO-KSIĘGOWA I DORADZTWO PODATKOWE;0.44223169455023503;23.0
41;ROBOTY BUDOWLANE ZWIĄZANE ZE WZNOSZENIEM BUDYNKÓW MIESZKALNYCH I NIEMIESZKALNYCH;0.44133564942556125;24.0
74;POZOSTAŁA DZIAŁALNOŚĆ PROFESJONALNA, NAUKOWA I TECHNICZNA;0.4412660215428278;25.0
52;MAGAZYNOWANIE, PRZECHOWYWANIE I DZIAŁALNOŚĆ USŁUGOWA WSPOMAGAJĄCA TRANSPORT;0.43624628909597396;26.0
39;DZIAŁALNOŚĆ ZWIĄZANA Z REKULTYWACJĄ I POZOSTAŁA DZIAŁALNOŚĆ USŁUGOWA ZWIĄZANA Z GOSPODARKĄ ODPADAMI;0.4350515872650107;27.0
66;DZIAŁALNOŚĆ WSPOMAGAJĄCA USŁUGI FINANSOWE, UBEZPIECZENIA I FUNDUSZE EMERYTALNE;0.4342999683220766;28.0
64;FINANSOWA DZIAŁALNOŚĆ USŁUGOWA, Z WYŁĄCZENIEM UBEZPIECZEŃ I FUNDUSZY EMERYTALNYCH;0.4314877116718425;29.0
43;ROBOTY BUDOWLANE SPECJALISTYCZNE;0.4252463359357339;30.0
60;NADAWANIE PROGRAMÓW OGÓLNODOSTĘPNYCH I ABONAMENTOWYCH, DZIAŁALNOŚĆ AGENCJI INFORMACYJNYCH I POZOSTAŁA DZIAŁALNOŚĆ ZWIĄZANA Z DYSTRYBUCJĄ TREŚCI;0.42412915184986955;31.0
31;PRODUKCJA MEBLI;0.42069992509922405;32.0
38;DZIAŁALNOŚĆ ZWIĄZANA ZE ZBIERANIEM, ODZYSKIEM I UNIESZKODLIWIANIEM ODPADÓW;0.41739636117662005;33.0
17;PRODUKCJA PAPIERU I WYROBÓW Z PAPIERU;0.41574409805869705;34.0
18;POLIGRAFIA I REPRODUKCJA ZAPISANYCH NOŚNIKÓW INFORMACJI;0.4112468007904734;35.0
88;POMOC SPOŁECZNA BEZ ZAKWATEROWANIA;0.4076622952434842;36.0
61;TELEKOMUNIKACJA;0.4068325917167158;37.0
19;WYTWARZANIE I PRZETWARZANIE KOKSU I PRODUKTÓW RAFINACJI ROPY NAFTOWEJ;0.4064199651246134;38.0
25;PRODUKCJA METALOWYCH WYROBÓW GOTOWYCH, Z WYŁĄCZENIEM MASZYN I URZĄDZEŃ;0.40535661621070784;39.0
26;PRODUKCJA KOMPUTERÓW, WYROBÓW ELEKTRONICZNYCH I OPTYCZNYCH;0.3984037742734027;40.0
85;EDUKACJA;0.3984022839362461;41.0
16;"PRODUKCJA WYROBÓW Z DREWNA I KORKA, Z WYŁĄCZENIEM MEBLI; PRODUKCJA WYROBÓW ZE SŁOMY I MATERIAŁÓW UŻYWANYCH DO WYPLATANIA";0.39765268400102083;42.0
68;DZIAŁALNOŚĆ ZWIĄZANA Z OBSŁUGĄ RYNKU NIERUCHOMOŚCI;0.3844664945278995;43.0
79;DZIAŁALNOŚĆ ORGANIZATORÓW TURYSTYKI, AGENTÓW TURYSTYCZNYCH ORAZ POZOSTAŁA DZIAŁALNOŚĆ USŁUGOWA W ZAKRESIE REZERWACJI I DZIAŁALNOŚCI Z NIĄ ZWIĄZANE;0.37721764936164215;44.0
71;"DZIAŁALNOŚĆ W ZAKRESIE ARCHITEKTURY I INŻYNIERII; BADANIA I ANALIZY TECHNICZNE";0.37289121742957;45.0
22;PRODUKCJA WYROBÓW Z GUMY I TWORZYW SZTUCZNYCH;0.37254241989693115;46.0
70;DZIAŁALNOŚĆ CENTRAL (HEAD OFFICES) ORAZ DORADZTWO ZWIĄZANE Z ZARZĄDZANIEM;0.37175149419713494;47.0
20;PRODUKCJA CHEMIKALIÓW I WYROBÓW CHEMICZNYCH;0.36971412401280923;48.0
10;PRODUKCJA ARTYKUŁÓW SPOŻYWCZYCH;0.3638475739948632;49.0
13;PRODUKCJA WYROBÓW TEKSTYLNYCH;0.3636626841354428;50.0
81;DZIAŁALNOŚĆ USŁUGOWA ZWIĄZANA Z UTRZYMANIEM PORZĄDKU W BUDYNKACH I ZAGOSPODAROWANIEM TERENÓW ZIELENI;0.3605500317450453;51.0
73;DZIAŁALNOŚĆ W ZAKRESIE REKLAMY, BADANIA RYNKU I PUBLIC RELATIONS;0.35970166531220027;52.0
95;NAPRAWA I KONSERWACJA KOMPUTERÓW, ARTYKUŁÓW UŻYTKU OSOBISTEGO I DOMOWEGO ORAZ POJAZDÓW SILNIKOWYCH, W TYM MOTOCYKLI;0.3584324563444663;53.0
77;WYNAJEM I DZIERŻAWA;0.35798977127057807;54.0
91;DZIAŁALNOŚĆ BIBLIOTEK, ARCHIWÓW, MUZEÓW ORAZ POZOSTAŁA DZIAŁALNOŚĆ ZWIĄZANA Z KULTURĄ;0.3557893908524784;55.0
49;TRANSPORT LĄDOWY ORAZ TRANSPORT RUROCIĄGOWY;0.34964714044242906;56.0
30;PRODUKCJA POZOSTAŁEGO SPRZĘTU TRANSPORTOWEGO;0.3337464249935497;57.0
96;DZIAŁALNOŚĆ USŁUGOWA INDYWIDUALNA;0.33297789419113377;58.0
07;GÓRNICTWO RUD METALI;0.3325227176668655;62.0
65;DZIAŁALNOŚĆ W ZAKRESIE UBEZPIECZEŃ, REASEKURACJI ORAZ FUNDUSZY EMERYTALNYCH, Z WYŁĄCZENIEM OBOWIĄZKOWEGO UBEZPIECZENIA SPOŁECZNEGO;0.3325227176668655;62.0
99;ORGANIZACJE I ZESPOŁY EKSTERYTORIALNE;0.3325227176668655;62.0
84;"ADMINISTRACJA PUBLICZNA I OBRONA NARODOWA; OBOWIĄZKOWE UBEZPIECZENIA SPOŁECZNE";0.3325227176668655;62.0
97;GOSPODARSTWA DOMOWE ZATRUDNIAJĄCE PRACOWNIKÓW;0.3325227176668655;62.0
06;GÓRNICTWO ROPY NAFTOWEJ I GAZU ZIEMNEGO;0.3325227176668655;62.0
98;GOSPODARSTWA DOMOWE PRODUKUJĄCE WYROBY I ŚWIADCZĄCE USŁUGI NA WŁASNE POTRZEBY;0.3325227176668655;62.0
82;DZIAŁALNOŚĆ ZWIĄZANA Z ADMINISTRACYJNĄ OBSŁUGĄ BIURA I POZOSTAŁA DZIAŁALNOŚĆ WSPOMAGAJĄCA PROWADZENIE DZIAŁALNOŚCI GOSPODARCZEJ;0.33165741174699404;66.0
80;DZIAŁALNOŚĆ DETEKTYWISTYCZNA I OCHRONIARSKA;0.32828183673559375;67.0
90;DZIAŁALNOŚĆ TWÓRCZA I DZIAŁALNOŚĆ ZWIĄZANA Z WYSTAWIANIEM PRZEDSTAWIEŃ ARTYSTYCZNYCH;0.3266918964822245;68.0
46;HANDEL HURTOWY;0.326406170262715;69.0
33;NAPRAWA, KONSERWACJA I INSTALOWANIE MASZYN I URZĄDZEŃ;0.32098141349927556;70.0
86;OPIEKA ZDROWOTNA;0.3132691797258462;71.0
11;PRODUKCJA NAPOJÓW;0.3100542597718201;72.0
56;DZIAŁALNOŚĆ USŁUGOWA ZWIĄZANA Z WYŻYWIENIEM;0.30358445729588746;73.0
42;ROBOTY ZWIĄZANE Z BUDOWĄ OBIEKTÓW INŻYNIERII LĄDOWEJ I WODNEJ;0.29927835580997253;74.0
78;DZIAŁALNOŚĆ ZWIĄZANA Z ZATRUDNIENIEM;0.290561876341622;75.0
47;HANDEL DETALICZNY;0.2843334138173734;76.0
29;PRODUKCJA POJAZDÓW SILNIKOWYCH, PRODUKCJA PRZYCZEP I NACZEP;0.28235005173950567;77.0
53;DZIAŁALNOŚĆ POCZTOWA I KURIERSKA;0.2756885675890789;78.0
35;WYTWARZANIE I ZAOPATRYWANIE W ENERGIĘ ELEKTRYCZNĄ, GAZ, PARĘ WODNĄ I POWIETRZE DO UKŁADÓW KLIMATYZACYJNYCH;0.2644246186063248;79.0
24;PRODUKCJA METALI;0.2547153021415245;80.0
93;DZIAŁALNOŚĆ SPORTOWA, ROZRYWKOWA I REKREACYJNA;0.2464087489876151;81.0
27;PRODUKCJA URZĄDZEŃ ELEKTRYCZNYCH;0.24075196109206431;82.0
92;DZIAŁALNOŚĆ ZWIĄZANA Z GRAMI HAZARDOWYMI;0.23461470694680053;83.0
50;TRANSPORT WODNY;0.22908218184449314;84.0
12;PRODUKCJA WYROBÓW TYTONIOWYCH;0.20982356329335705;85.0
09;DZIAŁALNOŚĆ USŁUGOWA WSPOMAGAJĄCA GÓRNICTWO I WYDOBYWANIE;0.09191136334409511;86.0
05;WYDOBYWANIE WĘGLA KAMIENNEGO I WĘGLA BRUNATNEGO (LIGNITU);0.04865343974510772;87.0
