alternative_id;nazwa;vikor_score;vikor_rank
37;ODPROWADZANIE I OCZYSZCZANIE ŚCIEKÓW;1.0;1.0
87;POMOC SPOŁECZNA Z ZAKWATEROWANIEM;0.8622876827590256;2.0
63;DZIAŁALNOŚĆ USŁUGOWA W ZAKRESIE INFRASTRUKTURY OBLICZENIOWEJ, PRZETWARZANIA DANYCH, ZARZĄDZANIA STRONAMI INTERNETOWYMI (HOSTING) I POZOSTAŁA DZIAŁALNOŚĆ USŁUGOWA W ZAKRESIE INFORMACJI;0.8374496143112655;3.0
21;PRODUKCJA PODSTAWOWYCH SUBSTANCJI FARMACEUTYCZNYCH ORAZ LEKÓW I POZOSTAŁYCH WYROBÓW FARMACEUTYCZNYCH;0.7835318233786823;4.0
77;WYNAJEM I DZIERŻAWA;0.7734574035639633;5.0
01;UPRAWY ROLNE, CHÓW I HODOWLA ZWIERZĄT, ŁOWIECTWO, W TYM DZIAŁALNOŚĆ USŁUGOWA;0.7456057654222713;6.0
36;POBÓR, UZDATNIANIE I DOSTARCZANIE WODY;0.7408764393807779;7.0
60;NADAWANIE PROGRAMÓW OGÓLNODOSTĘPNYCH I ABONAMENTOWYCH, DZIAŁALNOŚĆ AGENCJI INFORMACYJNYCH I POZOSTAŁA DZIAŁALNOŚĆ ZWIĄZANA Z DYSTRYBUCJĄ TREŚCI;0.7122430415375625;8.0
17;PRODUKCJA PAPIERU I WYROBÓW Z PAPIERU;0.6985622621097047;9.0
03;RYBACTWO;0.6518093573553139;10.0
61;TELEKOMUNIKACJA;0.6483704785808999;11.0
58;DZIAŁALNOŚĆ WYDAWNICZA;0.6304671901330157;12.0
23;PRODUKCJA WYROBÓW Z POZOSTAŁYCH MINERALNYCH SUROWCÓW NIEMETALICZNYCH;0.6219601318056407;13.0
94;DZIAŁALNOŚĆ ORGANIZACJI CZŁONKOWSKICH;0.60229113678046;14.0
16;"PRODUKCJA WYROBÓW Z DREWNA I KORKA, Z WYŁĄCZENIEM MEBLI; PRODUKCJA WYROBÓW ZE SŁOMY I MATERIAŁÓW UŻYWANYCH DO WYPLATANIA";0.6015324732699245;15.0
31;PRODUKCJA MEBLI;0.5957546271512458;16.0
32;POZOSTAŁA PRODUKCJA WYROBÓW;0.5901279226422009;17.0
88;POMOC SPOŁECZNA BEZ ZAKWATEROWANIA;0.5816468077681296;18.0
86;OPIEKA ZDROWOTNA;0.5710419680025753;19.0
56;DZIAŁALNOŚĆ USŁUGOWA ZWIĄZANA Z WYŻYWIENIEM;0.5688125746764536;20.0
12;PRODUKCJA WYROBÓW TYTONIOWYCH;0.5564972680912125;21.0
55;ZAKWATEROWANIE;0.5527182134634363;22.0
50;TRANSPORT WODNY;0.5487484538451898;23.0
20;PRODUKCJA CHEMIKALIÓW I WYROBÓW CHEMICZNYCH;0.5465677360682166;24.0
38;DZIAŁALNOŚĆ ZWIĄZANA ZE ZBIERANIEM, ODZYSKIEM I UNIESZKODLIWIANIEM ODPADÓW;0.54157518333469;25.0
13;PRODUKCJA WYROBÓW TEKSTYLNYCH;0.5393267645552764;26.0
64;FINANSOWA DZIAŁALNOŚĆ USŁUGOWA, Z WYŁĄCZENIEM UBEZPIECZEŃ I FUNDUSZY EMERYTALNYCH;0.5357375435888188;27.0
30;PRODUKCJA POZOSTAŁEGO SPRZĘTU TRANSPORTOWEGO;0.534005616973573;28.0
14;PRODUKCJA ODZIEŻY;0.5255642079316969;29.0
10;PRODUKCJA ARTYKUŁÓW SPOŻYWCZYCH;0.5238444499125121;30.0
25;PRODUKCJA METALOWYCH WYROBÓW GOTOWYCH, Z WYŁĄCZENIEM MASZYN I URZĄDZEŃ;0.5161770179472487;31.0
28;PRODUKCJA MASZYN I URZĄDZEŃ, GDZIE INDZIEJ NIESKLASYFIKOWANA;0.5094733299902764;32.0
68;DZIAŁALNOŚĆ ZWIĄZANA Z OBSŁUGĄ RYNKU NIERUCHOMOŚCI;0.5005163219918558;33.0
22;PRODUKCJA WYROBÓW Z GUMY I TWORZYW SZTUCZNYCH;0.49864651488941136;34.0
73;DZIAŁALNOŚĆ W ZAKRESIE REKLAMY, BADANIA RYNKU I PUBLIC RELATIONS;0.49195645805148636;35.0
15;PRODUKCJA SKÓR I WYROBÓW ZE SKÓR WYPRAWIONYCH, PRODUKCJA PODOBNYCH WYROBÓW Z INNYCH MATERIAŁÓW;0.4901165694796412;36.0
85;EDUKACJA;0.48805024058852187;37.0
18;POLIGRAFIA I REPRODUKCJA ZAPISANYCH NOŚNIKÓW INFORMACJI;0.4856481827383714;38.0
49;TRANSPORT LĄDOWY ORAZ TRANSPORT RUROCIĄGOWY;0.4738709405432573;39.0
91;DZIAŁALNOŚĆ BIBLIOTEK, ARCHIWÓW, MUZEÓW ORAZ POZOSTAŁA DZIAŁALNOŚĆ ZWIĄZANA Z KULTURĄ;0.44962721609698264;40.0
96;DZIAŁALNOŚĆ USŁUGOWA INDYWIDUALNA;0.4368821959687236;41.0
08;POZOSTAŁE GÓRNICTWO I WYDOBYWANIE;0.4303326515985977;42.0
52;MAGAZYNOWANIE, PRZECHOWYWANIE I DZIAŁALNOŚĆ USŁUGOWA WSPOMAGAJĄCA TRANSPORT;0.426491543190628;43.0
84;"ADMINISTRACJA PUBLICZNA I OBRONA NARODOWA; OBOWIĄZKOWE UBEZPIECZENIA SPOŁECZNE";0.42136175149180544;44.5
65;DZIAŁALNOŚĆ W ZAKRESIE UBEZPIECZEŃ, REASEKURACJI ORAZ FUNDUSZY EMERYTALNYCH, Z WYŁĄCZENIEM OBOWIĄZKOWEGO UBEZPIECZENIA SPOŁECZNEGO;0.42136175149180544;44.5
29;PRODUKCJA POJAZDÓW SILNIKOWYCH, PRODUKCJA PRZYCZEP I NACZEP;0.4167107642482454;46.0
42;ROBOTY ZWIĄZANE Z BUDOWĄ OBIEKTÓW INŻYNIERII LĄDOWEJ I WODNEJ;0.4140159187846696;47.0
35;WYTWARZANIE I ZAOPATRYWANIE W ENERGIĘ ELEKTRYCZNĄ, GAZ, PARĘ WODNĄ I POWIETRZE DO UKŁADÓW KLIMATYZACYJNYCH;0.41253804168051755;48.0
09;DZIAŁALNOŚĆ USŁUGOWA WSPOMAGAJĄCA GÓRNICTWO I WYDOBYWANIE;0.4116124831981893;49.0
69;DZIAŁALNOŚĆ PRAWNICZA, RACHUNKOWO-KSIĘGOWA I DORADZTWO PODATKOWE;0.4045390184268469;50.0
07;GÓRNICTWO RUD METALI;0.4009465015432322;51.0
06;GÓRNICTWO ROPY NAFTOWEJ I GAZU ZIEMNEGO;0.3967871717122251;52.0
39;DZIAŁALNOŚĆ ZWIĄZANA Z REKULTYWACJĄ I POZOSTAŁA DZIAŁALNOŚĆ USŁUGOWA ZWIĄZANA Z GOSPODARKĄ ODPADAMI;0.3961497355625533;53.0
24;PRODUKCJA METALI;0.39543140543727895;54.0
97;GOSPODARSTWA DOMOWE ZATRUDNIAJĄCE PRACOWNIKÓW;0.395056174202019;56.0
98;GOSPODARSTWA DOMOWE PRODUKUJĄCE WYROBY I ŚWIADCZĄCE USŁUGI NA WŁASNE POTRZEBY;0.395056174202019;56.0
99;ORGANIZACJE I ZESPOŁY EKSTERYTORIALNE;0.395056174202019;56.0
74;POZOSTAŁA DZIAŁALNOŚĆ PROFESJONALNA, NAUKOWA I TECHNICZNA;0.3898423783309526;58.0
33;NAPRAWA, KONSERWACJA I INSTALOWANIE MASZYN I URZĄDZEŃ;0.3829821009432204;59.0
41;ROBOTY BUDOWLANE ZWIĄZANE ZE WZNOSZENIEM BUDYNKÓW MIESZKALNYCH I NIEMIESZKALNYCH;0.3793184551876072;60.0
90;DZIAŁALNOŚĆ TWÓRCZA I DZIAŁALNOŚĆ ZWIĄZANA Z WYSTAWIANIEM PRZEDSTAWIEŃ ARTYSTYCZNYCH;0.367994623647381;61.0
11;PRODUKCJA NAPOJÓW;0.3664925891833951;62.0
92;DZIAŁALNOŚĆ ZWIĄZANA Z GRAMI HAZARDOWYMI;0.3607029675396215;63.0
71;"DZIAŁALNOŚĆ W ZAKRESIE ARCHITEKTURY I INŻYNIERII; BADANIA I ANALIZY TECHNICZNE";0.3572773745504064;64.0
93;DZIAŁALNOŚĆ SPORTOWA, ROZRYWKOWA I REKREACYJNA;0.34941805306072515;65.0
79;DZIAŁALNOŚĆ ORGANIZATORÓW TURYSTYKI, AGENTÓW TURYSTYCZNYCH ORAZ POZOSTAŁA DZIAŁALNOŚĆ USŁUGOWA W ZAKRESIE REZERWACJI I DZIAŁALNOŚCI Z NIĄ ZWIĄZANE;0.3377554050618281;66.0
59;DZIAŁALNOŚĆ ZWIĄZANA Z PRODUKCJĄ FILMÓW, NAGRAŃ WIDEO, PROGRAMÓW TELEWIZYJNYCH, NAGRAŃ DŹWIĘKOWYCH I MUZYCZNYCH;0.3366114162444255;67.0
27;PRODUKCJA URZĄDZEŃ ELEKTRYCZNYCH;0.3363132384746874;68.0
47;HANDEL DETALICZNY;0.33572059360326867;69.0
81;DZIAŁALNOŚĆ USŁUGOWA ZWIĄZANA Z UTRZYMANIEM PORZĄDKU W BUDYNKACH I ZAGOSPODAROWANIEM TERENÓW ZIELENI;0.3322414525350612;70.0
46;HANDEL HURTOWY;0.3318065851715418;71.0
70;DZIAŁALNOŚĆ CENTRAL (HEAD OFFICES) ORAZ DORADZTWO ZWIĄZANE Z ZARZĄDZANIEM;0.32200780928982975;72.0
72;BADANIA NAUKOWE I PRACE ROZWOJOWE;0.30942868996651074;73.0
43;ROBOTY BUDOWLANE SPECJALISTYCZNE;0.2925471353169813;74.0
78;DZIAŁALNOŚĆ ZWIĄZANA Z ZATRUDNIENIEM;0.2782913310570694;75.0
19;WYTWARZANIE I PRZETWARZANIE KOKSU I PRODUKTÓW RAFINACJI ROPY NAFTOWEJ;0.2683676044035126;76.0
62;DZIAŁALNOŚĆ ZWIĄZANA Z PROGRAMOWANIEM, DORADZTWEM W ZAKRESIE INFORMATYKI I DZIAŁALNOŚCI POWIĄZANE;0.26093686504199853;77.0
26;PRODUKCJA KOMPUTERÓW, WYROBÓW ELEKTRONICZNYCH I OPTYCZNYCH;0.25929647363621355;78.0
66;DZIAŁALNOŚĆ WSPOMAGAJĄCA USŁUGI FINANSOWE, UBEZPIECZENIA I FUNDUSZE EMERYTALNE;0.2512309194878336;79.0
51;TRANSPORT LOTNICZY;0.24835238498208256;80.0
82;DZIAŁALNOŚĆ ZWIĄZANA Z ADMINISTRACYJNĄ OBSŁUGĄ BIURA I POZOSTAŁA DZIAŁALNOŚĆ WSPOMAGAJĄCA PROWADZENIE DZIAŁALNOŚCI GOSPODARCZEJ;0.21384209449582325;81.0
53;DZIAŁALNOŚĆ POCZTOWA I KURIERSKA;0.19670063578447028;82.0
80;DZIAŁALNOŚĆ DETEKTYWISTYCZNA I OCHRONIARSKA;0.18370441522391223;83.0
75;DZIAŁALNOŚĆ WETERYNARYJNA;0.13537247362355953;84.0
05;WYDOBYWANIE WĘGLA KAMIENNEGO I WĘGLA BRUNATNEGO (LIGNITU);0.10827917015186639;85.0
02;LEŚNICTWO I POZYSKIWANIE DREWNA;0.10591590008831786;86.0
95;NAPRAWA I KONSERWACJA KOMPUTERÓW, ARTYKUŁÓW UŻYTKU OSOBISTEGO I DOMOWEGO ORAZ POJAZDÓW SILNIKOWYCH, W TYM MOTOCYKLI;0.09644082243160823;87.0
