alternative_id;nazwa;monte_carlo_score;monte_carlo_rank
94;DZIAŁALNOŚĆ ORGANIZACJI CZŁONKOWSKICH;0.48429881024926824;1.0
75;DZIAŁALNOŚĆ WETERYNARYJNA;0.4556890779643188;2.0
64;FINANSOWA DZIAŁALNOŚĆ USŁUGOWA, Z WYŁĄCZENIEM UBEZPIECZEŃ I FUNDUSZY EMERYTALNYCH;0.4150084703826751;3.0
09;DZIAŁALNOŚĆ USŁUGOWA WSPOMAGAJĄCA GÓRNICTWO I WYDOBYWANIE;0.3980234636296388;4.0
63;DZIAŁALNOŚĆ USŁUGOWA W ZAKRESIE INFRASTRUKTURY OBLICZENIOWEJ, PRZETWARZANIA DANYCH, ZARZĄDZANIA STRONAMI INTERNETOWYMI (HOSTING) I POZOSTAŁA DZIAŁALNOŚĆ USŁUGOWA W ZAKRESIE INFORMACJI;0.3734152296803486;5.0
08;POZOSTAŁE GÓRNICTWO I WYDOBYWANIE;0.37078804811914595;6.0
85;EDUKACJA;0.3486681222627069;7.0
15;PRODUKCJA SKÓR I WYROBÓW ZE SKÓR WYPRAWIONYCH, PRODUKCJA PODOBNYCH WYROBÓW Z INNYCH MATERIAŁÓW;0.3407405323892348;8.0
77;WYNAJEM I DZIERŻAWA;0.3404586018744059;9.0
62;DZIAŁALNOŚĆ ZWIĄZANA Z PROGRAMOWANIEM, DORADZTWEM W ZAKRESIE INFORMATYKI I DZIAŁALNOŚCI POWIĄZANE;0.3332555958098654;10.0
59;DZIAŁALNOŚĆ ZWIĄZANA Z PRODUKCJĄ FILMÓW, NAGRAŃ WIDEO, PROGRAMÓW TELEWIZYJNYCH, NAGRAŃ DŹWIĘKOWYCH I MUZYCZNYCH;0.3277053261371437;11.0
96;DZIAŁALNOŚĆ USŁUGOWA INDYWIDUALNA;0.3248625109233533;12.0
03;RYBACTWO;0.3247722265102734;13.0
21;PRODUKCJA PODSTAWOWYCH SUBSTANCJI FARMACEUTYCZNYCH ORAZ LEKÓW I POZOSTAŁYCH WYROBÓW FARMACEUTYCZNYCH;0.3242620035542706;14.0
02;LEŚNICTWO I POZYSKIWANIE DREWNA;0.32230380606883585;15.0
51;TRANSPORT LOTNICZY;0.32007985867208166;16.0
37;ODPROWADZANIE I OCZYSZCZANIE ŚCIEKÓW;0.3171004347669159;17.0
58;DZIAŁALNOŚĆ WYDAWNICZA;0.3149127420325387;18.0
69;DZIAŁALNOŚĆ PRAWNICZA, RACHUNKOWO-KSIĘGOWA I DORADZTWO PODATKOWE;0.31311096793686827;19.0
17;PRODUKCJA PAPIERU I WYROBÓW Z PAPIERU;0.312608956125061;20.0
14;PRODUKCJA ODZIEŻY;0.3113407428039084;21.0
31;PRODUKCJA MEBLI;0.3057672291731903;22.0
36;POBÓR, UZDATNIANIE I DOSTARCZANIE WODY;0.3054822688851764;23.0
87;POMOC SPOŁECZNA Z ZAKWATEROWANIEM;0.30296817625909594;24.0
92;DZIAŁALNOŚĆ ZWIĄZANA Z GRAMI HAZARDOWYMI;0.29961547229256336;25.0
91;DZIAŁALNOŚĆ BIBLIOTEK, ARCHIWÓW, MUZEÓW ORAZ POZOSTAŁA DZIAŁALNOŚĆ ZWIĄZANA Z KULTURĄ;0.2932052262949407;26.0
88;POMOC SPOŁECZNA BEZ ZAKWATEROWANIA;0.28880234557434425;27.0
74;POZOSTAŁA DZIAŁALNOŚĆ PROFESJONALNA, NAUKOWA I TECHNICZNA;0.28854234550685737;28.0
71;"DZIAŁALNOŚĆ W ZAKRESIE ARCHITEKTURY I INŻYNIERII; BADANIA I ANALIZY TECHNICZNE";0.28770644205790247;29.0
61;TELEKOMUNIKACJA;0.28724301434191085;30.0
66;DZIAŁALNOŚĆ WSPOMAGAJĄCA USŁUGI FINANSOWE, UBEZPIECZENIA I FUNDUSZE EMERYTALNE;0.2854929237054899;31.0
68;DZIAŁALNOŚĆ ZWIĄZANA Z OBSŁUGĄ RYNKU NIERUCHOMOŚCI;0.283800186909211;32.0
23;PRODUKCJA WYROBÓW Z POZOSTAŁYCH MINERALNYCH SUROWCÓW NIEMETALICZNYCH;0.28344703628449336;33.0
43;ROBOTY BUDOWLANE SPECJALISTYCZNE;0.2831833334490452;34.0
72;BADANIA NAUKOWE I PRACE ROZWOJOWE;0.2830218679566675;35.0
81;DZIAŁALNOŚĆ USŁUGOWA ZWIĄZANA Z UTRZYMANIEM PORZĄDKU W BUDYNKACH I ZAGOSPODAROWANIEM TERENÓW ZIELENI;0.27705070178607955;36.0
41;ROBOTY BUDOWLANE ZWIĄZANE ZE WZNOSZENIEM BUDYNKÓW MIESZKALNYCH I NIEMIESZKALNYCH;0.2748978356235076;37.0
55;ZAKWATEROWANIE;0.2729032426878711;38.0
78;DZIAŁALNOŚĆ ZWIĄZANA Z ZATRUDNIENIEM;0.27136096041355323;39.0
19;WYTWARZANIE I PRZETWARZANIE KOKSU I PRODUKTÓW RAFINACJI ROPY NAFTOWEJ;0.2699113575309621;40.0
28;PRODUKCJA MASZYN I URZĄDZEŃ, GDZIE INDZIEJ NIESKLASYFIKOWANA;0.26920187674209645;41.0
18;POLIGRAFIA I REPRODUKCJA ZAPISANYCH NOŚNIKÓW INFORMACJI;0.2681129311335498;42.0
84;"ADMINISTRACJA PUBLICZNA I OBRONA NARODOWA; OBOWIĄZKOWE UBEZPIECZENIA SPOŁECZNE";0.2680872192905649;43.0
65;DZIAŁALNOŚĆ W ZAKRESIE UBEZPIECZEŃ, REASEKURACJI ORAZ FUNDUSZY EMERYTALNYCH, Z WYŁĄCZENIEM OBOWIĄZKOWEGO UBEZPIECZENIA SPOŁECZNEGO;0.26772986431859797;44.0
52;MAGAZYNOWANIE, PRZECHOWYWANIE I DZIAŁALNOŚĆ USŁUGOWA WSPOMAGAJĄCA TRANSPORT;0.2647435138813202;45.0
25;PRODUKCJA METALOWYCH WYROBÓW GOTOWYCH, Z WYŁĄCZENIEM MASZYN I URZĄDZEŃ;0.2646433994798323;46.0
56;DZIAŁALNOŚĆ USŁUGOWA ZWIĄZANA Z WYŻYWIENIEM;0.26461090567483886;47.0
82;DZIAŁALNOŚĆ ZWIĄZANA Z ADMINISTRACYJNĄ OBSŁUGĄ BIURA I POZOSTAŁA DZIAŁALNOŚĆ WSPOMAGAJĄCA PROWADZENIE DZIAŁALNOŚCI GOSPODARCZEJ;0.2645977390604314;48.0
11;PRODUKCJA NAPOJÓW;0.2643038439504159;49.0
07;GÓRNICTWO RUD METALI;0.2602931862221731;50.0
22;PRODUKCJA WYROBÓW Z GUMY I TWORZYW SZTUCZNYCH;0.25980047775273024;51.0
06;GÓRNICTWO ROPY NAFTOWEJ I GAZU ZIEMNEGO;0.2588609846963444;52.0
42;ROBOTY ZWIĄZANE Z BUDOWĄ OBIEKTÓW INŻYNIERII LĄDOWEJ I WODNEJ;0.2580678137391201;53.0
99;ORGANIZACJE I ZESPOŁY EKSTERYTORIALNE;0.2576542582303031;54.0
49;TRANSPORT LĄDOWY ORAZ TRANSPORT RUROCIĄGOWY;0.2575608119451277;55.0
98;GOSPODARSTWA DOMOWE PRODUKUJĄCE WYROBY I ŚWIADCZĄCE USŁUGI NA WŁASNE POTRZEBY;0.2575463248078855;56.0
97;GOSPODARSTWA DOMOWE ZATRUDNIAJĄCE PRACOWNIKÓW;0.2574939663353882;57.0
32;POZOSTAŁA PRODUKCJA WYROBÓW;0.2567313408785653;58.0
30;PRODUKCJA POZOSTAŁEGO SPRZĘTU TRANSPORTOWEGO;0.25531021347670296;59.0
24;PRODUKCJA METALI;0.2551787424786986;60.0
70;DZIAŁALNOŚĆ CENTRAL (HEAD OFFICES) ORAZ DORADZTWO ZWIĄZANE Z ZARZĄDZANIEM;0.254443094064551;61.0
38;DZIAŁALNOŚĆ ZWIĄZANA ZE ZBIERANIEM, ODZYSKIEM I UNIESZKODLIWIANIEM ODPADÓW;0.252898647992283;62.0
10;PRODUKCJA ARTYKUŁÓW SPOŻYWCZYCH;0.25262566766850353;63.0
01;UPRAWY ROLNE, CHÓW I HODOWLA ZWIERZĄT, ŁOWIECTWO, W TYM DZIAŁALNOŚĆ USŁUGOWA;0.25223434311798965;64.0
20;PRODUKCJA CHEMIKALIÓW I WYROBÓW CHEMICZNYCH;0.25187504931837246;65.0
16;"PRODUKCJA WYROBÓW Z DREWNA I KORKA, Z WYŁĄCZENIEM MEBLI; PRODUKCJA WYROBÓW ZE SŁOMY I MATERIAŁÓW UŻYWANYCH DO WYPLATANIA";0.25164442231889356;66.0
33;NAPRAWA, KONSERWACJA I INSTALOWANIE MASZYN I URZĄDZEŃ;0.25148388293868296;67.0
95;NAPRAWA I KONSERWACJA KOMPUTERÓW, ARTYKUŁÓW UŻYTKU OSOBISTEGO I DOMOWEGO ORAZ POJAZDÓW SILNIKOWYCH, W TYM MOTOCYKLI;0.24743493205880732;68.0
27;PRODUKCJA URZĄDZEŃ ELEKTRYCZNYCH;0.24742790756799726;69.0
47;HANDEL DETALICZNY;0.24154493750133338;70.0
26;PRODUKCJA KOMPUTERÓW, WYROBÓW ELEKTRONICZNYCH I OPTYCZNYCH;0.23995634694372917;71.0
60;NADAWANIE PROGRAMÓW OGÓLNODOSTĘPNYCH I ABONAMENTOWYCH, DZIAŁALNOŚĆ AGENCJI INFORMACYJNYCH I POZOSTAŁA DZIAŁALNOŚĆ ZWIĄZANA Z DYSTRYBUCJĄ TREŚCI;0.23902437080639047;72.0
29;PRODUKCJA POJAZDÓW SILNIKOWYCH, PRODUKCJA PRZYCZEP I NACZEP;0.23508723972616652;73.0
46;HANDEL HURTOWY;0.2306410143971455;74.0
12;PRODUKCJA WYROBÓW TYTONIOWYCH;0.230497152940514;75.0
73;DZIAŁALNOŚĆ W ZAKRESIE REKLAMY, BADANIA RYNKU I PUBLIC RELATIONS;0.22810862293479267;76.0
53;DZIAŁALNOŚĆ POCZTOWA I KURIERSKA;0.22706040027431534;77.0
80;DZIAŁALNOŚĆ DETEKTYWISTYCZNA I OCHRONIARSKA;0.22681289281109535;78.0
86;OPIEKA ZDROWOTNA;0.22501742180092013;79.0
05;WYDOBYWANIE WĘGLA KAMIENNEGO I WĘGLA BRUNATNEGO (LIGNITU);0.22341789182001534;80.0
50;TRANSPORT WODNY;0.2206034507777694;81.0
35;WYTWARZANIE I ZAOPATRYWANIE W ENERGIĘ ELEKTRYCZNĄ, GAZ, PARĘ WODNĄ I POWIETRZE DO UKŁADÓW KLIMATYZACYJNYCH;0.21898522828874722;82.0
13;PRODUKCJA WYROBÓW TEKSTYLNYCH;0.21461924069748564;83.0
90;DZIAŁALNOŚĆ TWÓRCZA I DZIAŁALNOŚĆ ZWIĄZANA Z WYSTAWIANIEM PRZEDSTAWIEŃ ARTYSTYCZNYCH;0.19912721191759175;84.0
39;DZIAŁALNOŚĆ ZWIĄZANA Z REKULTYWACJĄ I POZOSTAŁA DZIAŁALNOŚĆ USŁUGOWA ZWIĄZANA Z GOSPODARKĄ ODPADAMI;0.19836990579586583;85.0
93;DZIAŁALNOŚĆ SPORTOWA, ROZRYWKOWA I REKREACYJNA;0.19056630013092404;86.0
79;DZIAŁALNOŚĆ ORGANIZATORÓW TURYSTYKI, AGENTÓW TURYSTYCZNYCH ORAZ POZOSTAŁA DZIAŁALNOŚĆ USŁUGOWA W ZAKRESIE REZERWACJI I DZIAŁALNOŚCI Z NIĄ ZWIĄZANE;0.17317943886843673;87.0
