alternative_id;nazwa;ensemble_score;ensemble_rank
77;WYNAJEM I DZIERŻAWA;0.7157861851824681;1.0
93;DZIAŁALNOŚĆ SPORTOWA, ROZRYWKOWA I REKREACYJNA;0.6987582649364306;2.0
55;ZAKWATEROWANIE;0.6231633396342948;3.0
36;POBÓR, UZDATNIANIE I DOSTARCZANIE WODY;0.5966993201166989;4.0
37;ODPROWADZANIE I OCZYSZCZANIE ŚCIEKÓW;0.5944657279742257;5.0
94;DZIAŁALNOŚĆ ORGANIZACJI CZŁONKOWSKICH;0.5802564720821775;6.0
64;FINANSOWA DZIAŁALNOŚĆ USŁUGOWA, Z WYŁĄCZENIEM UBEZPIECZEŃ I FUNDUSZY EMERYTALNYCH;0.5593565252085496;7.0
87;POMOC SPOŁECZNA Z ZAKWATEROWANIEM;0.5299175298901339;8.0
61;TELEKOMUNIKACJA;0.5132617346006314;9.0
60;NADAWANIE PROGRAMÓW OGÓLNODOSTĘPNYCH I ABONAMENTOWYCH, DZIAŁALNOŚĆ AGENCJI INFORMACYJNYCH I POZOSTAŁA DZIAŁALNOŚĆ ZWIĄZANA Z DYSTRYBUCJĄ TREŚCI;0.47818016775379923;10.0
56;DZIAŁALNOŚĆ USŁUGOWA ZWIĄZANA Z WYŻYWIENIEM;0.47146425028579386;11.0
05;WYDOBYWANIE WĘGLA KAMIENNEGO I WĘGLA BRUNATNEGO (LIGNITU);0.4664717121673192;12.0
16;"PRODUKCJA WYROBÓW Z DREWNA I KORKA, Z WYŁĄCZENIEM MEBLI; PRODUKCJA WYROBÓW ZE SŁOMY I MATERIAŁÓW UŻYWANYCH DO WYPLATANIA";0.4647029863253581;13.0
51;TRANSPORT LOTNICZY;0.46168350808876496;14.0
32;POZOSTAŁA PRODUKCJA WYROBÓW;0.4583180719656371;15.0
39;DZIAŁALNOŚĆ ZWIĄZANA Z REKULTYWACJĄ I POZOSTAŁA DZIAŁALNOŚĆ USŁUGOWA ZWIĄZANA Z GOSPODARKĄ ODPADAMI;0.4518858151677672;16.0
63;DZIAŁALNOŚĆ USŁUGOWA W ZAKRESIE INFRASTRUKTURY OBLICZENIOWEJ, PRZETWARZANIA DANYCH, ZARZĄDZANIA STRONAMI INTERNETOWYMI (HOSTING) I POZOSTAŁA DZIAŁALNOŚĆ USŁUGOWA W ZAKRESIE INFORMACJI;0.45053042036391333;17.0
03;RYBACTWO;0.44990863475525855;18.0
09;DZIAŁALNOŚĆ USŁUGOWA WSPOMAGAJĄCA GÓRNICTWO I WYDOBYWANIE;0.4477851420273983;19.0
68;DZIAŁALNOŚĆ ZWIĄZANA Z OBSŁUGĄ RYNKU NIERUCHOMOŚCI;0.4424141974884768;20.0
13;PRODUKCJA WYROBÓW TEKSTYLNYCH;0.4384803868801032;21.0
21;PRODUKCJA PODSTAWOWYCH SUBSTANCJI FARMACEUTYCZNYCH ORAZ LEKÓW I POZOSTAŁYCH WYROBÓW FARMACEUTYCZNYCH;0.42881946571703716;22.0
01;UPRAWY ROLNE, CHÓW I HODOWLA ZWIERZĄT, ŁOWIECTWO, W TYM DZIAŁALNOŚĆ USŁUGOWA;0.42821190812129706;23.0
85;EDUKACJA;0.41902141299391893;24.0
52;MAGAZYNOWANIE, PRZECHOWYWANIE I DZIAŁALNOŚĆ USŁUGOWA WSPOMAGAJĄCA TRANSPORT;0.41658268448305813;25.0
86;OPIEKA ZDROWOTNA;0.4163449039009638;26.0
27;PRODUKCJA URZĄDZEŃ ELEKTRYCZNYCH;0.4149603072017683;27.0
18;POLIGRAFIA I REPRODUKCJA ZAPISANYCH NOŚNIKÓW INFORMACJI;0.4125962330756234;28.0
49;TRANSPORT LĄDOWY ORAZ TRANSPORT RUROCIĄGOWY;0.408474675393707;29.0
90;DZIAŁALNOŚĆ TWÓRCZA I DZIAŁALNOŚĆ ZWIĄZANA Z WYSTAWIANIEM PRZEDSTAWIEŃ ARTYSTYCZNYCH;0.4008221536978021;30.0
20;PRODUKCJA CHEMIKALIÓW I WYROBÓW CHEMICZNYCH;0.3918919672881953;31.0
23;PRODUKCJA WYROBÓW Z POZOSTAŁYCH MINERALNYCH SUROWCÓW NIEMETALICZNYCH;0.3916394206227909;32.0
59;DZIAŁALNOŚĆ ZWIĄZANA Z PRODUKCJĄ FILMÓW, NAGRAŃ WIDEO, PROGRAMÓW TELEWIZYJNYCH, NAGRAŃ DŹWIĘKOWYCH I MUZYCZNYCH;0.3817149409950994;33.0
66;DZIAŁALNOŚĆ WSPOMAGAJĄCA USŁUGI FINANSOWE, UBEZPIECZENIA I FUNDUSZE EMERYTALNE;0.3795214810154009;34.0
10;PRODUKCJA ARTYKUŁÓW SPOŻYWCZYCH;0.377955680096467;35.0
15;PRODUKCJA SKÓR I WYROBÓW ZE SKÓR WYPRAWIONYCH, PRODUKCJA PODOBNYCH WYROBÓW Z INNYCH MATERIAŁÓW;0.36709259363956503;36.0
91;DZIAŁALNOŚĆ BIBLIOTEK, ARCHIWÓW, MUZEÓW ORAZ POZOSTAŁA DZIAŁALNOŚĆ ZWIĄZANA Z KULTURĄ;0.36486508781876054;37.0
17;PRODUKCJA PAPIERU I WYROBÓW Z PAPIERU;0.35018624228615297;38.0
22;PRODUKCJA WYROBÓW Z GUMY I TWORZYW SZTUCZNYCH;0.3488211277717748;39.0
24;PRODUKCJA METALI;0.34519659726463303;40.0
30;PRODUKCJA POZOSTAŁEGO SPRZĘTU TRANSPORTOWEGO;0.3446661506828413;41.0
14;PRODUKCJA ODZIEŻY;0.3439373906709908;42.0
96;DZIAŁALNOŚĆ USŁUGOWA INDYWIDUALNA;0.34107608355360036;43.0
29;PRODUKCJA POJAZDÓW SILNIKOWYCH, PRODUKCJA PRZYCZEP I NACZEP;0.3406462172774354;44.0
38;DZIAŁALNOŚĆ ZWIĄZANA ZE ZBIERANIEM, ODZYSKIEM I UNIESZKODLIWIANIEM ODPADÓW;0.3311499049035129;45.0
08;POZOSTAŁE GÓRNICTWO I WYDOBYWANIE;0.33044245479221585;46.0
74;POZOSTAŁA DZIAŁALNOŚĆ PROFESJONALNA, NAUKOWA I TECHNICZNA;0.3294627674421063;47.0
82;DZIAŁALNOŚĆ ZWIĄZANA Z ADMINISTRACYJNĄ OBSŁUGĄ BIURA I POZOSTAŁA DZIAŁALNOŚĆ WSPOMAGAJĄCA PROWADZENIE DZIAŁALNOŚCI GOSPODARCZEJ;0.3252024664063541;48.0
12;PRODUKCJA WYROBÓW TYTONIOWYCH;0.32444028900303723;49.0
92;DZIAŁALNOŚĆ ZWIĄZANA Z GRAMI HAZARDOWYMI;0.32207649405297256;50.0
31;PRODUKCJA MEBLI;0.3218626800409018;51.0
65;DZIAŁALNOŚĆ W ZAKRESIE UBEZPIECZEŃ, REASEKURACJI ORAZ FUNDUSZY EMERYTALNYCH, Z WYŁĄCZENIEM OBOWIĄZKOWEGO UBEZPIECZENIA SPOŁECZNEGO;0.320457393471775;52.0
75;DZIAŁALNOŚĆ WETERYNARYJNA;0.31562836441412945;53.0
72;BADANIA NAUKOWE I PRACE ROZWOJOWE;0.3148664188162623;54.0
79;DZIAŁALNOŚĆ ORGANIZATORÓW TURYSTYKI, AGENTÓW TURYSTYCZNYCH ORAZ POZOSTAŁA DZIAŁALNOŚĆ USŁUGOWA W ZAKRESIE REZERWACJI I DZIAŁALNOŚCI Z NIĄ ZWIĄZANE;0.3116266663859623;55.0
25;PRODUKCJA METALOWYCH WYROBÓW GOTOWYCH, Z WYŁĄCZENIEM MASZYN I URZĄDZEŃ;0.2957257281978877;56.0
28;PRODUKCJA MASZYN I URZĄDZEŃ, GDZIE INDZIEJ NIESKLASYFIKOWANA;0.29349393866776996;57.0
71;"DZIAŁALNOŚĆ W ZAKRESIE ARCHITEKTURY I INŻYNIERII; BADANIA I ANALIZY TECHNICZNE";0.2899122723913574;58.0
69;DZIAŁALNOŚĆ PRAWNICZA, RACHUNKOWO-KSIĘGOWA I DORADZTWO PODATKOWE;0.28979296375038527;59.0
35;WYTWARZANIE I ZAOPATRYWANIE W ENERGIĘ ELEKTRYCZNĄ, GAZ, PARĘ WODNĄ I POWIETRZE DO UKŁADÓW KLIMATYZACYJNYCH;0.2828580856738717;60.0
84;"ADMINISTRACJA PUBLICZNA I OBRONA NARODOWA; OBOWIĄZKOWE UBEZPIECZENIA SPOŁECZNE";0.281344162656816;61.0
07;GÓRNICTWO RUD METALI;0.28117789156047135;62.0
78;DZIAŁALNOŚĆ ZWIĄZANA Z ZATRUDNIENIEM;0.27885223181583324;63.0
06;GÓRNICTWO ROPY NAFTOWEJ I GAZU ZIEMNEGO;0.27485389376119396;64.0
11;PRODUKCJA NAPOJÓW;0.2747442449520031;65.0
98;GOSPODARSTWA DOMOWE PRODUKUJĄCE WYROBY I ŚWIADCZĄCE USŁUGI NA WŁASNE POTRZEBY;0.2746425736114063;66.0
97;GOSPODARSTWA DOMOWE ZATRUDNIAJĄCE PRACOWNIKÓW;0.27461941654302313;67.0
99;ORGANIZACJE I ZESPOŁY EKSTERYTORIALNE;0.27412530834895127;68.0
46;HANDEL HURTOWY;0.27129717332742415;69.0
62;DZIAŁALNOŚĆ ZWIĄZANA Z PROGRAMOWANIEM, DORADZTWEM W ZAKRESIE INFORMATYKI I DZIAŁALNOŚCI POWIĄZANE;0.25934558187287593;70.0
41;ROBOTY BUDOWLANE ZWIĄZANE ZE WZNOSZENIEM BUDYNKÓW MIESZKALNYCH I NIEMIESZKALNYCH;0.2546927385214491;71.0
42;ROBOTY ZWIĄZANE Z BUDOWĄ OBIEKTÓW INŻYNIERII LĄDOWEJ I WODNEJ;0.2512260610627014;72.0
33;NAPRAWA, KONSERWACJA I INSTALOWANIE MASZYN I URZĄDZEŃ;0.2504803246143968;73.0
95;NAPRAWA I KONSERWACJA KOMPUTERÓW, ARTYKUŁÓW UŻYTKU OSOBISTEGO I DOMOWEGO ORAZ POJAZDÓW SILNIKOWYCH, W TYM MOTOCYKLI;0.24523552515432617;74.0
43;ROBOTY BUDOWLANE SPECJALISTYCZNE;0.24152064101574583;75.0
47;HANDEL DETALICZNY;0.24080325244560838;76.0
58;DZIAŁALNOŚĆ WYDAWNICZA;0.23748404044474447;77.0
26;PRODUKCJA KOMPUTERÓW, WYROBÓW ELEKTRONICZNYCH I OPTYCZNYCH;0.2350206468315722;78.0
81;DZIAŁALNOŚĆ USŁUGOWA ZWIĄZANA Z UTRZYMANIEM PORZĄDKU W BUDYNKACH I ZAGOSPODAROWANIEM TERENÓW ZIELENI;0.22410707403548719;79.0
88;POMOC SPOŁECZNA BEZ ZAKWATEROWANIA;0.21958196112268297;80.0
19;WYTWARZANIE I PRZETWARZANIE KOKSU I PRODUKTÓW RAFINACJI ROPY NAFTOWEJ;0.21760769155043028;81.0
53;DZIAŁALNOŚĆ POCZTOWA I KURIERSKA;0.19730233386490223;82.0
70;DZIAŁALNOŚĆ CENTRAL (HEAD OFFICES) ORAZ DORADZTWO ZWIĄZANE Z ZARZĄDZANIEM;0.18714072600780818;83.0
02;LEŚNICTWO I POZYSKIWANIE DREWNA;0.17695008584836186;84.0
50;TRANSPORT WODNY;0.16985411095353098;85.0
73;DZIAŁALNOŚĆ W ZAKRESIE REKLAMY, BADANIA RYNKU I PUBLIC RELATIONS;0.16882328317286893;86.0
80;DZIAŁALNOŚĆ DETEKTYWISTYCZNA I OCHRONIARSKA;0.1572487785126242;87.0
