alternative_id;nazwa;ensemble_score;ensemble_rank
94;DZIAŁALNOŚĆ ORGANIZACJI CZŁONKOWSKICH;0.6658953025288494;1.0
75;DZIAŁALNOŚĆ WETERYNARYJNA;0.6403930518238875;2.0
58;DZIAŁALNOŚĆ WYDAWNICZA;0.5749965098058187;3.0
62;DZIAŁALNOŚĆ ZWIĄZANA Z PROGRAMOWANIEM, DORADZTWEM W ZAKRESIE INFORMATYKI I DZIAŁALNOŚCI POWIĄZANE;0.5719801262831082;4.0
02;LEŚNICTWO I POZYSKIWANIE DREWNA;0.5690391645333981;5.0
88;POMOC SPOŁECZNA BEZ ZAKWATEROWANIA;0.5563292697326183;6.0
39;DZIAŁALNOŚĆ ZWIĄZANA Z REKULTYWACJĄ I POZOSTAŁA DZIAŁALNOŚĆ USŁUGOWA ZWIĄZANA Z GOSPODARKĄ ODPADAMI;0.5547195652261087;7.0
72;BADANIA NAUKOWE I PRACE ROZWOJOWE;0.5512750659895859;8.0
08;POZOSTAŁE GÓRNICTWO I WYDOBYWANIE;0.548574972252241;9.0
21;PRODUKCJA PODSTAWOWYCH SUBSTANCJI FARMACEUTYCZNYCH ORAZ LEKÓW I POZOSTAŁYCH WYROBÓW FARMACEUTYCZNYCH;0.5400231999015657;10.0
14;PRODUKCJA ODZIEŻY;0.5375965878316221;11.0
79;DZIAŁALNOŚĆ ORGANIZATORÓW TURYSTYKI, AGENTÓW TURYSTYCZNYCH ORAZ POZOSTAŁA DZIAŁALNOŚĆ USŁUGOWA W ZAKRESIE REZERWACJI I DZIAŁALNOŚCI Z NIĄ ZWIĄZANE;0.5360948552840838;12.0
15;PRODUKCJA SKÓR I WYROBÓW ZE SKÓR WYPRAWIONYCH, PRODUKCJA PODOBNYCH WYROBÓW Z INNYCH MATERIAŁÓW;0.5357788061995434;13.0
17;PRODUKCJA PAPIERU I WYROBÓW Z PAPIERU;0.5327033554076362;14.0
69;DZIAŁALNOŚĆ PRAWNICZA, RACHUNKOWO-KSIĘGOWA I DORADZTWO PODATKOWE;0.5322543751673888;15.0
74;POZOSTAŁA DZIAŁALNOŚĆ PROFESJONALNA, NAUKOWA I TECHNICZNA;0.5314290920340203;16.0
66;DZIAŁALNOŚĆ WSPOMAGAJĄCA USŁUGI FINANSOWE, UBEZPIECZENIA I FUNDUSZE EMERYTALNE;0.5304243528268577;17.0
23;PRODUKCJA WYROBÓW Z POZOSTAŁYCH MINERALNYCH SUROWCÓW NIEMETALICZNYCH;0.528718589859762;18.0
43;ROBOTY BUDOWLANE SPECJALISTYCZNE;0.528197871166256;19.0
95;NAPRAWA I KONSERWACJA KOMPUTERÓW, ARTYKUŁÓW UŻYTKU OSOBISTEGO I DOMOWEGO ORAZ POJAZDÓW SILNIKOWYCH, W TYM MOTOCYKLI;0.5267014621687691;20.0
28;PRODUKCJA MASZYN I URZĄDZEŃ, GDZIE INDZIEJ NIESKLASYFIKOWANA;0.5262389767172606;21.0
85;EDUKACJA;0.5147411514411402;22.0
41;ROBOTY BUDOWLANE ZWIĄZANE ZE WZNOSZENIEM BUDYNKÓW MIESZKALNYCH I NIEMIESZKALNYCH;0.5144135429949839;23.0
03;RYBACTWO;0.5137704525325272;24.0
18;POLIGRAFIA I REPRODUKCJA ZAPISANYCH NOŚNIKÓW INFORMACJI;0.5137409437427409;25.0
26;PRODUKCJA KOMPUTERÓW, WYROBÓW ELEKTRONICZNYCH I OPTYCZNYCH;0.5119313815890632;26.0
81;DZIAŁALNOŚĆ USŁUGOWA ZWIĄZANA Z UTRZYMANIEM PORZĄDKU W BUDYNKACH I ZAGOSPODAROWANIEM TERENÓW ZIELENI;0.5118072017762382;27.0
73;DZIAŁALNOŚĆ W ZAKRESIE REKLAMY, BADANIA RYNKU I PUBLIC RELATIONS;0.5098502140251359;28.0
25;PRODUKCJA METALOWYCH WYROBÓW GOTOWYCH, Z WYŁĄCZENIEM MASZYN I URZĄDZEŃ;0.5096408385070594;29.0
22;PRODUKCJA WYROBÓW Z GUMY I TWORZYW SZTUCZNYCH;0.5089954212817074;30.0
31;PRODUKCJA MEBLI;0.5083055536716624;31.0
32;POZOSTAŁA PRODUKCJA WYROBÓW;0.5056204958949622;32.0
84;"ADMINISTRACJA PUBLICZNA I OBRONA NARODOWA; OBOWIĄZKOWE UBEZPIECZENIA SPOŁECZNE";0.5015210087563937;33.0
12;PRODUKCJA WYROBÓW TYTONIOWYCH;0.5011826497989507;34.0
65;DZIAŁALNOŚĆ W ZAKRESIE UBEZPIECZEŃ, REASEKURACJI ORAZ FUNDUSZY EMERYTALNYCH, Z WYŁĄCZENIEM OBOWIĄZKOWEGO UBEZPIECZENIA SPOŁECZNEGO;0.500773614528773;35.0
71;"DZIAŁALNOŚĆ W ZAKRESIE ARCHITEKTURY I INŻYNIERII; BADANIA I ANALIZY TECHNICZNE";0.496131431870849;36.0
06;GÓRNICTWO ROPY NAFTOWEJ I GAZU ZIEMNEGO;0.4953585914916727;37.0
07;GÓRNICTWO RUD METALI;0.4943440938198245;38.0
99;ORGANIZACJE I ZESPOŁY EKSTERYTORIALNE;0.4939518254966139;39.0
98;GOSPODARSTWA DOMOWE PRODUKUJĄCE WYROBY I ŚWIADCZĄCE USŁUGI NA WŁASNE POTRZEBY;0.49310571226390093;40.0
97;GOSPODARSTWA DOMOWE ZATRUDNIAJĄCE PRACOWNIKÓW;0.4930713397573626;41.0
10;PRODUKCJA ARTYKUŁÓW SPOŻYWCZYCH;0.49299963404097313;42.0
13;PRODUKCJA WYROBÓW TEKSTYLNYCH;0.49141528532010065;43.0
11;PRODUKCJA NAPOJÓW;0.49028016166683197;44.0
38;DZIAŁALNOŚĆ ZWIĄZANA ZE ZBIERANIEM, ODZYSKIEM I UNIESZKODLIWIANIEM ODPADÓW;0.4893638823998817;45.0
80;DZIAŁALNOŚĆ DETEKTYWISTYCZNA I OCHRONIARSKA;0.4883157437577955;46.0
20;PRODUKCJA CHEMIKALIÓW I WYROBÓW CHEMICZNYCH;0.48517295577187824;47.0
16;"PRODUKCJA WYROBÓW Z DREWNA I KORKA, Z WYŁĄCZENIEM MEBLI; PRODUKCJA WYROBÓW ZE SŁOMY I MATERIAŁÓW UŻYWANYCH DO WYPLATANIA";0.48405987573502274;48.0
33;NAPRAWA, KONSERWACJA I INSTALOWANIE MASZYN I URZĄDZEŃ;0.4834905395008964;49.0
53;DZIAŁALNOŚĆ POCZTOWA I KURIERSKA;0.48279820306350446;50.0
46;HANDEL HURTOWY;0.48143983885599395;51.0
29;PRODUKCJA POJAZDÓW SILNIKOWYCH, PRODUKCJA PRZYCZEP I NACZEP;0.4781570380774872;52.0
78;DZIAŁALNOŚĆ ZWIĄZANA Z ZATRUDNIENIEM;0.47739979258571175;53.0
47;HANDEL DETALICZNY;0.47619467324155706;54.0
30;PRODUKCJA POZOSTAŁEGO SPRZĘTU TRANSPORTOWEGO;0.47432014808573936;55.0
01;UPRAWY ROLNE, CHÓW I HODOWLA ZWIERZĄT, ŁOWIECTWO, W TYM DZIAŁALNOŚĆ USŁUGOWA;0.47256682910070824;56.0
50;TRANSPORT WODNY;0.4712872244547822;57.0
92;DZIAŁALNOŚĆ ZWIĄZANA Z GRAMI HAZARDOWYMI;0.47058354739660896;58.0
42;ROBOTY ZWIĄZANE Z BUDOWĄ OBIEKTÓW INŻYNIERII LĄDOWEJ I WODNEJ;0.4703400250870045;59.0
70;DZIAŁALNOŚĆ CENTRAL (HEAD OFFICES) ORAZ DORADZTWO ZWIĄZANE Z ZARZĄDZANIEM;0.4681845918458797;60.0
64;FINANSOWA DZIAŁALNOŚĆ USŁUGOWA, Z WYŁĄCZENIEM UBEZPIECZEŃ I FUNDUSZY EMERYTALNYCH;0.4674717044983858;61.0
60;NADAWANIE PROGRAMÓW OGÓLNODOSTĘPNYCH I ABONAMENTOWYCH, DZIAŁALNOŚĆ AGENCJI INFORMACYJNYCH I POZOSTAŁA DZIAŁALNOŚĆ ZWIĄZANA Z DYSTRYBUCJĄ TREŚCI;0.4599161183553444;62.0
19;WYTWARZANIE I PRZETWARZANIE KOKSU I PRODUKTÓW RAFINACJI ROPY NAFTOWEJ;0.45665951774945474;63.0
82;DZIAŁALNOŚĆ ZWIĄZANA Z ADMINISTRACYJNĄ OBSŁUGĄ BIURA I POZOSTAŁA DZIAŁALNOŚĆ WSPOMAGAJĄCA PROWADZENIE DZIAŁALNOŚCI GOSPODARCZEJ;0.4555921249017728;64.0
27;PRODUKCJA URZĄDZEŃ ELEKTRYCZNYCH;0.453297330100775;65.0
24;PRODUKCJA METALI;0.44790999675152154;66.0
49;TRANSPORT LĄDOWY ORAZ TRANSPORT RUROCIĄGOWY;0.4469054150991107;67.0
59;DZIAŁALNOŚĆ ZWIĄZANA Z PRODUKCJĄ FILMÓW, NAGRAŃ WIDEO, PROGRAMÓW TELEWIZYJNYCH, NAGRAŃ DŹWIĘKOWYCH I MUZYCZNYCH;0.4453259477471013;68.0
87;POMOC SPOŁECZNA Z ZAKWATEROWANIEM;0.43086402295831006;69.0
55;ZAKWATEROWANIE;0.4296003654017635;70.0
51;TRANSPORT LOTNICZY;0.42148329454349426;71.0
37;ODPROWADZANIE I OCZYSZCZANIE ŚCIEKÓW;0.416425395831725;72.0
86;OPIEKA ZDROWOTNA;0.40599888401853446;73.0
56;DZIAŁALNOŚĆ USŁUGOWA ZWIĄZANA Z WYŻYWIENIEM;0.4055921324269447;74.0
36;POBÓR, UZDATNIANIE I DOSTARCZANIE WODY;0.4052478950962694;75.0
96;DZIAŁALNOŚĆ USŁUGOWA INDYWIDUALNA;0.4045191081477152;76.0
77;WYNAJEM I DZIERŻAWA;0.39702883145964574;77.0
63;DZIAŁALNOŚĆ USŁUGOWA W ZAKRESIE INFRASTRUKTURY OBLICZENIOWEJ, PRZETWARZANIA DANYCH, ZARZĄDZANIA STRONAMI INTERNETOWYMI (HOSTING) I POZOSTAŁA DZIAŁALNOŚĆ USŁUGOWA W ZAKRESIE INFORMACJI;0.3950993091364043;78.0
68;DZIAŁALNOŚĆ ZWIĄZANA Z OBSŁUGĄ RYNKU NIERUCHOMOŚCI;0.3924775743928649;79.0
61;TELEKOMUNIKACJA;0.38864112022217767;80.0
91;DZIAŁALNOŚĆ BIBLIOTEK, ARCHIWÓW, MUZEÓW ORAZ POZOSTAŁA DZIAŁALNOŚĆ ZWIĄZANA Z KULTURĄ;0.386587520605143;81.0
05;WYDOBYWANIE WĘGLA KAMIENNEGO I WĘGLA BRUNATNEGO (LIGNITU);0.3842193440375049;82.0
52;MAGAZYNOWANIE, PRZECHOWYWANIE I DZIAŁALNOŚĆ USŁUGOWA WSPOMAGAJĄCA TRANSPORT;0.38178464125977385;83.0
35;WYTWARZANIE I ZAOPATRYWANIE W ENERGIĘ ELEKTRYCZNĄ, GAZ, PARĘ WODNĄ I POWIETRZE DO UKŁADÓW KLIMATYZACYJNYCH;0.379129466452478;84.0
09;DZIAŁALNOŚĆ USŁUGOWA WSPOMAGAJĄCA GÓRNICTWO I WYDOBYWANIE;0.3602209962652885;85.0
90;DZIAŁALNOŚĆ TWÓRCZA I DZIAŁALNOŚĆ ZWIĄZANA Z WYSTAWIANIEM PRZEDSTAWIEŃ ARTYSTYCZNYCH;0.35230060350772774;86.0
93;DZIAŁALNOŚĆ SPORTOWA, ROZRYWKOWA I REKREACYJNA;0.3225180870103015;87.0
