alternative_id;nazwa;vikor_score;vikor_rank
94;DZIAŁALNOŚĆ ORGANIZACJI CZŁONKOWSKICH;1.0;1.0
58;DZIAŁALNOŚĆ WYDAWNICZA;0.7503315435419315;2.0
75;DZIAŁALNOŚĆ WETERYNARYJNA;0.7000400466025333;3.0
09;DZIAŁALNOŚĆ USŁUGOWA WSPOMAGAJĄCA GÓRNICTWO I WYDOBYWANIE;0.6662515915489321;4.0
15;PRODUKCJA SKÓR I WYROBÓW ZE SKÓR WYPRAWIONYCH, PRODUKCJA PODOBNYCH WYROBÓW Z INNYCH MATERIAŁÓW;0.5827882314570003;5.0
72;BADANIA NAUKOWE I PRACE ROZWOJOWE;0.5541491464998223;6.0
14;PRODUKCJA ODZIEŻY;0.5220898455358968;7.0
02;LEŚNICTWO I POZYSKIWANIE DREWNA;0.5116765070865483;8.0
62;DZIAŁALNOŚĆ ZWIĄZANA Z PROGRAMOWANIEM, DORADZTWEM W ZAKRESIE INFORMATYKI I DZIAŁALNOŚCI POWIĄZANE;0.5033607037578791;9.0
32;POZOSTAŁA PRODUKCJA WYROBÓW;0.496542408857222;10.0
63;DZIAŁALNOŚĆ USŁUGOWA W ZAKRESIE INFRASTRUKTURY OBLICZENIOWEJ, PRZETWARZANIA DANYCH, ZARZĄDZANIA STRONAMI INTERNETOWYMI (HOSTING) I POZOSTAŁA DZIAŁALNOŚĆ USŁUGOWA W ZAKRESIE INFORMACJI;0.4905321282147459;11.0
21;PRODUKCJA PODSTAWOWYCH SUBSTANCJI FARMACEUTYCZNYCH ORAZ LEKÓW I POZOSTAŁYCH WYROBÓW FARMACEUTYCZNYCH;0.479238783854148;12.0
08;POZOSTAŁE GÓRNICTWO I WYDOBYWANIE;0.4739069583644483;13.0
88;POMOC SPOŁECZNA BEZ ZAKWATEROWANIA;0.4652174106508753;14.0
38;DZIAŁALNOŚĆ ZWIĄZANA ZE ZBIERANIEM, ODZYSKIEM I UNIESZKODLIWIANIEM ODPADÓW;0.4637914102488456;15.0
01;UPRAWY ROLNE, CHÓW I HODOWLA ZWIERZĄT, ŁOWIECTWO, W TYM DZIAŁALNOŚĆ USŁUGOWA;0.45691646381305917;16.0
69;DZIAŁALNOŚĆ PRAWNICZA, RACHUNKOWO-KSIĘGOWA I DORADZTWO PODATKOWE;0.45556712639341257;17.0
36;POBÓR, UZDATNIANIE I DOSTARCZANIE WODY;0.454631954686733;18.0
23;PRODUKCJA WYROBÓW Z POZOSTAŁYCH MINERALNYCH SUROWCÓW NIEMETALICZNYCH;0.44496206621632617;19.0
28;PRODUKCJA MASZYN I URZĄDZEŃ, GDZIE INDZIEJ NIESKLASYFIKOWANA;0.43847678143238233;20.0
74;POZOSTAŁA DZIAŁALNOŚĆ PROFESJONALNA, NAUKOWA I TECHNICZNA;0.4331215526479051;21.0
37;ODPROWADZANIE I OCZYSZCZANIE ŚCIEKÓW;0.43301259347029464;22.0
70;DZIAŁALNOŚĆ CENTRAL (HEAD OFFICES) ORAZ DORADZTWO ZWIĄZANE Z ZARZĄDZANIEM;0.4225909868733695;23.0
18;POLIGRAFIA I REPRODUKCJA ZAPISANYCH NOŚNIKÓW INFORMACJI;0.4199806963085463;24.0
22;PRODUKCJA WYROBÓW Z GUMY I TWORZYW SZTUCZNYCH;0.41892903586525565;25.0
51;TRANSPORT LOTNICZY;0.41777895078712535;26.0
31;PRODUKCJA MEBLI;0.4168548270625827;27.0
85;EDUKACJA;0.41469633701341535;28.0
81;DZIAŁALNOŚĆ USŁUGOWA ZWIĄZANA Z UTRZYMANIEM PORZĄDKU W BUDYNKACH I ZAGOSPODAROWANIEM TERENÓW ZIELENI;0.41354106695499415;29.0
90;DZIAŁALNOŚĆ TWÓRCZA I DZIAŁALNOŚĆ ZWIĄZANA Z WYSTAWIANIEM PRZEDSTAWIEŃ ARTYSTYCZNYCH;0.4132843050921273;30.0
17;PRODUKCJA PAPIERU I WYROBÓW Z PAPIERU;0.41211862596442506;31.0
43;ROBOTY BUDOWLANE SPECJALISTYCZNE;0.40834193591321033;32.0
03;RYBACTWO;0.4040360193593504;33.0
52;MAGAZYNOWANIE, PRZECHOWYWANIE I DZIAŁALNOŚĆ USŁUGOWA WSPOMAGAJĄCA TRANSPORT;0.4033465576467683;34.0
13;PRODUKCJA WYROBÓW TEKSTYLNYCH;0.3979160022903515;35.0
16;"PRODUKCJA WYROBÓW Z DREWNA I KORKA, Z WYŁĄCZENIEM MEBLI; PRODUKCJA WYROBÓW ZE SŁOMY I MATERIAŁÓW UŻYWANYCH DO WYPLATANIA";0.39667404772013937;36.0
66;DZIAŁALNOŚĆ WSPOMAGAJĄCA USŁUGI FINANSOWE, UBEZPIECZENIA I FUNDUSZE EMERYTALNE;0.39473759703829936;37.0
71;"DZIAŁALNOŚĆ W ZAKRESIE ARCHITEKTURY I INŻYNIERII; BADANIA I ANALIZY TECHNICZNE";0.38199414974022927;38.0
25;PRODUKCJA METALOWYCH WYROBÓW GOTOWYCH, Z WYŁĄCZENIEM MASZYN I URZĄDZEŃ;0.3819818009850129;39.0
10;PRODUKCJA ARTYKUŁÓW SPOŻYWCZYCH;0.3808525254298958;40.0
60;NADAWANIE PROGRAMÓW OGÓLNODOSTĘPNYCH I ABONAMENTOWYCH, DZIAŁALNOŚĆ AGENCJI INFORMACYJNYCH I POZOSTAŁA DZIAŁALNOŚĆ ZWIĄZANA Z DYSTRYBUCJĄ TREŚCI;0.379354158839347;41.0
26;PRODUKCJA KOMPUTERÓW, WYROBÓW ELEKTRONICZNYCH I OPTYCZNYCH;0.3772804976569655;42.0
87;POMOC SPOŁECZNA Z ZAKWATEROWANIEM;0.37063730480540813;43.0
95;NAPRAWA I KONSERWACJA KOMPUTERÓW, ARTYKUŁÓW UŻYTKU OSOBISTEGO I DOMOWEGO ORAZ POJAZDÓW SILNIKOWYCH, W TYM MOTOCYKLI;0.3693829121261114;44.0
39;DZIAŁALNOŚĆ ZWIĄZANA Z REKULTYWACJĄ I POZOSTAŁA DZIAŁALNOŚĆ USŁUGOWA ZWIĄZANA Z GOSPODARKĄ ODPADAMI;0.36681426099691494;45.0
80;DZIAŁALNOŚĆ DETEKTYWISTYCZNA I OCHRONIARSKA;0.3654315079012965;46.0
68;DZIAŁALNOŚĆ ZWIĄZANA Z OBSŁUGĄ RYNKU NIERUCHOMOŚCI;0.3591963595869825;47.0
73;DZIAŁALNOŚĆ W ZAKRESIE REKLAMY, BADANIA RYNKU I PUBLIC RELATIONS;0.35663945284480336;48.0
49;TRANSPORT LĄDOWY ORAZ TRANSPORT RUROCIĄGOWY;0.35574902488755256;49.0
84;"ADMINISTRACJA PUBLICZNA I OBRONA NARODOWA; OBOWIĄZKOWE UBEZPIECZENIA SPOŁECZNE";0.35323360219066446;50.0
35;WYTWARZANIE I ZAOPATRYWANIE W ENERGIĘ ELEKTRYCZNĄ, GAZ, PARĘ WODNĄ I POWIETRZE DO UKŁADÓW KLIMATYZACYJNYCH;0.3530574567420077;51.0
41;ROBOTY BUDOWLANE ZWIĄZANE ZE WZNOSZENIEM BUDYNKÓW MIESZKALNYCH I NIEMIESZKALNYCH;0.3505709450821616;52.0
07;GÓRNICTWO RUD METALI;0.34913530567789364;53.0
65;DZIAŁALNOŚĆ W ZAKRESIE UBEZPIECZEŃ, REASEKURACJI ORAZ FUNDUSZY EMERYTALNYCH, Z WYŁĄCZENIEM OBOWIĄZKOWEGO UBEZPIECZENIA SPOŁECZNEGO;0.3474938012034212;54.0
61;TELEKOMUNIKACJA;0.34484737241919483;55.0
64;FINANSOWA DZIAŁALNOŚĆ USŁUGOWA, Z WYŁĄCZENIEM UBEZPIECZEŃ I FUNDUSZY EMERYTALNYCH;0.3444049159929855;56.0
46;HANDEL HURTOWY;0.3433817497154372;57.0
86;OPIEKA ZDROWOTNA;0.33737172674987315;58.0
06;GÓRNICTWO ROPY NAFTOWEJ I GAZU ZIEMNEGO;0.336850964068081;59.0
91;DZIAŁALNOŚĆ BIBLIOTEK, ARCHIWÓW, MUZEÓW ORAZ POZOSTAŁA DZIAŁALNOŚĆ ZWIĄZANA Z KULTURĄ;0.3368442463329311;60.0
24;PRODUKCJA METALI;0.33575823743730593;61.0
99;ORGANIZACJE I ZESPOŁY EKSTERYTORIALNE;0.3351185963079778;62.0
30;PRODUKCJA POZOSTAŁEGO SPRZĘTU TRANSPORTOWEGO;0.331986294430761;63.0
98;GOSPODARSTWA DOMOWE PRODUKUJĄCE WYROBY I ŚWIADCZĄCE USŁUGI NA WŁASNE POTRZEBY;0.3311032130647462;64.5
97;GOSPODARSTWA DOMOWE ZATRUDNIAJĄCE PRACOWNIKÓW;0.3311032130647462;64.5
20;PRODUKCJA CHEMIKALIÓW I WYROBÓW CHEMICZNYCH;0.3302061790454871;66.0
42;ROBOTY ZWIĄZANE Z BUDOWĄ OBIEKTÓW INŻYNIERII LĄDOWEJ I WODNEJ;0.32854701998397184;67.0
78;DZIAŁALNOŚĆ ZWIĄZANA Z ZATRUDNIENIEM;0.32220747641630854;68.0
27;PRODUKCJA URZĄDZEŃ ELEKTRYCZNYCH;0.32206488271697564;69.0
50;TRANSPORT WODNY;0.31976567804301625;70.0
47;HANDEL DETALICZNY;0.31336906445668;71.0
11;PRODUKCJA NAPOJÓW;0.30385822629339954;72.0
33;NAPRAWA, KONSERWACJA I INSTALOWANIE MASZYN I URZĄDZEŃ;0.30383345451925103;73.0
59;DZIAŁALNOŚĆ ZWIĄZANA Z PRODUKCJĄ FILMÓW, NAGRAŃ WIDEO, PROGRAMÓW TELEWIZYJNYCH, NAGRAŃ DŹWIĘKOWYCH I MUZYCZNYCH;0.29598666212530056;74.0
82;DZIAŁALNOŚĆ ZWIĄZANA Z ADMINISTRACYJNĄ OBSŁUGĄ BIURA I POZOSTAŁA DZIAŁALNOŚĆ WSPOMAGAJĄCA PROWADZENIE DZIAŁALNOŚCI GOSPODARCZEJ;0.29484240491948377;75.0
29;PRODUKCJA POJAZDÓW SILNIKOWYCH, PRODUKCJA PRZYCZEP I NACZEP;0.27928445955099357;76.0
96;DZIAŁALNOŚĆ USŁUGOWA INDYWIDUALNA;0.26463295569769096;77.0
53;DZIAŁALNOŚĆ POCZTOWA I KURIERSKA;0.262429697091332;78.0
77;WYNAJEM I DZIERŻAWA;0.24677368639897546;79.0
19;WYTWARZANIE I PRZETWARZANIE KOKSU I PRODUKTÓW RAFINACJI ROPY NAFTOWEJ;0.23711389697584795;80.0
92;DZIAŁALNOŚĆ ZWIĄZANA Z GRAMI HAZARDOWYMI;0.23107823494897284;81.0
12;PRODUKCJA WYROBÓW TYTONIOWYCH;0.22067620293244805;82.0
56;DZIAŁALNOŚĆ USŁUGOWA ZWIĄZANA Z WYŻYWIENIEM;0.21594796564838536;83.0
79;DZIAŁALNOŚĆ ORGANIZATORÓW TURYSTYKI, AGENTÓW TURYSTYCZNYCH ORAZ POZOSTAŁA DZIAŁALNOŚĆ USŁUGOWA W ZAKRESIE REZERWACJI I DZIAŁALNOŚCI Z NIĄ ZWIĄZANE;0.1947683147510355;84.0
93;DZIAŁALNOŚĆ SPORTOWA, ROZRYWKOWA I REKREACYJNA;0.1867552964547523;85.0
55;ZAKWATEROWANIE;0.16503499430751;86.0
05;WYDOBYWANIE WĘGLA KAMIENNEGO I WĘGLA BRUNATNEGO (LIGNITU);0.011112731501427997;87.0
