alternative_id;nazwa;topsis_score;topsis_rank
05;WYDOBYWANIE WĘGLA KAMIENNEGO I WĘGLA BRUNATNEGO (LIGNITU);0.5451361958692416;1.0
92;DZIAŁALNOŚĆ ZWIĄZANA Z GRAMI HAZARDOWYMI;0.5419353982613416;2.0
94;DZIAŁALNOŚĆ ORGANIZACJI CZŁONKOWSKICH;0.47971138002185437;3.0
35;WYTWARZANIE I ZAOPATRYWANIE W ENERGIĘ ELEKTRYCZNĄ, GAZ, PARĘ WODNĄ I POWIETRZE DO UKŁADÓW KLIMATYZACYJNYCH;0.46616516437908195;4.0
55;ZAKWATEROWANIE;0.46545832340210885;5.0
87;POMOC SPOŁECZNA Z ZAKWATEROWANIEM;0.4572117116354338;6.0
93;DZIAŁALNOŚĆ SPORTOWA, ROZRYWKOWA I REKREACYJNA;0.45633460582980273;7.0
64;FINANSOWA DZIAŁALNOŚĆ USŁUGOWA, Z WYŁĄCZENIEM UBEZPIECZEŃ I FUNDUSZY EMERYTALNYCH;0.45443640008861563;8.0
66;DZIAŁALNOŚĆ WSPOMAGAJĄCA USŁUGI FINANSOWE, UBEZPIECZENIA I FUNDUSZE EMERYTALNE;0.44757735015418;9.0
88;POMOC SPOŁECZNA BEZ ZAKWATEROWANIA;0.444751689280209;10.0
69;DZIAŁALNOŚĆ PRAWNICZA, RACHUNKOWO-KSIĘGOWA I DORADZTWO PODATKOWE;0.44460518398331494;11.0
77;WYNAJEM I DZIERŻAWA;0.4444337608905504;12.0
70;DZIAŁALNOŚĆ CENTRAL (HEAD OFFICES) ORAZ DORADZTWO ZWIĄZANE Z ZARZĄDZANIEM;0.4424741161430579;13.0
19;WYTWARZANIE I PRZETWARZANIE KOKSU I PRODUKTÓW RAFINACJI ROPY NAFTOWEJ;0.4410493065099145;14.0
21;PRODUKCJA PODSTAWOWYCH SUBSTANCJI FARMACEUTYCZNYCH ORAZ LEKÓW I POZOSTAŁYCH WYROBÓW FARMACEUTYCZNYCH;0.44093057097792404;15.0
51;TRANSPORT LOTNICZY;0.4398817185168912;16.0
59;DZIAŁALNOŚĆ ZWIĄZANA Z PRODUKCJĄ FILMÓW, NAGRAŃ WIDEO, PROGRAMÓW TELEWIZYJNYCH, NAGRAŃ DŹWIĘKOWYCH I MUZYCZNYCH;0.4313767688581793;17.0
80;DZIAŁALNOŚĆ DETEKTYWISTYCZNA I OCHRONIARSKA;0.4304428746122302;18.0
56;DZIAŁALNOŚĆ USŁUGOWA ZWIĄZANA Z WYŻYWIENIEM;0.4271877859227255;19.0
12;PRODUKCJA WYROBÓW TYTONIOWYCH;0.4256634331921799;20.0
63;DZIAŁALNOŚĆ USŁUGOWA W ZAKRESIE INFRASTRUKTURY OBLICZENIOWEJ, PRZETWARZANIA DANYCH, ZARZĄDZANIA STRONAMI INTERNETOWYMI (HOSTING) I POZOSTAŁA DZIAŁALNOŚĆ USŁUGOWA W ZAKRESIE INFORMACJI;0.41700971180167934;21.0
73;DZIAŁALNOŚĆ W ZAKRESIE REKLAMY, BADANIA RYNKU I PUBLIC RELATIONS;0.4156492888214136;22.0
79;DZIAŁALNOŚĆ ORGANIZATORÓW TURYSTYKI, AGENTÓW TURYSTYCZNYCH ORAZ POZOSTAŁA DZIAŁALNOŚĆ USŁUGOWA W ZAKRESIE REZERWACJI I DZIAŁALNOŚCI Z NIĄ ZWIĄZANE;0.41478901329544743;23.0
47;HANDEL DETALICZNY;0.4145680357239146;24.0
11;PRODUKCJA NAPOJÓW;0.41273901225084253;25.0
78;DZIAŁALNOŚĆ ZWIĄZANA Z ZATRUDNIENIEM;0.4110795254409998;26.0
28;PRODUKCJA MASZYN I URZĄDZEŃ, GDZIE INDZIEJ NIESKLASYFIKOWANA;0.40946662464054995;27.0
08;POZOSTAŁE GÓRNICTWO I WYDOBYWANIE;0.4078224903347727;28.0
02;LEŚNICTWO I POZYSKIWANIE DREWNA;0.4064044086694563;29.0
13;PRODUKCJA WYROBÓW TEKSTYLNYCH;0.4062466785700343;30.0
16;"PRODUKCJA WYROBÓW Z DREWNA I KORKA, Z WYŁĄCZENIEM MEBLI; PRODUKCJA WYROBÓW ZE SŁOMY I MATERIAŁÓW UŻYWANYCH DO WYPLATANIA";0.403903290844928;31.0
32;POZOSTAŁA PRODUKCJA WYROBÓW;0.4035398544883393;32.0
10;PRODUKCJA ARTYKUŁÓW SPOŻYWCZYCH;0.4034912417496979;33.0
38;DZIAŁALNOŚĆ ZWIĄZANA ZE ZBIERANIEM, ODZYSKIEM I UNIESZKODLIWIANIEM ODPADÓW;0.4034269579115564;34.0
36;POBÓR, UZDATNIANIE I DOSTARCZANIE WODY;0.4024678526649599;35.0
31;PRODUKCJA MEBLI;0.4024457483789444;36.0
62;DZIAŁALNOŚĆ ZWIĄZANA Z PROGRAMOWANIEM, DORADZTWEM W ZAKRESIE INFORMATYKI I DZIAŁALNOŚCI POWIĄZANE;0.40191973104045675;37.0
95;NAPRAWA I KONSERWACJA KOMPUTERÓW, ARTYKUŁÓW UŻYTKU OSOBISTEGO I DOMOWEGO ORAZ POJAZDÓW SILNIKOWYCH, W TYM MOTOCYKLI;0.40151621191438325;38.0
22;PRODUKCJA WYROBÓW Z GUMY I TWORZYW SZTUCZNYCH;0.4010896359805831;39.0
18;POLIGRAFIA I REPRODUKCJA ZAPISANYCH NOŚNIKÓW INFORMACJI;0.4007078969707528;40.0
24;PRODUKCJA METALI;0.4004492141615028;41.0
49;TRANSPORT LĄDOWY ORAZ TRANSPORT RUROCIĄGOWY;0.3994101075291885;42.0
17;PRODUKCJA PAPIERU I WYROBÓW Z PAPIERU;0.3993366652606391;43.0
37;ODPROWADZANIE I OCZYSZCZANIE ŚCIEKÓW;0.39880270117030764;44.0
46;HANDEL HURTOWY;0.3985113237298893;45.0
91;DZIAŁALNOŚĆ BIBLIOTEK, ARCHIWÓW, MUZEÓW ORAZ POZOSTAŁA DZIAŁALNOŚĆ ZWIĄZANA Z KULTURĄ;0.39731235776737356;46.0
81;DZIAŁALNOŚĆ USŁUGOWA ZWIĄZANA Z UTRZYMANIEM PORZĄDKU W BUDYNKACH I ZAGOSPODAROWANIEM TERENÓW ZIELENI;0.39620101066813324;47.0
29;PRODUKCJA POJAZDÓW SILNIKOWYCH, PRODUKCJA PRZYCZEP I NACZEP;0.39609565046198925;48.0
53;DZIAŁALNOŚĆ POCZTOWA I KURIERSKA;0.39538327525728867;49.0
23;PRODUKCJA WYROBÓW Z POZOSTAŁYCH MINERALNYCH SUROWCÓW NIEMETALICZNYCH;0.3948675518483359;50.0
82;DZIAŁALNOŚĆ ZWIĄZANA Z ADMINISTRACYJNĄ OBSŁUGĄ BIURA I POZOSTAŁA DZIAŁALNOŚĆ WSPOMAGAJĄCA PROWADZENIE DZIAŁALNOŚCI GOSPODARCZEJ;0.3945683515559752;51.0
86;OPIEKA ZDROWOTNA;0.39289566861403735;52.0
26;PRODUKCJA KOMPUTERÓW, WYROBÓW ELEKTRONICZNYCH I OPTYCZNYCH;0.39238199749877023;53.0
58;DZIAŁALNOŚĆ WYDAWNICZA;0.39219584519112344;54.0
52;MAGAZYNOWANIE, PRZECHOWYWANIE I DZIAŁALNOŚĆ USŁUGOWA WSPOMAGAJĄCA TRANSPORT;0.3918389520058322;55.0
20;PRODUKCJA CHEMIKALIÓW I WYROBÓW CHEMICZNYCH;0.3916854578748251;56.0
03;RYBACTWO;0.3891553052669986;57.0
41;ROBOTY BUDOWLANE ZWIĄZANE ZE WZNOSZENIEM BUDYNKÓW MIESZKALNYCH I NIEMIESZKALNYCH;0.3879899393286475;58.0
43;ROBOTY BUDOWLANE SPECJALISTYCZNE;0.38795695797050905;59.0
30;PRODUKCJA POZOSTAŁEGO SPRZĘTU TRANSPORTOWEGO;0.38751416953716206;60.0
39;DZIAŁALNOŚĆ ZWIĄZANA Z REKULTYWACJĄ I POZOSTAŁA DZIAŁALNOŚĆ USŁUGOWA ZWIĄZANA Z GOSPODARKĄ ODPADAMI;0.3870301615845067;61.0
27;PRODUKCJA URZĄDZEŃ ELEKTRYCZNYCH;0.3867659998513208;62.0
75;DZIAŁALNOŚĆ WETERYNARYJNA;0.38660120778153056;63.0
68;DZIAŁALNOŚĆ ZWIĄZANA Z OBSŁUGĄ RYNKU NIERUCHOMOŚCI;0.3864203384834846;64.0
14;PRODUKCJA ODZIEŻY;0.3838609426624219;65.0
60;NADAWANIE PROGRAMÓW OGÓLNODOSTĘPNYCH I ABONAMENTOWYCH, DZIAŁALNOŚĆ AGENCJI INFORMACYJNYCH I POZOSTAŁA DZIAŁALNOŚĆ ZWIĄZANA Z DYSTRYBUCJĄ TREŚCI;0.38122424632014307;66.0
25;PRODUKCJA METALOWYCH WYROBÓW GOTOWYCH, Z WYŁĄCZENIEM MASZYN I URZĄDZEŃ;0.3800710037572077;67.0
50;TRANSPORT WODNY;0.3785792419571168;68.0
15;PRODUKCJA SKÓR I WYROBÓW ZE SKÓR WYPRAWIONYCH, PRODUKCJA PODOBNYCH WYROBÓW Z INNYCH MATERIAŁÓW;0.3782187267859111;69.0
84;"ADMINISTRACJA PUBLICZNA I OBRONA NARODOWA; OBOWIĄZKOWE UBEZPIECZENIA SPOŁECZNE";0.3775451999091579;70.0
06;GÓRNICTWO ROPY NAFTOWEJ I GAZU ZIEMNEGO;0.3755316220181723;71.0
65;DZIAŁALNOŚĆ W ZAKRESIE UBEZPIECZEŃ, REASEKURACJI ORAZ FUNDUSZY EMERYTALNYCH, Z WYŁĄCZENIEM OBOWIĄZKOWEGO UBEZPIECZENIA SPOŁECZNEGO;0.37512965769667456;72.0
07;GÓRNICTWO RUD METALI;0.37507581001570245;73.0
98;GOSPODARSTWA DOMOWE PRODUKUJĄCE WYROBY I ŚWIADCZĄCE USŁUGI NA WŁASNE POTRZEBY;0.37507505429859384;74.0
99;ORGANIZACJE I ZESPOŁY EKSTERYTORIALNE;0.3750512493555407;75.0
97;GOSPODARSTWA DOMOWE ZATRUDNIAJĄCE PRACOWNIKÓW;0.3750487298327621;76.0
61;TELEKOMUNIKACJA;0.3739961638390336;77.0
33;NAPRAWA, KONSERWACJA I INSTALOWANIE MASZYN I URZĄDZEŃ;0.3662970618915368;78.0
42;ROBOTY ZWIĄZANE Z BUDOWĄ OBIEKTÓW INŻYNIERII LĄDOWEJ I WODNEJ;0.36509079815676165;79.0
74;POZOSTAŁA DZIAŁALNOŚĆ PROFESJONALNA, NAUKOWA I TECHNICZNA;0.36504031251019003;80.0
85;EDUKACJA;0.3617655191021475;81.0
96;DZIAŁALNOŚĆ USŁUGOWA INDYWIDUALNA;0.36122772686602805;82.0
71;"DZIAŁALNOŚĆ W ZAKRESIE ARCHITEKTURY I INŻYNIERII; BADANIA I ANALIZY TECHNICZNE";0.35718172262635195;83.0
72;BADANIA NAUKOWE I PRACE ROZWOJOWE;0.35421144085074674;84.0
09;DZIAŁALNOŚĆ USŁUGOWA WSPOMAGAJĄCA GÓRNICTWO I WYDOBYWANIE;0.2911779339609024;85.0
90;DZIAŁALNOŚĆ TWÓRCZA I DZIAŁALNOŚĆ ZWIĄZANA Z WYSTAWIANIEM PRZEDSTAWIEŃ ARTYSTYCZNYCH;0.2777371704414446;86.0
01;UPRAWY ROLNE, CHÓW I HODOWLA ZWIERZĄT, ŁOWIECTWO, W TYM DZIAŁALNOŚĆ USŁUGOWA;0.2566252063368155;87.0
