alternative_id;nazwa;vikor_score;vikor_rank
94;DZIAŁALNOŚĆ ORGANIZACJI CZŁONKOWSKICH;0.9881416850966844;1.0
09;DZIAŁALNOŚĆ USŁUGOWA WSPOMAGAJĄCA GÓRNICTWO I WYDOBYWANIE;0.8009092703726275;2.0
66;DZIAŁALNOŚĆ WSPOMAGAJĄCA USŁUGI FINANSOWE, UBEZPIECZENIA I FUNDUSZE EMERYTALNE;0.45015185496334786;3.0
92;DZIAŁALNOŚĆ ZWIĄZANA Z GRAMI HAZARDOWYMI;0.3861246913998042;4.0
85;EDUKACJA;0.35504716339210685;5.0
90;DZIAŁALNOŚĆ TWÓRCZA I DZIAŁALNOŚĆ ZWIĄZANA Z WYSTAWIANIEM PRZEDSTAWIEŃ ARTYSTYCZNYCH;0.32667197763990696;6.0
88;POMOC SPOŁECZNA BEZ ZAKWATEROWANIA;0.3094296359293591;7.0
64;FINANSOWA DZIAŁALNOŚĆ USŁUGOWA, Z WYŁĄCZENIEM UBEZPIECZEŃ I FUNDUSZY EMERYTALNYCH;0.3054128238918048;8.0
70;DZIAŁALNOŚĆ CENTRAL (HEAD OFFICES) ORAZ DORADZTWO ZWIĄZANE Z ZARZĄDZANIEM;0.2685030262917112;9.0
79;DZIAŁALNOŚĆ ORGANIZATORÓW TURYSTYKI, AGENTÓW TURYSTYCZNYCH ORAZ POZOSTAŁA DZIAŁALNOŚĆ USŁUGOWA W ZAKRESIE REZERWACJI I DZIAŁALNOŚCI Z NIĄ ZWIĄZANE;0.2414835930755267;10.0
56;DZIAŁALNOŚĆ USŁUGOWA ZWIĄZANA Z WYŻYWIENIEM;0.23809439658010212;11.0
93;DZIAŁALNOŚĆ SPORTOWA, ROZRYWKOWA I REKREACYJNA;0.22617906980442193;12.0
91;DZIAŁALNOŚĆ BIBLIOTEK, ARCHIWÓW, MUZEÓW ORAZ POZOSTAŁA DZIAŁALNOŚĆ ZWIĄZANA Z KULTURĄ;0.21839839150333928;13.0
02;LEŚNICTWO I POZYSKIWANIE DREWNA;0.2136089285099514;14.0
05;WYDOBYWANIE WĘGLA KAMIENNEGO I WĘGLA BRUNATNEGO (LIGNITU);0.20043880193563002;15.0
60;NADAWANIE PROGRAMÓW OGÓLNODOSTĘPNYCH I ABONAMENTOWYCH, DZIAŁALNOŚĆ AGENCJI INFORMACYJNYCH I POZOSTAŁA DZIAŁALNOŚĆ ZWIĄZANA Z DYSTRYBUCJĄ TREŚCI;0.1998123541561454;16.0
53;DZIAŁALNOŚĆ POCZTOWA I KURIERSKA;0.19714784899384596;17.0
82;DZIAŁALNOŚĆ ZWIĄZANA Z ADMINISTRACYJNĄ OBSŁUGĄ BIURA I POZOSTAŁA DZIAŁALNOŚĆ WSPOMAGAJĄCA PROWADZENIE DZIAŁALNOŚCI GOSPODARCZEJ;0.19207304251465418;18.0
61;TELEKOMUNIKACJA;0.1878480181814397;19.0
81;DZIAŁALNOŚĆ USŁUGOWA ZWIĄZANA Z UTRZYMANIEM PORZĄDKU W BUDYNKACH I ZAGOSPODAROWANIEM TERENÓW ZIELENI;0.18345398269127955;20.0
35;WYTWARZANIE I ZAOPATRYWANIE W ENERGIĘ ELEKTRYCZNĄ, GAZ, PARĘ WODNĄ I POWIETRZE DO UKŁADÓW KLIMATYZACYJNYCH;0.1803610532828872;21.0
87;POMOC SPOŁECZNA Z ZAKWATEROWANIEM;0.17555651103635606;22.0
72;BADANIA NAUKOWE I PRACE ROZWOJOWE;0.1698246554078362;23.0
86;OPIEKA ZDROWOTNA;0.16407027784844952;24.0
77;WYNAJEM I DZIERŻAWA;0.16108654928339416;25.0
78;DZIAŁALNOŚĆ ZWIĄZANA Z ZATRUDNIENIEM;0.16084549192973063;26.0
26;PRODUKCJA KOMPUTERÓW, WYROBÓW ELEKTRONICZNYCH I OPTYCZNYCH;0.15767526431737489;27.0
68;DZIAŁALNOŚĆ ZWIĄZANA Z OBSŁUGĄ RYNKU NIERUCHOMOŚCI;0.15481384383534613;28.0
03;RYBACTWO;0.15054695872039536;29.0
17;PRODUKCJA PAPIERU I WYROBÓW Z PAPIERU;0.14573012307203537;30.0
73;DZIAŁALNOŚĆ W ZAKRESIE REKLAMY, BADANIA RYNKU I PUBLIC RELATIONS;0.14263659985848465;31.0
80;DZIAŁALNOŚĆ DETEKTYWISTYCZNA I OCHRONIARSKA;0.14015445689569694;32.0
12;PRODUKCJA WYROBÓW TYTONIOWYCH;0.13920459747669;33.0
47;HANDEL DETALICZNY;0.13880031789027103;34.0
19;WYTWARZANIE I PRZETWARZANIE KOKSU I PRODUKTÓW RAFINACJI ROPY NAFTOWEJ;0.13625300901517257;35.0
36;POBÓR, UZDATNIANIE I DOSTARCZANIE WODY;0.13524194100129283;36.0
18;POLIGRAFIA I REPRODUKCJA ZAPISANYCH NOŚNIKÓW INFORMACJI;0.13431819275927304;37.0
55;ZAKWATEROWANIE;0.1315589054072328;38.0
30;PRODUKCJA POZOSTAŁEGO SPRZĘTU TRANSPORTOWEGO;0.1273199973659116;39.0
96;DZIAŁALNOŚĆ USŁUGOWA INDYWIDUALNA;0.1269668647714448;40.0
29;PRODUKCJA POJAZDÓW SILNIKOWYCH, PRODUKCJA PRZYCZEP I NACZEP;0.1268613898949681;41.0
95;NAPRAWA I KONSERWACJA KOMPUTERÓW, ARTYKUŁÓW UŻYTKU OSOBISTEGO I DOMOWEGO ORAZ POJAZDÓW SILNIKOWYCH, W TYM MOTOCYKLI;0.12214254752630693;42.0
43;ROBOTY BUDOWLANE SPECJALISTYCZNE;0.12066236201172353;43.0
39;DZIAŁALNOŚĆ ZWIĄZANA Z REKULTYWACJĄ I POZOSTAŁA DZIAŁALNOŚĆ USŁUGOWA ZWIĄZANA Z GOSPODARKĄ ODPADAMI;0.11998014538618507;44.0
27;PRODUKCJA URZĄDZEŃ ELEKTRYCZNYCH;0.11887090884666818;45.0
74;POZOSTAŁA DZIAŁALNOŚĆ PROFESJONALNA, NAUKOWA I TECHNICZNA;0.11413220556559445;46.0
58;DZIAŁALNOŚĆ WYDAWNICZA;0.11065608518913295;47.0
49;TRANSPORT LĄDOWY ORAZ TRANSPORT RUROCIĄGOWY;0.11028990040976905;48.0
59;DZIAŁALNOŚĆ ZWIĄZANA Z PRODUKCJĄ FILMÓW, NAGRAŃ WIDEO, PROGRAMÓW TELEWIZYJNYCH, NAGRAŃ DŹWIĘKOWYCH I MUZYCZNYCH;0.10987039151309341;49.0
11;PRODUKCJA NAPOJÓW;0.10903031478229441;50.0
10;PRODUKCJA ARTYKUŁÓW SPOŻYWCZYCH;0.10885549313868537;51.0
28;PRODUKCJA MASZYN I URZĄDZEŃ, GDZIE INDZIEJ NIESKLASYFIKOWANA;0.10847120260979193;52.0
20;PRODUKCJA CHEMIKALIÓW I WYROBÓW CHEMICZNYCH;0.1061848150229443;53.0
52;MAGAZYNOWANIE, PRZECHOWYWANIE I DZIAŁALNOŚĆ USŁUGOWA WSPOMAGAJĄCA TRANSPORT;0.10478677392917435;54.0
24;PRODUKCJA METALI;0.10251749061948401;55.0
71;"DZIAŁALNOŚĆ W ZAKRESIE ARCHITEKTURY I INŻYNIERII; BADANIA I ANALIZY TECHNICZNE";0.10249999687695066;56.0
14;PRODUKCJA ODZIEŻY;0.10157533640402994;57.0
16;"PRODUKCJA WYROBÓW Z DREWNA I KORKA, Z WYŁĄCZENIEM MEBLI; PRODUKCJA WYROBÓW ZE SŁOMY I MATERIAŁÓW UŻYWANYCH DO WYPLATANIA";0.09989656018584225;58.0
13;PRODUKCJA WYROBÓW TEKSTYLNYCH;0.09767465473645687;59.0
38;DZIAŁALNOŚĆ ZWIĄZANA ZE ZBIERANIEM, ODZYSKIEM I UNIESZKODLIWIANIEM ODPADÓW;0.0960000222606201;60.0
41;ROBOTY BUDOWLANE ZWIĄZANE ZE WZNOSZENIEM BUDYNKÓW MIESZKALNYCH I NIEMIESZKALNYCH;0.09581637457032277;61.0
46;HANDEL HURTOWY;0.09456945792233984;62.0
08;POZOSTAŁE GÓRNICTWO I WYDOBYWANIE;0.09191731825410121;63.0
63;DZIAŁALNOŚĆ USŁUGOWA W ZAKRESIE INFRASTRUKTURY OBLICZENIOWEJ, PRZETWARZANIA DANYCH, ZARZĄDZANIA STRONAMI INTERNETOWYMI (HOSTING) I POZOSTAŁA DZIAŁALNOŚĆ USŁUGOWA W ZAKRESIE INFORMACJI;0.0877084208877772;64.0
84;"ADMINISTRACJA PUBLICZNA I OBRONA NARODOWA; OBOWIĄZKOWE UBEZPIECZENIA SPOŁECZNE";0.0870083085348099;65.0
22;PRODUKCJA WYROBÓW Z GUMY I TWORZYW SZTUCZNYCH;0.08570975544687154;66.0
62;DZIAŁALNOŚĆ ZWIĄZANA Z PROGRAMOWANIEM, DORADZTWEM W ZAKRESIE INFORMATYKI I DZIAŁALNOŚCI POWIĄZANE;0.08520368469945905;67.0
31;PRODUKCJA MEBLI;0.08517805733182415;68.0
25;PRODUKCJA METALOWYCH WYROBÓW GOTOWYCH, Z WYŁĄCZENIEM MASZYN I URZĄDZEŃ;0.08330578859099802;69.0
69;DZIAŁALNOŚĆ PRAWNICZA, RACHUNKOWO-KSIĘGOWA I DORADZTWO PODATKOWE;0.08295362295948583;70.0
37;ODPROWADZANIE I OCZYSZCZANIE ŚCIEKÓW;0.07868085163402305;71.0
06;GÓRNICTWO ROPY NAFTOWEJ I GAZU ZIEMNEGO;0.07867014321169363;72.0
21;PRODUKCJA PODSTAWOWYCH SUBSTANCJI FARMACEUTYCZNYCH ORAZ LEKÓW I POZOSTAŁYCH WYROBÓW FARMACEUTYCZNYCH;0.07836065672040893;73.0
01;UPRAWY ROLNE, CHÓW I HODOWLA ZWIERZĄT, ŁOWIECTWO, W TYM DZIAŁALNOŚĆ USŁUGOWA;0.0769011245474659;74.0
65;DZIAŁALNOŚĆ W ZAKRESIE UBEZPIECZEŃ, REASEKURACJI ORAZ FUNDUSZY EMERYTALNYCH, Z WYŁĄCZENIEM OBOWIĄZKOWEGO UBEZPIECZENIA SPOŁECZNEGO;0.07286770617664462;75.0
07;GÓRNICTWO RUD METALI;0.07244727548740182;76.0
98;GOSPODARSTWA DOMOWE PRODUKUJĄCE WYROBY I ŚWIADCZĄCE USŁUGI NA WŁASNE POTRZEBY;0.0724138952765101;77.0
99;ORGANIZACJE I ZESPOŁY EKSTERYTORIALNE;0.07183120137249133;78.0
97;GOSPODARSTWA DOMOWE ZATRUDNIAJĄCE PRACOWNIKÓW;0.0715848626273361;79.0
42;ROBOTY ZWIĄZANE Z BUDOWĄ OBIEKTÓW INŻYNIERII LĄDOWEJ I WODNEJ;0.07136163233074255;80.0
33;NAPRAWA, KONSERWACJA I INSTALOWANIE MASZYN I URZĄDZEŃ;0.0707702586887553;81.0
23;PRODUKCJA WYROBÓW Z POZOSTAŁYCH MINERALNYCH SUROWCÓW NIEMETALICZNYCH;0.07036226303103799;82.0
15;PRODUKCJA SKÓR I WYROBÓW ZE SKÓR WYPRAWIONYCH, PRODUKCJA PODOBNYCH WYROBÓW Z INNYCH MATERIAŁÓW;0.0701667410810678;83.0
32;POZOSTAŁA PRODUKCJA WYROBÓW;0.06849077180780583;84.0
51;TRANSPORT LOTNICZY;0.05337104005554716;85.0
75;DZIAŁALNOŚĆ WETERYNARYJNA;0.039750466182892796;86.0
50;TRANSPORT WODNY;0.013139416217559763;87.0
