alternative_id;nazwa;vikor_score;vikor_rank
58;DZIAŁALNOŚĆ WYDAWNICZA;0.8689594698881732;1.0
03;RYBACTWO;0.8308148162288156;2.0
94;DZIAŁALNOŚĆ ORGANIZACJI CZŁONKOWSKICH;0.8260554366920123;3.0
02;LEŚNICTWO I POZYSKIWANIE DREWNA;0.8119233028279085;4.0
90;DZIAŁALNOŚĆ TWÓRCZA I DZIAŁALNOŚĆ ZWIĄZANA Z WYSTAWIANIEM PRZEDSTAWIEŃ ARTYSTYCZNYCH;0.7995736224485129;5.0
21;PRODUKCJA PODSTAWOWYCH SUBSTANCJI FARMACEUTYCZNYCH ORAZ LEKÓW I POZOSTAŁYCH WYROBÓW FARMACEUTYCZNYCH;0.7888359545471892;6.0
14;PRODUKCJA ODZIEŻY;0.77237124851871;7.0
08;POZOSTAŁE GÓRNICTWO I WYDOBYWANIE;0.7529511069292834;8.0
69;DZIAŁALNOŚĆ PRAWNICZA, RACHUNKOWO-KSIĘGOWA I DORADZTWO PODATKOWE;0.7398824701435427;9.0
62;DZIAŁALNOŚĆ ZWIĄZANA Z PROGRAMOWANIEM, DORADZTWEM W ZAKRESIE INFORMATYKI I DZIAŁALNOŚCI POWIĄZANE;0.7394489794283098;10.0
80;DZIAŁALNOŚĆ DETEKTYWISTYCZNA I OCHRONIARSKA;0.7260841015577452;11.0
79;DZIAŁALNOŚĆ ORGANIZATORÓW TURYSTYKI, AGENTÓW TURYSTYCZNYCH ORAZ POZOSTAŁA DZIAŁALNOŚĆ USŁUGOWA W ZAKRESIE REZERWACJI I DZIAŁALNOŚCI Z NIĄ ZWIĄZANE;0.7260403402973973;12.0
26;PRODUKCJA KOMPUTERÓW, WYROBÓW ELEKTRONICZNYCH I OPTYCZNYCH;0.7241357930595967;13.0
95;NAPRAWA I KONSERWACJA KOMPUTERÓW, ARTYKUŁÓW UŻYTKU OSOBISTEGO I DOMOWEGO ORAZ POJAZDÓW SILNIKOWYCH, W TYM MOTOCYKLI;0.7227458366017092;14.0
43;ROBOTY BUDOWLANE SPECJALISTYCZNE;0.7218275726413305;15.0
09;DZIAŁALNOŚĆ USŁUGOWA WSPOMAGAJĄCA GÓRNICTWO I WYDOBYWANIE;0.7209107200880455;16.0
81;DZIAŁALNOŚĆ USŁUGOWA ZWIĄZANA Z UTRZYMANIEM PORZĄDKU W BUDYNKACH I ZAGOSPODAROWANIEM TERENÓW ZIELENI;0.7204394676911459;17.0
85;EDUKACJA;0.717937367199093;18.0
78;DZIAŁALNOŚĆ ZWIĄZANA Z ZATRUDNIENIEM;0.7122214270749523;19.0
72;BADANIA NAUKOWE I PRACE ROZWOJOWE;0.7097613873774657;20.0
42;ROBOTY ZWIĄZANE Z BUDOWĄ OBIEKTÓW INŻYNIERII LĄDOWEJ I WODNEJ;0.7018913648952657;21.0
19;WYTWARZANIE I PRZETWARZANIE KOKSU I PRODUKTÓW RAFINACJI ROPY NAFTOWEJ;0.7004778001309202;22.0
15;PRODUKCJA SKÓR I WYROBÓW ZE SKÓR WYPRAWIONYCH, PRODUKCJA PODOBNYCH WYROBÓW Z INNYCH MATERIAŁÓW;0.6886066293298247;23.0
73;DZIAŁALNOŚĆ W ZAKRESIE REKLAMY, BADANIA RYNKU I PUBLIC RELATIONS;0.68852293694658;24.0
59;DZIAŁALNOŚĆ ZWIĄZANA Z PRODUKCJĄ FILMÓW, NAGRAŃ WIDEO, PROGRAMÓW TELEWIZYJNYCH, NAGRAŃ DŹWIĘKOWYCH I MUZYCZNYCH;0.6884531777321258;25.0
23;PRODUKCJA WYROBÓW Z POZOSTAŁYCH MINERALNYCH SUROWCÓW NIEMETALICZNYCH;0.6882335615348971;26.0
31;PRODUKCJA MEBLI;0.6825933037215346;27.0
41;ROBOTY BUDOWLANE ZWIĄZANE ZE WZNOSZENIEM BUDYNKÓW MIESZKALNYCH I NIEMIESZKALNYCH;0.6818732732593068;28.0
96;DZIAŁALNOŚĆ USŁUGOWA INDYWIDUALNA;0.6814626737844585;29.0
13;PRODUKCJA WYROBÓW TEKSTYLNYCH;0.6782867478652914;30.0
28;PRODUKCJA MASZYN I URZĄDZEŃ, GDZIE INDZIEJ NIESKLASYFIKOWANA;0.6777773351044615;31.0
84;"ADMINISTRACJA PUBLICZNA I OBRONA NARODOWA; OBOWIĄZKOWE UBEZPIECZENIA SPOŁECZNE";0.6768629786683324;32.0
65;DZIAŁALNOŚĆ W ZAKRESIE UBEZPIECZEŃ, REASEKURACJI ORAZ FUNDUSZY EMERYTALNYCH, Z WYŁĄCZENIEM OBOWIĄZKOWEGO UBEZPIECZENIA SPOŁECZNEGO;0.6754145780609946;33.0
71;"DZIAŁALNOŚĆ W ZAKRESIE ARCHITEKTURY I INŻYNIERII; BADANIA I ANALIZY TECHNICZNE";0.6745663919680396;34.0
18;POLIGRAFIA I REPRODUKCJA ZAPISANYCH NOŚNIKÓW INFORMACJI;0.6724606371014975;35.0
01;UPRAWY ROLNE, CHÓW I HODOWLA ZWIERZĄT, ŁOWIECTWO, W TYM DZIAŁALNOŚĆ USŁUGOWA;0.6713018814774526;36.0
06;GÓRNICTWO ROPY NAFTOWEJ I GAZU ZIEMNEGO;0.6688324857398171;37.0
10;PRODUKCJA ARTYKUŁÓW SPOŻYWCZYCH;0.6678843902699977;38.0
25;PRODUKCJA METALOWYCH WYROBÓW GOTOWYCH, Z WYŁĄCZENIEM MASZYN I URZĄDZEŃ;0.6637236786277445;39.0
46;HANDEL HURTOWY;0.660814392404059;40.0
22;PRODUKCJA WYROBÓW Z GUMY I TWORZYW SZTUCZNYCH;0.6600724149011965;41.0
99;ORGANIZACJE I ZESPOŁY EKSTERYTORIALNE;0.6582255191192223;42.0
97;GOSPODARSTWA DOMOWE ZATRUDNIAJĄCE PRACOWNIKÓW;0.658088277722555;43.5
98;GOSPODARSTWA DOMOWE PRODUKUJĄCE WYROBY I ŚWIADCZĄCE USŁUGI NA WŁASNE POTRZEBY;0.658088277722555;43.5
88;POMOC SPOŁECZNA BEZ ZAKWATEROWANIA;0.6571224942719087;45.0
53;DZIAŁALNOŚĆ POCZTOWA I KURIERSKA;0.6568400936196276;46.0
07;GÓRNICTWO RUD METALI;0.6562660982781812;47.0
11;PRODUKCJA NAPOJÓW;0.6559219273505316;48.0
33;NAPRAWA, KONSERWACJA I INSTALOWANIE MASZYN I URZĄDZEŃ;0.6477047103414135;49.0
30;PRODUKCJA POZOSTAŁEGO SPRZĘTU TRANSPORTOWEGO;0.6474840142622253;50.0
60;NADAWANIE PROGRAMÓW OGÓLNODOSTĘPNYCH I ABONAMENTOWYCH, DZIAŁALNOŚĆ AGENCJI INFORMACYJNYCH I POZOSTAŁA DZIAŁALNOŚĆ ZWIĄZANA Z DYSTRYBUCJĄ TREŚCI;0.6470923202944767;51.0
29;PRODUKCJA POJAZDÓW SILNIKOWYCH, PRODUKCJA PRZYCZEP I NACZEP;0.645177916460927;52.0
39;DZIAŁALNOŚĆ ZWIĄZANA Z REKULTYWACJĄ I POZOSTAŁA DZIAŁALNOŚĆ USŁUGOWA ZWIĄZANA Z GOSPODARKĄ ODPADAMI;0.6440809260126188;53.0
74;POZOSTAŁA DZIAŁALNOŚĆ PROFESJONALNA, NAUKOWA I TECHNICZNA;0.6426591850559112;54.0
17;PRODUKCJA PAPIERU I WYROBÓW Z PAPIERU;0.640725072239484;55.0
47;HANDEL DETALICZNY;0.6337605343779453;56.0
20;PRODUKCJA CHEMIKALIÓW I WYROBÓW CHEMICZNYCH;0.6312698771045431;57.0
27;PRODUKCJA URZĄDZEŃ ELEKTRYCZNYCH;0.621026081079781;58.0
24;PRODUKCJA METALI;0.6176195455711233;59.0
64;FINANSOWA DZIAŁALNOŚĆ USŁUGOWA, Z WYŁĄCZENIEM UBEZPIECZEŃ I FUNDUSZY EMERYTALNYCH;0.6044618792167011;60.0
12;PRODUKCJA WYROBÓW TYTONIOWYCH;0.5996007334176745;61.0
70;DZIAŁALNOŚĆ CENTRAL (HEAD OFFICES) ORAZ DORADZTWO ZWIĄZANE Z ZARZĄDZANIEM;0.5981369556891856;62.0
50;TRANSPORT WODNY;0.5775246212065319;63.0
92;DZIAŁALNOŚĆ ZWIĄZANA Z GRAMI HAZARDOWYMI;0.5774182812022519;64.0
56;DZIAŁALNOŚĆ USŁUGOWA ZWIĄZANA Z WYŻYWIENIEM;0.5757348935119885;65.0
38;DZIAŁALNOŚĆ ZWIĄZANA ZE ZBIERANIEM, ODZYSKIEM I UNIESZKODLIWIANIEM ODPADÓW;0.5603514856826803;66.0
66;DZIAŁALNOŚĆ WSPOMAGAJĄCA USŁUGI FINANSOWE, UBEZPIECZENIA I FUNDUSZE EMERYTALNE;0.5359218177945799;67.0
16;"PRODUKCJA WYROBÓW Z DREWNA I KORKA, Z WYŁĄCZENIEM MEBLI; PRODUKCJA WYROBÓW ZE SŁOMY I MATERIAŁÓW UŻYWANYCH DO WYPLATANIA";0.5320655390780881;68.0
75;DZIAŁALNOŚĆ WETERYNARYJNA;0.5294018362654646;69.0
32;POZOSTAŁA PRODUKCJA WYROBÓW;0.5256322360223523;70.0
86;OPIEKA ZDROWOTNA;0.513710372479687;71.0
35;WYTWARZANIE I ZAOPATRYWANIE W ENERGIĘ ELEKTRYCZNĄ, GAZ, PARĘ WODNĄ I POWIETRZE DO UKŁADÓW KLIMATYZACYJNYCH;0.5037619620386893;72.0
49;TRANSPORT LĄDOWY ORAZ TRANSPORT RUROCIĄGOWY;0.5014275685485826;73.0
82;DZIAŁALNOŚĆ ZWIĄZANA Z ADMINISTRACYJNĄ OBSŁUGĄ BIURA I POZOSTAŁA DZIAŁALNOŚĆ WSPOMAGAJĄCA PROWADZENIE DZIAŁALNOŚCI GOSPODARCZEJ;0.49780901429708657;74.0
36;POBÓR, UZDATNIANIE I DOSTARCZANIE WODY;0.4707580030512696;75.0
68;DZIAŁALNOŚĆ ZWIĄZANA Z OBSŁUGĄ RYNKU NIERUCHOMOŚCI;0.41268059011464686;76.0
63;DZIAŁALNOŚĆ USŁUGOWA W ZAKRESIE INFRASTRUKTURY OBLICZENIOWEJ, PRZETWARZANIA DANYCH, ZARZĄDZANIA STRONAMI INTERNETOWYMI (HOSTING) I POZOSTAŁA DZIAŁALNOŚĆ USŁUGOWA W ZAKRESIE INFORMACJI;0.3992635078119955;77.0
51;TRANSPORT LOTNICZY;0.3845129044930531;78.0
91;DZIAŁALNOŚĆ BIBLIOTEK, ARCHIWÓW, MUZEÓW ORAZ POZOSTAŁA DZIAŁALNOŚĆ ZWIĄZANA Z KULTURĄ;0.3827359364722067;79.0
05;WYDOBYWANIE WĘGLA KAMIENNEGO I WĘGLA BRUNATNEGO (LIGNITU);0.37229197326937036;80.0
77;WYNAJEM I DZIERŻAWA;0.35145367457301324;81.0
93;DZIAŁALNOŚĆ SPORTOWA, ROZRYWKOWA I REKREACYJNA;0.3174184429945828;82.0
52;MAGAZYNOWANIE, PRZECHOWYWANIE I DZIAŁALNOŚĆ USŁUGOWA WSPOMAGAJĄCA TRANSPORT;0.31513705686720583;83.0
37;ODPROWADZANIE I OCZYSZCZANIE ŚCIEKÓW;0.31428493314853934;84.0
87;POMOC SPOŁECZNA Z ZAKWATEROWANIEM;0.28644498625774906;85.0
55;ZAKWATEROWANIE;0.279669057062782;86.0
61;TELEKOMUNIKACJA;0.2251187178525147;87.0
