alternative_id;nazwa;ensemble_score;ensemble_rank
75;DZIAŁALNOŚĆ WETERYNARYJNA;0.6411094805300239;1.0
94;DZIAŁALNOŚĆ ORGANIZACJI CZŁONKOWSKICH;0.5585460174219647;2.0
09;DZIAŁALNOŚĆ USŁUGOWA WSPOMAGAJĄCA GÓRNICTWO I WYDOBYWANIE;0.4995292445927335;3.0
63;DZIAŁALNOŚĆ USŁUGOWA W ZAKRESIE INFRASTRUKTURY OBLICZENIOWEJ, PRZETWARZANIA DANYCH, ZARZĄDZANIA STRONAMI INTERNETOWYMI (HOSTING) I POZOSTAŁA DZIAŁALNOŚĆ USŁUGOWA W ZAKRESIE INFORMACJI;0.491109719468779;4.0
64;FINANSOWA DZIAŁALNOŚĆ USŁUGOWA, Z WYŁĄCZENIEM UBEZPIECZEŃ I FUNDUSZY EMERYTALNYCH;0.48949958400649707;5.0
62;DZIAŁALNOŚĆ ZWIĄZANA Z PROGRAMOWANIEM, DORADZTWEM W ZAKRESIE INFORMATYKI I DZIAŁALNOŚCI POWIĄZANE;0.4487125020956544;6.0
08;POZOSTAŁE GÓRNICTWO I WYDOBYWANIE;0.43931286851214624;7.0
51;TRANSPORT LOTNICZY;0.42566315397050364;8.0
15;PRODUKCJA SKÓR I WYROBÓW ZE SKÓR WYPRAWIONYCH, PRODUKCJA PODOBNYCH WYROBÓW Z INNYCH MATERIAŁÓW;0.4207985280590658;9.0
03;RYBACTWO;0.4202154761234973;10.0
69;DZIAŁALNOŚĆ PRAWNICZA, RACHUNKOWO-KSIĘGOWA I DORADZTWO PODATKOWE;0.4145735625510122;11.0
59;DZIAŁALNOŚĆ ZWIĄZANA Z PRODUKCJĄ FILMÓW, NAGRAŃ WIDEO, PROGRAMÓW TELEWIZYJNYCH, NAGRAŃ DŹWIĘKOWYCH I MUZYCZNYCH;0.41284093803626826;12.0
02;LEŚNICTWO I POZYSKIWANIE DREWNA;0.40540235734834235;13.0
85;EDUKACJA;0.3973877390684225;14.0
58;DZIAŁALNOŚĆ WYDAWNICZA;0.3948730302816119;15.0
91;DZIAŁALNOŚĆ BIBLIOTEK, ARCHIWÓW, MUZEÓW ORAZ POZOSTAŁA DZIAŁALNOŚĆ ZWIĄZANA Z KULTURĄ;0.39435079751824537;16.0
37;ODPROWADZANIE I OCZYSZCZANIE ŚCIEKÓW;0.38520086419490074;17.0
74;POZOSTAŁA DZIAŁALNOŚĆ PROFESJONALNA, NAUKOWA I TECHNICZNA;0.37967674140465085;18.0
96;DZIAŁALNOŚĆ USŁUGOWA INDYWIDUALNA;0.3658640892050413;19.0
36;POBÓR, UZDATNIANIE I DOSTARCZANIE WODY;0.3652074280648177;20.0
92;DZIAŁALNOŚĆ ZWIĄZANA Z GRAMI HAZARDOWYMI;0.3634671520854713;21.0
14;PRODUKCJA ODZIEŻY;0.36063240055166773;22.0
21;PRODUKCJA PODSTAWOWYCH SUBSTANCJI FARMACEUTYCZNYCH ORAZ LEKÓW I POZOSTAŁYCH WYROBÓW FARMACEUTYCZNYCH;0.3604282595850857;23.0
88;POMOC SPOŁECZNA BEZ ZAKWATEROWANIA;0.3597258464683994;24.0
71;"DZIAŁALNOŚĆ W ZAKRESIE ARCHITEKTURY I INŻYNIERII; BADANIA I ANALIZY TECHNICZNE";0.35878951446372764;25.0
77;WYNAJEM I DZIERŻAWA;0.348912197357118;26.0
43;ROBOTY BUDOWLANE SPECJALISTYCZNE;0.34373919261129127;27.0
31;PRODUKCJA MEBLI;0.3393704173637622;28.0
17;PRODUKCJA PAPIERU I WYROBÓW Z PAPIERU;0.3384503909085389;29.0
72;BADANIA NAUKOWE I PRACE ROZWOJOWE;0.33838892873049975;30.0
87;POMOC SPOŁECZNA Z ZAKWATEROWANIEM;0.33772966292932083;31.0
81;DZIAŁALNOŚĆ USŁUGOWA ZWIĄZANA Z UTRZYMANIEM PORZĄDKU W BUDYNKACH I ZAGOSPODAROWANIEM TERENÓW ZIELENI;0.3306691010605294;32.0
68;DZIAŁALNOŚĆ ZWIĄZANA Z OBSŁUGĄ RYNKU NIERUCHOMOŚCI;0.3300978103873466;33.0
23;PRODUKCJA WYROBÓW Z POZOSTAŁYCH MINERALNYCH SUROWCÓW NIEMETALICZNYCH;0.3220913781851483;34.0
52;MAGAZYNOWANIE, PRZECHOWYWANIE I DZIAŁALNOŚĆ USŁUGOWA WSPOMAGAJĄCA TRANSPORT;0.31887955627307746;35.0
55;ZAKWATEROWANIE;0.3150927039312369;36.0
66;DZIAŁALNOŚĆ WSPOMAGAJĄCA USŁUGI FINANSOWE, UBEZPIECZENIA I FUNDUSZE EMERYTALNE;0.3111340350185624;37.0
18;POLIGRAFIA I REPRODUKCJA ZAPISANYCH NOŚNIKÓW INFORMACJI;0.310947258236284;38.0
28;PRODUKCJA MASZYN I URZĄDZEŃ, GDZIE INDZIEJ NIESKLASYFIKOWANA;0.3084838959362177;39.0
49;TRANSPORT LĄDOWY ORAZ TRANSPORT RUROCIĄGOWY;0.307849855177105;40.0
41;ROBOTY BUDOWLANE ZWIĄZANE ZE WZNOSZENIEM BUDYNKÓW MIESZKALNYCH I NIEMIESZKALNYCH;0.3045916664176277;41.0
33;NAPRAWA, KONSERWACJA I INSTALOWANIE MASZYN I URZĄDZEŃ;0.30073856466122806;42.0
61;TELEKOMUNIKACJA;0.2986465767989227;43.0
38;DZIAŁALNOŚĆ ZWIĄZANA ZE ZBIERANIEM, ODZYSKIEM I UNIESZKODLIWIANIEM ODPADÓW;0.2976725857508418;44.0
56;DZIAŁALNOŚĆ USŁUGOWA ZWIĄZANA Z WYŻYWIENIEM;0.2975769860712382;45.0
42;ROBOTY ZWIĄZANE Z BUDOWĄ OBIEKTÓW INŻYNIERII LĄDOWEJ I WODNEJ;0.29605458131414214;46.0
78;DZIAŁALNOŚĆ ZWIĄZANA Z ZATRUDNIENIEM;0.29528016860485506;47.0
01;UPRAWY ROLNE, CHÓW I HODOWLA ZWIERZĄT, ŁOWIECTWO, W TYM DZIAŁALNOŚĆ USŁUGOWA;0.2950699130934682;48.0
25;PRODUKCJA METALOWYCH WYROBÓW GOTOWYCH, Z WYŁĄCZENIEM MASZYN I URZĄDZEŃ;0.29117807422037845;49.0
99;ORGANIZACJE I ZESPOŁY EKSTERYTORIALNE;0.2879455648917706;50.0
07;GÓRNICTWO RUD METALI;0.28773649095467957;51.0
97;GOSPODARSTWA DOMOWE ZATRUDNIAJĄCE PRACOWNIKÓW;0.2877079492096848;52.0
98;GOSPODARSTWA DOMOWE PRODUKUJĄCE WYROBY I ŚWIADCZĄCE USŁUGI NA WŁASNE POTRZEBY;0.2876749682372407;53.0
65;DZIAŁALNOŚĆ W ZAKRESIE UBEZPIECZEŃ, REASEKURACJI ORAZ FUNDUSZY EMERYTALNYCH, Z WYŁĄCZENIEM OBOWIĄZKOWEGO UBEZPIECZENIA SPOŁECZNEGO;0.2876580333218665;54.0
06;GÓRNICTWO ROPY NAFTOWEJ I GAZU ZIEMNEGO;0.28752348379490983;55.0
84;"ADMINISTRACJA PUBLICZNA I OBRONA NARODOWA; OBOWIĄZKOWE UBEZPIECZENIA SPOŁECZNE";0.28734992651009417;56.0
70;DZIAŁALNOŚĆ CENTRAL (HEAD OFFICES) ORAZ DORADZTWO ZWIĄZANE Z ZARZĄDZANIEM;0.28501971828768213;57.0
19;WYTWARZANIE I PRZETWARZANIE KOKSU I PRODUKTÓW RAFINACJI ROPY NAFTOWEJ;0.28441636628194167;58.0
22;PRODUKCJA WYROBÓW Z GUMY I TWORZYW SZTUCZNYCH;0.28403469621585686;59.0
20;PRODUKCJA CHEMIKALIÓW I WYROBÓW CHEMICZNYCH;0.2804976558410216;60.0
80;DZIAŁALNOŚĆ DETEKTYWISTYCZNA I OCHRONIARSKA;0.2797055932493785;61.0
95;NAPRAWA I KONSERWACJA KOMPUTERÓW, ARTYKUŁÓW UŻYTKU OSOBISTEGO I DOMOWEGO ORAZ POJAZDÓW SILNIKOWYCH, W TYM MOTOCYKLI;0.27833285366158667;62.0
11;PRODUKCJA NAPOJÓW;0.27740998236009695;63.0
32;POZOSTAŁA PRODUKCJA WYROBÓW;0.27574827894295917;64.0
73;DZIAŁALNOŚĆ W ZAKRESIE REKLAMY, BADANIA RYNKU I PUBLIC RELATIONS;0.2753353058349106;65.0
82;DZIAŁALNOŚĆ ZWIĄZANA Z ADMINISTRACYJNĄ OBSŁUGĄ BIURA I POZOSTAŁA DZIAŁALNOŚĆ WSPOMAGAJĄCA PROWADZENIE DZIAŁALNOŚCI GOSPODARCZEJ;0.27180990379766923;66.0
10;PRODUKCJA ARTYKUŁÓW SPOŻYWCZYCH;0.27015815985339275;67.0
30;PRODUKCJA POZOSTAŁEGO SPRZĘTU TRANSPORTOWEGO;0.2697454348608906;68.0
26;PRODUKCJA KOMPUTERÓW, WYROBÓW ELEKTRONICZNYCH I OPTYCZNYCH;0.2617050953145549;69.0
16;"PRODUKCJA WYROBÓW Z DREWNA I KORKA, Z WYŁĄCZENIEM MEBLI; PRODUKCJA WYROBÓW ZE SŁOMY I MATERIAŁÓW UŻYWANYCH DO WYPLATANIA";0.2601864878060124;70.0
53;DZIAŁALNOŚĆ POCZTOWA I KURIERSKA;0.2498128894065182;71.0
24;PRODUKCJA METALI;0.24859436293321002;72.0
86;OPIEKA ZDROWOTNA;0.2481715845009125;73.0
27;PRODUKCJA URZĄDZEŃ ELEKTRYCZNYCH;0.24641774094939678;74.0
29;PRODUKCJA POJAZDÓW SILNIKOWYCH, PRODUKCJA PRZYCZEP I NACZEP;0.24198140467038975;75.0
50;TRANSPORT WODNY;0.24176110101101184;76.0
46;HANDEL HURTOWY;0.2417336686813269;77.0
35;WYTWARZANIE I ZAOPATRYWANIE W ENERGIĘ ELEKTRYCZNĄ, GAZ, PARĘ WODNĄ I POWIETRZE DO UKŁADÓW KLIMATYZACYJNYCH;0.23908657175679005;78.0
79;DZIAŁALNOŚĆ ORGANIZATORÓW TURYSTYKI, AGENTÓW TURYSTYCZNYCH ORAZ POZOSTAŁA DZIAŁALNOŚĆ USŁUGOWA W ZAKRESIE REZERWACJI I DZIAŁALNOŚCI Z NIĄ ZWIĄZANE;0.23532027014314288;79.0
05;WYDOBYWANIE WĘGLA KAMIENNEGO I WĘGLA BRUNATNEGO (LIGNITU);0.2285760423190059;80.0
47;HANDEL DETALICZNY;0.22856160620301544;81.0
39;DZIAŁALNOŚĆ ZWIĄZANA Z REKULTYWACJĄ I POZOSTAŁA DZIAŁALNOŚĆ USŁUGOWA ZWIĄZANA Z GOSPODARKĄ ODPADAMI;0.22751404037294934;82.0
13;PRODUKCJA WYROBÓW TEKSTYLNYCH;0.22689499335976882;83.0
12;PRODUKCJA WYROBÓW TYTONIOWYCH;0.207912713119767;84.0
60;NADAWANIE PROGRAMÓW OGÓLNODOSTĘPNYCH I ABONAMENTOWYCH, DZIAŁALNOŚĆ AGENCJI INFORMACYJNYCH I POZOSTAŁA DZIAŁALNOŚĆ ZWIĄZANA Z DYSTRYBUCJĄ TREŚCI;0.16685629624180298;85.0
93;DZIAŁALNOŚĆ SPORTOWA, ROZRYWKOWA I REKREACYJNA;0.1596167565435396;86.0
90;DZIAŁALNOŚĆ TWÓRCZA I DZIAŁALNOŚĆ ZWIĄZANA Z WYSTAWIANIEM PRZEDSTAWIEŃ ARTYSTYCZNYCH;0.1457651169308395;87.0
