alternative_id;nazwa;ensemble_score;ensemble_rank
09;DZIAŁALNOŚĆ USŁUGOWA WSPOMAGAJĄCA GÓRNICTWO I WYDOBYWANIE;0.6389321783042115;1.0
94;DZIAŁALNOŚĆ ORGANIZACJI CZŁONKOWSKICH;0.5746675353459666;2.0
63;DZIAŁALNOŚĆ USŁUGOWA W ZAKRESIE INFRASTRUKTURY OBLICZENIOWEJ, PRZETWARZANIA DANYCH, ZARZĄDZANIA STRONAMI INTERNETOWYMI (HOSTING) I POZOSTAŁA DZIAŁALNOŚĆ USŁUGOWA W ZAKRESIE INFORMACJI;0.508458081822089;3.0
75;DZIAŁALNOŚĆ WETERYNARYJNA;0.4939003401192379;4.0
08;POZOSTAŁE GÓRNICTWO I WYDOBYWANIE;0.4614800147618064;5.0
85;EDUKACJA;0.46137658910959567;6.0
59;DZIAŁALNOŚĆ ZWIĄZANA Z PRODUKCJĄ FILMÓW, NAGRAŃ WIDEO, PROGRAMÓW TELEWIZYJNYCH, NAGRAŃ DŹWIĘKOWYCH I MUZYCZNYCH;0.4556313373047265;7.0
15;PRODUKCJA SKÓR I WYROBÓW ZE SKÓR WYPRAWIONYCH, PRODUKCJA PODOBNYCH WYROBÓW Z INNYCH MATERIAŁÓW;0.45073424869298956;8.0
03;RYBACTWO;0.4358469354321817;9.0
62;DZIAŁALNOŚĆ ZWIĄZANA Z PROGRAMOWANIEM, DORADZTWEM W ZAKRESIE INFORMATYKI I DZIAŁALNOŚCI POWIĄZANE;0.4315704595109284;10.0
64;FINANSOWA DZIAŁALNOŚĆ USŁUGOWA, Z WYŁĄCZENIEM UBEZPIECZEŃ I FUNDUSZY EMERYTALNYCH;0.425470994876194;11.0
14;PRODUKCJA ODZIEŻY;0.40962577354964963;12.0
21;PRODUKCJA PODSTAWOWYCH SUBSTANCJI FARMACEUTYCZNYCH ORAZ LEKÓW I POZOSTAŁYCH WYROBÓW FARMACEUTYCZNYCH;0.403936239751145;13.0
58;DZIAŁALNOŚĆ WYDAWNICZA;0.3999155462791081;14.0
72;BADANIA NAUKOWE I PRACE ROZWOJOWE;0.3937633349848663;15.0
02;LEŚNICTWO I POZYSKIWANIE DREWNA;0.3876848277231478;16.0
51;TRANSPORT LOTNICZY;0.38717376711731877;17.0
71;"DZIAŁALNOŚĆ W ZAKRESIE ARCHITEKTURY I INŻYNIERII; BADANIA I ANALIZY TECHNICZNE";0.38371523653604966;18.0
36;POBÓR, UZDATNIANIE I DOSTARCZANIE WODY;0.3816524972335808;19.0
31;PRODUKCJA MEBLI;0.37994586794715807;20.0
37;ODPROWADZANIE I OCZYSZCZANIE ŚCIEKÓW;0.37885042732291035;21.0
41;ROBOTY BUDOWLANE ZWIĄZANE ZE WZNOSZENIEM BUDYNKÓW MIESZKALNYCH I NIEMIESZKALNYCH;0.36667794792279806;22.0
69;DZIAŁALNOŚĆ PRAWNICZA, RACHUNKOWO-KSIĘGOWA I DORADZTWO PODATKOWE;0.36357799458156237;23.0
74;POZOSTAŁA DZIAŁALNOŚĆ PROFESJONALNA, NAUKOWA I TECHNICZNA;0.361023840030853;24.0
91;DZIAŁALNOŚĆ BIBLIOTEK, ARCHIWÓW, MUZEÓW ORAZ POZOSTAŁA DZIAŁALNOŚĆ ZWIĄZANA Z KULTURĄ;0.3595523904291684;25.0
77;WYNAJEM I DZIERŻAWA;0.35681041911280253;26.0
68;DZIAŁALNOŚĆ ZWIĄZANA Z OBSŁUGĄ RYNKU NIERUCHOMOŚCI;0.3566279367101224;27.0
17;PRODUKCJA PAPIERU I WYROBÓW Z PAPIERU;0.35294548151156047;28.0
19;WYTWARZANIE I PRZETWARZANIE KOKSU I PRODUKTÓW RAFINACJI ROPY NAFTOWEJ;0.3500051477275927;29.0
61;TELEKOMUNIKACJA;0.3482753422093459;30.0
28;PRODUKCJA MASZYN I URZĄDZEŃ, GDZIE INDZIEJ NIESKLASYFIKOWANA;0.34498277277257167;31.0
01;UPRAWY ROLNE, CHÓW I HODOWLA ZWIERZĄT, ŁOWIECTWO, W TYM DZIAŁALNOŚĆ USŁUGOWA;0.3433918265473337;32.0
43;ROBOTY BUDOWLANE SPECJALISTYCZNE;0.3430535650169674;33.0
78;DZIAŁALNOŚĆ ZWIĄZANA Z ZATRUDNIENIEM;0.34208656785561037;34.0
87;POMOC SPOŁECZNA Z ZAKWATEROWANIEM;0.34104315430813503;35.0
52;MAGAZYNOWANIE, PRZECHOWYWANIE I DZIAŁALNOŚĆ USŁUGOWA WSPOMAGAJĄCA TRANSPORT;0.33986658432917044;36.0
96;DZIAŁALNOŚĆ USŁUGOWA INDYWIDUALNA;0.3387984745063579;37.0
23;PRODUKCJA WYROBÓW Z POZOSTAŁYCH MINERALNYCH SUROWCÓW NIEMETALICZNYCH;0.3302920495976446;38.0
25;PRODUKCJA METALOWYCH WYROBÓW GOTOWYCH, Z WYŁĄCZENIEM MASZYN I URZĄDZEŃ;0.32761762774529163;39.0
95;NAPRAWA I KONSERWACJA KOMPUTERÓW, ARTYKUŁÓW UŻYTKU OSOBISTEGO I DOMOWEGO ORAZ POJAZDÓW SILNIKOWYCH, W TYM MOTOCYKLI;0.3269055955875865;40.0
18;POLIGRAFIA I REPRODUKCJA ZAPISANYCH NOŚNIKÓW INFORMACJI;0.32015446478227316;41.0
81;DZIAŁALNOŚĆ USŁUGOWA ZWIĄZANA Z UTRZYMANIEM PORZĄDKU W BUDYNKACH I ZAGOSPODAROWANIEM TERENÓW ZIELENI;0.3195080743483706;42.0
82;DZIAŁALNOŚĆ ZWIĄZANA Z ADMINISTRACYJNĄ OBSŁUGĄ BIURA I POZOSTAŁA DZIAŁALNOŚĆ WSPOMAGAJĄCA PROWADZENIE DZIAŁALNOŚCI GOSPODARCZEJ;0.3187003427623063;43.0
24;PRODUKCJA METALI;0.3171777086403411;44.0
66;DZIAŁALNOŚĆ WSPOMAGAJĄCA USŁUGI FINANSOWE, UBEZPIECZENIA I FUNDUSZE EMERYTALNE;0.3161379597519582;45.0
60;NADAWANIE PROGRAMÓW OGÓLNODOSTĘPNYCH I ABONAMENTOWYCH, DZIAŁALNOŚĆ AGENCJI INFORMACYJNYCH I POZOSTAŁA DZIAŁALNOŚĆ ZWIĄZANA Z DYSTRYBUCJĄ TREŚCI;0.3157557824854179;46.0
88;POMOC SPOŁECZNA BEZ ZAKWATEROWANIA;0.31454169446009805;47.0
10;PRODUKCJA ARTYKUŁÓW SPOŻYWCZYCH;0.3136022502179897;48.0
33;NAPRAWA, KONSERWACJA I INSTALOWANIE MASZYN I URZĄDZEŃ;0.31325714983532116;49.0
07;GÓRNICTWO RUD METALI;0.3132326570978259;50.0
65;DZIAŁALNOŚĆ W ZAKRESIE UBEZPIECZEŃ, REASEKURACJI ORAZ FUNDUSZY EMERYTALNYCH, Z WYŁĄCZENIEM OBOWIĄZKOWEGO UBEZPIECZENIA SPOŁECZNEGO;0.31322888674163113;51.0
97;GOSPODARSTWA DOMOWE ZATRUDNIAJĄCE PRACOWNIKÓW;0.31322506172994424;52.0
98;GOSPODARSTWA DOMOWE PRODUKUJĄCE WYROBY I ŚWIADCZĄCE USŁUGI NA WŁASNE POTRZEBY;0.3132202566134368;53.0
84;"ADMINISTRACJA PUBLICZNA I OBRONA NARODOWA; OBOWIĄZKOWE UBEZPIECZENIA SPOŁECZNE";0.31321882018576663;54.0
06;GÓRNICTWO ROPY NAFTOWEJ I GAZU ZIEMNEGO;0.31321533826704867;55.0
99;ORGANIZACJE I ZESPOŁY EKSTERYTORIALNE;0.31321222788358144;56.0
49;TRANSPORT LĄDOWY ORAZ TRANSPORT RUROCIĄGOWY;0.3113433267279339;57.0
30;PRODUKCJA POZOSTAŁEGO SPRZĘTU TRANSPORTOWEGO;0.30939813524043924;58.0
26;PRODUKCJA KOMPUTERÓW, WYROBÓW ELEKTRONICZNYCH I OPTYCZNYCH;0.3090171447919343;59.0
42;ROBOTY ZWIĄZANE Z BUDOWĄ OBIEKTÓW INŻYNIERII LĄDOWEJ I WODNEJ;0.30794184816442904;60.0
38;DZIAŁALNOŚĆ ZWIĄZANA ZE ZBIERANIEM, ODZYSKIEM I UNIESZKODLIWIANIEM ODPADÓW;0.3050588642961716;61.0
32;POZOSTAŁA PRODUKCJA WYROBÓW;0.3036401109360845;62.0
22;PRODUKCJA WYROBÓW Z GUMY I TWORZYW SZTUCZNYCH;0.3014624650253131;63.0
55;ZAKWATEROWANIE;0.30011502306156423;64.0
73;DZIAŁALNOŚĆ W ZAKRESIE REKLAMY, BADANIA RYNKU I PUBLIC RELATIONS;0.29906992152608936;65.0
56;DZIAŁALNOŚĆ USŁUGOWA ZWIĄZANA Z WYŻYWIENIEM;0.2979692918808738;66.0
27;PRODUKCJA URZĄDZEŃ ELEKTRYCZNYCH;0.2964742219096937;67.0
53;DZIAŁALNOŚĆ POCZTOWA I KURIERSKA;0.29247629588618684;68.0
20;PRODUKCJA CHEMIKALIÓW I WYROBÓW CHEMICZNYCH;0.2924610660603383;69.0
11;PRODUKCJA NAPOJÓW;0.2912057932200571;70.0
47;HANDEL DETALICZNY;0.28731062333981955;71.0
46;HANDEL HURTOWY;0.28668880761304527;72.0
80;DZIAŁALNOŚĆ DETEKTYWISTYCZNA I OCHRONIARSKA;0.2784224272446205;73.0
29;PRODUKCJA POJAZDÓW SILNIKOWYCH, PRODUKCJA PRZYCZEP I NACZEP;0.2725485235559729;74.0
16;"PRODUKCJA WYROBÓW Z DREWNA I KORKA, Z WYŁĄCZENIEM MEBLI; PRODUKCJA WYROBÓW ZE SŁOMY I MATERIAŁÓW UŻYWANYCH DO WYPLATANIA";0.27168876809989134;75.0
86;OPIEKA ZDROWOTNA;0.2559306200776371;76.0
13;PRODUKCJA WYROBÓW TEKSTYLNYCH;0.24873169365875752;77.0
39;DZIAŁALNOŚĆ ZWIĄZANA Z REKULTYWACJĄ I POZOSTAŁA DZIAŁALNOŚĆ USŁUGOWA ZWIĄZANA Z GOSPODARKĄ ODPADAMI;0.22679072165312114;78.0
70;DZIAŁALNOŚĆ CENTRAL (HEAD OFFICES) ORAZ DORADZTWO ZWIĄZANE Z ZARZĄDZANIEM;0.22334718388199828;79.0
92;DZIAŁALNOŚĆ ZWIĄZANA Z GRAMI HAZARDOWYMI;0.22333224235166974;80.0
35;WYTWARZANIE I ZAOPATRYWANIE W ENERGIĘ ELEKTRYCZNĄ, GAZ, PARĘ WODNĄ I POWIETRZE DO UKŁADÓW KLIMATYZACYJNYCH;0.21987325508304953;81.0
93;DZIAŁALNOŚĆ SPORTOWA, ROZRYWKOWA I REKREACYJNA;0.21519326085535195;82.0
12;PRODUKCJA WYROBÓW TYTONIOWYCH;0.21504767614798634;83.0
05;WYDOBYWANIE WĘGLA KAMIENNEGO I WĘGLA BRUNATNEGO (LIGNITU);0.21128310876538647;84.0
79;DZIAŁALNOŚĆ ORGANIZATORÓW TURYSTYKI, AGENTÓW TURYSTYCZNYCH ORAZ POZOSTAŁA DZIAŁALNOŚĆ USŁUGOWA W ZAKRESIE REZERWACJI I DZIAŁALNOŚCI Z NIĄ ZWIĄZANE;0.19120337738791465;85.0
90;DZIAŁALNOŚĆ TWÓRCZA I DZIAŁALNOŚĆ ZWIĄZANA Z WYSTAWIANIEM PRZEDSTAWIEŃ ARTYSTYCZNYCH;0.17935176081922188;86.0
50;TRANSPORT WODNY;0.15608679978632528;87.0
