ensemble_rank;alternative_id;nazwa;ensemble_score;topsis_score;vikor_score;monte_carlo_score;topsis_rank;vikor_rank;monte_carlo_rank
1.0;94;DZIAŁALNOŚĆ ORGANIZACJI CZŁONKOWSKICH;0.65386044216753;0.48311350848877194;1.0;0.4836264246065744;2.0;1.0;2.0
2.0;09;DZIAŁALNOŚĆ USŁUGOWA WSPOMAGAJĄCA GÓRNICTWO I WYDOBYWANIE;0.6086947200598523;0.5870800846844823;0.6562087144373367;0.5835571069107413;1.0;2.0;1.0
3.0;92;DZIAŁALNOŚĆ ZWIĄZANA Z GRAMI HAZARDOWYMI;0.3818580143116818;0.4406708508148853;0.2618921636510011;0.4412124104057038;6.0;6.0;6.0
4.0;70;DZIAŁALNOŚĆ CENTRAL (HEAD OFFICES) ORAZ DORADZTWO ZWIĄZANE Z ZARZĄDZANIEM;0.34464642091734105;0.415998529738783;0.2003691658292135;0.41542670994088887;10.0;8.0;10.0
5.0;64;FINANSOWA DZIAŁALNOŚĆ USŁUGOWA, Z WYŁĄCZENIEM UBEZPIECZEŃ I FUNDUSZY EMERYTALNYCH;0.340664819053337;0.3610557088446579;0.2973545262108028;0.3629101220148086;45.0;4.0;43.0
6.0;91;DZIAŁALNOŚĆ BIBLIOTEK, ARCHIWÓW, MUZEÓW ORAZ POZOSTAŁA DZIAŁALNOŚĆ ZWIĄZANA Z KULTURĄ;0.3349987858229007;0.41553079060294057;0.17397437404010807;0.4131237690902784;11.0;9.0;12.0
7.0;95;NAPRAWA I KONSERWACJA KOMPUTERÓW, ARTYKUŁÓW UŻYTKU OSOBISTEGO I DOMOWEGO ORAZ POJAZDÓW SILNIKOWYCH, W TYM MOTOCYKLI;0.3264065770417325;0.35683649414962715;0.26624944729132793;0.3552594599006391;51.0;5.0;51.0
8.0;63;DZIAŁALNOŚĆ USŁUGOWA W ZAKRESIE INFRASTRUKTURY OBLICZENIOWEJ, PRZETWARZANIA DANYCH, ZARZĄDZANIA STRONAMI INTERNETOWYMI (HOSTING) I POZOSTAŁA DZIAŁALNOŚĆ USŁUGOWA W ZAKRESIE INFORMACJI;0.3255262818094474;0.4476126210480746;0.08035928025264638;0.4449869246476751;5.0;34.0;5.0
9.0;51;TRANSPORT LOTNICZY;0.31869636922612166;0.46719743818580617;0.01977787333429526;0.46468975418967107;3.0;86.0;3.0
10.0;77;WYNAJEM I DZIERŻAWA;0.31785487972693816;0.392800981309257;0.165114213301903;0.39336136913310377;22.0;10.0;20.0
11.0;87;POMOC SPOŁECZNA Z ZAKWATEROWANIEM;0.31437713536573775;0.4480867036416536;0.04552482550938941;0.4455450904290985;4.0;74.0;4.0
12.0;93;DZIAŁALNOŚĆ SPORTOWA, ROZRYWKOWA I REKREACYJNA;0.31281977628747915;0.3993460306679823;0.13846070408227484;0.3980692759408656;17.0;14.0;17.0
13.0;30;PRODUKCJA POZOSTAŁEGO SPRZĘTU TRANSPORTOWEGO;0.3088187843585015;0.4358609573742689;0.05371006242770293;0.4331186700701495;7.0;65.0;7.0
14.0;66;DZIAŁALNOŚĆ WSPOMAGAJĄCA USŁUGI FINANSOWE, UBEZPIECZENIA I FUNDUSZE EMERYTALNE;0.30749071934804684;0.3592213447650511;0.20190817392772953;0.35975875935126245;48.0;7.0;46.0
15.0;79;DZIAŁALNOŚĆ ORGANIZATORÓW TURYSTYKI, AGENTÓW TURYSTYCZNYCH ORAZ POZOSTAŁA DZIAŁALNOŚĆ USŁUGOWA W ZAKRESIE REZERWACJI I DZIAŁALNOŚCI Z NIĄ ZWIĄZANE;0.306903419498472;0.41489590814214694;0.08904491959477334;0.4135380774861421;12.0;29.0;11.0
16.0;72;BADANIA NAUKOWE I PRACE ROZWOJOWE;0.30513126872986907;0.3978747423765376;0.11951649615683113;0.39527105886428643;19.0;21.0;19.0
17.0;55;ZAKWATEROWANIE;0.3013879770957846;0.4220603885482154;0.05790636200673327;0.4205851453313279;8.0;55.0;8.0
18.0;59;DZIAŁALNOŚĆ ZWIĄZANA Z PRODUKCJĄ FILMÓW, NAGRAŃ WIDEO, PROGRAMÓW TELEWIZYJNYCH, NAGRAŃ DŹWIĘKOWYCH I MUZYCZNYCH;0.30008319109968895;0.41796347001382633;0.06292198297467722;0.415855857686714;9.0;50.0;9.0
19.0;81;DZIAŁALNOŚĆ USŁUGOWA ZWIĄZANA Z UTRZYMANIEM PORZĄDKU W BUDYNKACH I ZAGOSPODAROWANIEM TERENÓW ZIELENI;0.2972698862916019;0.40019702148021125;0.08997879621446636;0.3985643130951713;16.0;28.0;16.0
20.0;85;EDUKACJA;0.2886937893425622;0.2795550435594139;0.30581273513453433;0.28094830109870356;82.0;3.0;82.0
21.0;10;PRODUKCJA ARTYKUŁÓW SPOŻYWCZYCH;0.28838549525930485;0.4046867803587124;0.05463066223767976;0.402384527066163;14.0;61.0;15.0
22.0;49;TRANSPORT LĄDOWY ORAZ TRANSPORT RUROCIĄGOWY;0.2876894665473322;0.3551451889416986;0.15220745936401026;0.35371497825425946;52.0;12.0;52.0
23.0;86;OPIEKA ZDROWOTNA;0.2865882293177492;0.3945500104493589;0.06967563813624555;0.39233460377794027;20.0;43.0;21.0
24.0;35;WYTWARZANIE I ZAOPATRYWANIE W ENERGIĘ ELEKTRYCZNĄ, GAZ, PARĘ WODNĄ I POWIETRZE DO UKŁADÓW KLIMATYZACYJNYCH;0.2860901964933549;0.3650504027279651;0.1272630330929332;0.36360812550723076;42.0;17.0;42.0
25.0;82;DZIAŁALNOŚĆ ZWIĄZANA Z ADMINISTRACYJNĄ OBSŁUGĄ BIURA I POZOSTAŁA DZIAŁALNOŚĆ WSPOMAGAJĄCA PROWADZENIE DZIAŁALNOŚCI GOSPODARCZEJ;0.2834947777627649;0.3734428072740553;0.10170537913032685;0.372634930145055;33.0;24.0;33.0
26.0;42;ROBOTY ZWIĄZANE Z BUDOWĄ OBIEKTÓW INŻYNIERII LĄDOWEJ I WODNEJ;0.2833296301826443;0.4056785351886009;0.03706960036293738;0.40359631014893127;13.0;81.0;13.0
27.0;58;DZIAŁALNOŚĆ WYDAWNICZA;0.28067830864594445;0.398708028881651;0.04290617065290614;0.3968988905868841;18.0;78.0;18.0
28.0;13;PRODUKCJA WYROBÓW TEKSTYLNYCH;0.28058535405467233;0.38716403107870906;0.0663095257926124;0.385114942020989;24.0;47.0;25.0
29.0;88;POMOC SPOŁECZNA BEZ ZAKWATEROWANIA;0.2801548943849261;0.36272805979770323;0.1140955760952822;0.361185572177179;44.0;22.0;45.0
30.0;39;DZIAŁALNOŚĆ ZWIĄZANA Z REKULTYWACJĄ I POZOSTAŁA DZIAŁALNOŚĆ USŁUGOWA ZWIĄZANA Z GOSPODARKĄ ODPADAMI;0.27897874968362724;0.35436092792362645;0.12775141781567156;0.35259316349899683;53.0;16.0;54.0
31.0;21;PRODUKCJA PODSTAWOWYCH SUBSTANCJI FARMACEUTYCZNYCH ORAZ LEKÓW I POZOSTAŁYCH WYROBÓW FARMACEUTYCZNYCH;0.2785619933337433;0.4043686242519914;0.025155389956992624;0.40240902542581936;15.0;84.0;14.0
32.0;56;DZIAŁALNOŚĆ USŁUGOWA ZWIĄZANA Z WYŻYWIENIEM;0.2785505889127883;0.39297980342395106;0.04792886316519285;0.3913256733481492;21.0;71.0;22.0
33.0;14;PRODUKCJA ODZIEŻY;0.27826363568179363;0.3799355675296083;0.07347247033817572;0.37834995054536735;29.0;39.0;29.0
34.0;80;DZIAŁALNOŚĆ DETEKTYWISTYCZNA I OCHRONIARSKA;0.2779749603128164;0.3689958577923936;0.09533112767109153;0.3669031032643125;39.0;26.0;39.0
35.0;60;NADAWANIE PROGRAMÓW OGÓLNODOSTĘPNYCH I ABONAMENTOWYCH, DZIAŁALNOŚĆ AGENCJI INFORMACYJNYCH I POZOSTAŁA DZIAŁALNOŚĆ ZWIĄZANA Z DYSTRYBUCJĄ TREŚCI;0.2773618857927007;0.3802237170621855;0.06990868587153387;0.37887703771933323;28.0;42.0;27.0
36.0;19;WYTWARZANIE I PRZETWARZANIE KOKSU I PRODUKTÓW RAFINACJI ROPY NAFTOWEJ;0.27734392958742227;0.3730987068021958;0.08384991900636019;0.37220847961940806;34.0;31.0;34.0
37.0;11;PRODUKCJA NAPOJÓW;0.2733725667712076;0.38696551484579866;0.04452195724269803;0.385240297005893;25.0;77.0;24.0
38.0;37;ODPROWADZANIE I OCZYSZCZANIE ŚCIEKÓW;0.2728493883052982;0.33466353645465396;0.14781420863149974;0.3342109777260808;69.0;13.0;69.0
39.0;68;DZIAŁALNOŚĆ ZWIĄZANA Z OBSŁUGĄ RYNKU NIERUCHOMOŚCI;0.2722459498026405;0.34280447590871044;0.1294374046927924;0.3423709682474839;64.0;15.0;63.0
40.0;32;POZOSTAŁA PRODUKCJA WYROBÓW;0.27157487437231675;0.3706293475818902;0.07234890324194865;0.3688001517660291;37.0;40.0;38.0
41.0;25;PRODUKCJA METALOWYCH WYROBÓW GOTOWYCH, Z WYŁĄCZENIEM MASZYN I URZĄDZEŃ;0.2698665933991511;0.3668131849402096;0.07481150112262691;0.3650895499953382;41.0;36.0;41.0
42.0;74;POZOSTAŁA DZIAŁALNOŚĆ PROFESJONALNA, NAUKOWA I TECHNICZNA;0.26955758068634383;0.35738297572147343;0.0923622730169612;0.35629896647841297;50.0;27.0;50.0
43.0;01;UPRAWY ROLNE, CHÓW I HODOWLA ZWIERZĄT, ŁOWIECTWO, W TYM DZIAŁALNOŚĆ USŁUGOWA;0.2689245763161539;0.37818585863094756;0.04873210609337675;0.3765930822268438;32.0;70.0;31.0
44.0;03;RYBACTWO;0.2686709933853997;0.37215854888097966;0.05994153302403826;0.37081754810806977;35.0;51.0;35.0
45.0;36;POBÓR, UZDATNIANIE I DOSTARCZANIE WODY;0.2684374462191909;0.34066633110220873;0.12294987621212383;0.33954146413370934;65.0;20.0;66.0
46.0;50;TRANSPORT WODNY;0.26802963454294515;0.3601774940990735;0.08188405652207331;0.35926271422931383;46.0;32.0;47.0
47.0;22;PRODUKCJA WYROBÓW Z GUMY I TWORZYW SZTUCZNYCH;0.26786069000698043;0.3785925197142397;0.04486866498457198;0.3768191148716839;30.0;75.0;30.0
48.0;43;ROBOTY BUDOWLANE SPECJALISTYCZNE;0.2675516705218105;0.38685228187959664;0.027327848225622065;0.38491831643261276;26.0;83.0;26.0
49.0;18;POLIGRAFIA I REPRODUKCJA ZAPISANYCH NOŚNIKÓW INFORMACJI;0.26618944323116334;0.3783930975508441;0.04032823480811332;0.3765041280961982;31.0;79.0;32.0
50.0;96;DZIAŁALNOŚĆ USŁUGOWA INDYWIDUALNA;0.2648443061128818;0.3917384579600358;0.009100273843710927;0.3899044841695451;23.0;87.0;23.0
51.0;28;PRODUKCJA MASZYN I URZĄDZEŃ, GDZIE INDZIEJ NIESKLASYFIKOWANA;0.26449631582290956;0.3677234835930214;0.05656075177649855;0.3661250533851999;40.0;56.0;40.0
52.0;12;PRODUKCJA WYROBÓW TYTONIOWYCH;0.2630008448089672;0.37145997970255673;0.0445305223266419;0.36977640923332833;36.0;76.0;36.0
53.0;31;PRODUKCJA MEBLI;0.2628900412999867;0.3704941086774552;0.04611920236158862;0.36884602546206546;38.0;73.0;37.0
54.0;08;POZOSTAŁE GÓRNICTWO I WYDOBYWANIE;0.2620284526278869;0.3804414126786974;0.02325634359610329;0.3788476266388313;27.0;85.0;28.0
55.0;33;NAPRAWA, KONSERWACJA I INSTALOWANIE MASZYN I URZĄDZEŃ;0.26146911722036326;0.35434277150514826;0.07437173837960831;0.3529215557599812;54.0;38.0;53.0
56.0;73;DZIAŁALNOŚĆ W ZAKRESIE REKLAMY, BADANIA RYNKU I PUBLIC RELATIONS;0.2605150339403196;0.36329643978344306;0.05338763088361953;0.3617920312358498;43.0;66.0;44.0
57.0;26;PRODUKCJA KOMPUTERÓW, WYROBÓW ELEKTRONICZNYCH I OPTYCZNYCH;0.2593288310749619;0.35253242552441877;0.07156899539328898;0.35110400638858325;57.0;41.0;57.0
58.0;71;"DZIAŁALNOŚĆ W ZAKRESIE ARCHITEKTURY I INŻYNIERII; BADANIA I ANALIZY TECHNICZNE";0.2591672020039212;0.3587877656485352;0.05844085392654297;0.3572992868945452;49.0;53.0;49.0
59.0;52;MAGAZYNOWANIE, PRZECHOWYWANIE I DZIAŁALNOŚĆ USŁUGOWA WSPOMAGAJĄCA TRANSPORT;0.2586604229733494;0.3236695114341256;0.12668894115751872;0.32365333417090225;71.0;18.0;71.0
60.0;23;PRODUKCJA WYROBÓW Z POZOSTAŁYCH MINERALNYCH SUROWCÓW NIEMETALICZNYCH;0.25794076945271044;0.35986796337055504;0.05253303518235952;0.3583777645007312;47.0;67.0;48.0
61.0;15;PRODUKCJA SKÓR I WYROBÓW ZE SKÓR WYPRAWIONYCH, PRODUKCJA PODOBNYCH WYROBÓW Z INNYCH MATERIAŁÓW;0.2577995174207068;0.3541161218662027;0.06387775079804547;0.3525339395338377;55.0;49.0;55.0
62.0;78;DZIAŁALNOŚĆ ZWIĄZANA Z ZATRUDNIENIEM;0.25657520957272123;0.3443185290797674;0.07963469271610113;0.34314895994142525;61.0;35.0;61.0
63.0;53;DZIAŁALNOŚĆ POCZTOWA I KURIERSKA;0.25633285564879876;0.3432439109968725;0.08116744462561631;0.34199149498052195;63.0;33.0;64.0
64.0;47;HANDEL DETALICZNY;0.2560327873467385;0.3495079817073698;0.06770032734094289;0.34810013341410395;59.0;46.0;59.0
65.0;41;ROBOTY BUDOWLANE ZWIĄZANE ZE WZNOSZENIEM BUDYNKÓW MIESZKALNYCH I NIEMIESZKALNYCH;0.2550951120419691;0.353678803981518;0.05632825874413783;0.3523317098308901;56.0;57.0;56.0
66.0;17;PRODUKCJA PAPIERU I WYROBÓW Z PAPIERU;0.25401604066979755;0.35246416437133327;0.055584416544289805;0.3510588499048291;58.0;58.0;58.0
67.0;46;HANDEL HURTOWY;0.25268703478594523;0.3456121369513003;0.06551301439493384;0.34416392600496465;60.0;48.0;60.0
68.0;27;PRODUKCJA URZĄDZEŃ ELEKTRYCZNYCH;0.25069922101676395;0.34064010085811725;0.0691187231177437;0.33964355619038183;66.0;44.0;65.0
69.0;29;PRODUKCJA POJAZDÓW SILNIKOWYCH, PRODUKCJA PRZYCZEP I NACZEP;0.2492019547088059;0.3392556063129838;0.06806403934625593;0.33760726953310827;67.0;45.0;67.0
70.0;61;TELEKOMUNIKACJA;0.24445212491109103;0.30965631997275367;0.11171667435534172;0.3099971670082927;79.0;23.0;79.0
71.0;69;DZIAŁALNOŚĆ PRAWNICZA, RACHUNKOWO-KSIĘGOWA I DORADZTWO PODATKOWE;0.24229825766148516;0.3434897597525812;0.037862230934016194;0.34250617863208227;62.0;80.0;62.0
72.0;38;DZIAŁALNOŚĆ ZWIĄZANA ZE ZBIERANIEM, ODZYSKIEM I UNIESZKODLIWIANIEM ODPADÓW;0.23761852380266918;0.33833587958693767;0.034266498354209474;0.33723452671203125;68.0;82.0;68.0
73.0;62;DZIAŁALNOŚĆ ZWIĄZANA Z PROGRAMOWANIEM, DORADZTWEM W ZAKRESIE INFORMATYKI I DZIAŁALNOŚCI POWIĄZANE;0.23616074308856902;0.32740569057595265;0.052054828555886834;0.3262905052207705;70.0;68.0;70.0
74.0;65;DZIAŁALNOŚĆ W ZAKRESIE UBEZPIECZEŃ, REASEKURACJI ORAZ FUNDUSZY EMERYTALNYCH, Z WYŁĄCZENIEM OBOWIĄZKOWEGO UBEZPIECZENIA SPOŁECZNEGO;0.23413214753259998;0.320996421114448;0.058686483337022866;0.3201082031282781;73.0;52.0;75.0
75.0;84;"ADMINISTRACJA PUBLICZNA I OBRONA NARODOWA; OBOWIĄZKOWE UBEZPIECZENIA SPOŁECZNE";0.23393264423792465;0.3208949265497279;0.05800461315160543;0.32028175334260184;77.0;54.0;73.0
76.0;99;ORGANIZACJE I ZESPOŁY EKSTERYTORIALNE;0.23282606635592942;0.3209134451891496;0.05469508700019898;0.3202213256866011;74.0;60.0;74.0
77.0;98;GOSPODARSTWA DOMOWE PRODUKUJĄCE WYROBY I ŚWIADCZĄCE USŁUGI NA WŁASNE POTRZEBY;0.23268649896294535;0.32090513310308516;0.05449843804671839;0.3200097661279711;75.5;62.5;76.0
78.0;97;GOSPODARSTWA DOMOWE ZATRUDNIAJĄCE PRACOWNIKÓW;0.23268062130607453;0.32090513310308516;0.05449843804671839;0.3199924789018804;75.5;62.5;77.0
79.0;06;GÓRNICTWO ROPY NAFTOWEJ I GAZU ZIEMNEGO;0.23176969091969168;0.3228855680777566;0.047569492268802804;0.32211623825096203;72.0;72.0;72.0
80.0;07;GÓRNICTWO RUD METALI;0.2315794200860539;0.32049345333937973;0.05173745760776893;0.31983299845145535;78.0;69.0;78.0
81.0;90;DZIAŁALNOŚĆ TWÓRCZA I DZIAŁALNOŚĆ ZWIĄZANA Z WYSTAWIANIEM PRZEDSTAWIEŃ ARTYSTYCZNYCH;0.21800905675296423;0.29881791152573745;0.05390518841888192;0.2988542169742348;80.0;64.0;80.0
82.0;16;"PRODUKCJA WYROBÓW Z DREWNA I KORKA, Z WYŁĄCZENIEM MEBLI; PRODUKCJA WYROBÓW ZE SŁOMY I MATERIAŁÓW UŻYWANYCH DO WYPLATANIA";0.2150998020952628;0.2937880166270225;0.055383977208852686;0.2937442474394823;81.0;59.0;81.0
83.0;02;LEŚNICTWO I POZYSKIWANIE DREWNA;0.21431307091917623;0.24235194974105334;0.15475762722404318;0.2449026780020423;85.0;11.0;85.0
84.0;20;PRODUKCJA CHEMIKALIÓW I WYROBÓW CHEMICZNYCH;0.2118729218985821;0.27933490086541807;0.07468040634778772;0.2795525603477181;83.0;37.0;83.0
85.0;24;PRODUKCJA METALI;0.20934560701346383;0.27088741713423203;0.08440966500272884;0.27087520561254924;84.0;30.0;84.0
86.0;05;WYDOBYWANIE WĘGLA KAMIENNEGO I WĘGLA BRUNATNEGO (LIGNITU);0.1929414531709318;0.22605980909730772;0.12308477834236942;0.22859923328187748;87.0;19.0;87.0
87.0;75;DZIAŁALNOŚĆ WETERYNARYJNA;0.19071608294648168;0.2343592874766745;0.10012214902463135;0.23628590853250211;86.0;25.0;86.0
