alternative_id;nazwa;ensemble_score;ensemble_rank
94;DZIAŁALNOŚĆ ORGANIZACJI CZŁONKOWSKICH;0.65386044216753;1.0
09;DZIAŁALNOŚĆ USŁUGOWA WSPOMAGAJĄCA GÓRNICTWO I WYDOBYWANIE;0.6086947200598523;2.0
92;DZIAŁALNOŚĆ ZWIĄZANA Z GRAMI HAZARDOWYMI;0.3818580143116818;3.0
70;DZIAŁALNOŚĆ CENTRAL (HEAD OFFICES) ORAZ DORADZTWO ZWIĄZANE Z ZARZĄDZANIEM;0.34464642091734105;4.0
64;FINANSOWA DZIAŁALNOŚĆ USŁUGOWA, Z WYŁĄCZENIEM UBEZPIECZEŃ I FUNDUSZY EMERYTALNYCH;0.340664819053337;5.0
91;DZIAŁALNOŚĆ BIBLIOTEK, ARCHIWÓW, MUZEÓW ORAZ POZOSTAŁA DZIAŁALNOŚĆ ZWIĄZANA Z KULTURĄ;0.3349987858229007;6.0
95;NAPRAWA I KONSERWACJA KOMPUTERÓW, ARTYKUŁÓW UŻYTKU OSOBISTEGO I DOMOWEGO ORAZ POJAZDÓW SILNIKOWYCH, W TYM MOTOCYKLI;0.3264065770417325;7.0
63;DZIAŁALNOŚĆ USŁUGOWA W ZAKRESIE INFRASTRUKTURY OBLICZENIOWEJ, PRZETWARZANIA DANYCH, ZARZĄDZANIA STRONAMI INTERNETOWYMI (HOSTING) I POZOSTAŁA DZIAŁALNOŚĆ USŁUGOWA W ZAKRESIE INFORMACJI;0.3255262818094474;8.0
51;TRANSPORT LOTNICZY;0.31869636922612166;9.0
77;WYNAJEM I DZIERŻAWA;0.31785487972693816;10.0
87;POMOC SPOŁECZNA Z ZAKWATEROWANIEM;0.31437713536573775;11.0
93;DZIAŁALNOŚĆ SPORTOWA, ROZRYWKOWA I REKREACYJNA;0.31281977628747915;12.0
30;PRODUKCJA POZOSTAŁEGO SPRZĘTU TRANSPORTOWEGO;0.3088187843585015;13.0
66;DZIAŁALNOŚĆ WSPOMAGAJĄCA USŁUGI FINANSOWE, UBEZPIECZENIA I FUNDUSZE EMERYTALNE;0.30749071934804684;14.0
79;DZIAŁALNOŚĆ ORGANIZATORÓW TURYSTYKI, AGENTÓW TURYSTYCZNYCH ORAZ POZOSTAŁA DZIAŁALNOŚĆ USŁUGOWA W ZAKRESIE REZERWACJI I DZIAŁALNOŚCI Z NIĄ ZWIĄZANE;0.306903419498472;15.0
72;BADANIA NAUKOWE I PRACE ROZWOJOWE;0.30513126872986907;16.0
55;ZAKWATEROWANIE;0.3013879770957846;17.0
59;DZIAŁALNOŚĆ ZWIĄZANA Z PRODUKCJĄ FILMÓW, NAGRAŃ WIDEO, PROGRAMÓW TELEWIZYJNYCH, NAGRAŃ DŹWIĘKOWYCH I MUZYCZNYCH;0.30008319109968895;18.0
81;DZIAŁALNOŚĆ USŁUGOWA ZWIĄZANA Z UTRZYMANIEM PORZĄDKU W BUDYNKACH I ZAGOSPODAROWANIEM TERENÓW ZIELENI;0.2972698862916019;19.0
85;EDUKACJA;0.2886937893425622;20.0
10;PRODUKCJA ARTYKUŁÓW SPOŻYWCZYCH;0.28838549525930485;21.0
49;TRANSPORT LĄDOWY ORAZ TRANSPORT RUROCIĄGOWY;0.2876894665473322;22.0
86;OPIEKA ZDROWOTNA;0.2865882293177492;23.0
35;WYTWARZANIE I ZAOPATRYWANIE W ENERGIĘ ELEKTRYCZNĄ, GAZ, PARĘ WODNĄ I POWIETRZE DO UKŁADÓW KLIMATYZACYJNYCH;0.2860901964933549;24.0
82;DZIAŁALNOŚĆ ZWIĄZANA Z ADMINISTRACYJNĄ OBSŁUGĄ BIURA I POZOSTAŁA DZIAŁALNOŚĆ WSPOMAGAJĄCA PROWADZENIE DZIAŁALNOŚCI GOSPODARCZEJ;0.2834947777627649;25.0
42;ROBOTY ZWIĄZANE Z BUDOWĄ OBIEKTÓW INŻYNIERII LĄDOWEJ I WODNEJ;0.2833296301826443;26.0
58;DZIAŁALNOŚĆ WYDAWNICZA;0.28067830864594445;27.0
13;PRODUKCJA WYROBÓW TEKSTYLNYCH;0.28058535405467233;28.0
88;POMOC SPOŁECZNA BEZ ZAKWATEROWANIA;0.2801548943849261;29.0
39;DZIAŁALNOŚĆ ZWIĄZANA Z REKULTYWACJĄ I POZOSTAŁA DZIAŁALNOŚĆ USŁUGOWA ZWIĄZANA Z GOSPODARKĄ ODPADAMI;0.27897874968362724;30.0
21;PRODUKCJA PODSTAWOWYCH SUBSTANCJI FARMACEUTYCZNYCH ORAZ LEKÓW I POZOSTAŁYCH WYROBÓW FARMACEUTYCZNYCH;0.2785619933337433;31.0
56;DZIAŁALNOŚĆ USŁUGOWA ZWIĄZANA Z WYŻYWIENIEM;0.2785505889127883;32.0
14;PRODUKCJA ODZIEŻY;0.27826363568179363;33.0
80;DZIAŁALNOŚĆ DETEKTYWISTYCZNA I OCHRONIARSKA;0.2779749603128164;34.0
60;NADAWANIE PROGRAMÓW OGÓLNODOSTĘPNYCH I ABONAMENTOWYCH, DZIAŁALNOŚĆ AGENCJI INFORMACYJNYCH I POZOSTAŁA DZIAŁALNOŚĆ ZWIĄZANA Z DYSTRYBUCJĄ TREŚCI;0.2773618857927007;35.0
19;WYTWARZANIE I PRZETWARZANIE KOKSU I PRODUKTÓW RAFINACJI ROPY NAFTOWEJ;0.27734392958742227;36.0
11;PRODUKCJA NAPOJÓW;0.2733725667712076;37.0
37;ODPROWADZANIE I OCZYSZCZANIE ŚCIEKÓW;0.2728493883052982;38.0
68;DZIAŁALNOŚĆ ZWIĄZANA Z OBSŁUGĄ RYNKU NIERUCHOMOŚCI;0.2722459498026405;39.0
32;POZOSTAŁA PRODUKCJA WYROBÓW;0.27157487437231675;40.0
25;PRODUKCJA METALOWYCH WYROBÓW GOTOWYCH, Z WYŁĄCZENIEM MASZYN I URZĄDZEŃ;0.2698665933991511;41.0
74;POZOSTAŁA DZIAŁALNOŚĆ PROFESJONALNA, NAUKOWA I TECHNICZNA;0.26955758068634383;42.0
01;UPRAWY ROLNE, CHÓW I HODOWLA ZWIERZĄT, ŁOWIECTWO, W TYM DZIAŁALNOŚĆ USŁUGOWA;0.2689245763161539;43.0
03;RYBACTWO;0.2686709933853997;44.0
36;POBÓR, UZDATNIANIE I DOSTARCZANIE WODY;0.2684374462191909;45.0
50;TRANSPORT WODNY;0.26802963454294515;46.0
22;PRODUKCJA WYROBÓW Z GUMY I TWORZYW SZTUCZNYCH;0.26786069000698043;47.0
43;ROBOTY BUDOWLANE SPECJALISTYCZNE;0.2675516705218105;48.0
18;POLIGRAFIA I REPRODUKCJA ZAPISANYCH NOŚNIKÓW INFORMACJI;0.26618944323116334;49.0
96;DZIAŁALNOŚĆ USŁUGOWA INDYWIDUALNA;0.2648443061128818;50.0
28;PRODUKCJA MASZYN I URZĄDZEŃ, GDZIE INDZIEJ NIESKLASYFIKOWANA;0.26449631582290956;51.0
12;PRODUKCJA WYROBÓW TYTONIOWYCH;0.2630008448089672;52.0
31;PRODUKCJA MEBLI;0.2628900412999867;53.0
08;POZOSTAŁE GÓRNICTWO I WYDOBYWANIE;0.2620284526278869;54.0
33;NAPRAWA, KONSERWACJA I INSTALOWANIE MASZYN I URZĄDZEŃ;0.26146911722036326;55.0
73;DZIAŁALNOŚĆ W ZAKRESIE REKLAMY, BADANIA RYNKU I PUBLIC RELATIONS;0.2605150339403196;56.0
26;PRODUKCJA KOMPUTERÓW, WYROBÓW ELEKTRONICZNYCH I OPTYCZNYCH;0.2593288310749619;57.0
71;"DZIAŁALNOŚĆ W ZAKRESIE ARCHITEKTURY I INŻYNIERII; BADANIA I ANALIZY TECHNICZNE";0.2591672020039212;58.0
52;MAGAZYNOWANIE, PRZECHOWYWANIE I DZIAŁALNOŚĆ USŁUGOWA WSPOMAGAJĄCA TRANSPORT;0.2586604229733494;59.0
23;PRODUKCJA WYROBÓW Z POZOSTAŁYCH MINERALNYCH SUROWCÓW NIEMETALICZNYCH;0.25794076945271044;60.0
15;PRODUKCJA SKÓR I WYROBÓW ZE SKÓR WYPRAWIONYCH, PRODUKCJA PODOBNYCH WYROBÓW Z INNYCH MATERIAŁÓW;0.2577995174207068;61.0
78;DZIAŁALNOŚĆ ZWIĄZANA Z ZATRUDNIENIEM;0.25657520957272123;62.0
53;DZIAŁALNOŚĆ POCZTOWA I KURIERSKA;0.25633285564879876;63.0
47;HANDEL DETALICZNY;0.2560327873467385;64.0
41;ROBOTY BUDOWLANE ZWIĄZANE ZE WZNOSZENIEM BUDYNKÓW MIESZKALNYCH I NIEMIESZKALNYCH;0.2550951120419691;65.0
17;PRODUKCJA PAPIERU I WYROBÓW Z PAPIERU;0.25401604066979755;66.0
46;HANDEL HURTOWY;0.25268703478594523;67.0
27;PRODUKCJA URZĄDZEŃ ELEKTRYCZNYCH;0.25069922101676395;68.0
29;PRODUKCJA POJAZDÓW SILNIKOWYCH, PRODUKCJA PRZYCZEP I NACZEP;0.2492019547088059;69.0
61;TELEKOMUNIKACJA;0.24445212491109103;70.0
69;DZIAŁALNOŚĆ PRAWNICZA, RACHUNKOWO-KSIĘGOWA I DORADZTWO PODATKOWE;0.24229825766148516;71.0
38;DZIAŁALNOŚĆ ZWIĄZANA ZE ZBIERANIEM, ODZYSKIEM I UNIESZKODLIWIANIEM ODPADÓW;0.23761852380266918;72.0
62;DZIAŁALNOŚĆ ZWIĄZANA Z PROGRAMOWANIEM, DORADZTWEM W ZAKRESIE INFORMATYKI I DZIAŁALNOŚCI POWIĄZANE;0.23616074308856902;73.0
65;DZIAŁALNOŚĆ W ZAKRESIE UBEZPIECZEŃ, REASEKURACJI ORAZ FUNDUSZY EMERYTALNYCH, Z WYŁĄCZENIEM OBOWIĄZKOWEGO UBEZPIECZENIA SPOŁECZNEGO;0.23413214753259998;74.0
84;"ADMINISTRACJA PUBLICZNA I OBRONA NARODOWA; OBOWIĄZKOWE UBEZPIECZENIA SPOŁECZNE";0.23393264423792465;75.0
99;ORGANIZACJE I ZESPOŁY EKSTERYTORIALNE;0.23282606635592942;76.0
98;GOSPODARSTWA DOMOWE PRODUKUJĄCE WYROBY I ŚWIADCZĄCE USŁUGI NA WŁASNE POTRZEBY;0.23268649896294535;77.0
97;GOSPODARSTWA DOMOWE ZATRUDNIAJĄCE PRACOWNIKÓW;0.23268062130607453;78.0
06;GÓRNICTWO ROPY NAFTOWEJ I GAZU ZIEMNEGO;0.23176969091969168;79.0
07;GÓRNICTWO RUD METALI;0.2315794200860539;80.0
90;DZIAŁALNOŚĆ TWÓRCZA I DZIAŁALNOŚĆ ZWIĄZANA Z WYSTAWIANIEM PRZEDSTAWIEŃ ARTYSTYCZNYCH;0.21800905675296423;81.0
16;"PRODUKCJA WYROBÓW Z DREWNA I KORKA, Z WYŁĄCZENIEM MEBLI; PRODUKCJA WYROBÓW ZE SŁOMY I MATERIAŁÓW UŻYWANYCH DO WYPLATANIA";0.2150998020952628;82.0
02;LEŚNICTWO I POZYSKIWANIE DREWNA;0.21431307091917623;83.0
20;PRODUKCJA CHEMIKALIÓW I WYROBÓW CHEMICZNYCH;0.2118729218985821;84.0
24;PRODUKCJA METALI;0.20934560701346383;85.0
05;WYDOBYWANIE WĘGLA KAMIENNEGO I WĘGLA BRUNATNEGO (LIGNITU);0.1929414531709318;86.0
75;DZIAŁALNOŚĆ WETERYNARYJNA;0.19071608294648168;87.0
