alternative_id;nazwa;vikor_score;vikor_rank
94;DZIAŁALNOŚĆ ORGANIZACJI CZŁONKOWSKICH;1.0;1.0
09;DZIAŁALNOŚĆ USŁUGOWA WSPOMAGAJĄCA GÓRNICTWO I WYDOBYWANIE;0.6562087144373367;2.0
85;EDUKACJA;0.30581273513453433;3.0
64;FINANSOWA DZIAŁALNOŚĆ USŁUGOWA, Z WYŁĄCZENIEM UBEZPIECZEŃ I FUNDUSZY EMERYTALNYCH;0.2973545262108028;4.0
95;NAPRAWA I KONSERWACJA KOMPUTERÓW, ARTYKUŁÓW UŻYTKU OSOBISTEGO I DOMOWEGO ORAZ POJAZDÓW SILNIKOWYCH, W TYM MOTOCYKLI;0.26624944729132793;5.0
92;DZIAŁALNOŚĆ ZWIĄZANA Z GRAMI HAZARDOWYMI;0.2618921636510011;6.0
66;DZIAŁALNOŚĆ WSPOMAGAJĄCA USŁUGI FINANSOWE, UBEZPIECZENIA I FUNDUSZE EMERYTALNE;0.20190817392772953;7.0
70;DZIAŁALNOŚĆ CENTRAL (HEAD OFFICES) ORAZ DORADZTWO ZWIĄZANE Z ZARZĄDZANIEM;0.2003691658292135;8.0
91;DZIAŁALNOŚĆ BIBLIOTEK, ARCHIWÓW, MUZEÓW ORAZ POZOSTAŁA DZIAŁALNOŚĆ ZWIĄZANA Z KULTURĄ;0.17397437404010807;9.0
77;WYNAJEM I DZIERŻAWA;0.165114213301903;10.0
02;LEŚNICTWO I POZYSKIWANIE DREWNA;0.15475762722404318;11.0
49;TRANSPORT LĄDOWY ORAZ TRANSPORT RUROCIĄGOWY;0.15220745936401026;12.0
37;ODPROWADZANIE I OCZYSZCZANIE ŚCIEKÓW;0.14781420863149974;13.0
93;DZIAŁALNOŚĆ SPORTOWA, ROZRYWKOWA I REKREACYJNA;0.13846070408227484;14.0
68;DZIAŁALNOŚĆ ZWIĄZANA Z OBSŁUGĄ RYNKU NIERUCHOMOŚCI;0.1294374046927924;15.0
39;DZIAŁALNOŚĆ ZWIĄZANA Z REKULTYWACJĄ I POZOSTAŁA DZIAŁALNOŚĆ USŁUGOWA ZWIĄZANA Z GOSPODARKĄ ODPADAMI;0.12775141781567156;16.0
35;WYTWARZANIE I ZAOPATRYWANIE W ENERGIĘ ELEKTRYCZNĄ, GAZ, PARĘ WODNĄ I POWIETRZE DO UKŁADÓW KLIMATYZACYJNYCH;0.1272630330929332;17.0
52;MAGAZYNOWANIE, PRZECHOWYWANIE I DZIAŁALNOŚĆ USŁUGOWA WSPOMAGAJĄCA TRANSPORT;0.12668894115751872;18.0
05;WYDOBYWANIE WĘGLA KAMIENNEGO I WĘGLA BRUNATNEGO (LIGNITU);0.12308477834236942;19.0
36;POBÓR, UZDATNIANIE I DOSTARCZANIE WODY;0.12294987621212383;20.0
72;BADANIA NAUKOWE I PRACE ROZWOJOWE;0.11951649615683113;21.0
88;POMOC SPOŁECZNA BEZ ZAKWATEROWANIA;0.1140955760952822;22.0
61;TELEKOMUNIKACJA;0.11171667435534172;23.0
82;DZIAŁALNOŚĆ ZWIĄZANA Z ADMINISTRACYJNĄ OBSŁUGĄ BIURA I POZOSTAŁA DZIAŁALNOŚĆ WSPOMAGAJĄCA PROWADZENIE DZIAŁALNOŚCI GOSPODARCZEJ;0.10170537913032685;24.0
75;DZIAŁALNOŚĆ WETERYNARYJNA;0.10012214902463135;25.0
80;DZIAŁALNOŚĆ DETEKTYWISTYCZNA I OCHRONIARSKA;0.09533112767109153;26.0
74;POZOSTAŁA DZIAŁALNOŚĆ PROFESJONALNA, NAUKOWA I TECHNICZNA;0.0923622730169612;27.0
81;DZIAŁALNOŚĆ USŁUGOWA ZWIĄZANA Z UTRZYMANIEM PORZĄDKU W BUDYNKACH I ZAGOSPODAROWANIEM TERENÓW ZIELENI;0.08997879621446636;28.0
79;DZIAŁALNOŚĆ ORGANIZATORÓW TURYSTYKI, AGENTÓW TURYSTYCZNYCH ORAZ POZOSTAŁA DZIAŁALNOŚĆ USŁUGOWA W ZAKRESIE REZERWACJI I DZIAŁALNOŚCI Z NIĄ ZWIĄZANE;0.08904491959477334;29.0
24;PRODUKCJA METALI;0.08440966500272884;30.0
19;WYTWARZANIE I PRZETWARZANIE KOKSU I PRODUKTÓW RAFINACJI ROPY NAFTOWEJ;0.08384991900636019;31.0
50;TRANSPORT WODNY;0.08188405652207331;32.0
53;DZIAŁALNOŚĆ POCZTOWA I KURIERSKA;0.08116744462561631;33.0
63;DZIAŁALNOŚĆ USŁUGOWA W ZAKRESIE INFRASTRUKTURY OBLICZENIOWEJ, PRZETWARZANIA DANYCH, ZARZĄDZANIA STRONAMI INTERNETOWYMI (HOSTING) I POZOSTAŁA DZIAŁALNOŚĆ USŁUGOWA W ZAKRESIE INFORMACJI;0.08035928025264638;34.0
78;DZIAŁALNOŚĆ ZWIĄZANA Z ZATRUDNIENIEM;0.07963469271610113;35.0
25;PRODUKCJA METALOWYCH WYROBÓW GOTOWYCH, Z WYŁĄCZENIEM MASZYN I URZĄDZEŃ;0.07481150112262691;36.0
20;PRODUKCJA CHEMIKALIÓW I WYROBÓW CHEMICZNYCH;0.07468040634778772;37.0
33;NAPRAWA, KONSERWACJA I INSTALOWANIE MASZYN I URZĄDZEŃ;0.07437173837960831;38.0
14;PRODUKCJA ODZIEŻY;0.07347247033817572;39.0
32;POZOSTAŁA PRODUKCJA WYROBÓW;0.07234890324194865;40.0
26;PRODUKCJA KOMPUTERÓW, WYROBÓW ELEKTRONICZNYCH I OPTYCZNYCH;0.07156899539328898;41.0
60;NADAWANIE PROGRAMÓW OGÓLNODOSTĘPNYCH I ABONAMENTOWYCH, DZIAŁALNOŚĆ AGENCJI INFORMACYJNYCH I POZOSTAŁA DZIAŁALNOŚĆ ZWIĄZANA Z DYSTRYBUCJĄ TREŚCI;0.06990868587153387;42.0
86;OPIEKA ZDROWOTNA;0.06967563813624555;43.0
27;PRODUKCJA URZĄDZEŃ ELEKTRYCZNYCH;0.0691187231177437;44.0
29;PRODUKCJA POJAZDÓW SILNIKOWYCH, PRODUKCJA PRZYCZEP I NACZEP;0.06806403934625593;45.0
47;HANDEL DETALICZNY;0.06770032734094289;46.0
13;PRODUKCJA WYROBÓW TEKSTYLNYCH;0.0663095257926124;47.0
46;HANDEL HURTOWY;0.06551301439493384;48.0
15;PRODUKCJA SKÓR I WYROBÓW ZE SKÓR WYPRAWIONYCH, PRODUKCJA PODOBNYCH WYROBÓW Z INNYCH MATERIAŁÓW;0.06387775079804547;49.0
59;DZIAŁALNOŚĆ ZWIĄZANA Z PRODUKCJĄ FILMÓW, NAGRAŃ WIDEO, PROGRAMÓW TELEWIZYJNYCH, NAGRAŃ DŹWIĘKOWYCH I MUZYCZNYCH;0.06292198297467722;50.0
03;RYBACTWO;0.05994153302403826;51.0
65;DZIAŁALNOŚĆ W ZAKRESIE UBEZPIECZEŃ, REASEKURACJI ORAZ FUNDUSZY EMERYTALNYCH, Z WYŁĄCZENIEM OBOWIĄZKOWEGO UBEZPIECZENIA SPOŁECZNEGO;0.058686483337022866;52.0
71;"DZIAŁALNOŚĆ W ZAKRESIE ARCHITEKTURY I INŻYNIERII; BADANIA I ANALIZY TECHNICZNE";0.05844085392654297;53.0
84;"ADMINISTRACJA PUBLICZNA I OBRONA NARODOWA; OBOWIĄZKOWE UBEZPIECZENIA SPOŁECZNE";0.05800461315160543;54.0
55;ZAKWATEROWANIE;0.05790636200673327;55.0
28;PRODUKCJA MASZYN I URZĄDZEŃ, GDZIE INDZIEJ NIESKLASYFIKOWANA;0.05656075177649855;56.0
41;ROBOTY BUDOWLANE ZWIĄZANE ZE WZNOSZENIEM BUDYNKÓW MIESZKALNYCH I NIEMIESZKALNYCH;0.05632825874413783;57.0
17;PRODUKCJA PAPIERU I WYROBÓW Z PAPIERU;0.055584416544289805;58.0
16;"PRODUKCJA WYROBÓW Z DREWNA I KORKA, Z WYŁĄCZENIEM MEBLI; PRODUKCJA WYROBÓW ZE SŁOMY I MATERIAŁÓW UŻYWANYCH DO WYPLATANIA";0.055383977208852686;59.0
99;ORGANIZACJE I ZESPOŁY EKSTERYTORIALNE;0.05469508700019898;60.0
10;PRODUKCJA ARTYKUŁÓW SPOŻYWCZYCH;0.05463066223767976;61.0
98;GOSPODARSTWA DOMOWE PRODUKUJĄCE WYROBY I ŚWIADCZĄCE USŁUGI NA WŁASNE POTRZEBY;0.05449843804671839;62.5
97;GOSPODARSTWA DOMOWE ZATRUDNIAJĄCE PRACOWNIKÓW;0.05449843804671839;62.5
90;DZIAŁALNOŚĆ TWÓRCZA I DZIAŁALNOŚĆ ZWIĄZANA Z WYSTAWIANIEM PRZEDSTAWIEŃ ARTYSTYCZNYCH;0.05390518841888192;64.0
30;PRODUKCJA POZOSTAŁEGO SPRZĘTU TRANSPORTOWEGO;0.05371006242770293;65.0
73;DZIAŁALNOŚĆ W ZAKRESIE REKLAMY, BADANIA RYNKU I PUBLIC RELATIONS;0.05338763088361953;66.0
23;PRODUKCJA WYROBÓW Z POZOSTAŁYCH MINERALNYCH SUROWCÓW NIEMETALICZNYCH;0.05253303518235952;67.0
62;DZIAŁALNOŚĆ ZWIĄZANA Z PROGRAMOWANIEM, DORADZTWEM W ZAKRESIE INFORMATYKI I DZIAŁALNOŚCI POWIĄZANE;0.052054828555886834;68.0
07;GÓRNICTWO RUD METALI;0.05173745760776893;69.0
01;UPRAWY ROLNE, CHÓW I HODOWLA ZWIERZĄT, ŁOWIECTWO, W TYM DZIAŁALNOŚĆ USŁUGOWA;0.04873210609337675;70.0
56;DZIAŁALNOŚĆ USŁUGOWA ZWIĄZANA Z WYŻYWIENIEM;0.04792886316519285;71.0
06;GÓRNICTWO ROPY NAFTOWEJ I GAZU ZIEMNEGO;0.047569492268802804;72.0
31;PRODUKCJA MEBLI;0.04611920236158862;73.0
87;POMOC SPOŁECZNA Z ZAKWATEROWANIEM;0.04552482550938941;74.0
22;PRODUKCJA WYROBÓW Z GUMY I TWORZYW SZTUCZNYCH;0.04486866498457198;75.0
12;PRODUKCJA WYROBÓW TYTONIOWYCH;0.0445305223266419;76.0
11;PRODUKCJA NAPOJÓW;0.04452195724269803;77.0
58;DZIAŁALNOŚĆ WYDAWNICZA;0.04290617065290614;78.0
18;POLIGRAFIA I REPRODUKCJA ZAPISANYCH NOŚNIKÓW INFORMACJI;0.04032823480811332;79.0
69;DZIAŁALNOŚĆ PRAWNICZA, RACHUNKOWO-KSIĘGOWA I DORADZTWO PODATKOWE;0.037862230934016194;80.0
42;ROBOTY ZWIĄZANE Z BUDOWĄ OBIEKTÓW INŻYNIERII LĄDOWEJ I WODNEJ;0.03706960036293738;81.0
38;DZIAŁALNOŚĆ ZWIĄZANA ZE ZBIERANIEM, ODZYSKIEM I UNIESZKODLIWIANIEM ODPADÓW;0.034266498354209474;82.0
43;ROBOTY BUDOWLANE SPECJALISTYCZNE;0.027327848225622065;83.0
21;PRODUKCJA PODSTAWOWYCH SUBSTANCJI FARMACEUTYCZNYCH ORAZ LEKÓW I POZOSTAŁYCH WYROBÓW FARMACEUTYCZNYCH;0.025155389956992624;84.0
08;POZOSTAŁE GÓRNICTWO I WYDOBYWANIE;0.02325634359610329;85.0
51;TRANSPORT LOTNICZY;0.01977787333429526;86.0
96;DZIAŁALNOŚĆ USŁUGOWA INDYWIDUALNA;0.009100273843710927;87.0
