alternative_id;nazwa;ensemble_score;ensemble_rank
94;DZIAŁALNOŚĆ ORGANIZACJI CZŁONKOWSKICH;0.6482617809954351;1.0
90;DZIAŁALNOŚĆ TWÓRCZA I DZIAŁALNOŚĆ ZWIĄZANA Z WYSTAWIANIEM PRZEDSTAWIEŃ ARTYSTYCZNYCH;0.6106311927518202;2.0
75;DZIAŁALNOŚĆ WETERYNARYJNA;0.5773624782672354;3.0
66;DZIAŁALNOŚĆ WSPOMAGAJĄCA USŁUGI FINANSOWE, UBEZPIECZENIA I FUNDUSZE EMERYTALNE;0.5402101038928427;4.0
72;BADANIA NAUKOWE I PRACE ROZWOJOWE;0.5181504217595796;5.0
03;RYBACTWO;0.5100735915543199;6.0
15;PRODUKCJA SKÓR I WYROBÓW ZE SKÓR WYPRAWIONYCH, PRODUKCJA PODOBNYCH WYROBÓW Z INNYCH MATERIAŁÓW;0.5057584879652183;7.0
01;UPRAWY ROLNE, CHÓW I HODOWLA ZWIERZĄT, ŁOWIECTWO, W TYM DZIAŁALNOŚĆ USŁUGOWA;0.5008644781719341;8.0
96;DZIAŁALNOŚĆ USŁUGOWA INDYWIDUALNA;0.49608793346352736;9.0
69;DZIAŁALNOŚĆ PRAWNICZA, RACHUNKOWO-KSIĘGOWA I DORADZTWO PODATKOWE;0.49278353688345533;10.0
08;POZOSTAŁE GÓRNICTWO I WYDOBYWANIE;0.4884201980239558;11.0
92;DZIAŁALNOŚĆ ZWIĄZANA Z GRAMI HAZARDOWYMI;0.48800833838933666;12.0
02;LEŚNICTWO I POZYSKIWANIE DREWNA;0.48525354121497755;13.0
74;POZOSTAŁA DZIAŁALNOŚĆ PROFESJONALNA, NAUKOWA I TECHNICZNA;0.48510415754086844;14.0
14;PRODUKCJA ODZIEŻY;0.48050686857569713;15.0
50;TRANSPORT WODNY;0.47991558765691583;16.0
64;FINANSOWA DZIAŁALNOŚĆ USŁUGOWA, Z WYŁĄCZENIEM UBEZPIECZEŃ I FUNDUSZY EMERYTALNYCH;0.47942457740431443;17.0
62;DZIAŁALNOŚĆ ZWIĄZANA Z PROGRAMOWANIEM, DORADZTWEM W ZAKRESIE INFORMATYKI I DZIAŁALNOŚCI POWIĄZANE;0.4756733632271226;18.0
88;POMOC SPOŁECZNA BEZ ZAKWATEROWANIA;0.4679810777686554;19.0
58;DZIAŁALNOŚĆ WYDAWNICZA;0.46341226933609525;20.0
71;"DZIAŁALNOŚĆ W ZAKRESIE ARCHITEKTURY I INŻYNIERII; BADANIA I ANALIZY TECHNICZNE";0.45730809344629714;21.0
28;PRODUKCJA MASZYN I URZĄDZEŃ, GDZIE INDZIEJ NIESKLASYFIKOWANA;0.4562439723907227;22.0
20;PRODUKCJA CHEMIKALIÓW I WYROBÓW CHEMICZNYCH;0.4534219751070729;23.0
18;POLIGRAFIA I REPRODUKCJA ZAPISANYCH NOŚNIKÓW INFORMACJI;0.4531955758445314;24.0
13;PRODUKCJA WYROBÓW TEKSTYLNYCH;0.45215017575803584;25.0
81;DZIAŁALNOŚĆ USŁUGOWA ZWIĄZANA Z UTRZYMANIEM PORZĄDKU W BUDYNKACH I ZAGOSPODAROWANIEM TERENÓW ZIELENI;0.4499336380278889;26.0
17;PRODUKCJA PAPIERU I WYROBÓW Z PAPIERU;0.44949441149348995;27.0
27;PRODUKCJA URZĄDZEŃ ELEKTRYCZNYCH;0.4494106335720789;28.0
23;PRODUKCJA WYROBÓW Z POZOSTAŁYCH MINERALNYCH SUROWCÓW NIEMETALICZNYCH;0.4449579449477171;29.0
25;PRODUKCJA METALOWYCH WYROBÓW GOTOWYCH, Z WYŁĄCZENIEM MASZYN I URZĄDZEŃ;0.4437948277185844;30.0
16;"PRODUKCJA WYROBÓW Z DREWNA I KORKA, Z WYŁĄCZENIEM MEBLI; PRODUKCJA WYROBÓW ZE SŁOMY I MATERIAŁÓW UŻYWANYCH DO WYPLATANIA";0.44160708641793356;31.0
79;DZIAŁALNOŚĆ ORGANIZATORÓW TURYSTYKI, AGENTÓW TURYSTYCZNYCH ORAZ POZOSTAŁA DZIAŁALNOŚĆ USŁUGOWA W ZAKRESIE REZERWACJI I DZIAŁALNOŚCI Z NIĄ ZWIĄZANE;0.44120883116533344;32.0
43;ROBOTY BUDOWLANE SPECJALISTYCZNE;0.4392001787191816;33.0
21;PRODUKCJA PODSTAWOWYCH SUBSTANCJI FARMACEUTYCZNYCH ORAZ LEKÓW I POZOSTAŁYCH WYROBÓW FARMACEUTYCZNYCH;0.43723988583833684;34.0
41;ROBOTY BUDOWLANE ZWIĄZANE ZE WZNOSZENIEM BUDYNKÓW MIESZKALNYCH I NIEMIESZKALNYCH;0.4358503713946604;35.0
31;PRODUKCJA MEBLI;0.43487743245222;36.0
22;PRODUKCJA WYROBÓW Z GUMY I TWORZYW SZTUCZNYCH;0.43390970960155;37.0
33;NAPRAWA, KONSERWACJA I INSTALOWANIE MASZYN I URZĄDZEŃ;0.43246699934125926;38.0
26;PRODUKCJA KOMPUTERÓW, WYROBÓW ELEKTRONICZNYCH I OPTYCZNYCH;0.43137793123147006;39.0
84;"ADMINISTRACJA PUBLICZNA I OBRONA NARODOWA; OBOWIĄZKOWE UBEZPIECZENIA SPOŁECZNE";0.43040588129828594;40.0
65;DZIAŁALNOŚĆ W ZAKRESIE UBEZPIECZEŃ, REASEKURACJI ORAZ FUNDUSZY EMERYTALNYCH, Z WYŁĄCZENIEM OBOWIĄZKOWEGO UBEZPIECZENIA SPOŁECZNEGO;0.4303492025722524;41.0
37;ODPROWADZANIE I OCZYSZCZANIE ŚCIEKÓW;0.4285165886420802;42.0
32;POZOSTAŁA PRODUKCJA WYROBÓW;0.422389739935742;43.0
10;PRODUKCJA ARTYKUŁÓW SPOŻYWCZYCH;0.4216205414092442;44.0
06;GÓRNICTWO ROPY NAFTOWEJ I GAZU ZIEMNEGO;0.42065224285273833;45.0
07;GÓRNICTWO RUD METALI;0.42047184497947043;46.0
95;NAPRAWA I KONSERWACJA KOMPUTERÓW, ARTYKUŁÓW UŻYTKU OSOBISTEGO I DOMOWEGO ORAZ POJAZDÓW SILNIKOWYCH, W TYM MOTOCYKLI;0.42005929393780517;47.0
85;EDUKACJA;0.4200429591147272;48.0
99;ORGANIZACJE I ZESPOŁY EKSTERYTORIALNE;0.41875731298058144;49.0
98;GOSPODARSTWA DOMOWE PRODUKUJĄCE WYROBY I ŚWIADCZĄCE USŁUGI NA WŁASNE POTRZEBY;0.41872903453201293;50.0
97;GOSPODARSTWA DOMOWE ZATRUDNIAJĄCE PRACOWNIKÓW;0.4186491664100391;51.0
29;PRODUKCJA POJAZDÓW SILNIKOWYCH, PRODUKCJA PRZYCZEP I NACZEP;0.4133776928462815;52.0
42;ROBOTY ZWIĄZANE Z BUDOWĄ OBIEKTÓW INŻYNIERII LĄDOWEJ I WODNEJ;0.41225314286895365;53.0
49;TRANSPORT LĄDOWY ORAZ TRANSPORT RUROCIĄGOWY;0.40986652012847;54.0
30;PRODUKCJA POZOSTAŁEGO SPRZĘTU TRANSPORTOWEGO;0.4094773625767078;55.0
46;HANDEL HURTOWY;0.4063684747937364;56.0
51;TRANSPORT LOTNICZY;0.4051765974375814;57.0
38;DZIAŁALNOŚĆ ZWIĄZANA ZE ZBIERANIEM, ODZYSKIEM I UNIESZKODLIWIANIEM ODPADÓW;0.40323301777980886;58.0
73;DZIAŁALNOŚĆ W ZAKRESIE REKLAMY, BADANIA RYNKU I PUBLIC RELATIONS;0.4030537892519746;59.0
80;DZIAŁALNOŚĆ DETEKTYWISTYCZNA I OCHRONIARSKA;0.402975542710844;60.0
24;PRODUKCJA METALI;0.39579324277697064;61.0
78;DZIAŁALNOŚĆ ZWIĄZANA Z ZATRUDNIENIEM;0.39456387585091424;62.0
47;HANDEL DETALICZNY;0.39037691815336;63.0
53;DZIAŁALNOŚĆ POCZTOWA I KURIERSKA;0.3871297217087166;64.0
19;WYTWARZANIE I PRZETWARZANIE KOKSU I PRODUKTÓW RAFINACJI ROPY NAFTOWEJ;0.38514838229384074;65.0
39;DZIAŁALNOŚĆ ZWIĄZANA Z REKULTYWACJĄ I POZOSTAŁA DZIAŁALNOŚĆ USŁUGOWA ZWIĄZANA Z GOSPODARKĄ ODPADAMI;0.38263114155173855;66.0
59;DZIAŁALNOŚĆ ZWIĄZANA Z PRODUKCJĄ FILMÓW, NAGRAŃ WIDEO, PROGRAMÓW TELEWIZYJNYCH, NAGRAŃ DŹWIĘKOWYCH I MUZYCZNYCH;0.3786816438350792;67.0
82;DZIAŁALNOŚĆ ZWIĄZANA Z ADMINISTRACYJNĄ OBSŁUGĄ BIURA I POZOSTAŁA DZIAŁALNOŚĆ WSPOMAGAJĄCA PROWADZENIE DZIAŁALNOŚCI GOSPODARCZEJ;0.37169698415249475;68.0
11;PRODUKCJA NAPOJÓW;0.371549690466422;69.0
77;WYNAJEM I DZIERŻAWA;0.3688238034225623;70.0
12;PRODUKCJA WYROBÓW TYTONIOWYCH;0.3646304043513604;71.0
86;OPIEKA ZDROWOTNA;0.3607658331703461;72.0
61;TELEKOMUNIKACJA;0.3558808356066827;73.0
36;POBÓR, UZDATNIANIE I DOSTARCZANIE WODY;0.3515801574872379;74.0
60;NADAWANIE PROGRAMÓW OGÓLNODOSTĘPNYCH I ABONAMENTOWYCH, DZIAŁALNOŚĆ AGENCJI INFORMACYJNYCH I POZOSTAŁA DZIAŁALNOŚĆ ZWIĄZANA Z DYSTRYBUCJĄ TREŚCI;0.33985316224331724;75.0
68;DZIAŁALNOŚĆ ZWIĄZANA Z OBSŁUGĄ RYNKU NIERUCHOMOŚCI;0.3396659871332439;76.0
70;DZIAŁALNOŚĆ CENTRAL (HEAD OFFICES) ORAZ DORADZTWO ZWIĄZANE Z ZARZĄDZANIEM;0.3325077256149845;77.0
55;ZAKWATEROWANIE;0.32743705967993203;78.0
09;DZIAŁALNOŚĆ USŁUGOWA WSPOMAGAJĄCA GÓRNICTWO I WYDOBYWANIE;0.3270259232630882;79.0
91;DZIAŁALNOŚĆ BIBLIOTEK, ARCHIWÓW, MUZEÓW ORAZ POZOSTAŁA DZIAŁALNOŚĆ ZWIĄZANA Z KULTURĄ;0.3228442913729679;80.0
56;DZIAŁALNOŚĆ USŁUGOWA ZWIĄZANA Z WYŻYWIENIEM;0.32099461980019284;81.0
52;MAGAZYNOWANIE, PRZECHOWYWANIE I DZIAŁALNOŚĆ USŁUGOWA WSPOMAGAJĄCA TRANSPORT;0.31761328921154475;82.0
35;WYTWARZANIE I ZAOPATRYWANIE W ENERGIĘ ELEKTRYCZNĄ, GAZ, PARĘ WODNĄ I POWIETRZE DO UKŁADÓW KLIMATYZACYJNYCH;0.30993260667636935;83.0
63;DZIAŁALNOŚĆ USŁUGOWA W ZAKRESIE INFRASTRUKTURY OBLICZENIOWEJ, PRZETWARZANIA DANYCH, ZARZĄDZANIA STRONAMI INTERNETOWYMI (HOSTING) I POZOSTAŁA DZIAŁALNOŚĆ USŁUGOWA W ZAKRESIE INFORMACJI;0.3087789024112344;84.0
05;WYDOBYWANIE WĘGLA KAMIENNEGO I WĘGLA BRUNATNEGO (LIGNITU);0.2646795562769044;85.0
93;DZIAŁALNOŚĆ SPORTOWA, ROZRYWKOWA I REKREACYJNA;0.2465372712584742;86.0
87;POMOC SPOŁECZNA Z ZAKWATEROWANIEM;0.22326686788717895;87.0
