alternative_id;nazwa;monte_carlo_score;monte_carlo_rank
94;DZIAŁALNOŚĆ ORGANIZACJI CZŁONKOWSKICH;0.4797019751703608;1.0
64;FINANSOWA DZIAŁALNOŚĆ USŁUGOWA, Z WYŁĄCZENIEM UBEZPIECZEŃ I FUNDUSZY EMERYTALNYCH;0.449838022165406;2.0
75;DZIAŁALNOŚĆ WETERYNARYJNA;0.43259323181187803;3.0
96;DZIAŁALNOŚĆ USŁUGOWA INDYWIDUALNA;0.4096458794178856;4.0
92;DZIAŁALNOŚĆ ZWIĄZANA Z GRAMI HAZARDOWYMI;0.3866902664913873;5.0
66;DZIAŁALNOŚĆ WSPOMAGAJĄCA USŁUGI FINANSOWE, UBEZPIECZENIA I FUNDUSZE EMERYTALNE;0.3830050295945464;6.0
90;DZIAŁALNOŚĆ TWÓRCZA I DZIAŁALNOŚĆ ZWIĄZANA Z WYSTAWIANIEM PRZEDSTAWIEŃ ARTYSTYCZNYCH;0.3829830425078691;7.0
01;UPRAWY ROLNE, CHÓW I HODOWLA ZWIERZĄT, ŁOWIECTWO, W TYM DZIAŁALNOŚĆ USŁUGOWA;0.37705464373856645;8.0
50;TRANSPORT WODNY;0.3766110372039741;9.0
37;ODPROWADZANIE I OCZYSZCZANIE ŚCIEKÓW;0.37328997164302574;10.0
51;TRANSPORT LOTNICZY;0.36739117546200484;11.0
60;NADAWANIE PROGRAMÓW OGÓLNODOSTĘPNYCH I ABONAMENTOWYCH, DZIAŁALNOŚĆ AGENCJI INFORMACYJNYCH I POZOSTAŁA DZIAŁALNOŚĆ ZWIĄZANA Z DYSTRYBUCJĄ TREŚCI;0.34256516024979355;12.0
15;PRODUKCJA SKÓR I WYROBÓW ZE SKÓR WYPRAWIONYCH, PRODUKCJA PODOBNYCH WYROBÓW Z INNYCH MATERIAŁÓW;0.3420117375241391;13.0
03;RYBACTWO;0.33940874358920653;14.0
77;WYNAJEM I DZIERŻAWA;0.335444179666319;15.0
02;LEŚNICTWO I POZYSKIWANIE DREWNA;0.33312746827096834;16.0
08;POZOSTAŁE GÓRNICTWO I WYDOBYWANIE;0.3327684556894062;17.0
69;DZIAŁALNOŚĆ PRAWNICZA, RACHUNKOWO-KSIĘGOWA I DORADZTWO PODATKOWE;0.3292235822944772;18.0
63;DZIAŁALNOŚĆ USŁUGOWA W ZAKRESIE INFRASTRUKTURY OBLICZENIOWEJ, PRZETWARZANIA DANYCH, ZARZĄDZANIA STRONAMI INTERNETOWYMI (HOSTING) I POZOSTAŁA DZIAŁALNOŚĆ USŁUGOWA W ZAKRESIE INFORMACJI;0.3260106205355219;19.0
58;DZIAŁALNOŚĆ WYDAWNICZA;0.3259371820090343;20.0
36;POBÓR, UZDATNIANIE I DOSTARCZANIE WODY;0.3258380085088712;21.0
72;BADANIA NAUKOWE I PRACE ROZWOJOWE;0.32085527814403175;22.0
91;DZIAŁALNOŚĆ BIBLIOTEK, ARCHIWÓW, MUZEÓW ORAZ POZOSTAŁA DZIAŁALNOŚĆ ZWIĄZANA Z KULTURĄ;0.3201144341520526;23.0
88;POMOC SPOŁECZNA BEZ ZAKWATEROWANIA;0.31868408195047476;24.0
61;TELEKOMUNIKACJA;0.3166639756228893;25.0
55;ZAKWATEROWANIE;0.31580408125738607;26.0
62;DZIAŁALNOŚĆ ZWIĄZANA Z PROGRAMOWANIEM, DORADZTWEM W ZAKRESIE INFORMATYKI I DZIAŁALNOŚCI POWIĄZANE;0.31573027379388274;27.0
14;PRODUKCJA ODZIEŻY;0.31349255395794795;28.0
23;PRODUKCJA WYROBÓW Z POZOSTAŁYCH MINERALNYCH SUROWCÓW NIEMETALICZNYCH;0.3130188406156113;29.0
74;POZOSTAŁA DZIAŁALNOŚĆ PROFESJONALNA, NAUKOWA I TECHNICZNA;0.3123360998963872;30.0
18;POLIGRAFIA I REPRODUKCJA ZAPISANYCH NOŚNIKÓW INFORMACJI;0.3100933885438182;31.0
20;PRODUKCJA CHEMIKALIÓW I WYROBÓW CHEMICZNYCH;0.30969692085854683;32.0
19;WYTWARZANIE I PRZETWARZANIE KOKSU I PRODUKTÓW RAFINACJI ROPY NAFTOWEJ;0.3077324718746591;33.0
32;POZOSTAŁA PRODUKCJA WYROBÓW;0.30501642258118594;34.0
25;PRODUKCJA METALOWYCH WYROBÓW GOTOWYCH, Z WYŁĄCZENIEM MASZYN I URZĄDZEŃ;0.30323737329769157;35.0
17;PRODUKCJA PAPIERU I WYROBÓW Z PAPIERU;0.302990902014374;36.0
28;PRODUKCJA MASZYN I URZĄDZEŃ, GDZIE INDZIEJ NIESKLASYFIKOWANA;0.3025140234734279;37.0
13;PRODUKCJA WYROBÓW TEKSTYLNYCH;0.30145445371899576;38.0
56;DZIAŁALNOŚĆ USŁUGOWA ZWIĄZANA Z WYŻYWIENIEM;0.29990226668522957;39.0
41;ROBOTY BUDOWLANE ZWIĄZANE ZE WZNOSZENIEM BUDYNKÓW MIESZKALNYCH I NIEMIESZKALNYCH;0.29855184721351735;40.0
21;PRODUKCJA PODSTAWOWYCH SUBSTANCJI FARMACEUTYCZNYCH ORAZ LEKÓW I POZOSTAŁYCH WYROBÓW FARMACEUTYCZNYCH;0.2985166912006634;41.0
68;DZIAŁALNOŚĆ ZWIĄZANA Z OBSŁUGĄ RYNKU NIERUCHOMOŚCI;0.29849000895615346;42.0
27;PRODUKCJA URZĄDZEŃ ELEKTRYCZNYCH;0.2973706422739347;43.0
31;PRODUKCJA MEBLI;0.2971118172272968;44.0
52;MAGAZYNOWANIE, PRZECHOWYWANIE I DZIAŁALNOŚĆ USŁUGOWA WSPOMAGAJĄCA TRANSPORT;0.2967880544626758;45.0
22;PRODUKCJA WYROBÓW Z GUMY I TWORZYW SZTUCZNYCH;0.29649967149586137;46.0
38;DZIAŁALNOŚĆ ZWIĄZANA ZE ZBIERANIEM, ODZYSKIEM I UNIESZKODLIWIANIEM ODPADÓW;0.29569944619249267;47.0
86;OPIEKA ZDROWOTNA;0.2935485489997952;48.0
81;DZIAŁALNOŚĆ USŁUGOWA ZWIĄZANA Z UTRZYMANIEM PORZĄDKU W BUDYNKACH I ZAGOSPODAROWANIEM TERENÓW ZIELENI;0.2931777140684582;49.0
71;"DZIAŁALNOŚĆ W ZAKRESIE ARCHITEKTURY I INŻYNIERII; BADANIA I ANALIZY TECHNICZNE";0.2931192028129873;50.0
42;ROBOTY ZWIĄZANE Z BUDOWĄ OBIEKTÓW INŻYNIERII LĄDOWEJ I WODNEJ;0.2926558085313882;51.0
16;"PRODUKCJA WYROBÓW Z DREWNA I KORKA, Z WYŁĄCZENIEM MEBLI; PRODUKCJA WYROBÓW ZE SŁOMY I MATERIAŁÓW UŻYWANYCH DO WYPLATANIA";0.29201783593943825;52.0
49;TRANSPORT LĄDOWY ORAZ TRANSPORT RUROCIĄGOWY;0.29051013225162764;53.0
43;ROBOTY BUDOWLANE SPECJALISTYCZNE;0.28947035743355326;54.0
84;"ADMINISTRACJA PUBLICZNA I OBRONA NARODOWA; OBOWIĄZKOWE UBEZPIECZENIA SPOŁECZNE";0.28936251181871014;55.0
65;DZIAŁALNOŚĆ W ZAKRESIE UBEZPIECZEŃ, REASEKURACJI ORAZ FUNDUSZY EMERYTALNYCH, Z WYŁĄCZENIEM OBOWIĄZKOWEGO UBEZPIECZENIA SPOŁECZNEGO;0.28935238228442284;56.0
33;NAPRAWA, KONSERWACJA I INSTALOWANIE MASZYN I URZĄDZEŃ;0.28471697249772454;57.0
79;DZIAŁALNOŚĆ ORGANIZATORÓW TURYSTYKI, AGENTÓW TURYSTYCZNYCH ORAZ POZOSTAŁA DZIAŁALNOŚĆ USŁUGOWA W ZAKRESIE REZERWACJI I DZIAŁALNOŚCI Z NIĄ ZWIĄZANE;0.28284267614179487;58.0
59;DZIAŁALNOŚĆ ZWIĄZANA Z PRODUKCJĄ FILMÓW, NAGRAŃ WIDEO, PROGRAMÓW TELEWIZYJNYCH, NAGRAŃ DŹWIĘKOWYCH I MUZYCZNYCH;0.28127863195818376;59.0
07;GÓRNICTWO RUD METALI;0.28118303405133555;60.0
06;GÓRNICTWO ROPY NAFTOWEJ I GAZU ZIEMNEGO;0.2811385107820952;61.0
98;GOSPODARSTWA DOMOWE PRODUKUJĄCE WYROBY I ŚWIADCZĄCE USŁUGI NA WŁASNE POTRZEBY;0.28029562588623497;62.0
10;PRODUKCJA ARTYKUŁÓW SPOŻYWCZYCH;0.28026875573717525;63.0
97;GOSPODARSTWA DOMOWE ZATRUDNIAJĄCE PRACOWNIKÓW;0.2802439498289977;64.0
99;ORGANIZACJE I ZESPOŁY EKSTERYTORIALNE;0.28018562058600177;65.0
26;PRODUKCJA KOMPUTERÓW, WYROBÓW ELEKTRONICZNYCH I OPTYCZNYCH;0.2801433878240836;66.0
29;PRODUKCJA POJAZDÓW SILNIKOWYCH, PRODUKCJA PRZYCZEP I NACZEP;0.2786336592272134;67.0
85;EDUKACJA;0.27703447824790267;68.0
30;PRODUKCJA POZOSTAŁEGO SPRZĘTU TRANSPORTOWEGO;0.2765753938664672;69.0
11;PRODUKCJA NAPOJÓW;0.2748511789708116;70.0
70;DZIAŁALNOŚĆ CENTRAL (HEAD OFFICES) ORAZ DORADZTWO ZWIĄZANE Z ZARZĄDZANIEM;0.2746591614917793;71.0
73;DZIAŁALNOŚĆ W ZAKRESIE REKLAMY, BADANIA RYNKU I PUBLIC RELATIONS;0.27375992544113215;72.0
39;DZIAŁALNOŚĆ ZWIĄZANA Z REKULTYWACJĄ I POZOSTAŁA DZIAŁALNOŚĆ USŁUGOWA ZWIĄZANA Z GOSPODARKĄ ODPADAMI;0.2717749608341733;73.0
95;NAPRAWA I KONSERWACJA KOMPUTERÓW, ARTYKUŁÓW UŻYTKU OSOBISTEGO I DOMOWEGO ORAZ POJAZDÓW SILNIKOWYCH, W TYM MOTOCYKLI;0.2712246165762407;74.0
87;POMOC SPOŁECZNA Z ZAKWATEROWANIEM;0.2660180017370856;75.0
46;HANDEL HURTOWY;0.26548115302397046;76.0
82;DZIAŁALNOŚĆ ZWIĄZANA Z ADMINISTRACYJNĄ OBSŁUGĄ BIURA I POZOSTAŁA DZIAŁALNOŚĆ WSPOMAGAJĄCA PROWADZENIE DZIAŁALNOŚCI GOSPODARCZEJ;0.2636672804379414;77.0
24;PRODUKCJA METALI;0.2636536894091116;78.0
78;DZIAŁALNOŚĆ ZWIĄZANA Z ZATRUDNIENIEM;0.26253880593073126;79.0
47;HANDEL DETALICZNY;0.25946226526929206;80.0
53;DZIAŁALNOŚĆ POCZTOWA I KURIERSKA;0.25840043789050776;81.0
12;PRODUKCJA WYROBÓW TYTONIOWYCH;0.25066210729864913;82.0
35;WYTWARZANIE I ZAOPATRYWANIE W ENERGIĘ ELEKTRYCZNĄ, GAZ, PARĘ WODNĄ I POWIETRZE DO UKŁADÓW KLIMATYZACYJNYCH;0.24833241835792672;83.0
93;DZIAŁALNOŚĆ SPORTOWA, ROZRYWKOWA I REKREACYJNA;0.2462518411836642;84.0
80;DZIAŁALNOŚĆ DETEKTYWISTYCZNA I OCHRONIARSKA;0.24129975057040776;85.0
09;DZIAŁALNOŚĆ USŁUGOWA WSPOMAGAJĄCA GÓRNICTWO I WYDOBYWANIE;0.21500212723713136;86.0
05;WYDOBYWANIE WĘGLA KAMIENNEGO I WĘGLA BRUNATNEGO (LIGNITU);0.1728169713634188;87.0
