alternative_id;nazwa;ensemble_score;ensemble_rank
77;WYNAJEM I DZIERŻAWA;0.6474438979337287;1.0
94;DZIAŁALNOŚĆ ORGANIZACJI CZŁONKOWSKICH;0.5669447817930235;2.0
64;FINANSOWA DZIAŁALNOŚĆ USŁUGOWA, Z WYŁĄCZENIEM UBEZPIECZEŃ I FUNDUSZY EMERYTALNYCH;0.5647465885486145;3.0
96;DZIAŁALNOŚĆ USŁUGOWA INDYWIDUALNA;0.5448466306475284;4.0
61;TELEKOMUNIKACJA;0.4915551204383889;5.0
21;PRODUKCJA PODSTAWOWYCH SUBSTANCJI FARMACEUTYCZNYCH ORAZ LEKÓW I POZOSTAŁYCH WYROBÓW FARMACEUTYCZNYCH;0.4889910080498206;6.0
03;RYBACTWO;0.48568705694502934;7.0
37;ODPROWADZANIE I OCZYSZCZANIE ŚCIEKÓW;0.4846696444396526;8.0
63;DZIAŁALNOŚĆ USŁUGOWA W ZAKRESIE INFRASTRUKTURY OBLICZENIOWEJ, PRZETWARZANIA DANYCH, ZARZĄDZANIA STRONAMI INTERNETOWYMI (HOSTING) I POZOSTAŁA DZIAŁALNOŚĆ USŁUGOWA W ZAKRESIE INFORMACJI;0.48307618390442664;9.0
60;NADAWANIE PROGRAMÓW OGÓLNODOSTĘPNYCH I ABONAMENTOWYCH, DZIAŁALNOŚĆ AGENCJI INFORMACYJNYCH I POZOSTAŁA DZIAŁALNOŚĆ ZWIĄZANA Z DYSTRYBUCJĄ TREŚCI;0.4785803627079687;10.0
01;UPRAWY ROLNE, CHÓW I HODOWLA ZWIERZĄT, ŁOWIECTWO, W TYM DZIAŁALNOŚĆ USŁUGOWA;0.47058250460681406;11.0
08;POZOSTAŁE GÓRNICTWO I WYDOBYWANIE;0.4579049931411666;12.0
36;POBÓR, UZDATNIANIE I DOSTARCZANIE WODY;0.4494458359226034;13.0
39;DZIAŁALNOŚĆ ZWIĄZANA Z REKULTYWACJĄ I POZOSTAŁA DZIAŁALNOŚĆ USŁUGOWA ZWIĄZANA Z GOSPODARKĄ ODPADAMI;0.4478400142565946;14.0
56;DZIAŁALNOŚĆ USŁUGOWA ZWIĄZANA Z WYŻYWIENIEM;0.4392330665178836;15.0
23;PRODUKCJA WYROBÓW Z POZOSTAŁYCH MINERALNYCH SUROWCÓW NIEMETALICZNYCH;0.42851896521331684;16.0
58;DZIAŁALNOŚĆ WYDAWNICZA;0.4281953595982374;17.0
17;PRODUKCJA PAPIERU I WYROBÓW Z PAPIERU;0.42811219481658735;18.0
87;POMOC SPOŁECZNA Z ZAKWATEROWANIEM;0.4210890449745753;19.0
55;ZAKWATEROWANIE;0.41947595177954966;20.0
38;DZIAŁALNOŚĆ ZWIĄZANA ZE ZBIERANIEM, ODZYSKIEM I UNIESZKODLIWIANIEM ODPADÓW;0.4167364695458873;21.0
85;EDUKACJA;0.41253390737069107;22.0
16;"PRODUKCJA WYROBÓW Z DREWNA I KORKA, Z WYŁĄCZENIEM MEBLI; PRODUKCJA WYROBÓW ZE SŁOMY I MATERIAŁÓW UŻYWANYCH DO WYPLATANIA";0.4041848195331575;23.0
93;DZIAŁALNOŚĆ SPORTOWA, ROZRYWKOWA I REKREACYJNA;0.4039328579245327;24.0
18;POLIGRAFIA I REPRODUKCJA ZAPISANYCH NOŚNIKÓW INFORMACJI;0.3977239969535257;25.0
22;PRODUKCJA WYROBÓW Z GUMY I TWORZYW SZTUCZNYCH;0.38979846672548607;26.0
32;POZOSTAŁA PRODUKCJA WYROBÓW;0.38545231463122426;27.0
14;PRODUKCJA ODZIEŻY;0.38096462256340025;28.0
86;OPIEKA ZDROWOTNA;0.3801441008233214;29.0
13;PRODUKCJA WYROBÓW TEKSTYLNYCH;0.37368478490780044;30.0
69;DZIAŁALNOŚĆ PRAWNICZA, RACHUNKOWO-KSIĘGOWA I DORADZTWO PODATKOWE;0.3731745467144306;31.0
50;TRANSPORT WODNY;0.36771240232468677;32.0
31;PRODUKCJA MEBLI;0.36755855832904005;33.0
59;DZIAŁALNOŚĆ ZWIĄZANA Z PRODUKCJĄ FILMÓW, NAGRAŃ WIDEO, PROGRAMÓW TELEWIZYJNYCH, NAGRAŃ DŹWIĘKOWYCH I MUZYCZNYCH;0.36642714906571894;34.0
11;PRODUKCJA NAPOJÓW;0.35983903341530676;35.0
66;DZIAŁALNOŚĆ WSPOMAGAJĄCA USŁUGI FINANSOWE, UBEZPIECZENIA I FUNDUSZE EMERYTALNE;0.358176158822387;36.0
91;DZIAŁALNOŚĆ BIBLIOTEK, ARCHIWÓW, MUZEÓW ORAZ POZOSTAŁA DZIAŁALNOŚĆ ZWIĄZANA Z KULTURĄ;0.3531628263397147;37.0
65;DZIAŁALNOŚĆ W ZAKRESIE UBEZPIECZEŃ, REASEKURACJI ORAZ FUNDUSZY EMERYTALNYCH, Z WYŁĄCZENIEM OBOWIĄZKOWEGO UBEZPIECZENIA SPOŁECZNEGO;0.35225784763030443;38.0
10;PRODUKCJA ARTYKUŁÓW SPOŻYWCZYCH;0.34980120683826793;39.0
82;DZIAŁALNOŚĆ ZWIĄZANA Z ADMINISTRACYJNĄ OBSŁUGĄ BIURA I POZOSTAŁA DZIAŁALNOŚĆ WSPOMAGAJĄCA PROWADZENIE DZIAŁALNOŚCI GOSPODARCZEJ;0.34062164175559645;40.0
51;TRANSPORT LOTNICZY;0.3361976272977501;41.0
84;"ADMINISTRACJA PUBLICZNA I OBRONA NARODOWA; OBOWIĄZKOWE UBEZPIECZENIA SPOŁECZNE";0.33516862567195155;42.0
49;TRANSPORT LĄDOWY ORAZ TRANSPORT RUROCIĄGOWY;0.3337658211991928;43.0
25;PRODUKCJA METALOWYCH WYROBÓW GOTOWYCH, Z WYŁĄCZENIEM MASZYN I URZĄDZEŃ;0.32982708960304946;44.0
52;MAGAZYNOWANIE, PRZECHOWYWANIE I DZIAŁALNOŚĆ USŁUGOWA WSPOMAGAJĄCA TRANSPORT;0.3283174302194285;45.0
28;PRODUKCJA MASZYN I URZĄDZEŃ, GDZIE INDZIEJ NIESKLASYFIKOWANA;0.3262509107518157;46.0
75;DZIAŁALNOŚĆ WETERYNARYJNA;0.32117207432623684;47.0
62;DZIAŁALNOŚĆ ZWIĄZANA Z PROGRAMOWANIEM, DORADZTWEM W ZAKRESIE INFORMATYKI I DZIAŁALNOŚCI POWIĄZANE;0.3187373518039548;48.0
12;PRODUKCJA WYROBÓW TYTONIOWYCH;0.3167808304665093;49.0
19;WYTWARZANIE I PRZETWARZANIE KOKSU I PRODUKTÓW RAFINACJI ROPY NAFTOWEJ;0.3152553009253108;50.0
90;DZIAŁALNOŚĆ TWÓRCZA I DZIAŁALNOŚĆ ZWIĄZANA Z WYSTAWIANIEM PRZEDSTAWIEŃ ARTYSTYCZNYCH;0.31327386268733115;51.0
07;GÓRNICTWO RUD METALI;0.31295252420573283;52.0
06;GÓRNICTWO ROPY NAFTOWEJ I GAZU ZIEMNEGO;0.3113305921361922;53.0
20;PRODUKCJA CHEMIKALIÓW I WYROBÓW CHEMICZNYCH;0.30988986191680307;54.0
98;GOSPODARSTWA DOMOWE PRODUKUJĄCE WYROBY I ŚWIADCZĄCE USŁUGI NA WŁASNE POTRZEBY;0.3091604442258492;55.0
35;WYTWARZANIE I ZAOPATRYWANIE W ENERGIĘ ELEKTRYCZNĄ, GAZ, PARĘ WODNĄ I POWIETRZE DO UKŁADÓW KLIMATYZACYJNYCH;0.3059780479574521;56.0
97;GOSPODARSTWA DOMOWE ZATRUDNIAJĄCE PRACOWNIKÓW;0.3037225289059879;57.0
27;PRODUKCJA URZĄDZEŃ ELEKTRYCZNYCH;0.3019231876703089;58.0
15;PRODUKCJA SKÓR I WYROBÓW ZE SKÓR WYPRAWIONYCH, PRODUKCJA PODOBNYCH WYROBÓW Z INNYCH MATERIAŁÓW;0.3000321043145051;59.0
43;ROBOTY BUDOWLANE SPECJALISTYCZNE;0.2988101317852634;60.0
99;ORGANIZACJE I ZESPOŁY EKSTERYTORIALNE;0.29871024669723284;61.0
68;DZIAŁALNOŚĆ ZWIĄZANA Z OBSŁUGĄ RYNKU NIERUCHOMOŚCI;0.29377775986932303;62.0
74;POZOSTAŁA DZIAŁALNOŚĆ PROFESJONALNA, NAUKOWA I TECHNICZNA;0.287039201234477;63.0
71;"DZIAŁALNOŚĆ W ZAKRESIE ARCHITEKTURY I INŻYNIERII; BADANIA I ANALIZY TECHNICZNE";0.28689637645219185;64.0
92;DZIAŁALNOŚĆ ZWIĄZANA Z GRAMI HAZARDOWYMI;0.2667383419029413;65.0
81;DZIAŁALNOŚĆ USŁUGOWA ZWIĄZANA Z UTRZYMANIEM PORZĄDKU W BUDYNKACH I ZAGOSPODAROWANIEM TERENÓW ZIELENI;0.2637354611096739;66.0
29;PRODUKCJA POJAZDÓW SILNIKOWYCH, PRODUKCJA PRZYCZEP I NACZEP;0.2620316672534938;67.0
41;ROBOTY BUDOWLANE ZWIĄZANE ZE WZNOSZENIEM BUDYNKÓW MIESZKALNYCH I NIEMIESZKALNYCH;0.26115703227082526;68.0
26;PRODUKCJA KOMPUTERÓW, WYROBÓW ELEKTRONICZNYCH I OPTYCZNYCH;0.260797634021147;69.0
30;PRODUKCJA POZOSTAŁEGO SPRZĘTU TRANSPORTOWEGO;0.2599887001089016;70.0
79;DZIAŁALNOŚĆ ORGANIZATORÓW TURYSTYKI, AGENTÓW TURYSTYCZNYCH ORAZ POZOSTAŁA DZIAŁALNOŚĆ USŁUGOWA W ZAKRESIE REZERWACJI I DZIAŁALNOŚCI Z NIĄ ZWIĄZANE;0.25977362850826147;71.0
24;PRODUKCJA METALI;0.25188723440887645;72.0
42;ROBOTY ZWIĄZANE Z BUDOWĄ OBIEKTÓW INŻYNIERII LĄDOWEJ I WODNEJ;0.24959535800632732;73.0
05;WYDOBYWANIE WĘGLA KAMIENNEGO I WĘGLA BRUNATNEGO (LIGNITU);0.24852905542249643;74.0
46;HANDEL HURTOWY;0.24827919796687697;75.0
47;HANDEL DETALICZNY;0.24301523854976492;76.0
33;NAPRAWA, KONSERWACJA I INSTALOWANIE MASZYN I URZĄDZEŃ;0.23708761390085645;77.0
53;DZIAŁALNOŚĆ POCZTOWA I KURIERSKA;0.23641141987286188;78.0
95;NAPRAWA I KONSERWACJA KOMPUTERÓW, ARTYKUŁÓW UŻYTKU OSOBISTEGO I DOMOWEGO ORAZ POJAZDÓW SILNIKOWYCH, W TYM MOTOCYKLI;0.23621020735383363;79.0
70;DZIAŁALNOŚĆ CENTRAL (HEAD OFFICES) ORAZ DORADZTWO ZWIĄZANE Z ZARZĄDZANIEM;0.2253831011257112;80.0
88;POMOC SPOŁECZNA BEZ ZAKWATEROWANIA;0.22373992334690307;81.0
78;DZIAŁALNOŚĆ ZWIĄZANA Z ZATRUDNIENIEM;0.21676793928936874;82.0
02;LEŚNICTWO I POZYSKIWANIE DREWNA;0.21626169315056354;83.0
73;DZIAŁALNOŚĆ W ZAKRESIE REKLAMY, BADANIA RYNKU I PUBLIC RELATIONS;0.20620307179852831;84.0
72;BADANIA NAUKOWE I PRACE ROZWOJOWE;0.20164843638253727;85.0
09;DZIAŁALNOŚĆ USŁUGOWA WSPOMAGAJĄCA GÓRNICTWO I WYDOBYWANIE;0.17646992799702102;86.0
80;DZIAŁALNOŚĆ DETEKTYWISTYCZNA I OCHRONIARSKA;0.16849364898554567;87.0
