alternative_id;nazwa;ensemble_score;ensemble_rank
94;DZIAŁALNOŚĆ ORGANIZACJI CZŁONKOWSKICH;0.6571015826102311;1.0
75;DZIAŁALNOŚĆ WETERYNARYJNA;0.5075308515240479;2.0
37;ODPROWADZANIE I OCZYSZCZANIE ŚCIEKÓW;0.47826632794795076;3.0
50;TRANSPORT WODNY;0.45240023611494307;4.0
72;BADANIA NAUKOWE I PRACE ROZWOJOWE;0.44774865010824605;5.0
51;TRANSPORT LOTNICZY;0.44733325014572733;6.0
64;FINANSOWA DZIAŁALNOŚĆ USŁUGOWA, Z WYŁĄCZENIEM UBEZPIECZEŃ I FUNDUSZY EMERYTALNYCH;0.4339915785292525;7.0
01;UPRAWY ROLNE, CHÓW I HODOWLA ZWIERZĄT, ŁOWIECTWO, W TYM DZIAŁALNOŚĆ USŁUGOWA;0.42794387986686144;8.0
03;RYBACTWO;0.424382701243196;9.0
59;DZIAŁALNOŚĆ ZWIĄZANA Z PRODUKCJĄ FILMÓW, NAGRAŃ WIDEO, PROGRAMÓW TELEWIZYJNYCH, NAGRAŃ DŹWIĘKOWYCH I MUZYCZNYCH;0.4169585911255508;10.0
62;DZIAŁALNOŚĆ ZWIĄZANA Z PROGRAMOWANIEM, DORADZTWEM W ZAKRESIE INFORMATYKI I DZIAŁALNOŚCI POWIĄZANE;0.4146288839982333;11.0
63;DZIAŁALNOŚĆ USŁUGOWA W ZAKRESIE INFRASTRUKTURY OBLICZENIOWEJ, PRZETWARZANIA DANYCH, ZARZĄDZANIA STRONAMI INTERNETOWYMI (HOSTING) I POZOSTAŁA DZIAŁALNOŚĆ USŁUGOWA W ZAKRESIE INFORMACJI;0.40602577347489555;12.0
15;PRODUKCJA SKÓR I WYROBÓW ZE SKÓR WYPRAWIONYCH, PRODUKCJA PODOBNYCH WYROBÓW Z INNYCH MATERIAŁÓW;0.3960813158520957;13.0
77;WYNAJEM I DZIERŻAWA;0.3813706037363986;14.0
36;POBÓR, UZDATNIANIE I DOSTARCZANIE WODY;0.3809490848444306;15.0
05;WYDOBYWANIE WĘGLA KAMIENNEGO I WĘGLA BRUNATNEGO (LIGNITU);0.3782881500115306;16.0
69;DZIAŁALNOŚĆ PRAWNICZA, RACHUNKOWO-KSIĘGOWA I DORADZTWO PODATKOWE;0.3740615109476225;17.0
23;PRODUKCJA WYROBÓW Z POZOSTAŁYCH MINERALNYCH SUROWCÓW NIEMETALICZNYCH;0.36933543133563806;18.0
91;DZIAŁALNOŚĆ BIBLIOTEK, ARCHIWÓW, MUZEÓW ORAZ POZOSTAŁA DZIAŁALNOŚĆ ZWIĄZANA Z KULTURĄ;0.36642307777237065;19.0
02;LEŚNICTWO I POZYSKIWANIE DREWNA;0.3644001721098836;20.0
43;ROBOTY BUDOWLANE SPECJALISTYCZNE;0.3605283044318426;21.0
14;PRODUKCJA ODZIEŻY;0.355594279152947;22.0
80;DZIAŁALNOŚĆ DETEKTYWISTYCZNA I OCHRONIARSKA;0.35269373024369916;23.0
96;DZIAŁALNOŚĆ USŁUGOWA INDYWIDUALNA;0.3507495947933083;24.0
58;DZIAŁALNOŚĆ WYDAWNICZA;0.35023887121546626;25.0
35;WYTWARZANIE I ZAOPATRYWANIE W ENERGIĘ ELEKTRYCZNĄ, GAZ, PARĘ WODNĄ I POWIETRZE DO UKŁADÓW KLIMATYZACYJNYCH;0.3491814601282096;26.0
74;POZOSTAŁA DZIAŁALNOŚĆ PROFESJONALNA, NAUKOWA I TECHNICZNA;0.34724053827917467;27.0
55;ZAKWATEROWANIE;0.3469219891439979;28.0
92;DZIAŁALNOŚĆ ZWIĄZANA Z GRAMI HAZARDOWYMI;0.33647541705111494;29.0
66;DZIAŁALNOŚĆ WSPOMAGAJĄCA USŁUGI FINANSOWE, UBEZPIECZENIA I FUNDUSZE EMERYTALNE;0.3345846446183447;30.0
18;POLIGRAFIA I REPRODUKCJA ZAPISANYCH NOŚNIKÓW INFORMACJI;0.33282815424259315;31.0
20;PRODUKCJA CHEMIKALIÓW I WYROBÓW CHEMICZNYCH;0.33267160116890615;32.0
08;POZOSTAŁE GÓRNICTWO I WYDOBYWANIE;0.3321986587491952;33.0
21;PRODUKCJA PODSTAWOWYCH SUBSTANCJI FARMACEUTYCZNYCH ORAZ LEKÓW I POZOSTAŁYCH WYROBÓW FARMACEUTYCZNYCH;0.32814081238937504;34.0
13;PRODUKCJA WYROBÓW TEKSTYLNYCH;0.32811614069430994;35.0
19;WYTWARZANIE I PRZETWARZANIE KOKSU I PRODUKTÓW RAFINACJI ROPY NAFTOWEJ;0.3279447218470443;36.0
32;POZOSTAŁA PRODUKCJA WYROBÓW;0.3269321299343231;37.0
49;TRANSPORT LĄDOWY ORAZ TRANSPORT RUROCIĄGOWY;0.324847745643927;38.0
30;PRODUKCJA POZOSTAŁEGO SPRZĘTU TRANSPORTOWEGO;0.3235906052742717;39.0
28;PRODUKCJA MASZYN I URZĄDZEŃ, GDZIE INDZIEJ NIESKLASYFIKOWANA;0.32242680814877683;40.0
38;DZIAŁALNOŚĆ ZWIĄZANA ZE ZBIERANIEM, ODZYSKIEM I UNIESZKODLIWIANIEM ODPADÓW;0.3215295766995321;41.0
52;MAGAZYNOWANIE, PRZECHOWYWANIE I DZIAŁALNOŚĆ USŁUGOWA WSPOMAGAJĄCA TRANSPORT;0.3214317020069271;42.0
31;PRODUKCJA MEBLI;0.3166946280158187;43.0
70;DZIAŁALNOŚĆ CENTRAL (HEAD OFFICES) ORAZ DORADZTWO ZWIĄZANE Z ZARZĄDZANIEM;0.31565170130177334;44.0
88;POMOC SPOŁECZNA BEZ ZAKWATEROWANIA;0.31079857173686737;45.0
25;PRODUKCJA METALOWYCH WYROBÓW GOTOWYCH, Z WYŁĄCZENIEM MASZYN I URZĄDZEŃ;0.31065097016338944;46.0
22;PRODUKCJA WYROBÓW Z GUMY I TWORZYW SZTUCZNYCH;0.31001226562927525;47.0
61;TELEKOMUNIKACJA;0.3088945304523603;48.0
41;ROBOTY BUDOWLANE ZWIĄZANE ZE WZNOSZENIEM BUDYNKÓW MIESZKALNYCH I NIEMIESZKALNYCH;0.30808502402688653;49.0
79;DZIAŁALNOŚĆ ORGANIZATORÓW TURYSTYKI, AGENTÓW TURYSTYCZNYCH ORAZ POZOSTAŁA DZIAŁALNOŚĆ USŁUGOWA W ZAKRESIE REZERWACJI I DZIAŁALNOŚCI Z NIĄ ZWIĄZANE;0.2977018595033863;50.0
68;DZIAŁALNOŚĆ ZWIĄZANA Z OBSŁUGĄ RYNKU NIERUCHOMOŚCI;0.29768364880163295;51.0
17;PRODUKCJA PAPIERU I WYROBÓW Z PAPIERU;0.29732540841365096;52.0
60;NADAWANIE PROGRAMÓW OGÓLNODOSTĘPNYCH I ABONAMENTOWYCH, DZIAŁALNOŚĆ AGENCJI INFORMACYJNYCH I POZOSTAŁA DZIAŁALNOŚĆ ZWIĄZANA Z DYSTRYBUCJĄ TREŚCI;0.29689888131374403;53.0
10;PRODUKCJA ARTYKUŁÓW SPOŻYWCZYCH;0.28563646438667906;54.0
16;"PRODUKCJA WYROBÓW Z DREWNA I KORKA, Z WYŁĄCZENIEM MEBLI; PRODUKCJA WYROBÓW ZE SŁOMY I MATERIAŁÓW UŻYWANYCH DO WYPLATANIA";0.2852213724499535;55.0
81;DZIAŁALNOŚĆ USŁUGOWA ZWIĄZANA Z UTRZYMANIEM PORZĄDKU W BUDYNKACH I ZAGOSPODAROWANIEM TERENÓW ZIELENI;0.28316257671331874;56.0
33;NAPRAWA, KONSERWACJA I INSTALOWANIE MASZYN I URZĄDZEŃ;0.2791521584127944;57.0
26;PRODUKCJA KOMPUTERÓW, WYROBÓW ELEKTRONICZNYCH I OPTYCZNYCH;0.27838969251685053;58.0
24;PRODUKCJA METALI;0.2772619152092616;59.0
90;DZIAŁALNOŚĆ TWÓRCZA I DZIAŁALNOŚĆ ZWIĄZANA Z WYSTAWIANIEM PRZEDSTAWIEŃ ARTYSTYCZNYCH;0.27511770745665504;60.0
73;DZIAŁALNOŚĆ W ZAKRESIE REKLAMY, BADANIA RYNKU I PUBLIC RELATIONS;0.2745925176147491;61.0
71;"DZIAŁALNOŚĆ W ZAKRESIE ARCHITEKTURY I INŻYNIERII; BADANIA I ANALIZY TECHNICZNE";0.27447699928226793;62.0
11;PRODUKCJA NAPOJÓW;0.27240318493329924;63.0
84;"ADMINISTRACJA PUBLICZNA I OBRONA NARODOWA; OBOWIĄZKOWE UBEZPIECZENIA SPOŁECZNE";0.2705939007646423;64.0
65;DZIAŁALNOŚĆ W ZAKRESIE UBEZPIECZEŃ, REASEKURACJI ORAZ FUNDUSZY EMERYTALNYCH, Z WYŁĄCZENIEM OBOWIĄZKOWEGO UBEZPIECZENIA SPOŁECZNEGO;0.27057925627465207;65.0
06;GÓRNICTWO ROPY NAFTOWEJ I GAZU ZIEMNEGO;0.27057660367631803;66.0
07;GÓRNICTWO RUD METALI;0.2705714087540463;67.0
98;GOSPODARSTWA DOMOWE PRODUKUJĄCE WYROBY I ŚWIADCZĄCE USŁUGI NA WŁASNE POTRZEBY;0.2705605239548817;68.0
99;ORGANIZACJE I ZESPOŁY EKSTERYTORIALNE;0.27055586164405987;69.0
97;GOSPODARSTWA DOMOWE ZATRUDNIAJĄCE PRACOWNIKÓW;0.27053742949678417;70.0
87;POMOC SPOŁECZNA Z ZAKWATEROWANIEM;0.26924683651543846;71.0
86;OPIEKA ZDROWOTNA;0.2676389117551107;72.0
46;HANDEL HURTOWY;0.2645755593205682;73.0
42;ROBOTY ZWIĄZANE Z BUDOWĄ OBIEKTÓW INŻYNIERII LĄDOWEJ I WODNEJ;0.2618410975494742;74.0
93;DZIAŁALNOŚĆ SPORTOWA, ROZRYWKOWA I REKREACYJNA;0.2579698013934084;75.0
56;DZIAŁALNOŚĆ USŁUGOWA ZWIĄZANA Z WYŻYWIENIEM;0.2545521517323598;76.0
29;PRODUKCJA POJAZDÓW SILNIKOWYCH, PRODUKCJA PRZYCZEP I NACZEP;0.25435042715815115;77.0
82;DZIAŁALNOŚĆ ZWIĄZANA Z ADMINISTRACYJNĄ OBSŁUGĄ BIURA I POZOSTAŁA DZIAŁALNOŚĆ WSPOMAGAJĄCA PROWADZENIE DZIAŁALNOŚCI GOSPODARCZEJ;0.25434233351051405;78.0
27;PRODUKCJA URZĄDZEŃ ELEKTRYCZNYCH;0.2541055267158723;79.0
85;EDUKACJA;0.2512301480511273;80.0
39;DZIAŁALNOŚĆ ZWIĄZANA Z REKULTYWACJĄ I POZOSTAŁA DZIAŁALNOŚĆ USŁUGOWA ZWIĄZANA Z GOSPODARKĄ ODPADAMI;0.24742975539199674;81.0
95;NAPRAWA I KONSERWACJA KOMPUTERÓW, ARTYKUŁÓW UŻYTKU OSOBISTEGO I DOMOWEGO ORAZ POJAZDÓW SILNIKOWYCH, W TYM MOTOCYKLI;0.23768329736326982;82.0
47;HANDEL DETALICZNY;0.23749999665644933;83.0
78;DZIAŁALNOŚĆ ZWIĄZANA Z ZATRUDNIENIEM;0.23395302623551012;84.0
53;DZIAŁALNOŚĆ POCZTOWA I KURIERSKA;0.20350897939958174;85.0
12;PRODUKCJA WYROBÓW TYTONIOWYCH;0.19767114972467403;86.0
09;DZIAŁALNOŚĆ USŁUGOWA WSPOMAGAJĄCA GÓRNICTWO I WYDOBYWANIE;0.1767078853684226;87.0
