alternative_id;nazwa;monte_carlo_score;monte_carlo_rank
05;WYDOBYWANIE WĘGLA KAMIENNEGO I WĘGLA BRUNATNEGO (LIGNITU);0.5341502552373228;1.0
80;DZIAŁALNOŚĆ DETEKTYWISTYCZNA I OCHRONIARSKA;0.4102994865855114;2.0
94;DZIAŁALNOŚĆ ORGANIZACJI CZŁONKOWSKICH;0.4092850275227895;3.0
35;WYTWARZANIE I ZAOPATRYWANIE W ENERGIĘ ELEKTRYCZNĄ, GAZ, PARĘ WODNĄ I POWIETRZE DO UKŁADÓW KLIMATYZACYJNYCH;0.4062080730369876;4.0
37;ODPROWADZANIE I OCZYSZCZANIE ŚCIEKÓW;0.3881600450573662;5.0
19;WYTWARZANIE I PRZETWARZANIE KOKSU I PRODUKTÓW RAFINACJI ROPY NAFTOWEJ;0.3740752971864852;6.0
50;TRANSPORT WODNY;0.37034490607654597;7.0
59;DZIAŁALNOŚĆ ZWIĄZANA Z PRODUKCJĄ FILMÓW, NAGRAŃ WIDEO, PROGRAMÓW TELEWIZYJNYCH, NAGRAŃ DŹWIĘKOWYCH I MUZYCZNYCH;0.3689566308316571;8.0
75;DZIAŁALNOŚĆ WETERYNARYJNA;0.3687706099835072;9.0
43;ROBOTY BUDOWLANE SPECJALISTYCZNE;0.3662955797994578;10.0
62;DZIAŁALNOŚĆ ZWIĄZANA Z PROGRAMOWANIEM, DORADZTWEM W ZAKRESIE INFORMATYKI I DZIAŁALNOŚCI POWIĄZANE;0.36304933658907584;11.0
70;DZIAŁALNOŚĆ CENTRAL (HEAD OFFICES) ORAZ DORADZTWO ZWIĄZANE Z ZARZĄDZANIEM;0.3607274813205421;12.0
61;TELEKOMUNIKACJA;0.35780798919538315;13.0
08;POZOSTAŁE GÓRNICTWO I WYDOBYWANIE;0.35676600462819585;14.0
55;ZAKWATEROWANIE;0.35667102222891134;15.0
51;TRANSPORT LOTNICZY;0.35577925345482647;16.0
64;FINANSOWA DZIAŁALNOŚĆ USŁUGOWA, Z WYŁĄCZENIEM UBEZPIECZEŃ I FUNDUSZY EMERYTALNYCH;0.35559484849052275;17.0
96;DZIAŁALNOŚĆ USŁUGOWA INDYWIDUALNA;0.3516046913955725;18.0
87;POMOC SPOŁECZNA Z ZAKWATEROWANIEM;0.34664464750122814;19.0
93;DZIAŁALNOŚĆ SPORTOWA, ROZRYWKOWA I REKREACYJNA;0.34606457105184374;20.0
77;WYNAJEM I DZIERŻAWA;0.33945140516504446;21.0
63;DZIAŁALNOŚĆ USŁUGOWA W ZAKRESIE INFRASTRUKTURY OBLICZENIOWEJ, PRZETWARZANIA DANYCH, ZARZĄDZANIA STRONAMI INTERNETOWYMI (HOSTING) I POZOSTAŁA DZIAŁALNOŚĆ USŁUGOWA W ZAKRESIE INFORMACJI;0.33818201288387995;22.0
91;DZIAŁALNOŚĆ BIBLIOTEK, ARCHIWÓW, MUZEÓW ORAZ POZOSTAŁA DZIAŁALNOŚĆ ZWIĄZANA Z KULTURĄ;0.3346317412044144;23.0
30;PRODUKCJA POZOSTAŁEGO SPRZĘTU TRANSPORTOWEGO;0.33187996208683734;24.0
03;RYBACTWO;0.33141462398791643;25.0
36;POBÓR, UZDATNIANIE I DOSTARCZANIE WODY;0.3310343466127073;26.0
69;DZIAŁALNOŚĆ PRAWNICZA, RACHUNKOWO-KSIĘGOWA I DORADZTWO PODATKOWE;0.32878006650334063;27.0
15;PRODUKCJA SKÓR I WYROBÓW ZE SKÓR WYPRAWIONYCH, PRODUKCJA PODOBNYCH WYROBÓW Z INNYCH MATERIAŁÓW;0.32782548623765106;28.0
23;PRODUKCJA WYROBÓW Z POZOSTAŁYCH MINERALNYCH SUROWCÓW NIEMETALICZNYCH;0.3273307461580943;29.0
11;PRODUKCJA NAPOJÓW;0.32659455661080494;30.0
49;TRANSPORT LĄDOWY ORAZ TRANSPORT RUROCIĄGOWY;0.32553735868801215;31.0
92;DZIAŁALNOŚĆ ZWIĄZANA Z GRAMI HAZARDOWYMI;0.32276603314731445;32.0
79;DZIAŁALNOŚĆ ORGANIZATORÓW TURYSTYKI, AGENTÓW TURYSTYCZNYCH ORAZ POZOSTAŁA DZIAŁALNOŚĆ USŁUGOWA W ZAKRESIE REZERWACJI I DZIAŁALNOŚCI Z NIĄ ZWIĄZANE;0.32073538651678485;33.0
72;BADANIA NAUKOWE I PRACE ROZWOJOWE;0.32051068139970806;34.0
20;PRODUKCJA CHEMIKALIÓW I WYROBÓW CHEMICZNYCH;0.32045021320594647;35.0
18;POLIGRAFIA I REPRODUKCJA ZAPISANYCH NOŚNIKÓW INFORMACJI;0.3203327309784631;36.0
38;DZIAŁALNOŚĆ ZWIĄZANA ZE ZBIERANIEM, ODZYSKIEM I UNIESZKODLIWIANIEM ODPADÓW;0.3201920258414281;37.0
02;LEŚNICTWO I POZYSKIWANIE DREWNA;0.31924543566929126;38.0
01;UPRAWY ROLNE, CHÓW I HODOWLA ZWIERZĄT, ŁOWIECTWO, W TYM DZIAŁALNOŚĆ USŁUGOWA;0.31862197317831836;39.0
13;PRODUKCJA WYROBÓW TEKSTYLNYCH;0.3160809092287399;40.0
74;POZOSTAŁA DZIAŁALNOŚĆ PROFESJONALNA, NAUKOWA I TECHNICZNA;0.3123727085807243;41.0
52;MAGAZYNOWANIE, PRZECHOWYWANIE I DZIAŁALNOŚĆ USŁUGOWA WSPOMAGAJĄCA TRANSPORT;0.31120009528076015;42.0
09;DZIAŁALNOŚĆ USŁUGOWA WSPOMAGAJĄCA GÓRNICTWO I WYDOBYWANIE;0.3103451290700722;43.0
14;PRODUKCJA ODZIEŻY;0.3098123205533167;44.0
28;PRODUKCJA MASZYN I URZĄDZEŃ, GDZIE INDZIEJ NIESKLASYFIKOWANA;0.3070496146512538;45.0
25;PRODUKCJA METALOWYCH WYROBÓW GOTOWYCH, Z WYŁĄCZENIEM MASZYN I URZĄDZEŃ;0.3070407703908955;46.0
31;PRODUKCJA MEBLI;0.3065478794728491;47.0
24;PRODUKCJA METALI;0.305816947785208;48.0
58;DZIAŁALNOŚĆ WYDAWNICZA;0.30489281383897104;49.0
86;OPIEKA ZDROWOTNA;0.30486879857316;50.0
41;ROBOTY BUDOWLANE ZWIĄZANE ZE WZNOSZENIEM BUDYNKÓW MIESZKALNYCH I NIEMIESZKALNYCH;0.3047668607927633;51.0
39;DZIAŁALNOŚĆ ZWIĄZANA Z REKULTYWACJĄ I POZOSTAŁA DZIAŁALNOŚĆ USŁUGOWA ZWIĄZANA Z GOSPODARKĄ ODPADAMI;0.3045994226269335;52.0
10;PRODUKCJA ARTYKUŁÓW SPOŻYWCZYCH;0.3034139281079691;53.0
22;PRODUKCJA WYROBÓW Z GUMY I TWORZYW SZTUCZNYCH;0.3028980046183533;54.0
88;POMOC SPOŁECZNA BEZ ZAKWATEROWANIA;0.30277482785141346;55.0
33;NAPRAWA, KONSERWACJA I INSTALOWANIE MASZYN I URZĄDZEŃ;0.30269719567613473;56.0
82;DZIAŁALNOŚĆ ZWIĄZANA Z ADMINISTRACYJNĄ OBSŁUGĄ BIURA I POZOSTAŁA DZIAŁALNOŚĆ WSPOMAGAJĄCA PROWADZENIE DZIAŁALNOŚCI GOSPODARCZEJ;0.3020386912444887;57.0
32;POZOSTAŁA PRODUKCJA WYROBÓW;0.3012475942992178;58.0
97;GOSPODARSTWA DOMOWE ZATRUDNIAJĄCE PRACOWNIKÓW;0.3011855749533687;59.0
07;GÓRNICTWO RUD METALI;0.30118476523903365;60.0
84;"ADMINISTRACJA PUBLICZNA I OBRONA NARODOWA; OBOWIĄZKOWE UBEZPIECZENIA SPOŁECZNE";0.30118059942741393;61.0
65;DZIAŁALNOŚĆ W ZAKRESIE UBEZPIECZEŃ, REASEKURACJI ORAZ FUNDUSZY EMERYTALNYCH, Z WYŁĄCZENIEM OBOWIĄZKOWEGO UBEZPIECZENIA SPOŁECZNEGO;0.301180443194838;62.0
99;ORGANIZACJE I ZESPOŁY EKSTERYTORIALNE;0.3011629298872988;63.0
98;GOSPODARSTWA DOMOWE PRODUKUJĄCE WYROBY I ŚWIADCZĄCE USŁUGI NA WŁASNE POTRZEBY;0.30116102301033854;64.0
46;HANDEL HURTOWY;0.3011538724335603;65.0
06;GÓRNICTWO ROPY NAFTOWEJ I GAZU ZIEMNEGO;0.3011418255088808;66.0
26;PRODUKCJA KOMPUTERÓW, WYROBÓW ELEKTRONICZNYCH I OPTYCZNYCH;0.3009131350320581;67.0
21;PRODUKCJA PODSTAWOWYCH SUBSTANCJI FARMACEUTYCZNYCH ORAZ LEKÓW I POZOSTAŁYCH WYROBÓW FARMACEUTYCZNYCH;0.29862231800194455;68.0
47;HANDEL DETALICZNY;0.29640359989395676;69.0
81;DZIAŁALNOŚĆ USŁUGOWA ZWIĄZANA Z UTRZYMANIEM PORZĄDKU W BUDYNKACH I ZAGOSPODAROWANIEM TERENÓW ZIELENI;0.2954695431535636;70.0
16;"PRODUKCJA WYROBÓW Z DREWNA I KORKA, Z WYŁĄCZENIEM MEBLI; PRODUKCJA WYROBÓW ZE SŁOMY I MATERIAŁÓW UŻYWANYCH DO WYPLATANIA";0.29405932228423554;71.0
42;ROBOTY ZWIĄZANE Z BUDOWĄ OBIEKTÓW INŻYNIERII LĄDOWEJ I WODNEJ;0.2940388808875529;72.0
85;EDUKACJA;0.2934480921835776;73.0
71;"DZIAŁALNOŚĆ W ZAKRESIE ARCHITEKTURY I INŻYNIERII; BADANIA I ANALIZY TECHNICZNE";0.29283344823036633;74.0
68;DZIAŁALNOŚĆ ZWIĄZANA Z OBSŁUGĄ RYNKU NIERUCHOMOŚCI;0.2927605107063123;75.0
17;PRODUKCJA PAPIERU I WYROBÓW Z PAPIERU;0.29150470575487836;76.0
60;NADAWANIE PROGRAMÓW OGÓLNODOSTĘPNYCH I ABONAMENTOWYCH, DZIAŁALNOŚĆ AGENCJI INFORMACYJNYCH I POZOSTAŁA DZIAŁALNOŚĆ ZWIĄZANA Z DYSTRYBUCJĄ TREŚCI;0.2911186079393866;77.0
29;PRODUKCJA POJAZDÓW SILNIKOWYCH, PRODUKCJA PRZYCZEP I NACZEP;0.29049823093592625;78.0
78;DZIAŁALNOŚĆ ZWIĄZANA Z ZATRUDNIENIEM;0.29033653107249396;79.0
27;PRODUKCJA URZĄDZEŃ ELEKTRYCZNYCH;0.2869203769171932;80.0
73;DZIAŁALNOŚĆ W ZAKRESIE REKLAMY, BADANIA RYNKU I PUBLIC RELATIONS;0.2868193849682315;81.0
66;DZIAŁALNOŚĆ WSPOMAGAJĄCA USŁUGI FINANSOWE, UBEZPIECZENIA I FUNDUSZE EMERYTALNE;0.2831725572768649;82.0
56;DZIAŁALNOŚĆ USŁUGOWA ZWIĄZANA Z WYŻYWIENIEM;0.28233183837310205;83.0
95;NAPRAWA I KONSERWACJA KOMPUTERÓW, ARTYKUŁÓW UŻYTKU OSOBISTEGO I DOMOWEGO ORAZ POJAZDÓW SILNIKOWYCH, W TYM MOTOCYKLI;0.28230141522104313;84.0
53;DZIAŁALNOŚĆ POCZTOWA I KURIERSKA;0.27583194510094594;85.0
12;PRODUKCJA WYROBÓW TYTONIOWYCH;0.2732102382185854;86.0
90;DZIAŁALNOŚĆ TWÓRCZA I DZIAŁALNOŚĆ ZWIĄZANA Z WYSTAWIANIEM PRZEDSTAWIEŃ ARTYSTYCZNYCH;0.1661600811222847;87.0
