alternative_id;nazwa;ensemble_score;ensemble_rank
60;NADAWANIE PROGRAMÓW OGÓLNODOSTĘPNYCH I ABONAMENTOWYCH, DZIAŁALNOŚĆ AGENCJI INFORMACYJNYCH I POZOSTAŁA DZIAŁALNOŚĆ ZWIĄZANA Z DYSTRYBUCJĄ TREŚCI;0.8027403508792111;1.0
77;WYNAJEM I DZIERŻAWA;0.7638255591239873;2.0
87;POMOC SPOŁECZNA Z ZAKWATEROWANIEM;0.7192964109902273;3.0
37;ODPROWADZANIE I OCZYSZCZANIE ŚCIEKÓW;0.7032026201235831;4.0
36;POBÓR, UZDATNIANIE I DOSTARCZANIE WODY;0.7010197740679047;5.0
55;ZAKWATEROWANIE;0.6985125142934355;6.0
91;DZIAŁALNOŚĆ BIBLIOTEK, ARCHIWÓW, MUZEÓW ORAZ POZOSTAŁA DZIAŁALNOŚĆ ZWIĄZANA Z KULTURĄ;0.6906577606389632;7.0
93;DZIAŁALNOŚĆ SPORTOWA, ROZRYWKOWA I REKREACYJNA;0.6791730496581725;8.0
63;DZIAŁALNOŚĆ USŁUGOWA W ZAKRESIE INFRASTRUKTURY OBLICZENIOWEJ, PRZETWARZANIA DANYCH, ZARZĄDZANIA STRONAMI INTERNETOWYMI (HOSTING) I POZOSTAŁA DZIAŁALNOŚĆ USŁUGOWA W ZAKRESIE INFORMACJI;0.6590904706351837;9.0
56;DZIAŁALNOŚĆ USŁUGOWA ZWIĄZANA Z WYŻYWIENIEM;0.6445948000288069;10.0
94;DZIAŁALNOŚĆ ORGANIZACJI CZŁONKOWSKICH;0.6343814619876855;11.0
64;FINANSOWA DZIAŁALNOŚĆ USŁUGOWA, Z WYŁĄCZENIEM UBEZPIECZEŃ I FUNDUSZY EMERYTALNYCH;0.6307322160956993;12.0
61;TELEKOMUNIKACJA;0.6295913891523242;13.0
01;UPRAWY ROLNE, CHÓW I HODOWLA ZWIERZĄT, ŁOWIECTWO, W TYM DZIAŁALNOŚĆ USŁUGOWA;0.5908534498408287;14.0
50;TRANSPORT WODNY;0.5876397996475672;15.0
86;OPIEKA ZDROWOTNA;0.5863198044571458;16.0
68;DZIAŁALNOŚĆ ZWIĄZANA Z OBSŁUGĄ RYNKU NIERUCHOMOŚCI;0.5851360109399713;17.0
32;POZOSTAŁA PRODUKCJA WYROBÓW;0.5826944667924745;18.0
23;PRODUKCJA WYROBÓW Z POZOSTAŁYCH MINERALNYCH SUROWCÓW NIEMETALICZNYCH;0.5809089850316544;19.0
85;EDUKACJA;0.579069815069952;20.0
39;DZIAŁALNOŚĆ ZWIĄZANA Z REKULTYWACJĄ I POZOSTAŁA DZIAŁALNOŚĆ USŁUGOWA ZWIĄZANA Z GOSPODARKĄ ODPADAMI;0.5612995148094383;21.0
38;DZIAŁALNOŚĆ ZWIĄZANA ZE ZBIERANIEM, ODZYSKIEM I UNIESZKODLIWIANIEM ODPADÓW;0.5600931819774108;22.0
31;PRODUKCJA MEBLI;0.5576905482700857;23.0
03;RYBACTWO;0.5549400244128566;24.0
09;DZIAŁALNOŚĆ USŁUGOWA WSPOMAGAJĄCA GÓRNICTWO I WYDOBYWANIE;0.5547162513679282;25.0
19;WYTWARZANIE I PRZETWARZANIE KOKSU I PRODUKTÓW RAFINACJI ROPY NAFTOWEJ;0.5460011350067567;26.0
17;PRODUKCJA PAPIERU I WYROBÓW Z PAPIERU;0.5447991035691845;27.0
59;DZIAŁALNOŚĆ ZWIĄZANA Z PRODUKCJĄ FILMÓW, NAGRAŃ WIDEO, PROGRAMÓW TELEWIZYJNYCH, NAGRAŃ DŹWIĘKOWYCH I MUZYCZNYCH;0.5423592171961316;28.0
24;PRODUKCJA METALI;0.5380713966569689;29.0
08;POZOSTAŁE GÓRNICTWO I WYDOBYWANIE;0.5277072748272208;30.0
49;TRANSPORT LĄDOWY ORAZ TRANSPORT RUROCIĄGOWY;0.5261690604577878;31.0
58;DZIAŁALNOŚĆ WYDAWNICZA;0.5257153139905385;32.0
70;DZIAŁALNOŚĆ CENTRAL (HEAD OFFICES) ORAZ DORADZTWO ZWIĄZANE Z ZARZĄDZANIEM;0.5237351631080894;33.0
11;PRODUKCJA NAPOJÓW;0.5200219725460213;34.0
30;PRODUKCJA POZOSTAŁEGO SPRZĘTU TRANSPORTOWEGO;0.519927357848974;35.0
10;PRODUKCJA ARTYKUŁÓW SPOŻYWCZYCH;0.5096886124526692;36.0
16;"PRODUKCJA WYROBÓW Z DREWNA I KORKA, Z WYŁĄCZENIEM MEBLI; PRODUKCJA WYROBÓW ZE SŁOMY I MATERIAŁÓW UŻYWANYCH DO WYPLATANIA";0.509407375067824;37.0
95;NAPRAWA I KONSERWACJA KOMPUTERÓW, ARTYKUŁÓW UŻYTKU OSOBISTEGO I DOMOWEGO ORAZ POJAZDÓW SILNIKOWYCH, W TYM MOTOCYKLI;0.5069048732657673;38.0
96;DZIAŁALNOŚĆ USŁUGOWA INDYWIDUALNA;0.5062931730704592;39.0
13;PRODUKCJA WYROBÓW TEKSTYLNYCH;0.5041479655247434;40.0
73;DZIAŁALNOŚĆ W ZAKRESIE REKLAMY, BADANIA RYNKU I PUBLIC RELATIONS;0.5019923697745481;41.0
42;ROBOTY ZWIĄZANE Z BUDOWĄ OBIEKTÓW INŻYNIERII LĄDOWEJ I WODNEJ;0.49986600439872175;42.0
25;PRODUKCJA METALOWYCH WYROBÓW GOTOWYCH, Z WYŁĄCZENIEM MASZYN I URZĄDZEŃ;0.49164338861923457;43.0
82;DZIAŁALNOŚĆ ZWIĄZANA Z ADMINISTRACYJNĄ OBSŁUGĄ BIURA I POZOSTAŁA DZIAŁALNOŚĆ WSPOMAGAJĄCA PROWADZENIE DZIAŁALNOŚCI GOSPODARCZEJ;0.49126602107117723;44.0
18;POLIGRAFIA I REPRODUKCJA ZAPISANYCH NOŚNIKÓW INFORMACJI;0.4910588583011822;45.0
52;MAGAZYNOWANIE, PRZECHOWYWANIE I DZIAŁALNOŚĆ USŁUGOWA WSPOMAGAJĄCA TRANSPORT;0.48811955383107575;46.0
20;PRODUKCJA CHEMIKALIÓW I WYROBÓW CHEMICZNYCH;0.48339089350936;47.0
21;PRODUKCJA PODSTAWOWYCH SUBSTANCJI FARMACEUTYCZNYCH ORAZ LEKÓW I POZOSTAŁYCH WYROBÓW FARMACEUTYCZNYCH;0.4824446565321252;48.0
14;PRODUKCJA ODZIEŻY;0.4749422429008979;49.0
22;PRODUKCJA WYROBÓW Z GUMY I TWORZYW SZTUCZNYCH;0.47147169463340566;50.0
72;BADANIA NAUKOWE I PRACE ROZWOJOWE;0.4708456771141949;51.0
92;DZIAŁALNOŚĆ ZWIĄZANA Z GRAMI HAZARDOWYMI;0.4613924162054315;52.0
47;HANDEL DETALICZNY;0.45202453006938814;53.0
35;WYTWARZANIE I ZAOPATRYWANIE W ENERGIĘ ELEKTRYCZNĄ, GAZ, PARĘ WODNĄ I POWIETRZE DO UKŁADÓW KLIMATYZACYJNYCH;0.448238423182187;54.0
65;DZIAŁALNOŚĆ W ZAKRESIE UBEZPIECZEŃ, REASEKURACJI ORAZ FUNDUSZY EMERYTALNYCH, Z WYŁĄCZENIEM OBOWIĄZKOWEGO UBEZPIECZENIA SPOŁECZNEGO;0.4469736289037952;55.0
07;GÓRNICTWO RUD METALI;0.44694289183793257;56.0
97;GOSPODARSTWA DOMOWE ZATRUDNIAJĄCE PRACOWNIKÓW;0.44693736964062764;57.0
84;"ADMINISTRACJA PUBLICZNA I OBRONA NARODOWA; OBOWIĄZKOWE UBEZPIECZENIA SPOŁECZNE";0.4469242205883202;58.0
99;ORGANIZACJE I ZESPOŁY EKSTERYTORIALNE;0.4469033289662073;59.0
06;GÓRNICTWO ROPY NAFTOWEJ I GAZU ZIEMNEGO;0.44688263341780077;60.0
98;GOSPODARSTWA DOMOWE PRODUKUJĄCE WYROBY I ŚWIADCZĄCE USŁUGI NA WŁASNE POTRZEBY;0.4468758700868577;61.0
26;PRODUKCJA KOMPUTERÓW, WYROBÓW ELEKTRONICZNYCH I OPTYCZNYCH;0.44318010352304527;62.0
62;DZIAŁALNOŚĆ ZWIĄZANA Z PROGRAMOWANIEM, DORADZTWEM W ZAKRESIE INFORMATYKI I DZIAŁALNOŚCI POWIĄZANE;0.4429828077899229;63.0
88;POMOC SPOŁECZNA BEZ ZAKWATEROWANIA;0.44004327193533227;64.0
28;PRODUKCJA MASZYN I URZĄDZEŃ, GDZIE INDZIEJ NIESKLASYFIKOWANA;0.4392553585373783;65.0
46;HANDEL HURTOWY;0.4301411488299418;66.0
81;DZIAŁALNOŚĆ USŁUGOWA ZWIĄZANA Z UTRZYMANIEM PORZĄDKU W BUDYNKACH I ZAGOSPODAROWANIEM TERENÓW ZIELENI;0.42840150814376365;67.0
29;PRODUKCJA POJAZDÓW SILNIKOWYCH, PRODUKCJA PRZYCZEP I NACZEP;0.4267623097639576;68.0
27;PRODUKCJA URZĄDZEŃ ELEKTRYCZNYCH;0.419094958702979;69.0
78;DZIAŁALNOŚĆ ZWIĄZANA Z ZATRUDNIENIEM;0.4096810789605936;70.0
41;ROBOTY BUDOWLANE ZWIĄZANE ZE WZNOSZENIEM BUDYNKÓW MIESZKALNYCH I NIEMIESZKALNYCH;0.40691205725502305;71.0
43;ROBOTY BUDOWLANE SPECJALISTYCZNE;0.401447282684145;72.0
71;"DZIAŁALNOŚĆ W ZAKRESIE ARCHITEKTURY I INŻYNIERII; BADANIA I ANALIZY TECHNICZNE";0.3959314172188533;73.0
74;POZOSTAŁA DZIAŁALNOŚĆ PROFESJONALNA, NAUKOWA I TECHNICZNA;0.38970876245584246;74.0
69;DZIAŁALNOŚĆ PRAWNICZA, RACHUNKOWO-KSIĘGOWA I DORADZTWO PODATKOWE;0.383701220865019;75.0
15;PRODUKCJA SKÓR I WYROBÓW ZE SKÓR WYPRAWIONYCH, PRODUKCJA PODOBNYCH WYROBÓW Z INNYCH MATERIAŁÓW;0.38329841275360205;76.0
33;NAPRAWA, KONSERWACJA I INSTALOWANIE MASZYN I URZĄDZEŃ;0.38198853124787857;77.0
53;DZIAŁALNOŚĆ POCZTOWA I KURIERSKA;0.3792789629313006;78.0
12;PRODUKCJA WYROBÓW TYTONIOWYCH;0.3750967615641097;79.0
80;DZIAŁALNOŚĆ DETEKTYWISTYCZNA I OCHRONIARSKA;0.37327349264353016;80.0
75;DZIAŁALNOŚĆ WETERYNARYJNA;0.3598649435828001;81.0
05;WYDOBYWANIE WĘGLA KAMIENNEGO I WĘGLA BRUNATNEGO (LIGNITU);0.35346425637356266;82.0
90;DZIAŁALNOŚĆ TWÓRCZA I DZIAŁALNOŚĆ ZWIĄZANA Z WYSTAWIANIEM PRZEDSTAWIEŃ ARTYSTYCZNYCH;0.35138249778146236;83.0
02;LEŚNICTWO I POZYSKIWANIE DREWNA;0.3155764987914572;84.0
66;DZIAŁALNOŚĆ WSPOMAGAJĄCA USŁUGI FINANSOWE, UBEZPIECZENIA I FUNDUSZE EMERYTALNE;0.3095307676569021;85.0
79;DZIAŁALNOŚĆ ORGANIZATORÓW TURYSTYKI, AGENTÓW TURYSTYCZNYCH ORAZ POZOSTAŁA DZIAŁALNOŚĆ USŁUGOWA W ZAKRESIE REZERWACJI I DZIAŁALNOŚCI Z NIĄ ZWIĄZANE;0.2955722119389922;86.0
51;TRANSPORT LOTNICZY;0.13839201635588094;87.0
