alternative_id;nazwa;topsis_score;topsis_rank
94;DZIAŁALNOŚĆ ORGANIZACJI CZŁONKOWSKICH;0.5375919786128538;1.0
64;FINANSOWA DZIAŁALNOŚĆ USŁUGOWA, Z WYŁĄCZENIEM UBEZPIECZEŃ I FUNDUSZY EMERYTALNYCH;0.49515537420151856;2.0
03;RYBACTWO;0.45289008525577734;3.0
77;WYNAJEM I DZIERŻAWA;0.3945376843829822;4.0
70;DZIAŁALNOŚĆ CENTRAL (HEAD OFFICES) ORAZ DORADZTWO ZWIĄZANE Z ZARZĄDZANIEM;0.38973062200412917;5.0
58;DZIAŁALNOŚĆ WYDAWNICZA;0.3839881518316311;6.0
02;LEŚNICTWO I POZYSKIWANIE DREWNA;0.3830484570084125;7.0
21;PRODUKCJA PODSTAWOWYCH SUBSTANCJI FARMACEUTYCZNYCH ORAZ LEKÓW I POZOSTAŁYCH WYROBÓW FARMACEUTYCZNYCH;0.35195267622194715;8.0
08;POZOSTAŁE GÓRNICTWO I WYDOBYWANIE;0.34454034057559507;9.0
85;EDUKACJA;0.33132833180150584;10.0
01;UPRAWY ROLNE, CHÓW I HODOWLA ZWIERZĄT, ŁOWIECTWO, W TYM DZIAŁALNOŚĆ USŁUGOWA;0.3301335225370393;11.0
69;DZIAŁALNOŚĆ PRAWNICZA, RACHUNKOWO-KSIĘGOWA I DORADZTWO PODATKOWE;0.32737390675788003;12.0
51;TRANSPORT LOTNICZY;0.32121131287416577;13.0
96;DZIAŁALNOŚĆ USŁUGOWA INDYWIDUALNA;0.3195434180072883;14.0
61;TELEKOMUNIKACJA;0.31748174210919405;15.0
19;WYTWARZANIE I PRZETWARZANIE KOKSU I PRODUKTÓW RAFINACJI ROPY NAFTOWEJ;0.31283545379334454;16.0
82;DZIAŁALNOŚĆ ZWIĄZANA Z ADMINISTRACYJNĄ OBSŁUGĄ BIURA I POZOSTAŁA DZIAŁALNOŚĆ WSPOMAGAJĄCA PROWADZENIE DZIAŁALNOŚCI GOSPODARCZEJ;0.3100723025160006;17.0
90;DZIAŁALNOŚĆ TWÓRCZA I DZIAŁALNOŚĆ ZWIĄZANA Z WYSTAWIANIEM PRZEDSTAWIEŃ ARTYSTYCZNYCH;0.3081899116663629;18.0
38;DZIAŁALNOŚĆ ZWIĄZANA ZE ZBIERANIEM, ODZYSKIEM I UNIESZKODLIWIANIEM ODPADÓW;0.3039128136807564;19.0
63;DZIAŁALNOŚĆ USŁUGOWA W ZAKRESIE INFRASTRUKTURY OBLICZENIOWEJ, PRZETWARZANIA DANYCH, ZARZĄDZANIA STRONAMI INTERNETOWYMI (HOSTING) I POZOSTAŁA DZIAŁALNOŚĆ USŁUGOWA W ZAKRESIE INFORMACJI;0.30131561258507567;20.0
55;ZAKWATEROWANIE;0.298643664244592;21.0
60;NADAWANIE PROGRAMÓW OGÓLNODOSTĘPNYCH I ABONAMENTOWYCH, DZIAŁALNOŚĆ AGENCJI INFORMACYJNYCH I POZOSTAŁA DZIAŁALNOŚĆ ZWIĄZANA Z DYSTRYBUCJĄ TREŚCI;0.2965825975806912;22.0
91;DZIAŁALNOŚĆ BIBLIOTEK, ARCHIWÓW, MUZEÓW ORAZ POZOSTAŁA DZIAŁALNOŚĆ ZWIĄZANA Z KULTURĄ;0.29411165299551434;23.0
62;DZIAŁALNOŚĆ ZWIĄZANA Z PROGRAMOWANIEM, DORADZTWEM W ZAKRESIE INFORMATYKI I DZIAŁALNOŚCI POWIĄZANE;0.28822944004357864;24.0
14;PRODUKCJA ODZIEŻY;0.28804295873152624;25.0
66;DZIAŁALNOŚĆ WSPOMAGAJĄCA USŁUGI FINANSOWE, UBEZPIECZENIA I FUNDUSZE EMERYTALNE;0.2759526488348646;26.0
59;DZIAŁALNOŚĆ ZWIĄZANA Z PRODUKCJĄ FILMÓW, NAGRAŃ WIDEO, PROGRAMÓW TELEWIZYJNYCH, NAGRAŃ DŹWIĘKOWYCH I MUZYCZNYCH;0.2730281393563532;27.0
39;DZIAŁALNOŚĆ ZWIĄZANA Z REKULTYWACJĄ I POZOSTAŁA DZIAŁALNOŚĆ USŁUGOWA ZWIĄZANA Z GOSPODARKĄ ODPADAMI;0.27215166980248345;28.0
32;POZOSTAŁA PRODUKCJA WYROBÓW;0.27068758633558165;29.0
23;PRODUKCJA WYROBÓW Z POZOSTAŁYCH MINERALNYCH SUROWCÓW NIEMETALICZNYCH;0.27034011758818555;30.0
41;ROBOTY BUDOWLANE ZWIĄZANE ZE WZNOSZENIEM BUDYNKÓW MIESZKALNYCH I NIEMIESZKALNYCH;0.2691839436401376;31.0
52;MAGAZYNOWANIE, PRZECHOWYWANIE I DZIAŁALNOŚĆ USŁUGOWA WSPOMAGAJĄCA TRANSPORT;0.26632181342824096;32.0
56;DZIAŁALNOŚĆ USŁUGOWA ZWIĄZANA Z WYŻYWIENIEM;0.2656128737538743;33.0
42;ROBOTY ZWIĄZANE Z BUDOWĄ OBIEKTÓW INŻYNIERII LĄDOWEJ I WODNEJ;0.2648357507937003;34.0
43;ROBOTY BUDOWLANE SPECJALISTYCZNE;0.2637223941496311;35.0
17;PRODUKCJA PAPIERU I WYROBÓW Z PAPIERU;0.26137501064052443;36.0
79;DZIAŁALNOŚĆ ORGANIZATORÓW TURYSTYKI, AGENTÓW TURYSTYCZNYCH ORAZ POZOSTAŁA DZIAŁALNOŚĆ USŁUGOWA W ZAKRESIE REZERWACJI I DZIAŁALNOŚCI Z NIĄ ZWIĄZANE;0.2575649855711183;37.0
87;POMOC SPOŁECZNA Z ZAKWATEROWANIEM;0.2574152632392245;38.0
74;POZOSTAŁA DZIAŁALNOŚĆ PROFESJONALNA, NAUKOWA I TECHNICZNA;0.25639112364518585;39.0
93;DZIAŁALNOŚĆ SPORTOWA, ROZRYWKOWA I REKREACYJNA;0.2561572109369915;40.0
18;POLIGRAFIA I REPRODUKCJA ZAPISANYCH NOŚNIKÓW INFORMACJI;0.2551466836955244;41.0
81;DZIAŁALNOŚĆ USŁUGOWA ZWIĄZANA Z UTRZYMANIEM PORZĄDKU W BUDYNKACH I ZAGOSPODAROWANIEM TERENÓW ZIELENI;0.254907335348195;42.0
11;PRODUKCJA NAPOJÓW;0.25429240895297683;43.0
22;PRODUKCJA WYROBÓW Z GUMY I TWORZYW SZTUCZNYCH;0.2526185011449558;44.0
25;PRODUKCJA METALOWYCH WYROBÓW GOTOWYCH, Z WYŁĄCZENIEM MASZYN I URZĄDZEŃ;0.25130707879630865;45.0
16;"PRODUKCJA WYROBÓW Z DREWNA I KORKA, Z WYŁĄCZENIEM MEBLI; PRODUKCJA WYROBÓW ZE SŁOMY I MATERIAŁÓW UŻYWANYCH DO WYPLATANIA";0.25009598229166824;46.0
68;DZIAŁALNOŚĆ ZWIĄZANA Z OBSŁUGĄ RYNKU NIERUCHOMOŚCI;0.2498753079708342;47.0
73;DZIAŁALNOŚĆ W ZAKRESIE REKLAMY, BADANIA RYNKU I PUBLIC RELATIONS;0.24917869361101075;48.0
50;TRANSPORT WODNY;0.24783887094971283;49.0
28;PRODUKCJA MASZYN I URZĄDZEŃ, GDZIE INDZIEJ NIESKLASYFIKOWANA;0.2460627706096976;50.0
31;PRODUKCJA MEBLI;0.24220102750078198;51.0
13;PRODUKCJA WYROBÓW TEKSTYLNYCH;0.24185148421836064;52.0
86;OPIEKA ZDROWOTNA;0.24045727362249883;53.0
30;PRODUKCJA POZOSTAŁEGO SPRZĘTU TRANSPORTOWEGO;0.23754324152335962;54.0
26;PRODUKCJA KOMPUTERÓW, WYROBÓW ELEKTRONICZNYCH I OPTYCZNYCH;0.234183534296514;55.0
78;DZIAŁALNOŚĆ ZWIĄZANA Z ZATRUDNIENIEM;0.2330112210547419;56.0
10;PRODUKCJA ARTYKUŁÓW SPOŻYWCZYCH;0.23250381955092816;57.0
71;"DZIAŁALNOŚĆ W ZAKRESIE ARCHITEKTURY I INŻYNIERII; BADANIA I ANALIZY TECHNICZNE";0.23217596222007653;58.0
98;GOSPODARSTWA DOMOWE PRODUKUJĄCE WYROBY I ŚWIADCZĄCE USŁUGI NA WŁASNE POTRZEBY;0.23039690894718093;62.0
65;DZIAŁALNOŚĆ W ZAKRESIE UBEZPIECZEŃ, REASEKURACJI ORAZ FUNDUSZY EMERYTALNYCH, Z WYŁĄCZENIEM OBOWIĄZKOWEGO UBEZPIECZENIA SPOŁECZNEGO;0.23039690894718093;62.0
07;GÓRNICTWO RUD METALI;0.23039690894718093;62.0
97;GOSPODARSTWA DOMOWE ZATRUDNIAJĄCE PRACOWNIKÓW;0.23039690894718093;62.0
06;GÓRNICTWO ROPY NAFTOWEJ I GAZU ZIEMNEGO;0.23039690894718093;62.0
84;"ADMINISTRACJA PUBLICZNA I OBRONA NARODOWA; OBOWIĄZKOWE UBEZPIECZENIA SPOŁECZNE";0.23039690894718093;62.0
99;ORGANIZACJE I ZESPOŁY EKSTERYTORIALNE;0.23039690894718093;62.0
75;DZIAŁALNOŚĆ WETERYNARYJNA;0.23032031265211958;66.0
15;PRODUKCJA SKÓR I WYROBÓW ZE SKÓR WYPRAWIONYCH, PRODUKCJA PODOBNYCH WYROBÓW Z INNYCH MATERIAŁÓW;0.230275716753442;67.0
92;DZIAŁALNOŚĆ ZWIĄZANA Z GRAMI HAZARDOWYMI;0.22880543097700407;68.0
37;ODPROWADZANIE I OCZYSZCZANIE ŚCIEKÓW;0.2268658054878693;69.0
53;DZIAŁALNOŚĆ POCZTOWA I KURIERSKA;0.21880566434397167;70.0
95;NAPRAWA I KONSERWACJA KOMPUTERÓW, ARTYKUŁÓW UŻYTKU OSOBISTEGO I DOMOWEGO ORAZ POJAZDÓW SILNIKOWYCH, W TYM MOTOCYKLI;0.21748587097949934;71.0
33;NAPRAWA, KONSERWACJA I INSTALOWANIE MASZYN I URZĄDZEŃ;0.21698029873112615;72.0
80;DZIAŁALNOŚĆ DETEKTYWISTYCZNA I OCHRONIARSKA;0.2161269770212797;73.0
49;TRANSPORT LĄDOWY ORAZ TRANSPORT RUROCIĄGOWY;0.2156285867542754;74.0
72;BADANIA NAUKOWE I PRACE ROZWOJOWE;0.21548088418057923;75.0
46;HANDEL HURTOWY;0.2095441281793622;76.0
20;PRODUKCJA CHEMIKALIÓW I WYROBÓW CHEMICZNYCH;0.20910213101153186;77.0
36;POBÓR, UZDATNIANIE I DOSTARCZANIE WODY;0.20735231308532773;78.0
27;PRODUKCJA URZĄDZEŃ ELEKTRYCZNYCH;0.2051115275375237;79.0
47;HANDEL DETALICZNY;0.19833442481394234;80.0
35;WYTWARZANIE I ZAOPATRYWANIE W ENERGIĘ ELEKTRYCZNĄ, GAZ, PARĘ WODNĄ I POWIETRZE DO UKŁADÓW KLIMATYZACYJNYCH;0.1972735540849221;81.0
88;POMOC SPOŁECZNA BEZ ZAKWATEROWANIA;0.19494427169916462;82.0
29;PRODUKCJA POJAZDÓW SILNIKOWYCH, PRODUKCJA PRZYCZEP I NACZEP;0.19449452674292902;83.0
12;PRODUKCJA WYROBÓW TYTONIOWYCH;0.19430677965780113;84.0
24;PRODUKCJA METALI;0.19422835741211453;85.0
09;DZIAŁALNOŚĆ USŁUGOWA WSPOMAGAJĄCA GÓRNICTWO I WYDOBYWANIE;0.14002143186889668;86.0
05;WYDOBYWANIE WĘGLA KAMIENNEGO I WĘGLA BRUNATNEGO (LIGNITU);0.044264044739243676;87.0
