alternative_id;nazwa;monte_carlo_score;monte_carlo_rank
75;DZIAŁALNOŚĆ WETERYNARYJNA;0.5289405050096885;1.0
70;DZIAŁALNOŚĆ CENTRAL (HEAD OFFICES) ORAZ DORADZTWO ZWIĄZANE Z ZARZĄDZANIEM;0.5288562348428336;2.0
03;RYBACTWO;0.47534518629954203;3.0
94;DZIAŁALNOŚĆ ORGANIZACJI CZŁONKOWSKICH;0.46917595718685207;4.0
24;PRODUKCJA METALI;0.46434982520867635;5.0
05;WYDOBYWANIE WĘGLA KAMIENNEGO I WĘGLA BRUNATNEGO (LIGNITU);0.46003095847837633;6.0
64;FINANSOWA DZIAŁALNOŚĆ USŁUGOWA, Z WYŁĄCZENIEM UBEZPIECZEŃ I FUNDUSZY EMERYTALNYCH;0.43956204594256987;7.0
50;TRANSPORT WODNY;0.4370100519846215;8.0
02;LEŚNICTWO I POZYSKIWANIE DREWNA;0.43041038179941554;9.0
74;POZOSTAŁA DZIAŁALNOŚĆ PROFESJONALNA, NAUKOWA I TECHNICZNA;0.4297878122318355;10.0
32;POZOSTAŁA PRODUKCJA WYROBÓW;0.40825261420477543;11.0
78;DZIAŁALNOŚĆ ZWIĄZANA Z ZATRUDNIENIEM;0.4048327211170983;12.0
55;ZAKWATEROWANIE;0.40452659800743174;13.0
51;TRANSPORT LOTNICZY;0.40264641475501467;14.0
16;"PRODUKCJA WYROBÓW Z DREWNA I KORKA, Z WYŁĄCZENIEM MEBLI; PRODUKCJA WYROBÓW ZE SŁOMY I MATERIAŁÓW UŻYWANYCH DO WYPLATANIA";0.40204543481465305;15.0
91;DZIAŁALNOŚĆ BIBLIOTEK, ARCHIWÓW, MUZEÓW ORAZ POZOSTAŁA DZIAŁALNOŚĆ ZWIĄZANA Z KULTURĄ;0.39888581324997024;16.0
12;PRODUKCJA WYROBÓW TYTONIOWYCH;0.3987172403707538;17.0
38;DZIAŁALNOŚĆ ZWIĄZANA ZE ZBIERANIEM, ODZYSKIEM I UNIESZKODLIWIANIEM ODPADÓW;0.39830156399954775;18.0
69;DZIAŁALNOŚĆ PRAWNICZA, RACHUNKOWO-KSIĘGOWA I DORADZTWO PODATKOWE;0.3976260319697331;19.0
82;DZIAŁALNOŚĆ ZWIĄZANA Z ADMINISTRACYJNĄ OBSŁUGĄ BIURA I POZOSTAŁA DZIAŁALNOŚĆ WSPOMAGAJĄCA PROWADZENIE DZIAŁALNOŚCI GOSPODARCZEJ;0.3975723125468145;20.0
85;EDUKACJA;0.3964159521165697;21.0
58;DZIAŁALNOŚĆ WYDAWNICZA;0.39530218117397886;22.0
61;TELEKOMUNIKACJA;0.3949398470908868;23.0
96;DZIAŁALNOŚĆ USŁUGOWA INDYWIDUALNA;0.3942143478075865;24.0
72;BADANIA NAUKOWE I PRACE ROZWOJOWE;0.39399229995962953;25.0
19;WYTWARZANIE I PRZETWARZANIE KOKSU I PRODUKTÓW RAFINACJI ROPY NAFTOWEJ;0.3933794469916883;26.0
49;TRANSPORT LĄDOWY ORAZ TRANSPORT RUROCIĄGOWY;0.39278074933379736;27.0
28;PRODUKCJA MASZYN I URZĄDZEŃ, GDZIE INDZIEJ NIESKLASYFIKOWANA;0.3911650978978129;28.0
08;POZOSTAŁE GÓRNICTWO I WYDOBYWANIE;0.3896183628693469;29.0
52;MAGAZYNOWANIE, PRZECHOWYWANIE I DZIAŁALNOŚĆ USŁUGOWA WSPOMAGAJĄCA TRANSPORT;0.3890264636736962;30.0
90;DZIAŁALNOŚĆ TWÓRCZA I DZIAŁALNOŚĆ ZWIĄZANA Z WYSTAWIANIEM PRZEDSTAWIEŃ ARTYSTYCZNYCH;0.388345464046619;31.0
25;PRODUKCJA METALOWYCH WYROBÓW GOTOWYCH, Z WYŁĄCZENIEM MASZYN I URZĄDZEŃ;0.38701389583452417;32.0
20;PRODUKCJA CHEMIKALIÓW I WYROBÓW CHEMICZNYCH;0.38468196515116226;33.0
17;PRODUKCJA PAPIERU I WYROBÓW Z PAPIERU;0.3835392877189942;34.0
18;POLIGRAFIA I REPRODUKCJA ZAPISANYCH NOŚNIKÓW INFORMACJI;0.383371780405526;35.0
41;ROBOTY BUDOWLANE ZWIĄZANE ZE WZNOSZENIEM BUDYNKÓW MIESZKALNYCH I NIEMIESZKALNYCH;0.38293915717922505;36.0
60;NADAWANIE PROGRAMÓW OGÓLNODOSTĘPNYCH I ABONAMENTOWYCH, DZIAŁALNOŚĆ AGENCJI INFORMACYJNYCH I POZOSTAŁA DZIAŁALNOŚĆ ZWIĄZANA Z DYSTRYBUCJĄ TREŚCI;0.3827924197786859;37.0
62;DZIAŁALNOŚĆ ZWIĄZANA Z PROGRAMOWANIEM, DORADZTWEM W ZAKRESIE INFORMATYKI I DZIAŁALNOŚCI POWIĄZANE;0.38245006008360083;38.0
27;PRODUKCJA URZĄDZEŃ ELEKTRYCZNYCH;0.38212750301121845;39.0
11;PRODUKCJA NAPOJÓW;0.3814337575655354;40.0
68;DZIAŁALNOŚĆ ZWIĄZANA Z OBSŁUGĄ RYNKU NIERUCHOMOŚCI;0.38067412834279535;41.0
21;PRODUKCJA PODSTAWOWYCH SUBSTANCJI FARMACEUTYCZNYCH ORAZ LEKÓW I POZOSTAŁYCH WYROBÓW FARMACEUTYCZNYCH;0.3804384516124869;42.0
77;WYNAJEM I DZIERŻAWA;0.38032637031002453;43.0
22;PRODUKCJA WYROBÓW Z GUMY I TWORZYW SZTUCZNYCH;0.3798942964529337;44.0
73;DZIAŁALNOŚĆ W ZAKRESIE REKLAMY, BADANIA RYNKU I PUBLIC RELATIONS;0.37986687027556704;45.0
79;DZIAŁALNOŚĆ ORGANIZATORÓW TURYSTYKI, AGENTÓW TURYSTYCZNYCH ORAZ POZOSTAŁA DZIAŁALNOŚĆ USŁUGOWA W ZAKRESIE REZERWACJI I DZIAŁALNOŚCI Z NIĄ ZWIĄZANE;0.379489256143675;46.0
23;PRODUKCJA WYROBÓW Z POZOSTAŁYCH MINERALNYCH SUROWCÓW NIEMETALICZNYCH;0.3791847983106538;47.0
01;UPRAWY ROLNE, CHÓW I HODOWLA ZWIERZĄT, ŁOWIECTWO, W TYM DZIAŁALNOŚĆ USŁUGOWA;0.37868523778536184;48.0
33;NAPRAWA, KONSERWACJA I INSTALOWANIE MASZYN I URZĄDZEŃ;0.37684459269100185;49.0
63;DZIAŁALNOŚĆ USŁUGOWA W ZAKRESIE INFRASTRUKTURY OBLICZENIOWEJ, PRZETWARZANIA DANYCH, ZARZĄDZANIA STRONAMI INTERNETOWYMI (HOSTING) I POZOSTAŁA DZIAŁALNOŚĆ USŁUGOWA W ZAKRESIE INFORMACJI;0.37682114489319823;50.0
81;DZIAŁALNOŚĆ USŁUGOWA ZWIĄZANA Z UTRZYMANIEM PORZĄDKU W BUDYNKACH I ZAGOSPODAROWANIEM TERENÓW ZIELENI;0.37657349801549694;51.0
46;HANDEL HURTOWY;0.3760074793307439;52.0
93;DZIAŁALNOŚĆ SPORTOWA, ROZRYWKOWA I REKREACYJNA;0.37588579029239766;53.0
92;DZIAŁALNOŚĆ ZWIĄZANA Z GRAMI HAZARDOWYMI;0.3756840552150089;54.0
42;ROBOTY ZWIĄZANE Z BUDOWĄ OBIEKTÓW INŻYNIERII LĄDOWEJ I WODNEJ;0.37533815041894697;55.0
15;PRODUKCJA SKÓR I WYROBÓW ZE SKÓR WYPRAWIONYCH, PRODUKCJA PODOBNYCH WYROBÓW Z INNYCH MATERIAŁÓW;0.37398485205162707;56.0
71;"DZIAŁALNOŚĆ W ZAKRESIE ARCHITEKTURY I INŻYNIERII; BADANIA I ANALIZY TECHNICZNE";0.37393936467751554;57.0
43;ROBOTY BUDOWLANE SPECJALISTYCZNE;0.37201387671727193;58.0
47;HANDEL DETALICZNY;0.3710585279447201;59.0
95;NAPRAWA I KONSERWACJA KOMPUTERÓW, ARTYKUŁÓW UŻYTKU OSOBISTEGO I DOMOWEGO ORAZ POJAZDÓW SILNIKOWYCH, W TYM MOTOCYKLI;0.3689506919107844;60.0
56;DZIAŁALNOŚĆ USŁUGOWA ZWIĄZANA Z WYŻYWIENIEM;0.36891666864284955;61.0
13;PRODUKCJA WYROBÓW TEKSTYLNYCH;0.36699014640105887;62.0
10;PRODUKCJA ARTYKUŁÓW SPOŻYWCZYCH;0.36582435389068124;63.0
66;DZIAŁALNOŚĆ WSPOMAGAJĄCA USŁUGI FINANSOWE, UBEZPIECZENIA I FUNDUSZE EMERYTALNE;0.36493389109127683;64.0
30;PRODUKCJA POZOSTAŁEGO SPRZĘTU TRANSPORTOWEGO;0.36475215720412685;65.0
80;DZIAŁALNOŚĆ DETEKTYWISTYCZNA I OCHRONIARSKA;0.3646469078647952;66.0
14;PRODUKCJA ODZIEŻY;0.36454957344187;67.0
86;OPIEKA ZDROWOTNA;0.36415881340967277;68.0
31;PRODUKCJA MEBLI;0.3634597851734531;69.0
29;PRODUKCJA POJAZDÓW SILNIKOWYCH, PRODUKCJA PRZYCZEP I NACZEP;0.3608154049773646;70.0
35;WYTWARZANIE I ZAOPATRYWANIE W ENERGIĘ ELEKTRYCZNĄ, GAZ, PARĘ WODNĄ I POWIETRZE DO UKŁADÓW KLIMATYZACYJNYCH;0.36004360778606087;71.0
59;DZIAŁALNOŚĆ ZWIĄZANA Z PRODUKCJĄ FILMÓW, NAGRAŃ WIDEO, PROGRAMÓW TELEWIZYJNYCH, NAGRAŃ DŹWIĘKOWYCH I MUZYCZNYCH;0.35971246644752014;72.0
97;GOSPODARSTWA DOMOWE ZATRUDNIAJĄCE PRACOWNIKÓW;0.35965988941129917;73.0
84;"ADMINISTRACJA PUBLICZNA I OBRONA NARODOWA; OBOWIĄZKOWE UBEZPIECZENIA SPOŁECZNE";0.359654942941183;74.0
65;DZIAŁALNOŚĆ W ZAKRESIE UBEZPIECZEŃ, REASEKURACJI ORAZ FUNDUSZY EMERYTALNYCH, Z WYŁĄCZENIEM OBOWIĄZKOWEGO UBEZPIECZENIA SPOŁECZNEGO;0.3596501277897854;75.0
06;GÓRNICTWO ROPY NAFTOWEJ I GAZU ZIEMNEGO;0.3596412130121585;76.0
07;GÓRNICTWO RUD METALI;0.3596173820639119;77.0
98;GOSPODARSTWA DOMOWE PRODUKUJĄCE WYROBY I ŚWIADCZĄCE USŁUGI NA WŁASNE POTRZEBY;0.359605131483982;78.0
99;ORGANIZACJE I ZESPOŁY EKSTERYTORIALNE;0.35957789901327414;79.0
88;POMOC SPOŁECZNA BEZ ZAKWATEROWANIA;0.3592859864457981;80.0
53;DZIAŁALNOŚĆ POCZTOWA I KURIERSKA;0.3584349191714043;81.0
26;PRODUKCJA KOMPUTERÓW, WYROBÓW ELEKTRONICZNYCH I OPTYCZNYCH;0.35520570150854625;82.0
37;ODPROWADZANIE I OCZYSZCZANIE ŚCIEKÓW;0.3490032292842729;83.0
36;POBÓR, UZDATNIANIE I DOSTARCZANIE WODY;0.3419485185764131;84.0
39;DZIAŁALNOŚĆ ZWIĄZANA Z REKULTYWACJĄ I POZOSTAŁA DZIAŁALNOŚĆ USŁUGOWA ZWIĄZANA Z GOSPODARKĄ ODPADAMI;0.31972177387881523;85.0
87;POMOC SPOŁECZNA Z ZAKWATEROWANIEM;0.3045010529211448;86.0
09;DZIAŁALNOŚĆ USŁUGOWA WSPOMAGAJĄCA GÓRNICTWO I WYDOBYWANIE;0.2731122915276173;87.0
