alternative_id;nazwa;vikor_score;vikor_rank
94;DZIAŁALNOŚĆ ORGANIZACJI CZŁONKOWSKICH;0.9947783406358638;1.0
03;RYBACTWO;0.9136584339343636;2.0
70;DZIAŁALNOŚĆ CENTRAL (HEAD OFFICES) ORAZ DORADZTWO ZWIĄZANE Z ZARZĄDZANIEM;0.6846034862371357;3.0
58;DZIAŁALNOŚĆ WYDAWNICZA;0.6149263086063739;4.0
90;DZIAŁALNOŚĆ TWÓRCZA I DZIAŁALNOŚĆ ZWIĄZANA Z WYSTAWIANIEM PRZEDSTAWIEŃ ARTYSTYCZNYCH;0.5439855650851556;5.0
01;UPRAWY ROLNE, CHÓW I HODOWLA ZWIERZĄT, ŁOWIECTWO, W TYM DZIAŁALNOŚĆ USŁUGOWA;0.5337722221038435;6.0
02;LEŚNICTWO I POZYSKIWANIE DREWNA;0.5336575369711234;7.0
21;PRODUKCJA PODSTAWOWYCH SUBSTANCJI FARMACEUTYCZNYCH ORAZ LEKÓW I POZOSTAŁYCH WYROBÓW FARMACEUTYCZNYCH;0.5041920572825653;8.0
72;BADANIA NAUKOWE I PRACE ROZWOJOWE;0.49306547839754244;9.0
32;POZOSTAŁA PRODUKCJA WYROBÓW;0.4720115195852561;10.0
64;FINANSOWA DZIAŁALNOŚĆ USŁUGOWA, Z WYŁĄCZENIEM UBEZPIECZEŃ I FUNDUSZY EMERYTALNYCH;0.45204796508595435;11.0
85;EDUKACJA;0.4502965172269823;12.0
08;POZOSTAŁE GÓRNICTWO I WYDOBYWANIE;0.4486096033904472;13.0
50;TRANSPORT WODNY;0.44426623220510686;14.0
24;PRODUKCJA METALI;0.44369277926245254;15.0
14;PRODUKCJA ODZIEŻY;0.44347669644235066;16.0
75;DZIAŁALNOŚĆ WETERYNARYJNA;0.4411570496108158;17.0
69;DZIAŁALNOŚĆ PRAWNICZA, RACHUNKOWO-KSIĘGOWA I DORADZTWO PODATKOWE;0.4359753415667249;18.0
62;DZIAŁALNOŚĆ ZWIĄZANA Z PROGRAMOWANIEM, DORADZTWEM W ZAKRESIE INFORMATYKI I DZIAŁALNOŚCI POWIĄZANE;0.43284840594022556;19.0
51;TRANSPORT LOTNICZY;0.4264465961958357;20.0
74;POZOSTAŁA DZIAŁALNOŚĆ PROFESJONALNA, NAUKOWA I TECHNICZNA;0.4187062439058842;21.0
38;DZIAŁALNOŚĆ ZWIĄZANA ZE ZBIERANIEM, ODZYSKIEM I UNIESZKODLIWIANIEM ODPADÓW;0.4048294611666692;22.0
16;"PRODUKCJA WYROBÓW Z DREWNA I KORKA, Z WYŁĄCZENIEM MEBLI; PRODUKCJA WYROBÓW ZE SŁOMY I MATERIAŁÓW UŻYWANYCH DO WYPLATANIA";0.40326254994599875;23.0
15;PRODUKCJA SKÓR I WYROBÓW ZE SKÓR WYPRAWIONYCH, PRODUKCJA PODOBNYCH WYROBÓW Z INNYCH MATERIAŁÓW;0.39714083772105024;24.0
52;MAGAZYNOWANIE, PRZECHOWYWANIE I DZIAŁALNOŚĆ USŁUGOWA WSPOMAGAJĄCA TRANSPORT;0.39658748015406364;25.0
91;DZIAŁALNOŚĆ BIBLIOTEK, ARCHIWÓW, MUZEÓW ORAZ POZOSTAŁA DZIAŁALNOŚĆ ZWIĄZANA Z KULTURĄ;0.3845229679571537;26.0
41;ROBOTY BUDOWLANE ZWIĄZANE ZE WZNOSZENIEM BUDYNKÓW MIESZKALNYCH I NIEMIESZKALNYCH;0.38124442465769737;27.0
23;PRODUKCJA WYROBÓW Z POZOSTAŁYCH MINERALNYCH SUROWCÓW NIEMETALICZNYCH;0.37137623712595014;28.0
31;PRODUKCJA MEBLI;0.366600846179882;29.0
96;DZIAŁALNOŚĆ USŁUGOWA INDYWIDUALNA;0.36284619630809356;30.0
19;WYTWARZANIE I PRZETWARZANIE KOKSU I PRODUKTÓW RAFINACJI ROPY NAFTOWEJ;0.36158093164121574;31.0
28;PRODUKCJA MASZYN I URZĄDZEŃ, GDZIE INDZIEJ NIESKLASYFIKOWANA;0.3609371938688216;32.0
25;PRODUKCJA METALOWYCH WYROBÓW GOTOWYCH, Z WYŁĄCZENIEM MASZYN I URZĄDZEŃ;0.3566294428222827;33.0
55;ZAKWATEROWANIE;0.3564234585510384;34.0
63;DZIAŁALNOŚĆ USŁUGOWA W ZAKRESIE INFRASTRUKTURY OBLICZENIOWEJ, PRZETWARZANIA DANYCH, ZARZĄDZANIA STRONAMI INTERNETOWYMI (HOSTING) I POZOSTAŁA DZIAŁALNOŚĆ USŁUGOWA W ZAKRESIE INFORMACJI;0.35474981870543654;35.0
43;ROBOTY BUDOWLANE SPECJALISTYCZNE;0.35039469314953475;36.0
18;POLIGRAFIA I REPRODUKCJA ZAPISANYCH NOŚNIKÓW INFORMACJI;0.34595646270890146;37.0
59;DZIAŁALNOŚĆ ZWIĄZANA Z PRODUKCJĄ FILMÓW, NAGRAŃ WIDEO, PROGRAMÓW TELEWIZYJNYCH, NAGRAŃ DŹWIĘKOWYCH I MUZYCZNYCH;0.342058258426964;38.0
95;NAPRAWA I KONSERWACJA KOMPUTERÓW, ARTYKUŁÓW UŻYTKU OSOBISTEGO I DOMOWEGO ORAZ POJAZDÓW SILNIKOWYCH, W TYM MOTOCYKLI;0.33836194095506333;39.0
66;DZIAŁALNOŚĆ WSPOMAGAJĄCA USŁUGI FINANSOWE, UBEZPIECZENIA I FUNDUSZE EMERYTALNE;0.33805175736689996;40.0
26;PRODUKCJA KOMPUTERÓW, WYROBÓW ELEKTRONICZNYCH I OPTYCZNYCH;0.3375548712342953;41.0
81;DZIAŁALNOŚĆ USŁUGOWA ZWIĄZANA Z UTRZYMANIEM PORZĄDKU W BUDYNKACH I ZAGOSPODAROWANIEM TERENÓW ZIELENI;0.3373428993733689;42.0
79;DZIAŁALNOŚĆ ORGANIZATORÓW TURYSTYKI, AGENTÓW TURYSTYCZNYCH ORAZ POZOSTAŁA DZIAŁALNOŚĆ USŁUGOWA W ZAKRESIE REZERWACJI I DZIAŁALNOŚCI Z NIĄ ZWIĄZANE;0.33528778272478643;43.0
60;NADAWANIE PROGRAMÓW OGÓLNODOSTĘPNYCH I ABONAMENTOWYCH, DZIAŁALNOŚĆ AGENCJI INFORMACYJNYCH I POZOSTAŁA DZIAŁALNOŚĆ ZWIĄZANA Z DYSTRYBUCJĄ TREŚCI;0.32573621443808454;44.0
22;PRODUKCJA WYROBÓW Z GUMY I TWORZYW SZTUCZNYCH;0.3256570400927149;45.0
61;TELEKOMUNIKACJA;0.31815279597493007;46.0
17;PRODUKCJA PAPIERU I WYROBÓW Z PAPIERU;0.3161826002396606;47.0
42;ROBOTY ZWIĄZANE Z BUDOWĄ OBIEKTÓW INŻYNIERII LĄDOWEJ I WODNEJ;0.31498181496094335;48.0
82;DZIAŁALNOŚĆ ZWIĄZANA Z ADMINISTRACYJNĄ OBSŁUGĄ BIURA I POZOSTAŁA DZIAŁALNOŚĆ WSPOMAGAJĄCA PROWADZENIE DZIAŁALNOŚCI GOSPODARCZEJ;0.309072490966925;49.0
39;DZIAŁALNOŚĆ ZWIĄZANA Z REKULTYWACJĄ I POZOSTAŁA DZIAŁALNOŚĆ USŁUGOWA ZWIĄZANA Z GOSPODARKĄ ODPADAMI;0.3090451784969295;50.0
13;PRODUKCJA WYROBÓW TEKSTYLNYCH;0.3088420233693252;51.0
73;DZIAŁALNOŚĆ W ZAKRESIE REKLAMY, BADANIA RYNKU I PUBLIC RELATIONS;0.30518075402681366;52.0
68;DZIAŁALNOŚĆ ZWIĄZANA Z OBSŁUGĄ RYNKU NIERUCHOMOŚCI;0.30514799652772506;53.0
10;PRODUKCJA ARTYKUŁÓW SPOŻYWCZYCH;0.2961089105285317;54.0
71;"DZIAŁALNOŚĆ W ZAKRESIE ARCHITEKTURY I INŻYNIERII; BADANIA I ANALIZY TECHNICZNE";0.29525345649953294;55.0
46;HANDEL HURTOWY;0.28932674741340314;56.0
88;POMOC SPOŁECZNA BEZ ZAKWATEROWANIA;0.28894470775713677;57.0
78;DZIAŁALNOŚĆ ZWIĄZANA Z ZATRUDNIENIEM;0.2873443505652544;58.0
77;WYNAJEM I DZIERŻAWA;0.28432404073612516;59.0
80;DZIAŁALNOŚĆ DETEKTYWISTYCZNA I OCHRONIARSKA;0.28308063873819345;60.0
36;POBÓR, UZDATNIANIE I DOSTARCZANIE WODY;0.27919659184146917;61.0
49;TRANSPORT LĄDOWY ORAZ TRANSPORT RUROCIĄGOWY;0.27918659115026545;62.0
30;PRODUKCJA POZOSTAŁEGO SPRZĘTU TRANSPORTOWEGO;0.27779403831191374;63.0
86;OPIEKA ZDROWOTNA;0.2741676800985646;64.0
33;NAPRAWA, KONSERWACJA I INSTALOWANIE MASZYN I URZĄDZEŃ;0.26234219540712844;65.0
98;GOSPODARSTWA DOMOWE PRODUKUJĄCE WYROBY I ŚWIADCZĄCE USŁUGI NA WŁASNE POTRZEBY;0.26115906230907293;69.0
99;ORGANIZACJE I ZESPOŁY EKSTERYTORIALNE;0.26115906230907293;69.0
07;GÓRNICTWO RUD METALI;0.26115906230907293;69.0
65;DZIAŁALNOŚĆ W ZAKRESIE UBEZPIECZEŃ, REASEKURACJI ORAZ FUNDUSZY EMERYTALNYCH, Z WYŁĄCZENIEM OBOWIĄZKOWEGO UBEZPIECZENIA SPOŁECZNEGO;0.26115906230907293;69.0
84;"ADMINISTRACJA PUBLICZNA I OBRONA NARODOWA; OBOWIĄZKOWE UBEZPIECZENIA SPOŁECZNE";0.26115906230907293;69.0
06;GÓRNICTWO ROPY NAFTOWEJ I GAZU ZIEMNEGO;0.26115906230907293;69.0
97;GOSPODARSTWA DOMOWE ZATRUDNIAJĄCE PRACOWNIKÓW;0.26115906230907293;69.0
20;PRODUKCJA CHEMIKALIÓW I WYROBÓW CHEMICZNYCH;0.25957966455061143;73.0
47;HANDEL DETALICZNY;0.2581575489316872;74.0
27;PRODUKCJA URZĄDZEŃ ELEKTRYCZNYCH;0.2571767689834662;75.0
37;ODPROWADZANIE I OCZYSZCZANIE ŚCIEKÓW;0.25715175099050813;76.0
87;POMOC SPOŁECZNA Z ZAKWATEROWANIEM;0.24123196825291926;77.0
56;DZIAŁALNOŚĆ USŁUGOWA ZWIĄZANA Z WYŻYWIENIEM;0.23485649623004257;78.0
11;PRODUKCJA NAPOJÓW;0.23440208640903026;79.0
05;WYDOBYWANIE WĘGLA KAMIENNEGO I WĘGLA BRUNATNEGO (LIGNITU);0.23229756041437366;80.0
29;PRODUKCJA POJAZDÓW SILNIKOWYCH, PRODUKCJA PRZYCZEP I NACZEP;0.23224622087693847;81.0
53;DZIAŁALNOŚĆ POCZTOWA I KURIERSKA;0.2206290557222661;82.0
12;PRODUKCJA WYROBÓW TYTONIOWYCH;0.21906511244391447;83.0
93;DZIAŁALNOŚĆ SPORTOWA, ROZRYWKOWA I REKREACYJNA;0.19276309979807338;84.0
09;DZIAŁALNOŚĆ USŁUGOWA WSPOMAGAJĄCA GÓRNICTWO I WYDOBYWANIE;0.1917670538148335;85.0
35;WYTWARZANIE I ZAOPATRYWANIE W ENERGIĘ ELEKTRYCZNĄ, GAZ, PARĘ WODNĄ I POWIETRZE DO UKŁADÓW KLIMATYZACYJNYCH;0.1911701586554504;86.0
92;DZIAŁALNOŚĆ ZWIĄZANA Z GRAMI HAZARDOWYMI;0.18439825392059972;87.0
