alternative_id;nazwa;monte_carlo_score;monte_carlo_rank
03;RYBACTWO;0.5094321762167849;1.0
29;PRODUKCJA POJAZDÓW SILNIKOWYCH, PRODUKCJA PRZYCZEP I NACZEP;0.5084309809698813;2.0
58;DZIAŁALNOŚĆ WYDAWNICZA;0.507655188239511;3.0
91;DZIAŁALNOŚĆ BIBLIOTEK, ARCHIWÓW, MUZEÓW ORAZ POZOSTAŁA DZIAŁALNOŚĆ ZWIĄZANA Z KULTURĄ;0.5072194976454063;4.0
42;ROBOTY ZWIĄZANE Z BUDOWĄ OBIEKTÓW INŻYNIERII LĄDOWEJ I WODNEJ;0.5070523534654332;5.0
95;NAPRAWA I KONSERWACJA KOMPUTERÓW, ARTYKUŁÓW UŻYTKU OSOBISTEGO I DOMOWEGO ORAZ POJAZDÓW SILNIKOWYCH, W TYM MOTOCYKLI;0.5065699183941482;6.0
30;PRODUKCJA POZOSTAŁEGO SPRZĘTU TRANSPORTOWEGO;0.5065293605476244;7.0
97;GOSPODARSTWA DOMOWE ZATRUDNIAJĄCE PRACOWNIKÓW;0.50635112907027;8.0
88;POMOC SPOŁECZNA BEZ ZAKWATEROWANIA;0.5062604114655416;9.0
70;DZIAŁALNOŚĆ CENTRAL (HEAD OFFICES) ORAZ DORADZTWO ZWIĄZANE Z ZARZĄDZANIEM;0.5062312662215244;10.0
73;DZIAŁALNOŚĆ W ZAKRESIE REKLAMY, BADANIA RYNKU I PUBLIC RELATIONS;0.5060096877541225;11.0
01;UPRAWY ROLNE, CHÓW I HODOWLA ZWIERZĄT, ŁOWIECTWO, W TYM DZIAŁALNOŚĆ USŁUGOWA;0.5058216874410549;12.0
27;PRODUKCJA URZĄDZEŃ ELEKTRYCZNYCH;0.5057762776802083;13.0
39;DZIAŁALNOŚĆ ZWIĄZANA Z REKULTYWACJĄ I POZOSTAŁA DZIAŁALNOŚĆ USŁUGOWA ZWIĄZANA Z GOSPODARKĄ ODPADAMI;0.5055096502777776;14.0
19;WYTWARZANIE I PRZETWARZANIE KOKSU I PRODUKTÓW RAFINACJI ROPY NAFTOWEJ;0.5052540682895112;15.0
41;ROBOTY BUDOWLANE ZWIĄZANE ZE WZNOSZENIEM BUDYNKÓW MIESZKALNYCH I NIEMIESZKALNYCH;0.5046150030945007;16.0
64;FINANSOWA DZIAŁALNOŚĆ USŁUGOWA, Z WYŁĄCZENIEM UBEZPIECZEŃ I FUNDUSZY EMERYTALNYCH;0.5042621698295975;17.0
84;"ADMINISTRACJA PUBLICZNA I OBRONA NARODOWA; OBOWIĄZKOWE UBEZPIECZENIA SPOŁECZNE";0.5042413124103525;18.0
08;POZOSTAŁE GÓRNICTWO I WYDOBYWANIE;0.5038092682186613;19.0
17;PRODUKCJA PAPIERU I WYROBÓW Z PAPIERU;0.5036600552063821;20.0
94;DZIAŁALNOŚĆ ORGANIZACJI CZŁONKOWSKICH;0.5033544102301691;21.0
46;HANDEL HURTOWY;0.503272381656834;22.0
61;TELEKOMUNIKACJA;0.5028727903189247;23.0
93;DZIAŁALNOŚĆ SPORTOWA, ROZRYWKOWA I REKREACYJNA;0.5028562152968137;24.0
05;WYDOBYWANIE WĘGLA KAMIENNEGO I WĘGLA BRUNATNEGO (LIGNITU);0.5027886051644457;25.0
12;PRODUKCJA WYROBÓW TYTONIOWYCH;0.5027803030290557;26.0
20;PRODUKCJA CHEMIKALIÓW I WYROBÓW CHEMICZNYCH;0.5025615611380889;27.0
26;PRODUKCJA KOMPUTERÓW, WYROBÓW ELEKTRONICZNYCH I OPTYCZNYCH;0.502545062623182;28.0
10;PRODUKCJA ARTYKUŁÓW SPOŻYWCZYCH;0.5023640247466882;29.0
38;DZIAŁALNOŚĆ ZWIĄZANA ZE ZBIERANIEM, ODZYSKIEM I UNIESZKODLIWIANIEM ODPADÓW;0.5021632742435018;30.0
96;DZIAŁALNOŚĆ USŁUGOWA INDYWIDUALNA;0.5020026562666684;31.0
15;PRODUKCJA SKÓR I WYROBÓW ZE SKÓR WYPRAWIONYCH, PRODUKCJA PODOBNYCH WYROBÓW Z INNYCH MATERIAŁÓW;0.5015850602628658;32.0
81;DZIAŁALNOŚĆ USŁUGOWA ZWIĄZANA Z UTRZYMANIEM PORZĄDKU W BUDYNKACH I ZAGOSPODAROWANIEM TERENÓW ZIELENI;0.5014722747921129;33.0
35;WYTWARZANIE I ZAOPATRYWANIE W ENERGIĘ ELEKTRYCZNĄ, GAZ, PARĘ WODNĄ I POWIETRZE DO UKŁADÓW KLIMATYZACYJNYCH;0.5012572132463244;34.0
43;ROBOTY BUDOWLANE SPECJALISTYCZNE;0.5011757870184139;35.0
49;TRANSPORT LĄDOWY ORAZ TRANSPORT RUROCIĄGOWY;0.5011587376185094;36.0
59;DZIAŁALNOŚĆ ZWIĄZANA Z PRODUKCJĄ FILMÓW, NAGRAŃ WIDEO, PROGRAMÓW TELEWIZYJNYCH, NAGRAŃ DŹWIĘKOWYCH I MUZYCZNYCH;0.5011383399834348;37.0
11;PRODUKCJA NAPOJÓW;0.5011170973074878;38.0
99;ORGANIZACJE I ZESPOŁY EKSTERYTORIALNE;0.5010551645660487;39.0
79;DZIAŁALNOŚĆ ORGANIZATORÓW TURYSTYKI, AGENTÓW TURYSTYCZNYCH ORAZ POZOSTAŁA DZIAŁALNOŚĆ USŁUGOWA W ZAKRESIE REZERWACJI I DZIAŁALNOŚCI Z NIĄ ZWIĄZANE;0.5010448171819543;40.0
31;PRODUKCJA MEBLI;0.5009890177586103;41.0
14;PRODUKCJA ODZIEŻY;0.5009223247303524;42.0
02;LEŚNICTWO I POZYSKIWANIE DREWNA;0.5007320735311007;43.0
55;ZAKWATEROWANIE;0.5004125761217494;44.0
60;NADAWANIE PROGRAMÓW OGÓLNODOSTĘPNYCH I ABONAMENTOWYCH, DZIAŁALNOŚĆ AGENCJI INFORMACYJNYCH I POZOSTAŁA DZIAŁALNOŚĆ ZWIĄZANA Z DYSTRYBUCJĄ TREŚCI;0.5000163876031586;45.0
51;TRANSPORT LOTNICZY;0.4999507916506592;46.0
68;DZIAŁALNOŚĆ ZWIĄZANA Z OBSŁUGĄ RYNKU NIERUCHOMOŚCI;0.49947526002311565;47.0
47;HANDEL DETALICZNY;0.49944245498524814;48.0
74;POZOSTAŁA DZIAŁALNOŚĆ PROFESJONALNA, NAUKOWA I TECHNICZNA;0.4990553584527733;49.0
98;GOSPODARSTWA DOMOWE PRODUKUJĄCE WYROBY I ŚWIADCZĄCE USŁUGI NA WŁASNE POTRZEBY;0.49899558798177335;50.0
33;NAPRAWA, KONSERWACJA I INSTALOWANIE MASZYN I URZĄDZEŃ;0.49898588838175933;51.0
07;GÓRNICTWO RUD METALI;0.49889439906896654;52.0
87;POMOC SPOŁECZNA Z ZAKWATEROWANIEM;0.4984498297798891;53.0
21;PRODUKCJA PODSTAWOWYCH SUBSTANCJI FARMACEUTYCZNYCH ORAZ LEKÓW I POZOSTAŁYCH WYROBÓW FARMACEUTYCZNYCH;0.4980734900333761;54.0
16;"PRODUKCJA WYROBÓW Z DREWNA I KORKA, Z WYŁĄCZENIEM MEBLI; PRODUKCJA WYROBÓW ZE SŁOMY I MATERIAŁÓW UŻYWANYCH DO WYPLATANIA";0.49781021853415264;55.0
52;MAGAZYNOWANIE, PRZECHOWYWANIE I DZIAŁALNOŚĆ USŁUGOWA WSPOMAGAJĄCA TRANSPORT;0.49763036666887944;56.0
28;PRODUKCJA MASZYN I URZĄDZEŃ, GDZIE INDZIEJ NIESKLASYFIKOWANA;0.49728722457553504;57.0
53;DZIAŁALNOŚĆ POCZTOWA I KURIERSKA;0.49725591828691906;58.0
85;EDUKACJA;0.49693063837352247;59.0
62;DZIAŁALNOŚĆ ZWIĄZANA Z PROGRAMOWANIEM, DORADZTWEM W ZAKRESIE INFORMATYKI I DZIAŁALNOŚCI POWIĄZANE;0.49684225236096524;60.0
80;DZIAŁALNOŚĆ DETEKTYWISTYCZNA I OCHRONIARSKA;0.49671305322146064;61.0
25;PRODUKCJA METALOWYCH WYROBÓW GOTOWYCH, Z WYŁĄCZENIEM MASZYN I URZĄDZEŃ;0.49665574170410204;62.0
50;TRANSPORT WODNY;0.4965863765170003;63.0
37;ODPROWADZANIE I OCZYSZCZANIE ŚCIEKÓW;0.49627670155035186;64.0
18;POLIGRAFIA I REPRODUKCJA ZAPISANYCH NOŚNIKÓW INFORMACJI;0.4958748525483798;65.0
13;PRODUKCJA WYROBÓW TEKSTYLNYCH;0.4958507835600617;66.0
72;BADANIA NAUKOWE I PRACE ROZWOJOWE;0.49560253932451825;67.0
32;POZOSTAŁA PRODUKCJA WYROBÓW;0.4955566500785298;68.0
24;PRODUKCJA METALI;0.4954875036943167;69.0
66;DZIAŁALNOŚĆ WSPOMAGAJĄCA USŁUGI FINANSOWE, UBEZPIECZENIA I FUNDUSZE EMERYTALNE;0.4954496408856699;70.0
36;POBÓR, UZDATNIANIE I DOSTARCZANIE WODY;0.49533650007938645;71.0
06;GÓRNICTWO ROPY NAFTOWEJ I GAZU ZIEMNEGO;0.4951145807987669;72.0
71;"DZIAŁALNOŚĆ W ZAKRESIE ARCHITEKTURY I INŻYNIERII; BADANIA I ANALIZY TECHNICZNE";0.4950569236735674;73.0
82;DZIAŁALNOŚĆ ZWIĄZANA Z ADMINISTRACYJNĄ OBSŁUGĄ BIURA I POZOSTAŁA DZIAŁALNOŚĆ WSPOMAGAJĄCA PROWADZENIE DZIAŁALNOŚCI GOSPODARCZEJ;0.494754714518953;74.0
92;DZIAŁALNOŚĆ ZWIĄZANA Z GRAMI HAZARDOWYMI;0.4943750427708995;75.0
65;DZIAŁALNOŚĆ W ZAKRESIE UBEZPIECZEŃ, REASEKURACJI ORAZ FUNDUSZY EMERYTALNYCH, Z WYŁĄCZENIEM OBOWIĄZKOWEGO UBEZPIECZENIA SPOŁECZNEGO;0.4941976047544568;76.0
77;WYNAJEM I DZIERŻAWA;0.49410231825103734;77.0
63;DZIAŁALNOŚĆ USŁUGOWA W ZAKRESIE INFRASTRUKTURY OBLICZENIOWEJ, PRZETWARZANIA DANYCH, ZARZĄDZANIA STRONAMI INTERNETOWYMI (HOSTING) I POZOSTAŁA DZIAŁALNOŚĆ USŁUGOWA W ZAKRESIE INFORMACJI;0.4934762688293756;78.0
90;DZIAŁALNOŚĆ TWÓRCZA I DZIAŁALNOŚĆ ZWIĄZANA Z WYSTAWIANIEM PRZEDSTAWIEŃ ARTYSTYCZNYCH;0.49320938315067325;79.0
23;PRODUKCJA WYROBÓW Z POZOSTAŁYCH MINERALNYCH SUROWCÓW NIEMETALICZNYCH;0.49257423632197345;80.0
78;DZIAŁALNOŚĆ ZWIĄZANA Z ZATRUDNIENIEM;0.4919334886686809;81.0
69;DZIAŁALNOŚĆ PRAWNICZA, RACHUNKOWO-KSIĘGOWA I DORADZTWO PODATKOWE;0.49185327143721896;82.0
22;PRODUKCJA WYROBÓW Z GUMY I TWORZYW SZTUCZNYCH;0.4917564706974592;83.0
56;DZIAŁALNOŚĆ USŁUGOWA ZWIĄZANA Z WYŻYWIENIEM;0.49094067179692896;84.0
09;DZIAŁALNOŚĆ USŁUGOWA WSPOMAGAJĄCA GÓRNICTWO I WYDOBYWANIE;0.49093093461229104;85.0
75;DZIAŁALNOŚĆ WETERYNARYJNA;0.4901619352094958;86.0
86;OPIEKA ZDROWOTNA;0.48910709336128994;87.0
