alternative_id;nazwa;ensemble_score;ensemble_rank
90;DZIAŁALNOŚĆ TWÓRCZA I DZIAŁALNOŚĆ ZWIĄZANA Z WYSTAWIANIEM PRZEDSTAWIEŃ ARTYSTYCZNYCH;0.6859425016299578;1.0
94;DZIAŁALNOŚĆ ORGANIZACJI CZŁONKOWSKICH;0.6134532859640228;2.0
01;UPRAWY ROLNE, CHÓW I HODOWLA ZWIERZĄT, ŁOWIECTWO, W TYM DZIAŁALNOŚĆ USŁUGOWA;0.5756531666986433;3.0
64;FINANSOWA DZIAŁALNOŚĆ USŁUGOWA, Z WYŁĄCZENIEM UBEZPIECZEŃ I FUNDUSZY EMERYTALNYCH;0.48047607338077997;4.0
75;DZIAŁALNOŚĆ WETERYNARYJNA;0.47831347989408723;5.0
72;BADANIA NAUKOWE I PRACE ROZWOJOWE;0.44712365313619234;6.0
77;WYNAJEM I DZIERŻAWA;0.41240425630992117;7.0
03;RYBACTWO;0.4030076396898792;8.0
15;PRODUKCJA SKÓR I WYROBÓW ZE SKÓR WYPRAWIONYCH, PRODUKCJA PODOBNYCH WYROBÓW Z INNYCH MATERIAŁÓW;0.39122763612149636;9.0
95;NAPRAWA I KONSERWACJA KOMPUTERÓW, ARTYKUŁÓW UŻYTKU OSOBISTEGO I DOMOWEGO ORAZ POJAZDÓW SILNIKOWYCH, W TYM MOTOCYKLI;0.38438943261779385;10.0
51;TRANSPORT LOTNICZY;0.3835700810832775;11.0
61;TELEKOMUNIKACJA;0.38003145117935894;12.0
63;DZIAŁALNOŚĆ USŁUGOWA W ZAKRESIE INFRASTRUKTURY OBLICZENIOWEJ, PRZETWARZANIA DANYCH, ZARZĄDZANIA STRONAMI INTERNETOWYMI (HOSTING) I POZOSTAŁA DZIAŁALNOŚĆ USŁUGOWA W ZAKRESIE INFORMACJI;0.3787694091712756;13.0
74;POZOSTAŁA DZIAŁALNOŚĆ PROFESJONALNA, NAUKOWA I TECHNICZNA;0.3765429843175025;14.0
88;POMOC SPOŁECZNA BEZ ZAKWATEROWANIA;0.37517517264466227;15.0
36;POBÓR, UZDATNIANIE I DOSTARCZANIE WODY;0.3729587192330235;16.0
70;DZIAŁALNOŚĆ CENTRAL (HEAD OFFICES) ORAZ DORADZTWO ZWIĄZANE Z ZARZĄDZANIEM;0.3672512434704375;17.0
21;PRODUKCJA PODSTAWOWYCH SUBSTANCJI FARMACEUTYCZNYCH ORAZ LEKÓW I POZOSTAŁYCH WYROBÓW FARMACEUTYCZNYCH;0.3635251531692666;18.0
50;TRANSPORT WODNY;0.36332795202479806;19.0
69;DZIAŁALNOŚĆ PRAWNICZA, RACHUNKOWO-KSIĘGOWA I DORADZTWO PODATKOWE;0.3589451215777078;20.0
35;WYTWARZANIE I ZAOPATRYWANIE W ENERGIĘ ELEKTRYCZNĄ, GAZ, PARĘ WODNĄ I POWIETRZE DO UKŁADÓW KLIMATYZACYJNYCH;0.3576420219006613;21.0
60;NADAWANIE PROGRAMÓW OGÓLNODOSTĘPNYCH I ABONAMENTOWYCH, DZIAŁALNOŚĆ AGENCJI INFORMACYJNYCH I POZOSTAŁA DZIAŁALNOŚĆ ZWIĄZANA Z DYSTRYBUCJĄ TREŚCI;0.35618283156637287;22.0
58;DZIAŁALNOŚĆ WYDAWNICZA;0.3556434301083445;23.0
37;ODPROWADZANIE I OCZYSZCZANIE ŚCIEKÓW;0.3514614087050689;24.0
71;"DZIAŁALNOŚĆ W ZAKRESIE ARCHITEKTURY I INŻYNIERII; BADANIA I ANALIZY TECHNICZNE";0.3505969940121765;25.0
59;DZIAŁALNOŚĆ ZWIĄZANA Z PRODUKCJĄ FILMÓW, NAGRAŃ WIDEO, PROGRAMÓW TELEWIZYJNYCH, NAGRAŃ DŹWIĘKOWYCH I MUZYCZNYCH;0.3449787245571624;26.0
23;PRODUKCJA WYROBÓW Z POZOSTAŁYCH MINERALNYCH SUROWCÓW NIEMETALICZNYCH;0.34422547987842755;27.0
14;PRODUKCJA ODZIEŻY;0.3439873757202337;28.0
02;LEŚNICTWO I POZYSKIWANIE DREWNA;0.34273211390988434;29.0
68;DZIAŁALNOŚĆ ZWIĄZANA Z OBSŁUGĄ RYNKU NIERUCHOMOŚCI;0.3328033720877859;30.0
17;PRODUKCJA PAPIERU I WYROBÓW Z PAPIERU;0.3323591930466181;31.0
28;PRODUKCJA MASZYN I URZĄDZEŃ, GDZIE INDZIEJ NIESKLASYFIKOWANA;0.32980018650222;32.0
18;POLIGRAFIA I REPRODUKCJA ZAPISANYCH NOŚNIKÓW INFORMACJI;0.3250784557682863;33.0
31;PRODUKCJA MEBLI;0.3245184246903413;34.0
32;POZOSTAŁA PRODUKCJA WYROBÓW;0.3209171506715983;35.0
62;DZIAŁALNOŚĆ ZWIĄZANA Z PROGRAMOWANIEM, DORADZTWEM W ZAKRESIE INFORMATYKI I DZIAŁALNOŚCI POWIĄZANE;0.3208370728957571;36.0
22;PRODUKCJA WYROBÓW Z GUMY I TWORZYW SZTUCZNYCH;0.3204652965509648;37.0
25;PRODUKCJA METALOWYCH WYROBÓW GOTOWYCH, Z WYŁĄCZENIEM MASZYN I URZĄDZEŃ;0.3110547561383128;38.0
85;EDUKACJA;0.31009301400536593;39.0
91;DZIAŁALNOŚĆ BIBLIOTEK, ARCHIWÓW, MUZEÓW ORAZ POZOSTAŁA DZIAŁALNOŚĆ ZWIĄZANA Z KULTURĄ;0.30775612273335967;40.0
73;DZIAŁALNOŚĆ W ZAKRESIE REKLAMY, BADANIA RYNKU I PUBLIC RELATIONS;0.3000592722793356;41.0
81;DZIAŁALNOŚĆ USŁUGOWA ZWIĄZANA Z UTRZYMANIEM PORZĄDKU W BUDYNKACH I ZAGOSPODAROWANIEM TERENÓW ZIELENI;0.29588393962532605;42.0
41;ROBOTY BUDOWLANE ZWIĄZANE ZE WZNOSZENIEM BUDYNKÓW MIESZKALNYCH I NIEMIESZKALNYCH;0.2951701556198276;43.0
33;NAPRAWA, KONSERWACJA I INSTALOWANIE MASZYN I URZĄDZEŃ;0.2946724297007327;44.0
13;PRODUKCJA WYROBÓW TEKSTYLNYCH;0.2946697043714879;45.0
16;"PRODUKCJA WYROBÓW Z DREWNA I KORKA, Z WYŁĄCZENIEM MEBLI; PRODUKCJA WYROBÓW ZE SŁOMY I MATERIAŁÓW UŻYWANYCH DO WYPLATANIA";0.2935109433334748;46.0
66;DZIAŁALNOŚĆ WSPOMAGAJĄCA USŁUGI FINANSOWE, UBEZPIECZENIA I FUNDUSZE EMERYTALNE;0.2915814614600496;47.0
55;ZAKWATEROWANIE;0.2899952210246356;48.0
20;PRODUKCJA CHEMIKALIÓW I WYROBÓW CHEMICZNYCH;0.2853760989690094;49.0
82;DZIAŁALNOŚĆ ZWIĄZANA Z ADMINISTRACYJNĄ OBSŁUGĄ BIURA I POZOSTAŁA DZIAŁALNOŚĆ WSPOMAGAJĄCA PROWADZENIE DZIAŁALNOŚCI GOSPODARCZEJ;0.28500464915228885;50.0
10;PRODUKCJA ARTYKUŁÓW SPOŻYWCZYCH;0.28424132475272285;51.0
11;PRODUKCJA NAPOJÓW;0.28371196855722103;52.0
49;TRANSPORT LĄDOWY ORAZ TRANSPORT RUROCIĄGOWY;0.28164119102068486;53.0
30;PRODUKCJA POZOSTAŁEGO SPRZĘTU TRANSPORTOWEGO;0.2808140123883972;54.0
38;DZIAŁALNOŚĆ ZWIĄZANA ZE ZBIERANIEM, ODZYSKIEM I UNIESZKODLIWIANIEM ODPADÓW;0.27979879648252015;55.0
52;MAGAZYNOWANIE, PRZECHOWYWANIE I DZIAŁALNOŚĆ USŁUGOWA WSPOMAGAJĄCA TRANSPORT;0.2761096138612606;56.0
56;DZIAŁALNOŚĆ USŁUGOWA ZWIĄZANA Z WYŻYWIENIEM;0.2742828864897806;57.0
24;PRODUKCJA METALI;0.27075696261069104;58.0
08;POZOSTAŁE GÓRNICTWO I WYDOBYWANIE;0.27029605896327685;59.0
42;ROBOTY ZWIĄZANE Z BUDOWĄ OBIEKTÓW INŻYNIERII LĄDOWEJ I WODNEJ;0.26474514335892674;60.0
43;ROBOTY BUDOWLANE SPECJALISTYCZNE;0.2640758133204836;61.0
26;PRODUKCJA KOMPUTERÓW, WYROBÓW ELEKTRONICZNYCH I OPTYCZNYCH;0.26200364577900415;62.0
79;DZIAŁALNOŚĆ ORGANIZATORÓW TURYSTYKI, AGENTÓW TURYSTYCZNYCH ORAZ POZOSTAŁA DZIAŁALNOŚĆ USŁUGOWA W ZAKRESIE REZERWACJI I DZIAŁALNOŚCI Z NIĄ ZWIĄZANE;0.26143193781114543;63.0
07;GÓRNICTWO RUD METALI;0.2594798357022962;64.0
97;GOSPODARSTWA DOMOWE ZATRUDNIAJĄCE PRACOWNIKÓW;0.25944642795727446;65.0
99;ORGANIZACJE I ZESPOŁY EKSTERYTORIALNE;0.2594418287151645;66.0
84;"ADMINISTRACJA PUBLICZNA I OBRONA NARODOWA; OBOWIĄZKOWE UBEZPIECZENIA SPOŁECZNE";0.2594183570324052;67.0
06;GÓRNICTWO ROPY NAFTOWEJ I GAZU ZIEMNEGO;0.259415073034514;68.0
98;GOSPODARSTWA DOMOWE PRODUKUJĄCE WYROBY I ŚWIADCZĄCE USŁUGI NA WŁASNE POTRZEBY;0.259414066029739;69.0
65;DZIAŁALNOŚĆ W ZAKRESIE UBEZPIECZEŃ, REASEKURACJI ORAZ FUNDUSZY EMERYTALNYCH, Z WYŁĄCZENIEM OBOWIĄZKOWEGO UBEZPIECZENIA SPOŁECZNEGO;0.2594118966555218;70.0
96;DZIAŁALNOŚĆ USŁUGOWA INDYWIDUALNA;0.25781953589973794;71.0
29;PRODUKCJA POJAZDÓW SILNIKOWYCH, PRODUKCJA PRZYCZEP I NACZEP;0.25722693524459994;72.0
80;DZIAŁALNOŚĆ DETEKTYWISTYCZNA I OCHRONIARSKA;0.2534186024903162;73.0
46;HANDEL HURTOWY;0.2506887281760056;74.0
27;PRODUKCJA URZĄDZEŃ ELEKTRYCZNYCH;0.24726367587639375;75.0
92;DZIAŁALNOŚĆ ZWIĄZANA Z GRAMI HAZARDOWYMI;0.24481624708515276;76.0
86;OPIEKA ZDROWOTNA;0.24112451396435514;77.0
09;DZIAŁALNOŚĆ USŁUGOWA WSPOMAGAJĄCA GÓRNICTWO I WYDOBYWANIE;0.2333635116926071;78.0
53;DZIAŁALNOŚĆ POCZTOWA I KURIERSKA;0.23176378045576196;79.0
39;DZIAŁALNOŚĆ ZWIĄZANA Z REKULTYWACJĄ I POZOSTAŁA DZIAŁALNOŚĆ USŁUGOWA ZWIĄZANA Z GOSPODARKĄ ODPADAMI;0.23138514414164785;80.0
47;HANDEL DETALICZNY;0.22298855689753638;81.0
78;DZIAŁALNOŚĆ ZWIĄZANA Z ZATRUDNIENIEM;0.2155444929638922;82.0
12;PRODUKCJA WYROBÓW TYTONIOWYCH;0.19945538469232904;83.0
93;DZIAŁALNOŚĆ SPORTOWA, ROZRYWKOWA I REKREACYJNA;0.19708574566332285;84.0
19;WYTWARZANIE I PRZETWARZANIE KOKSU I PRODUKTÓW RAFINACJI ROPY NAFTOWEJ;0.1682002157609905;85.0
87;POMOC SPOŁECZNA Z ZAKWATEROWANIEM;0.13125952644762362;86.0
05;WYDOBYWANIE WĘGLA KAMIENNEGO I WĘGLA BRUNATNEGO (LIGNITU);0.09820625547202771;87.0
