alternative_id;nazwa;monte_carlo_score;monte_carlo_rank
90;DZIAŁALNOŚĆ TWÓRCZA I DZIAŁALNOŚĆ ZWIĄZANA Z WYSTAWIANIEM PRZEDSTAWIEŃ ARTYSTYCZNYCH;0.5045731064228327;1.0
75;DZIAŁALNOŚĆ WETERYNARYJNA;0.49080510228344715;2.0
64;FINANSOWA DZIAŁALNOŚĆ USŁUGOWA, Z WYŁĄCZENIEM UBEZPIECZEŃ I FUNDUSZY EMERYTALNYCH;0.48126346804974546;3.0
94;DZIAŁALNOŚĆ ORGANIZACJI CZŁONKOWSKICH;0.45816092407947273;4.0
01;UPRAWY ROLNE, CHÓW I HODOWLA ZWIERZĄT, ŁOWIECTWO, W TYM DZIAŁALNOŚĆ USŁUGOWA;0.4482763817414769;5.0
95;NAPRAWA I KONSERWACJA KOMPUTERÓW, ARTYKUŁÓW UŻYTKU OSOBISTEGO I DOMOWEGO ORAZ POJAZDÓW SILNIKOWYCH, W TYM MOTOCYKLI;0.4090978359822519;6.0
77;WYNAJEM I DZIERŻAWA;0.4044025646027199;7.0
70;DZIAŁALNOŚĆ CENTRAL (HEAD OFFICES) ORAZ DORADZTWO ZWIĄZANE Z ZARZĄDZANIEM;0.3858953945263021;8.0
50;TRANSPORT WODNY;0.37474458738297184;9.0
51;TRANSPORT LOTNICZY;0.36992897830452437;10.0
69;DZIAŁALNOŚĆ PRAWNICZA, RACHUNKOWO-KSIĘGOWA I DORADZTWO PODATKOWE;0.3668369134817344;11.0
74;POZOSTAŁA DZIAŁALNOŚĆ PROFESJONALNA, NAUKOWA I TECHNICZNA;0.3630984258045187;12.0
88;POMOC SPOŁECZNA BEZ ZAKWATEROWANIA;0.36084045252758706;13.0
15;PRODUKCJA SKÓR I WYROBÓW ZE SKÓR WYPRAWIONYCH, PRODUKCJA PODOBNYCH WYROBÓW Z INNYCH MATERIAŁÓW;0.35616350998765883;14.0
03;RYBACTWO;0.3550196198007532;15.0
60;NADAWANIE PROGRAMÓW OGÓLNODOSTĘPNYCH I ABONAMENTOWYCH, DZIAŁALNOŚĆ AGENCJI INFORMACYJNYCH I POZOSTAŁA DZIAŁALNOŚĆ ZWIĄZANA Z DYSTRYBUCJĄ TREŚCI;0.3475965663131728;16.0
71;"DZIAŁALNOŚĆ W ZAKRESIE ARCHITEKTURY I INŻYNIERII; BADANIA I ANALIZY TECHNICZNE";0.34755909986477557;17.0
63;DZIAŁALNOŚĆ USŁUGOWA W ZAKRESIE INFRASTRUKTURY OBLICZENIOWEJ, PRZETWARZANIA DANYCH, ZARZĄDZANIA STRONAMI INTERNETOWYMI (HOSTING) I POZOSTAŁA DZIAŁALNOŚĆ USŁUGOWA W ZAKRESIE INFORMACJI;0.34456927543285315;18.0
61;TELEKOMUNIKACJA;0.3438386602787309;19.0
37;ODPROWADZANIE I OCZYSZCZANIE ŚCIEKÓW;0.3414723173627434;20.0
35;WYTWARZANIE I ZAOPATRYWANIE W ENERGIĘ ELEKTRYCZNĄ, GAZ, PARĘ WODNĄ I POWIETRZE DO UKŁADÓW KLIMATYZACYJNYCH;0.3376450887396649;21.0
02;LEŚNICTWO I POZYSKIWANIE DREWNA;0.3373407610118432;22.0
36;POBÓR, UZDATNIANIE I DOSTARCZANIE WODY;0.33621750354052277;23.0
21;PRODUKCJA PODSTAWOWYCH SUBSTANCJI FARMACEUTYCZNYCH ORAZ LEKÓW I POZOSTAŁYCH WYROBÓW FARMACEUTYCZNYCH;0.3352070691078677;24.0
68;DZIAŁALNOŚĆ ZWIĄZANA Z OBSŁUGĄ RYNKU NIERUCHOMOŚCI;0.33129710595360506;25.0
17;PRODUKCJA PAPIERU I WYROBÓW Z PAPIERU;0.3309279620172824;26.0
58;DZIAŁALNOŚĆ WYDAWNICZA;0.3283758203883865;27.0
59;DZIAŁALNOŚĆ ZWIĄZANA Z PRODUKCJĄ FILMÓW, NAGRAŃ WIDEO, PROGRAMÓW TELEWIZYJNYCH, NAGRAŃ DŹWIĘKOWYCH I MUZYCZNYCH;0.3251823120336213;28.0
85;EDUKACJA;0.324876416372774;29.0
18;POLIGRAFIA I REPRODUKCJA ZAPISANYCH NOŚNIKÓW INFORMACJI;0.324056658689339;30.0
72;BADANIA NAUKOWE I PRACE ROZWOJOWE;0.3240021372178429;31.0
55;ZAKWATEROWANIE;0.3236486485694198;32.0
23;PRODUKCJA WYROBÓW Z POZOSTAŁYCH MINERALNYCH SUROWCÓW NIEMETALICZNYCH;0.32222251641417804;33.0
28;PRODUKCJA MASZYN I URZĄDZEŃ, GDZIE INDZIEJ NIESKLASYFIKOWANA;0.32146474617149456;34.0
91;DZIAŁALNOŚĆ BIBLIOTEK, ARCHIWÓW, MUZEÓW ORAZ POZOSTAŁA DZIAŁALNOŚĆ ZWIĄZANA Z KULTURĄ;0.31577515088973857;35.0
25;PRODUKCJA METALOWYCH WYROBÓW GOTOWYCH, Z WYŁĄCZENIEM MASZYN I URZĄDZEŃ;0.3155965708093835;36.0
62;DZIAŁALNOŚĆ ZWIĄZANA Z PROGRAMOWANIEM, DORADZTWEM W ZAKRESIE INFORMATYKI I DZIAŁALNOŚCI POWIĄZANE;0.3138359508762022;37.0
22;PRODUKCJA WYROBÓW Z GUMY I TWORZYW SZTUCZNYCH;0.31224270174992874;38.0
11;PRODUKCJA NAPOJÓW;0.3122095980553778;39.0
14;PRODUKCJA ODZIEŻY;0.31038103668618855;40.0
33;NAPRAWA, KONSERWACJA I INSTALOWANIE MASZYN I URZĄDZEŃ;0.30689931025782774;41.0
31;PRODUKCJA MEBLI;0.3065769224748849;42.0
08;POZOSTAŁE GÓRNICTWO I WYDOBYWANIE;0.3058123223134217;43.0
73;DZIAŁALNOŚĆ W ZAKRESIE REKLAMY, BADANIA RYNKU I PUBLIC RELATIONS;0.30429252663705536;44.0
82;DZIAŁALNOŚĆ ZWIĄZANA Z ADMINISTRACYJNĄ OBSŁUGĄ BIURA I POZOSTAŁA DZIAŁALNOŚĆ WSPOMAGAJĄCA PROWADZENIE DZIAŁALNOŚCI GOSPODARCZEJ;0.3029803020576973;45.0
16;"PRODUKCJA WYROBÓW Z DREWNA I KORKA, Z WYŁĄCZENIEM MEBLI; PRODUKCJA WYROBÓW ZE SŁOMY I MATERIAŁÓW UŻYWANYCH DO WYPLATANIA";0.3026071779086556;46.0
81;DZIAŁALNOŚĆ USŁUGOWA ZWIĄZANA Z UTRZYMANIEM PORZĄDKU W BUDYNKACH I ZAGOSPODAROWANIEM TERENÓW ZIELENI;0.30243464001417336;47.0
20;PRODUKCJA CHEMIKALIÓW I WYROBÓW CHEMICZNYCH;0.29905848304868526;48.0
32;POZOSTAŁA PRODUKCJA WYROBÓW;0.29680110931505554;49.0
13;PRODUKCJA WYROBÓW TEKSTYLNYCH;0.2965642128285423;50.0
56;DZIAŁALNOŚĆ USŁUGOWA ZWIĄZANA Z WYŻYWIENIEM;0.29541402407233697;51.0
43;ROBOTY BUDOWLANE SPECJALISTYCZNE;0.2936438333826716;52.0
41;ROBOTY BUDOWLANE ZWIĄZANE ZE WZNOSZENIEM BUDYNKÓW MIESZKALNYCH I NIEMIESZKALNYCH;0.29273019673344813;53.0
42;ROBOTY ZWIĄZANE Z BUDOWĄ OBIEKTÓW INŻYNIERII LĄDOWEJ I WODNEJ;0.292390439437507;54.0
79;DZIAŁALNOŚĆ ORGANIZATORÓW TURYSTYKI, AGENTÓW TURYSTYCZNYCH ORAZ POZOSTAŁA DZIAŁALNOŚĆ USŁUGOWA W ZAKRESIE REZERWACJI I DZIAŁALNOŚCI Z NIĄ ZWIĄZANE;0.29104411574781675;55.0
49;TRANSPORT LĄDOWY ORAZ TRANSPORT RUROCIĄGOWY;0.2898630920550973;56.0
30;PRODUKCJA POZOSTAŁEGO SPRZĘTU TRANSPORTOWEGO;0.28954932204858763;57.0
38;DZIAŁALNOŚĆ ZWIĄZANA ZE ZBIERANIEM, ODZYSKIEM I UNIESZKODLIWIANIEM ODPADÓW;0.28894136371816503;58.0
10;PRODUKCJA ARTYKUŁÓW SPOŻYWCZYCH;0.2864401097101805;59.0
07;GÓRNICTWO RUD METALI;0.2848416583409813;60.0
92;DZIAŁALNOŚĆ ZWIĄZANA Z GRAMI HAZARDOWYMI;0.28361347757338695;61.0
84;"ADMINISTRACJA PUBLICZNA I OBRONA NARODOWA; OBOWIĄZKOWE UBEZPIECZENIA SPOŁECZNE";0.2833979102589047;62.0
52;MAGAZYNOWANIE, PRZECHOWYWANIE I DZIAŁALNOŚĆ USŁUGOWA WSPOMAGAJĄCA TRANSPORT;0.2833003192641655;63.0
65;DZIAŁALNOŚĆ W ZAKRESIE UBEZPIECZEŃ, REASEKURACJI ORAZ FUNDUSZY EMERYTALNYCH, Z WYŁĄCZENIEM OBOWIĄZKOWEGO UBEZPIECZENIA SPOŁECZNEGO;0.28328906763796735;64.0
97;GOSPODARSTWA DOMOWE ZATRUDNIAJĄCE PRACOWNIKÓW;0.28327320986036214;65.0
99;ORGANIZACJE I ZESPOŁY EKSTERYTORIALNE;0.28322191060740726;66.0
98;GOSPODARSTWA DOMOWE PRODUKUJĄCE WYROBY I ŚWIADCZĄCE USŁUGI NA WŁASNE POTRZEBY;0.28321196669438536;67.0
06;GÓRNICTWO ROPY NAFTOWEJ I GAZU ZIEMNEGO;0.2830368447283015;68.0
29;PRODUKCJA POJAZDÓW SILNIKOWYCH, PRODUKCJA PRZYCZEP I NACZEP;0.28268331381658457;69.0
24;PRODUKCJA METALI;0.2796814155672922;70.0
80;DZIAŁALNOŚĆ DETEKTYWISTYCZNA I OCHRONIARSKA;0.2767559572823168;71.0
27;PRODUKCJA URZĄDZEŃ ELEKTRYCZNYCH;0.27592108840690127;72.0
53;DZIAŁALNOŚĆ POCZTOWA I KURIERSKA;0.2756103458027837;73.0
86;OPIEKA ZDROWOTNA;0.27476619741501357;74.0
26;PRODUKCJA KOMPUTERÓW, WYROBÓW ELEKTRONICZNYCH I OPTYCZNYCH;0.27267342668026096;75.0
66;DZIAŁALNOŚĆ WSPOMAGAJĄCA USŁUGI FINANSOWE, UBEZPIECZENIA I FUNDUSZE EMERYTALNE;0.2725365570842547;76.0
46;HANDEL HURTOWY;0.26738444536658934;77.0
78;DZIAŁALNOŚĆ ZWIĄZANA Z ZATRUDNIENIEM;0.25998376968354286;78.0
09;DZIAŁALNOŚĆ USŁUGOWA WSPOMAGAJĄCA GÓRNICTWO I WYDOBYWANIE;0.2587740618061759;79.0
47;HANDEL DETALICZNY;0.2584388840655429;80.0
39;DZIAŁALNOŚĆ ZWIĄZANA Z REKULTYWACJĄ I POZOSTAŁA DZIAŁALNOŚĆ USŁUGOWA ZWIĄZANA Z GOSPODARKĄ ODPADAMI;0.2571346530532937;81.0
96;DZIAŁALNOŚĆ USŁUGOWA INDYWIDUALNA;0.24693045709392275;82.0
12;PRODUKCJA WYROBÓW TYTONIOWYCH;0.24570735221586593;83.0
93;DZIAŁALNOŚĆ SPORTOWA, ROZRYWKOWA I REKREACYJNA;0.21861790627283853;84.0
19;WYTWARZANIE I PRZETWARZANIE KOKSU I PRODUKTÓW RAFINACJI ROPY NAFTOWEJ;0.21107697597251954;85.0
87;POMOC SPOŁECZNA Z ZAKWATEROWANIEM;0.19418310893565732;86.0
05;WYDOBYWANIE WĘGLA KAMIENNEGO I WĘGLA BRUNATNEGO (LIGNITU);0.12180723915206121;87.0
