alternative_id;nazwa;ensemble_score;ensemble_rank
94;DZIAŁALNOŚĆ ORGANIZACJI CZŁONKOWSKICH;0.6053702737909795;1.0
09;DZIAŁALNOŚĆ USŁUGOWA WSPOMAGAJĄCA GÓRNICTWO I WYDOBYWANIE;0.5499517630549816;2.0
92;DZIAŁALNOŚĆ ZWIĄZANA Z GRAMI HAZARDOWYMI;0.39231749236420255;3.0
90;DZIAŁALNOŚĆ TWÓRCZA I DZIAŁALNOŚĆ ZWIĄZANA Z WYSTAWIANIEM PRZEDSTAWIEŃ ARTYSTYCZNYCH;0.39191223113465107;4.0
60;NADAWANIE PROGRAMÓW OGÓLNODOSTĘPNYCH I ABONAMENTOWYCH, DZIAŁALNOŚĆ AGENCJI INFORMACYJNYCH I POZOSTAŁA DZIAŁALNOŚĆ ZWIĄZANA Z DYSTRYBUCJĄ TREŚCI;0.3627969530418768;5.0
85;EDUKACJA;0.3384948889414753;6.0
70;DZIAŁALNOŚĆ CENTRAL (HEAD OFFICES) ORAZ DORADZTWO ZWIĄZANE Z ZARZĄDZANIEM;0.31671109805988396;7.0
64;FINANSOWA DZIAŁALNOŚĆ USŁUGOWA, Z WYŁĄCZENIEM UBEZPIECZEŃ I FUNDUSZY EMERYTALNYCH;0.31592724477398737;8.0
66;DZIAŁALNOŚĆ WSPOMAGAJĄCA USŁUGI FINANSOWE, UBEZPIECZENIA I FUNDUSZE EMERYTALNE;0.30197279153820467;9.0
77;WYNAJEM I DZIERŻAWA;0.29900874283704804;10.0
12;PRODUKCJA WYROBÓW TYTONIOWYCH;0.28413349859468257;11.0
79;DZIAŁALNOŚĆ ORGANIZATORÓW TURYSTYKI, AGENTÓW TURYSTYCZNYCH ORAZ POZOSTAŁA DZIAŁALNOŚĆ USŁUGOWA W ZAKRESIE REZERWACJI I DZIAŁALNOŚCI Z NIĄ ZWIĄZANE;0.27706026303061426;12.0
93;DZIAŁALNOŚĆ SPORTOWA, ROZRYWKOWA I REKREACYJNA;0.27280906233417956;13.0
63;DZIAŁALNOŚĆ USŁUGOWA W ZAKRESIE INFRASTRUKTURY OBLICZENIOWEJ, PRZETWARZANIA DANYCH, ZARZĄDZANIA STRONAMI INTERNETOWYMI (HOSTING) I POZOSTAŁA DZIAŁALNOŚĆ USŁUGOWA W ZAKRESIE INFORMACJI;0.25918745922817943;14.0
53;DZIAŁALNOŚĆ POCZTOWA I KURIERSKA;0.2585657875495038;15.0
73;DZIAŁALNOŚĆ W ZAKRESIE REKLAMY, BADANIA RYNKU I PUBLIC RELATIONS;0.2580724467891157;16.0
36;POBÓR, UZDATNIANIE I DOSTARCZANIE WODY;0.2504668104604014;17.0
61;TELEKOMUNIKACJA;0.24790360281134577;18.0
39;DZIAŁALNOŚĆ ZWIĄZANA Z REKULTYWACJĄ I POZOSTAŁA DZIAŁALNOŚĆ USŁUGOWA ZWIĄZANA Z GOSPODARKĄ ODPADAMI;0.24501025317362832;19.0
38;DZIAŁALNOŚĆ ZWIĄZANA ZE ZBIERANIEM, ODZYSKIEM I UNIESZKODLIWIANIEM ODPADÓW;0.2442056597451419;20.0
80;DZIAŁALNOŚĆ DETEKTYWISTYCZNA I OCHRONIARSKA;0.2414196951252103;21.0
87;POMOC SPOŁECZNA Z ZAKWATEROWANIEM;0.24100048851526465;22.0
95;NAPRAWA I KONSERWACJA KOMPUTERÓW, ARTYKUŁÓW UŻYTKU OSOBISTEGO I DOMOWEGO ORAZ POJAZDÓW SILNIKOWYCH, W TYM MOTOCYKLI;0.2398104141298743;23.0
01;UPRAWY ROLNE, CHÓW I HODOWLA ZWIERZĄT, ŁOWIECTWO, W TYM DZIAŁALNOŚĆ USŁUGOWA;0.23976555122298884;24.0
86;OPIEKA ZDROWOTNA;0.23868852909287075;25.0
52;MAGAZYNOWANIE, PRZECHOWYWANIE I DZIAŁALNOŚĆ USŁUGOWA WSPOMAGAJĄCA TRANSPORT;0.2345351533880886;26.0
68;DZIAŁALNOŚĆ ZWIĄZANA Z OBSŁUGĄ RYNKU NIERUCHOMOŚCI;0.233336699696357;27.0
19;WYTWARZANIE I PRZETWARZANIE KOKSU I PRODUKTÓW RAFINACJI ROPY NAFTOWEJ;0.23331274267620955;28.0
81;DZIAŁALNOŚĆ USŁUGOWA ZWIĄZANA Z UTRZYMANIEM PORZĄDKU W BUDYNKACH I ZAGOSPODAROWANIEM TERENÓW ZIELENI;0.2330789761249586;29.0
56;DZIAŁALNOŚĆ USŁUGOWA ZWIĄZANA Z WYŻYWIENIEM;0.23269287968386304;30.0
02;LEŚNICTWO I POZYSKIWANIE DREWNA;0.2320701795731181;31.0
78;DZIAŁALNOŚĆ ZWIĄZANA Z ZATRUDNIENIEM;0.23186337335494056;32.0
72;BADANIA NAUKOWE I PRACE ROZWOJOWE;0.23110807486731025;33.0
50;TRANSPORT WODNY;0.23001675389672793;34.0
20;PRODUKCJA CHEMIKALIÓW I WYROBÓW CHEMICZNYCH;0.22919809211295283;35.0
88;POMOC SPOŁECZNA BEZ ZAKWATEROWANIA;0.2288247735764701;36.0
49;TRANSPORT LĄDOWY ORAZ TRANSPORT RUROCIĄGOWY;0.22847680090548178;37.0
28;PRODUKCJA MASZYN I URZĄDZEŃ, GDZIE INDZIEJ NIESKLASYFIKOWANA;0.22735871298760899;38.0
55;ZAKWATEROWANIE;0.2268356420447265;39.0
82;DZIAŁALNOŚĆ ZWIĄZANA Z ADMINISTRACYJNĄ OBSŁUGĄ BIURA I POZOSTAŁA DZIAŁALNOŚĆ WSPOMAGAJĄCA PROWADZENIE DZIAŁALNOŚCI GOSPODARCZEJ;0.2263437685871777;40.0
23;PRODUKCJA WYROBÓW Z POZOSTAŁYCH MINERALNYCH SUROWCÓW NIEMETALICZNYCH;0.22496703099912346;41.0
31;PRODUKCJA MEBLI;0.2241560113465343;42.0
13;PRODUKCJA WYROBÓW TEKSTYLNYCH;0.22357531770473257;43.0
58;DZIAŁALNOŚĆ WYDAWNICZA;0.22338605352556665;44.0
91;DZIAŁALNOŚĆ BIBLIOTEK, ARCHIWÓW, MUZEÓW ORAZ POZOSTAŁA DZIAŁALNOŚĆ ZWIĄZANA Z KULTURĄ;0.22334183746203493;45.0
16;"PRODUKCJA WYROBÓW Z DREWNA I KORKA, Z WYŁĄCZENIEM MEBLI; PRODUKCJA WYROBÓW ZE SŁOMY I MATERIAŁÓW UŻYWANYCH DO WYPLATANIA";0.22268232151295775;46.0
10;PRODUKCJA ARTYKUŁÓW SPOŻYWCZYCH;0.22130320172454732;47.0
29;PRODUKCJA POJAZDÓW SILNIKOWYCH, PRODUKCJA PRZYCZEP I NACZEP;0.2202793927068577;48.0
18;POLIGRAFIA I REPRODUKCJA ZAPISANYCH NOŚNIKÓW INFORMACJI;0.21931505101125948;49.0
62;DZIAŁALNOŚĆ ZWIĄZANA Z PROGRAMOWANIEM, DORADZTWEM W ZAKRESIE INFORMATYKI I DZIAŁALNOŚCI POWIĄZANE;0.2183055040428639;50.0
22;PRODUKCJA WYROBÓW Z GUMY I TWORZYW SZTUCZNYCH;0.21774872148840946;51.0
30;PRODUKCJA POZOSTAŁEGO SPRZĘTU TRANSPORTOWEGO;0.21747237910423775;52.0
69;DZIAŁALNOŚĆ PRAWNICZA, RACHUNKOWO-KSIĘGOWA I DORADZTWO PODATKOWE;0.21690707852248087;53.0
59;DZIAŁALNOŚĆ ZWIĄZANA Z PRODUKCJĄ FILMÓW, NAGRAŃ WIDEO, PROGRAMÓW TELEWIZYJNYCH, NAGRAŃ DŹWIĘKOWYCH I MUZYCZNYCH;0.21672758833913916;54.0
47;HANDEL DETALICZNY;0.21593319979985343;55.0
43;ROBOTY BUDOWLANE SPECJALISTYCZNE;0.21568746476125317;56.0
74;POZOSTAŁA DZIAŁALNOŚĆ PROFESJONALNA, NAUKOWA I TECHNICZNA;0.21510907533544588;57.0
42;ROBOTY ZWIĄZANE Z BUDOWĄ OBIEKTÓW INŻYNIERII LĄDOWEJ I WODNEJ;0.21451401201534184;58.0
41;ROBOTY BUDOWLANE ZWIĄZANE ZE WZNOSZENIEM BUDYNKÓW MIESZKALNYCH I NIEMIESZKALNYCH;0.21381453458078087;59.0
03;RYBACTWO;0.21362540646314007;60.0
25;PRODUKCJA METALOWYCH WYROBÓW GOTOWYCH, Z WYŁĄCZENIEM MASZYN I URZĄDZEŃ;0.21235837677251704;61.0
26;PRODUKCJA KOMPUTERÓW, WYROBÓW ELEKTRONICZNYCH I OPTYCZNYCH;0.21114250950212676;62.0
46;HANDEL HURTOWY;0.21077275215530547;63.0
05;WYDOBYWANIE WĘGLA KAMIENNEGO I WĘGLA BRUNATNEGO (LIGNITU);0.21076071173464858;64.0
71;"DZIAŁALNOŚĆ W ZAKRESIE ARCHITEKTURY I INŻYNIERII; BADANIA I ANALIZY TECHNICZNE";0.2103000062414056;65.0
17;PRODUKCJA PAPIERU I WYROBÓW Z PAPIERU;0.2075349172088121;66.0
11;PRODUKCJA NAPOJÓW;0.20737080236174854;67.0
24;PRODUKCJA METALI;0.20676566087578188;68.0
51;TRANSPORT LOTNICZY;0.2028901101096292;69.0
84;"ADMINISTRACJA PUBLICZNA I OBRONA NARODOWA; OBOWIĄZKOWE UBEZPIECZENIA SPOŁECZNE";0.20259500319350848;70.0
37;ODPROWADZANIE I OCZYSZCZANIE ŚCIEKÓW;0.20187136000272277;71.0
99;ORGANIZACJE I ZESPOŁY EKSTERYTORIALNE;0.19991136819741667;72.0
65;DZIAŁALNOŚĆ W ZAKRESIE UBEZPIECZEŃ, REASEKURACJI ORAZ FUNDUSZY EMERYTALNYCH, Z WYŁĄCZENIEM OBOWIĄZKOWEGO UBEZPIECZENIA SPOŁECZNEGO;0.19932237487159765;73.0
97;GOSPODARSTWA DOMOWE ZATRUDNIAJĄCE PRACOWNIKÓW;0.1980587627319535;74.0
98;GOSPODARSTWA DOMOWE PRODUKUJĄCE WYROBY I ŚWIADCZĄCE USŁUGI NA WŁASNE POTRZEBY;0.19804327741385308;75.0
06;GÓRNICTWO ROPY NAFTOWEJ I GAZU ZIEMNEGO;0.19751023319387329;76.0
96;DZIAŁALNOŚĆ USŁUGOWA INDYWIDUALNA;0.19719983377756478;77.0
07;GÓRNICTWO RUD METALI;0.1964983387989773;78.0
75;DZIAŁALNOŚĆ WETERYNARYJNA;0.19235559688156975;79.0
32;POZOSTAŁA PRODUKCJA WYROBÓW;0.19204464107576408;80.0
15;PRODUKCJA SKÓR I WYROBÓW ZE SKÓR WYPRAWIONYCH, PRODUKCJA PODOBNYCH WYROBÓW Z INNYCH MATERIAŁÓW;0.19104469723674877;81.0
33;NAPRAWA, KONSERWACJA I INSTALOWANIE MASZYN I URZĄDZEŃ;0.19008439008211878;82.0
27;PRODUKCJA URZĄDZEŃ ELEKTRYCZNYCH;0.18977239131391221;83.0
14;PRODUKCJA ODZIEŻY;0.1880033973000067;84.0
35;WYTWARZANIE I ZAOPATRYWANIE W ENERGIĘ ELEKTRYCZNĄ, GAZ, PARĘ WODNĄ I POWIETRZE DO UKŁADÓW KLIMATYZACYJNYCH;0.18581531635971277;85.0
08;POZOSTAŁE GÓRNICTWO I WYDOBYWANIE;0.18395877828060697;86.0
21;PRODUKCJA PODSTAWOWYCH SUBSTANCJI FARMACEUTYCZNYCH ORAZ LEKÓW I POZOSTAŁYCH WYROBÓW FARMACEUTYCZNYCH;0.17919623935500043;87.0
