alternative_id;nazwa;topsis_score;topsis_rank
09;DZIAŁALNOŚĆ USŁUGOWA WSPOMAGAJĄCA GÓRNICTWO I WYDOBYWANIE;0.6348798961482273;1.0
64;FINANSOWA DZIAŁALNOŚĆ USŁUGOWA, Z WYŁĄCZENIEM UBEZPIECZEŃ I FUNDUSZY EMERYTALNYCH;0.5946076178968824;2.0
94;DZIAŁALNOŚĆ ORGANIZACJI CZŁONKOWSKICH;0.5860825340384906;3.0
92;DZIAŁALNOŚĆ ZWIĄZANA Z GRAMI HAZARDOWYMI;0.5585797585218588;4.0
80;DZIAŁALNOŚĆ DETEKTYWISTYCZNA I OCHRONIARSKA;0.5522237344711178;5.0
63;DZIAŁALNOŚĆ USŁUGOWA W ZAKRESIE INFRASTRUKTURY OBLICZENIOWEJ, PRZETWARZANIA DANYCH, ZARZĄDZANIA STRONAMI INTERNETOWYMI (HOSTING) I POZOSTAŁA DZIAŁALNOŚĆ USŁUGOWA W ZAKRESIE INFORMACJI;0.5502418988685253;6.0
93;DZIAŁALNOŚĆ SPORTOWA, ROZRYWKOWA I REKREACYJNA;0.5350984166134256;7.0
70;DZIAŁALNOŚĆ CENTRAL (HEAD OFFICES) ORAZ DORADZTWO ZWIĄZANE Z ZARZĄDZANIEM;0.534469182774378;8.0
87;POMOC SPOŁECZNA Z ZAKWATEROWANIEM;0.5316215992752858;9.0
66;DZIAŁALNOŚĆ WSPOMAGAJĄCA USŁUGI FINANSOWE, UBEZPIECZENIA I FUNDUSZE EMERYTALNE;0.5303763482831608;10.0
21;PRODUKCJA PODSTAWOWYCH SUBSTANCJI FARMACEUTYCZNYCH ORAZ LEKÓW I POZOSTAŁYCH WYROBÓW FARMACEUTYCZNYCH;0.5272791541312404;11.0
59;DZIAŁALNOŚĆ ZWIĄZANA Z PRODUKCJĄ FILMÓW, NAGRAŃ WIDEO, PROGRAMÓW TELEWIZYJNYCH, NAGRAŃ DŹWIĘKOWYCH I MUZYCZNYCH;0.5270186187838151;12.0
37;ODPROWADZANIE I OCZYSZCZANIE ŚCIEKÓW;0.5266277256293038;13.0
79;DZIAŁALNOŚĆ ORGANIZATORÓW TURYSTYKI, AGENTÓW TURYSTYCZNYCH ORAZ POZOSTAŁA DZIAŁALNOŚĆ USŁUGOWA W ZAKRESIE REZERWACJI I DZIAŁALNOŚCI Z NIĄ ZWIĄZANE;0.5238754208427892;14.0
35;WYTWARZANIE I ZAOPATRYWANIE W ENERGIĘ ELEKTRYCZNĄ, GAZ, PARĘ WODNĄ I POWIETRZE DO UKŁADÓW KLIMATYZACYJNYCH;0.5219896661740898;15.0
91;DZIAŁALNOŚĆ BIBLIOTEK, ARCHIWÓW, MUZEÓW ORAZ POZOSTAŁA DZIAŁALNOŚĆ ZWIĄZANA Z KULTURĄ;0.5219439056599181;16.0
30;PRODUKCJA POZOSTAŁEGO SPRZĘTU TRANSPORTOWEGO;0.5204809170869422;17.0
36;POBÓR, UZDATNIANIE I DOSTARCZANIE WODY;0.5184150669837949;18.0
58;DZIAŁALNOŚĆ WYDAWNICZA;0.5171322124990883;19.0
77;WYNAJEM I DZIERŻAWA;0.5167299808418669;20.0
10;PRODUKCJA ARTYKUŁÓW SPOŻYWCZYCH;0.5162013930363165;21.0
96;DZIAŁALNOŚĆ USŁUGOWA INDYWIDUALNA;0.5156974717712057;22.0
72;BADANIA NAUKOWE I PRACE ROZWOJOWE;0.5144841716215429;23.0
55;ZAKWATEROWANIE;0.5144477318562852;24.0
08;POZOSTAŁE GÓRNICTWO I WYDOBYWANIE;0.5142963348211126;25.0
51;TRANSPORT LOTNICZY;0.5133519412659477;26.0
39;DZIAŁALNOŚĆ ZWIĄZANA Z REKULTYWACJĄ I POZOSTAŁA DZIAŁALNOŚĆ USŁUGOWA ZWIĄZANA Z GOSPODARKĄ ODPADAMI;0.5132881538067438;27.0
86;OPIEKA ZDROWOTNA;0.5119876304573343;28.0
14;PRODUKCJA ODZIEŻY;0.5116859777363181;29.0
13;PRODUKCJA WYROBÓW TEKSTYLNYCH;0.5116529729859296;30.0
56;DZIAŁALNOŚĆ USŁUGOWA ZWIĄZANA Z WYŻYWIENIEM;0.5116233756288846;31.0
81;DZIAŁALNOŚĆ USŁUGOWA ZWIĄZANA Z UTRZYMANIEM PORZĄDKU W BUDYNKACH I ZAGOSPODAROWANIEM TERENÓW ZIELENI;0.5104438029009485;32.0
01;UPRAWY ROLNE, CHÓW I HODOWLA ZWIERZĄT, ŁOWIECTWO, W TYM DZIAŁALNOŚĆ USŁUGOWA;0.5091378844943251;33.0
82;DZIAŁALNOŚĆ ZWIĄZANA Z ADMINISTRACYJNĄ OBSŁUGĄ BIURA I POZOSTAŁA DZIAŁALNOŚĆ WSPOMAGAJĄCA PROWADZENIE DZIAŁALNOŚCI GOSPODARCZEJ;0.5090989167161868;34.0
41;ROBOTY BUDOWLANE ZWIĄZANE ZE WZNOSZENIEM BUDYNKÓW MIESZKALNYCH I NIEMIESZKALNYCH;0.5089820992063907;35.0
19;WYTWARZANIE I PRZETWARZANIE KOKSU I PRODUKTÓW RAFINACJI ROPY NAFTOWEJ;0.5085268481962575;36.0
69;DZIAŁALNOŚĆ PRAWNICZA, RACHUNKOWO-KSIĘGOWA I DORADZTWO PODATKOWE;0.5080866021852091;37.0
12;PRODUKCJA WYROBÓW TYTONIOWYCH;0.5077037844614739;38.0
11;PRODUKCJA NAPOJÓW;0.5074965519132867;39.0
42;ROBOTY ZWIĄZANE Z BUDOWĄ OBIEKTÓW INŻYNIERII LĄDOWEJ I WODNEJ;0.50616206951113;40.0
97;GOSPODARSTWA DOMOWE ZATRUDNIAJĄCE PRACOWNIKÓW;0.5058321541434052;41.0
99;ORGANIZACJE I ZESPOŁY EKSTERYTORIALNE;0.5057051173554344;42.0
68;DZIAŁALNOŚĆ ZWIĄZANA Z OBSŁUGĄ RYNKU NIERUCHOMOŚCI;0.5056854311430827;43.0
23;PRODUKCJA WYROBÓW Z POZOSTAŁYCH MINERALNYCH SUROWCÓW NIEMETALICZNYCH;0.5038390155064439;44.0
47;HANDEL DETALICZNY;0.5034974979536415;45.0
43;ROBOTY BUDOWLANE SPECJALISTYCZNE;0.5032160292137043;46.0
53;DZIAŁALNOŚĆ POCZTOWA I KURIERSKA;0.5031590117884569;47.0
60;NADAWANIE PROGRAMÓW OGÓLNODOSTĘPNYCH I ABONAMENTOWYCH, DZIAŁALNOŚĆ AGENCJI INFORMACYJNYCH I POZOSTAŁA DZIAŁALNOŚĆ ZWIĄZANA Z DYSTRYBUCJĄ TREŚCI;0.5025180966078774;48.0
26;PRODUKCJA KOMPUTERÓW, WYROBÓW ELEKTRONICZNYCH I OPTYCZNYCH;0.502289303526021;49.0
75;DZIAŁALNOŚĆ WETERYNARYJNA;0.5014450757043164;50.0
88;POMOC SPOŁECZNA BEZ ZAKWATEROWANIA;0.501002619846506;51.0
78;DZIAŁALNOŚĆ ZWIĄZANA Z ZATRUDNIENIEM;0.5001459064142983;52.0
74;POZOSTAŁA DZIAŁALNOŚĆ PROFESJONALNA, NAUKOWA I TECHNICZNA;0.5000640940053134;53.0
15;PRODUKCJA SKÓR I WYROBÓW ZE SKÓR WYPRAWIONYCH, PRODUKCJA PODOBNYCH WYROBÓW Z INNYCH MATERIAŁÓW;0.4998580901281332;54.0
95;NAPRAWA I KONSERWACJA KOMPUTERÓW, ARTYKUŁÓW UŻYTKU OSOBISTEGO I DOMOWEGO ORAZ POJAZDÓW SILNIKOWYCH, W TYM MOTOCYKLI;0.499570258286769;55.0
22;PRODUKCJA WYROBÓW Z GUMY I TWORZYW SZTUCZNYCH;0.4992399603420572;56.0
73;DZIAŁALNOŚĆ W ZAKRESIE REKLAMY, BADANIA RYNKU I PUBLIC RELATIONS;0.4989299832419211;57.0
38;DZIAŁALNOŚĆ ZWIĄZANA ZE ZBIERANIEM, ODZYSKIEM I UNIESZKODLIWIANIEM ODPADÓW;0.498482519406786;58.0
46;HANDEL HURTOWY;0.4977656170974862;59.0
61;TELEKOMUNIKACJA;0.4976984330639904;60.0
33;NAPRAWA, KONSERWACJA I INSTALOWANIE MASZYN I URZĄDZEŃ;0.49755998244117483;61.0
71;"DZIAŁALNOŚĆ W ZAKRESIE ARCHITEKTURY I INŻYNIERII; BADANIA I ANALIZY TECHNICZNE";0.49718243271063417;62.0
28;PRODUKCJA MASZYN I URZĄDZEŃ, GDZIE INDZIEJ NIESKLASYFIKOWANA;0.49608555049701336;63.0
25;PRODUKCJA METALOWYCH WYROBÓW GOTOWYCH, Z WYŁĄCZENIEM MASZYN I URZĄDZEŃ;0.49517664599524275;64.0
32;POZOSTAŁA PRODUKCJA WYROBÓW;0.49515592800072855;65.0
84;"ADMINISTRACJA PUBLICZNA I OBRONA NARODOWA; OBOWIĄZKOWE UBEZPIECZENIA SPOŁECZNE";0.4948019373009839;66.0
06;GÓRNICTWO ROPY NAFTOWEJ I GAZU ZIEMNEGO;0.49426938961522815;67.0
98;GOSPODARSTWA DOMOWE PRODUKUJĄCE WYROBY I ŚWIADCZĄCE USŁUGI NA WŁASNE POTRZEBY;0.4941234835170556;68.0
65;DZIAŁALNOŚĆ W ZAKRESIE UBEZPIECZEŃ, REASEKURACJI ORAZ FUNDUSZY EMERYTALNYCH, Z WYŁĄCZENIEM OBOWIĄZKOWEGO UBEZPIECZENIA SPOŁECZNEGO;0.49410816305940536;69.0
07;GÓRNICTWO RUD METALI;0.4940295669064494;70.0
31;PRODUKCJA MEBLI;0.4938028208393806;71.0
18;POLIGRAFIA I REPRODUKCJA ZAPISANYCH NOŚNIKÓW INFORMACJI;0.4935017247229207;72.0
62;DZIAŁALNOŚĆ ZWIĄZANA Z PROGRAMOWANIEM, DORADZTWEM W ZAKRESIE INFORMATYKI I DZIAŁALNOŚCI POWIĄZANE;0.4932836780897899;73.0
52;MAGAZYNOWANIE, PRZECHOWYWANIE I DZIAŁALNOŚĆ USŁUGOWA WSPOMAGAJĄCA TRANSPORT;0.49255536018537394;74.0
90;DZIAŁALNOŚĆ TWÓRCZA I DZIAŁALNOŚĆ ZWIĄZANA Z WYSTAWIANIEM PRZEDSTAWIEŃ ARTYSTYCZNYCH;0.4921438353858755;75.0
29;PRODUKCJA POJAZDÓW SILNIKOWYCH, PRODUKCJA PRZYCZEP I NACZEP;0.4905004762798257;76.0
17;PRODUKCJA PAPIERU I WYROBÓW Z PAPIERU;0.48825768172540884;77.0
49;TRANSPORT LĄDOWY ORAZ TRANSPORT RUROCIĄGOWY;0.48749154762501745;78.0
03;RYBACTWO;0.4858601675406419;79.0
20;PRODUKCJA CHEMIKALIÓW I WYROBÓW CHEMICZNYCH;0.4810391731712701;80.0
27;PRODUKCJA URZĄDZEŃ ELEKTRYCZNYCH;0.4721618599203933;81.0
50;TRANSPORT WODNY;0.4669690587960201;82.0
16;"PRODUKCJA WYROBÓW Z DREWNA I KORKA, Z WYŁĄCZENIEM MEBLI; PRODUKCJA WYROBÓW ZE SŁOMY I MATERIAŁÓW UŻYWANYCH DO WYPLATANIA";0.465269333481807;83.0
85;EDUKACJA;0.4599703387072094;84.0
02;LEŚNICTWO I POZYSKIWANIE DREWNA;0.44671997912980294;85.0
24;PRODUKCJA METALI;0.44394970222931646;86.0
05;WYDOBYWANIE WĘGLA KAMIENNEGO I WĘGLA BRUNATNEGO (LIGNITU);0.17001312119876472;87.0
