alternative_id;nazwa;monte_carlo_score;monte_carlo_rank
94;DZIAŁALNOŚĆ ORGANIZACJI CZŁONKOWSKICH;0.5553960226452167;1.0
87;POMOC SPOŁECZNA Z ZAKWATEROWANIEM;0.4885758126699537;2.0
58;DZIAŁALNOŚĆ WYDAWNICZA;0.4806901886824865;3.0
39;DZIAŁALNOŚĆ ZWIĄZANA Z REKULTYWACJĄ I POZOSTAŁA DZIAŁALNOŚĆ USŁUGOWA ZWIĄZANA Z GOSPODARKĄ ODPADAMI;0.46465841056113755;4.0
64;FINANSOWA DZIAŁALNOŚĆ USŁUGOWA, Z WYŁĄCZENIEM UBEZPIECZEŃ I FUNDUSZY EMERYTALNYCH;0.46253024603374143;5.0
02;LEŚNICTWO I POZYSKIWANIE DREWNA;0.4579439668425284;6.0
77;WYNAJEM I DZIERŻAWA;0.4505455361528141;7.0
66;DZIAŁALNOŚĆ WSPOMAGAJĄCA USŁUGI FINANSOWE, UBEZPIECZENIA I FUNDUSZE EMERYTALNE;0.4499257744539983;8.0
08;POZOSTAŁE GÓRNICTWO I WYDOBYWANIE;0.4422300161543867;9.0
85;EDUKACJA;0.4400166788160228;10.0
09;DZIAŁALNOŚĆ USŁUGOWA WSPOMAGAJĄCA GÓRNICTWO I WYDOBYWANIE;0.4343868065045704;11.0
01;UPRAWY ROLNE, CHÓW I HODOWLA ZWIERZĄT, ŁOWIECTWO, W TYM DZIAŁALNOŚĆ USŁUGOWA;0.43076756421794105;12.0
80;DZIAŁALNOŚĆ DETEKTYWISTYCZNA I OCHRONIARSKA;0.42961958735567185;13.0
03;RYBACTWO;0.42812313517006717;14.0
21;PRODUKCJA PODSTAWOWYCH SUBSTANCJI FARMACEUTYCZNYCH ORAZ LEKÓW I POZOSTAŁYCH WYROBÓW FARMACEUTYCZNYCH;0.4234767200840384;15.0
63;DZIAŁALNOŚĆ USŁUGOWA W ZAKRESIE INFRASTRUKTURY OBLICZENIOWEJ, PRZETWARZANIA DANYCH, ZARZĄDZANIA STRONAMI INTERNETOWYMI (HOSTING) I POZOSTAŁA DZIAŁALNOŚĆ USŁUGOWA W ZAKRESIE INFORMACJI;0.4207294077610444;16.0
14;PRODUKCJA ODZIEŻY;0.41740312809786323;17.0
69;DZIAŁALNOŚĆ PRAWNICZA, RACHUNKOWO-KSIĘGOWA I DORADZTWO PODATKOWE;0.4170571369606853;18.0
38;DZIAŁALNOŚĆ ZWIĄZANA ZE ZBIERANIEM, ODZYSKIEM I UNIESZKODLIWIANIEM ODPADÓW;0.41501373806879843;19.0
19;WYTWARZANIE I PRZETWARZANIE KOKSU I PRODUKTÓW RAFINACJI ROPY NAFTOWEJ;0.41240658834719535;20.0
62;DZIAŁALNOŚĆ ZWIĄZANA Z PROGRAMOWANIEM, DORADZTWEM W ZAKRESIE INFORMATYKI I DZIAŁALNOŚCI POWIĄZANE;0.41110315481928245;21.0
82;DZIAŁALNOŚĆ ZWIĄZANA Z ADMINISTRACYJNĄ OBSŁUGĄ BIURA I POZOSTAŁA DZIAŁALNOŚĆ WSPOMAGAJĄCA PROWADZENIE DZIAŁALNOŚCI GOSPODARCZEJ;0.40483084298803534;22.0
61;TELEKOMUNIKACJA;0.40468114299773317;23.0
51;TRANSPORT LOTNICZY;0.4023540286249877;24.0
23;PRODUKCJA WYROBÓW Z POZOSTAŁYCH MINERALNYCH SUROWCÓW NIEMETALICZNYCH;0.4017424193937878;25.0
17;PRODUKCJA PAPIERU I WYROBÓW Z PAPIERU;0.4016956379041543;26.0
96;DZIAŁALNOŚĆ USŁUGOWA INDYWIDUALNA;0.40001897145882775;27.0
42;ROBOTY ZWIĄZANE Z BUDOWĄ OBIEKTÓW INŻYNIERII LĄDOWEJ I WODNEJ;0.39817126770192196;28.0
43;ROBOTY BUDOWLANE SPECJALISTYCZNE;0.39712350076841885;29.0
52;MAGAZYNOWANIE, PRZECHOWYWANIE I DZIAŁALNOŚĆ USŁUGOWA WSPOMAGAJĄCA TRANSPORT;0.3968458792606279;30.0
81;DZIAŁALNOŚĆ USŁUGOWA ZWIĄZANA Z UTRZYMANIEM PORZĄDKU W BUDYNKACH I ZAGOSPODAROWANIEM TERENÓW ZIELENI;0.3943920601600823;31.0
22;PRODUKCJA WYROBÓW Z GUMY I TWORZYW SZTUCZNYCH;0.39426267176330543;32.0
59;DZIAŁALNOŚĆ ZWIĄZANA Z PRODUKCJĄ FILMÓW, NAGRAŃ WIDEO, PROGRAMÓW TELEWIZYJNYCH, NAGRAŃ DŹWIĘKOWYCH I MUZYCZNYCH;0.3925713987232562;33.0
26;PRODUKCJA KOMPUTERÓW, WYROBÓW ELEKTRONICZNYCH I OPTYCZNYCH;0.39224058191262173;34.0
86;OPIEKA ZDROWOTNA;0.39131016133939106;35.0
79;DZIAŁALNOŚĆ ORGANIZATORÓW TURYSTYKI, AGENTÓW TURYSTYCZNYCH ORAZ POZOSTAŁA DZIAŁALNOŚĆ USŁUGOWA W ZAKRESIE REZERWACJI I DZIAŁALNOŚCI Z NIĄ ZWIĄZANE;0.39073777002538107;36.0
10;PRODUKCJA ARTYKUŁÓW SPOŻYWCZYCH;0.38788201479439943;37.0
84;"ADMINISTRACJA PUBLICZNA I OBRONA NARODOWA; OBOWIĄZKOWE UBEZPIECZENIA SPOŁECZNE";0.3872384526951819;38.0
65;DZIAŁALNOŚĆ W ZAKRESIE UBEZPIECZEŃ, REASEKURACJI ORAZ FUNDUSZY EMERYTALNYCH, Z WYŁĄCZENIEM OBOWIĄZKOWEGO UBEZPIECZENIA SPOŁECZNEGO;0.3870736342379173;39.0
31;PRODUKCJA MEBLI;0.38697875922372416;40.0
18;POLIGRAFIA I REPRODUKCJA ZAPISANYCH NOŚNIKÓW INFORMACJI;0.38686846859767415;41.0
56;DZIAŁALNOŚĆ USŁUGOWA ZWIĄZANA Z WYŻYWIENIEM;0.38577610695392606;42.0
36;POBÓR, UZDATNIANIE I DOSTARCZANIE WODY;0.38466215573007756;43.0
13;PRODUKCJA WYROBÓW TEKSTYLNYCH;0.38270154206858864;44.0
73;DZIAŁALNOŚĆ W ZAKRESIE REKLAMY, BADANIA RYNKU I PUBLIC RELATIONS;0.38189547548102903;45.0
35;WYTWARZANIE I ZAOPATRYWANIE W ENERGIĘ ELEKTRYCZNĄ, GAZ, PARĘ WODNĄ I POWIETRZE DO UKŁADÓW KLIMATYZACYJNYCH;0.38187750879158794;46.0
07;GÓRNICTWO RUD METALI;0.38136857044292566;47.0
06;GÓRNICTWO ROPY NAFTOWEJ I GAZU ZIEMNEGO;0.38125780411726695;48.0
37;ODPROWADZANIE I OCZYSZCZANIE ŚCIEKÓW;0.38091361468216617;49.0
90;DZIAŁALNOŚĆ TWÓRCZA I DZIAŁALNOŚĆ ZWIĄZANA Z WYSTAWIANIEM PRZEDSTAWIEŃ ARTYSTYCZNYCH;0.38077186515523487;50.0
71;"DZIAŁALNOŚĆ W ZAKRESIE ARCHITEKTURY I INŻYNIERII; BADANIA I ANALIZY TECHNICZNE";0.3807197604002821;51.0
32;POZOSTAŁA PRODUKCJA WYROBÓW;0.3798733427334654;52.0
50;TRANSPORT WODNY;0.3791515527329403;53.0
98;GOSPODARSTWA DOMOWE PRODUKUJĄCE WYROBY I ŚWIADCZĄCE USŁUGI NA WŁASNE POTRZEBY;0.37849390576288355;54.0
95;NAPRAWA I KONSERWACJA KOMPUTERÓW, ARTYKUŁÓW UŻYTKU OSOBISTEGO I DOMOWEGO ORAZ POJAZDÓW SILNIKOWYCH, W TYM MOTOCYKLI;0.3783967384682933;55.0
97;GOSPODARSTWA DOMOWE ZATRUDNIAJĄCE PRACOWNIKÓW;0.3778399355872158;56.0
99;ORGANIZACJE I ZESPOŁY EKSTERYTORIALNE;0.37779767755704863;57.0
28;PRODUKCJA MASZYN I URZĄDZEŃ, GDZIE INDZIEJ NIESKLASYFIKOWANA;0.376929116033675;58.0
25;PRODUKCJA METALOWYCH WYROBÓW GOTOWYCH, Z WYŁĄCZENIEM MASZYN I URZĄDZEŃ;0.3769147708135786;59.0
16;"PRODUKCJA WYROBÓW Z DREWNA I KORKA, Z WYŁĄCZENIEM MEBLI; PRODUKCJA WYROBÓW ZE SŁOMY I MATERIAŁÓW UŻYWANYCH DO WYPLATANIA";0.37589527276450313;60.0
91;DZIAŁALNOŚĆ BIBLIOTEK, ARCHIWÓW, MUZEÓW ORAZ POZOSTAŁA DZIAŁALNOŚĆ ZWIĄZANA Z KULTURĄ;0.3748923292803941;61.0
15;PRODUKCJA SKÓR I WYROBÓW ZE SKÓR WYPRAWIONYCH, PRODUKCJA PODOBNYCH WYROBÓW Z INNYCH MATERIAŁÓW;0.3732737792982883;62.0
93;DZIAŁALNOŚĆ SPORTOWA, ROZRYWKOWA I REKREACYJNA;0.3731558739690493;63.0
88;POMOC SPOŁECZNA BEZ ZAKWATEROWANIA;0.3728184516318104;64.0
74;POZOSTAŁA DZIAŁALNOŚĆ PROFESJONALNA, NAUKOWA I TECHNICZNA;0.37144935993231554;65.0
30;PRODUKCJA POZOSTAŁEGO SPRZĘTU TRANSPORTOWEGO;0.3712324878336999;66.0
53;DZIAŁALNOŚĆ POCZTOWA I KURIERSKA;0.36977358020481743;67.0
49;TRANSPORT LĄDOWY ORAZ TRANSPORT RUROCIĄGOWY;0.3684247848977988;68.0
33;NAPRAWA, KONSERWACJA I INSTALOWANIE MASZYN I URZĄDZEŃ;0.3677894500350441;69.0
55;ZAKWATEROWANIE;0.36647648545514794;70.0
78;DZIAŁALNOŚĆ ZWIĄZANA Z ZATRUDNIENIEM;0.3664153600740583;71.0
11;PRODUKCJA NAPOJÓW;0.3660074870547101;72.0
41;ROBOTY BUDOWLANE ZWIĄZANE ZE WZNOSZENIEM BUDYNKÓW MIESZKALNYCH I NIEMIESZKALNYCH;0.36494857676660636;73.0
46;HANDEL HURTOWY;0.36469815990437615;74.0
47;HANDEL DETALICZNY;0.3608651504532385;75.0
68;DZIAŁALNOŚĆ ZWIĄZANA Z OBSŁUGĄ RYNKU NIERUCHOMOŚCI;0.35710359638597783;76.0
92;DZIAŁALNOŚĆ ZWIĄZANA Z GRAMI HAZARDOWYMI;0.356753685250831;77.0
12;PRODUKCJA WYROBÓW TYTONIOWYCH;0.35451745144185015;78.0
27;PRODUKCJA URZĄDZEŃ ELEKTRYCZNYCH;0.353080437951427;79.0
29;PRODUKCJA POJAZDÓW SILNIKOWYCH, PRODUKCJA PRZYCZEP I NACZEP;0.3523257247808498;80.0
72;BADANIA NAUKOWE I PRACE ROZWOJOWE;0.3492061413187367;81.0
20;PRODUKCJA CHEMIKALIÓW I WYROBÓW CHEMICZNYCH;0.34825235056775483;82.0
24;PRODUKCJA METALI;0.34814449077687504;83.0
60;NADAWANIE PROGRAMÓW OGÓLNODOSTĘPNYCH I ABONAMENTOWYCH, DZIAŁALNOŚĆ AGENCJI INFORMACYJNYCH I POZOSTAŁA DZIAŁALNOŚĆ ZWIĄZANA Z DYSTRYBUCJĄ TREŚCI;0.3314162822942875;84.0
05;WYDOBYWANIE WĘGLA KAMIENNEGO I WĘGLA BRUNATNEGO (LIGNITU);0.31895173697863316;85.0
70;DZIAŁALNOŚĆ CENTRAL (HEAD OFFICES) ORAZ DORADZTWO ZWIĄZANE Z ZARZĄDZANIEM;0.31019562315050897;86.0
75;DZIAŁALNOŚĆ WETERYNARYJNA;0.30072666839335555;87.0
