alternative_id;nazwa;ensemble_score;ensemble_rank
03;RYBACTWO;0.6701401288685341;1.0
94;DZIAŁALNOŚĆ ORGANIZACJI CZŁONKOWSKICH;0.568876866240277;2.0
51;TRANSPORT LOTNICZY;0.5076328501742519;3.0
58;DZIAŁALNOŚĆ WYDAWNICZA;0.49895475095387276;4.0
02;LEŚNICTWO I POZYSKIWANIE DREWNA;0.4856639980559412;5.0
85;EDUKACJA;0.41724795379918805;6.0
08;POZOSTAŁE GÓRNICTWO I WYDOBYWANIE;0.40326813071870693;7.0
64;FINANSOWA DZIAŁALNOŚĆ USŁUGOWA, Z WYŁĄCZENIEM UBEZPIECZEŃ I FUNDUSZY EMERYTALNYCH;0.4009955731237193;8.0
01;UPRAWY ROLNE, CHÓW I HODOWLA ZWIERZĄT, ŁOWIECTWO, W TYM DZIAŁALNOŚĆ USŁUGOWA;0.39512321768654873;9.0
05;WYDOBYWANIE WĘGLA KAMIENNEGO I WĘGLA BRUNATNEGO (LIGNITU);0.38553053267425286;10.0
14;PRODUKCJA ODZIEŻY;0.38435599138862203;11.0
09;DZIAŁALNOŚĆ USŁUGOWA WSPOMAGAJĄCA GÓRNICTWO I WYDOBYWANIE;0.38158906428152317;12.0
90;DZIAŁALNOŚĆ TWÓRCZA I DZIAŁALNOŚĆ ZWIĄZANA Z WYSTAWIANIEM PRZEDSTAWIEŃ ARTYSTYCZNYCH;0.3759001570055275;13.0
79;DZIAŁALNOŚĆ ORGANIZATORÓW TURYSTYKI, AGENTÓW TURYSTYCZNYCH ORAZ POZOSTAŁA DZIAŁALNOŚĆ USŁUGOWA W ZAKRESIE REZERWACJI I DZIAŁALNOŚCI Z NIĄ ZWIĄZANE;0.3741211563906336;14.0
63;DZIAŁALNOŚĆ USŁUGOWA W ZAKRESIE INFRASTRUKTURY OBLICZENIOWEJ, PRZETWARZANIA DANYCH, ZARZĄDZANIA STRONAMI INTERNETOWYMI (HOSTING) I POZOSTAŁA DZIAŁALNOŚĆ USŁUGOWA W ZAKRESIE INFORMACJI;0.3730385094894188;15.0
19;WYTWARZANIE I PRZETWARZANIE KOKSU I PRODUKTÓW RAFINACJI ROPY NAFTOWEJ;0.3729395132588112;16.0
21;PRODUKCJA PODSTAWOWYCH SUBSTANCJI FARMACEUTYCZNYCH ORAZ LEKÓW I POZOSTAŁYCH WYROBÓW FARMACEUTYCZNYCH;0.372304323662631;17.0
32;POZOSTAŁA PRODUKCJA WYROBÓW;0.3673794747070237;18.0
69;DZIAŁALNOŚĆ PRAWNICZA, RACHUNKOWO-KSIĘGOWA I DORADZTWO PODATKOWE;0.36098250569174195;19.0
96;DZIAŁALNOŚĆ USŁUGOWA INDYWIDUALNA;0.3574948498871372;20.0
77;WYNAJEM I DZIERŻAWA;0.35637961283291164;21.0
66;DZIAŁALNOŚĆ WSPOMAGAJĄCA USŁUGI FINANSOWE, UBEZPIECZENIA I FUNDUSZE EMERYTALNE;0.3544878573868727;22.0
60;NADAWANIE PROGRAMÓW OGÓLNODOSTĘPNYCH I ABONAMENTOWYCH, DZIAŁALNOŚĆ AGENCJI INFORMACYJNYCH I POZOSTAŁA DZIAŁALNOŚĆ ZWIĄZANA Z DYSTRYBUCJĄ TREŚCI;0.3527243099012636;23.0
62;DZIAŁALNOŚĆ ZWIĄZANA Z PROGRAMOWANIEM, DORADZTWEM W ZAKRESIE INFORMATYKI I DZIAŁALNOŚCI POWIĄZANE;0.33962615722355227;24.0
42;ROBOTY ZWIĄZANE Z BUDOWĄ OBIEKTÓW INŻYNIERII LĄDOWEJ I WODNEJ;0.3394250636200853;25.0
59;DZIAŁALNOŚĆ ZWIĄZANA Z PRODUKCJĄ FILMÓW, NAGRAŃ WIDEO, PROGRAMÓW TELEWIZYJNYCH, NAGRAŃ DŹWIĘKOWYCH I MUZYCZNYCH;0.3354997795797122;26.0
38;DZIAŁALNOŚĆ ZWIĄZANA ZE ZBIERANIEM, ODZYSKIEM I UNIESZKODLIWIANIEM ODPADÓW;0.3354678416684862;27.0
23;PRODUKCJA WYROBÓW Z POZOSTAŁYCH MINERALNYCH SUROWCÓW NIEMETALICZNYCH;0.33345898048612443;28.0
18;POLIGRAFIA I REPRODUKCJA ZAPISANYCH NOŚNIKÓW INFORMACJI;0.3333021741358869;29.0
43;ROBOTY BUDOWLANE SPECJALISTYCZNE;0.33064424768161843;30.0
81;DZIAŁALNOŚĆ USŁUGOWA ZWIĄZANA Z UTRZYMANIEM PORZĄDKU W BUDYNKACH I ZAGOSPODAROWANIEM TERENÓW ZIELENI;0.3281829387099604;31.0
13;PRODUKCJA WYROBÓW TEKSTYLNYCH;0.3266092150529448;32.0
31;PRODUKCJA MEBLI;0.3258640908867777;33.0
11;PRODUKCJA NAPOJÓW;0.32574293401191406;34.0
70;DZIAŁALNOŚĆ CENTRAL (HEAD OFFICES) ORAZ DORADZTWO ZWIĄZANE Z ZARZĄDZANIEM;0.32534554542583144;35.0
22;PRODUKCJA WYROBÓW Z GUMY I TWORZYW SZTUCZNYCH;0.3245523442690438;36.0
78;DZIAŁALNOŚĆ ZWIĄZANA Z ZATRUDNIENIEM;0.32064453160996936;37.0
52;MAGAZYNOWANIE, PRZECHOWYWANIE I DZIAŁALNOŚĆ USŁUGOWA WSPOMAGAJĄCA TRANSPORT;0.3197836413112029;38.0
93;DZIAŁALNOŚĆ SPORTOWA, ROZRYWKOWA I REKREACYJNA;0.3177776011356899;39.0
82;DZIAŁALNOŚĆ ZWIĄZANA Z ADMINISTRACYJNĄ OBSŁUGĄ BIURA I POZOSTAŁA DZIAŁALNOŚĆ WSPOMAGAJĄCA PROWADZENIE DZIAŁALNOŚCI GOSPODARCZEJ;0.3159813395849787;40.0
41;ROBOTY BUDOWLANE ZWIĄZANE ZE WZNOSZENIEM BUDYNKÓW MIESZKALNYCH I NIEMIESZKALNYCH;0.3123484271972648;41.0
56;DZIAŁALNOŚĆ USŁUGOWA ZWIĄZANA Z WYŻYWIENIEM;0.31211669472081266;42.0
10;PRODUKCJA ARTYKUŁÓW SPOŻYWCZYCH;0.31012814253322174;43.0
25;PRODUKCJA METALOWYCH WYROBÓW GOTOWYCH, Z WYŁĄCZENIEM MASZYN I URZĄDZEŃ;0.31005256704430256;44.0
28;PRODUKCJA MASZYN I URZĄDZEŃ, GDZIE INDZIEJ NIESKLASYFIKOWANA;0.30959458642854865;45.0
87;POMOC SPOŁECZNA Z ZAKWATEROWANIEM;0.30650065486077005;46.0
55;ZAKWATEROWANIE;0.303526036439981;47.0
91;DZIAŁALNOŚĆ BIBLIOTEK, ARCHIWÓW, MUZEÓW ORAZ POZOSTAŁA DZIAŁALNOŚĆ ZWIĄZANA Z KULTURĄ;0.3003585650438011;48.0
61;TELEKOMUNIKACJA;0.2986716578469324;49.0
86;OPIEKA ZDROWOTNA;0.29849044354071613;50.0
71;"DZIAŁALNOŚĆ W ZAKRESIE ARCHITEKTURY I INŻYNIERII; BADANIA I ANALIZY TECHNICZNE";0.2965200733687974;51.0
17;PRODUKCJA PAPIERU I WYROBÓW Z PAPIERU;0.29650138670900095;52.0
15;PRODUKCJA SKÓR I WYROBÓW ZE SKÓR WYPRAWIONYCH, PRODUKCJA PODOBNYCH WYROBÓW Z INNYCH MATERIAŁÓW;0.29469067587204134;53.0
26;PRODUKCJA KOMPUTERÓW, WYROBÓW ELEKTRONICZNYCH I OPTYCZNYCH;0.2935241484061242;54.0
73;DZIAŁALNOŚĆ W ZAKRESIE REKLAMY, BADANIA RYNKU I PUBLIC RELATIONS;0.2927039751877486;55.0
16;"PRODUKCJA WYROBÓW Z DREWNA I KORKA, Z WYŁĄCZENIEM MEBLI; PRODUKCJA WYROBÓW ZE SŁOMY I MATERIAŁÓW UŻYWANYCH DO WYPLATANIA";0.28842341629071727;56.0
95;NAPRAWA I KONSERWACJA KOMPUTERÓW, ARTYKUŁÓW UŻYTKU OSOBISTEGO I DOMOWEGO ORAZ POJAZDÓW SILNIKOWYCH, W TYM MOTOCYKLI;0.286646741230924;57.0
65;DZIAŁALNOŚĆ W ZAKRESIE UBEZPIECZEŃ, REASEKURACJI ORAZ FUNDUSZY EMERYTALNYCH, Z WYŁĄCZENIEM OBOWIĄZKOWEGO UBEZPIECZENIA SPOŁECZNEGO;0.28607318178760877;58.0
07;GÓRNICTWO RUD METALI;0.2838799132305949;59.0
84;"ADMINISTRACJA PUBLICZNA I OBRONA NARODOWA; OBOWIĄZKOWE UBEZPIECZENIA SPOŁECZNE";0.2838035456377247;60.0
50;TRANSPORT WODNY;0.28083453594969543;61.0
39;DZIAŁALNOŚĆ ZWIĄZANA Z REKULTYWACJĄ I POZOSTAŁA DZIAŁALNOŚĆ USŁUGOWA ZWIĄZANA Z GOSPODARKĄ ODPADAMI;0.2793018099270409;62.0
06;GÓRNICTWO ROPY NAFTOWEJ I GAZU ZIEMNEGO;0.2756885666032004;63.0
80;DZIAŁALNOŚĆ DETEKTYWISTYCZNA I OCHRONIARSKA;0.2750404065408252;64.0
99;ORGANIZACJE I ZESPOŁY EKSTERYTORIALNE;0.2745017567389764;65.0
97;GOSPODARSTWA DOMOWE ZATRUDNIAJĄCE PRACOWNIKÓW;0.2744309757001794;66.0
98;GOSPODARSTWA DOMOWE PRODUKUJĄCE WYROBY I ŚWIADCZĄCE USŁUGI NA WŁASNE POTRZEBY;0.2743956270733713;67.0
46;HANDEL HURTOWY;0.27230682170478493;68.0
74;POZOSTAŁA DZIAŁALNOŚĆ PROFESJONALNA, NAUKOWA I TECHNICZNA;0.27015994737412435;69.0
30;PRODUKCJA POZOSTAŁEGO SPRZĘTU TRANSPORTOWEGO;0.26903163928341556;70.0
49;TRANSPORT LĄDOWY ORAZ TRANSPORT RUROCIĄGOWY;0.26828252289307414;71.0
37;ODPROWADZANIE I OCZYSZCZANIE ŚCIEKÓW;0.25827238026805244;72.0
27;PRODUKCJA URZĄDZEŃ ELEKTRYCZNYCH;0.2563535677253207;73.0
75;DZIAŁALNOŚĆ WETERYNARYJNA;0.25302643040677897;74.0
68;DZIAŁALNOŚĆ ZWIĄZANA Z OBSŁUGĄ RYNKU NIERUCHOMOŚCI;0.2483133536033324;75.0
33;NAPRAWA, KONSERWACJA I INSTALOWANIE MASZYN I URZĄDZEŃ;0.2443843470908874;76.0
47;HANDEL DETALICZNY;0.24191372847759113;77.0
12;PRODUKCJA WYROBÓW TYTONIOWYCH;0.23628655955375416;78.0
35;WYTWARZANIE I ZAOPATRYWANIE W ENERGIĘ ELEKTRYCZNĄ, GAZ, PARĘ WODNĄ I POWIETRZE DO UKŁADÓW KLIMATYZACYJNYCH;0.23524966325939617;79.0
92;DZIAŁALNOŚĆ ZWIĄZANA Z GRAMI HAZARDOWYMI;0.23438559273804788;80.0
24;PRODUKCJA METALI;0.2337764524021938;81.0
29;PRODUKCJA POJAZDÓW SILNIKOWYCH, PRODUKCJA PRZYCZEP I NACZEP;0.23240149396543638;82.0
88;POMOC SPOŁECZNA BEZ ZAKWATEROWANIA;0.2215160213369875;83.0
36;POBÓR, UZDATNIANIE I DOSTARCZANIE WODY;0.21182864366246149;84.0
53;DZIAŁALNOŚĆ POCZTOWA I KURIERSKA;0.20523439817938288;85.0
20;PRODUKCJA CHEMIKALIÓW I WYROBÓW CHEMICZNYCH;0.20244650409426063;86.0
72;BADANIA NAUKOWE I PRACE ROZWOJOWE;0.16083495714530488;87.0
