alternative_id;nazwa;topsis_score;topsis_rank
94;DZIAŁALNOŚĆ ORGANIZACJI CZŁONKOWSKICH;0.4564258080865538;1.0
92;DZIAŁALNOŚĆ ZWIĄZANA Z GRAMI HAZARDOWYMI;0.4212438125876899;2.0
75;DZIAŁALNOŚĆ WETERYNARYJNA;0.4200074115398778;3.0
05;WYDOBYWANIE WĘGLA KAMIENNEGO I WĘGLA BRUNATNEGO (LIGNITU);0.3866707196215055;4.0
09;DZIAŁALNOŚĆ USŁUGOWA WSPOMAGAJĄCA GÓRNICTWO I WYDOBYWANIE;0.3781752803786179;5.0
64;FINANSOWA DZIAŁALNOŚĆ USŁUGOWA, Z WYŁĄCZENIEM UBEZPIECZEŃ I FUNDUSZY EMERYTALNYCH;0.35242864522722966;6.0
70;DZIAŁALNOŚĆ CENTRAL (HEAD OFFICES) ORAZ DORADZTWO ZWIĄZANE Z ZARZĄDZANIEM;0.3445737295905896;7.0
91;DZIAŁALNOŚĆ BIBLIOTEK, ARCHIWÓW, MUZEÓW ORAZ POZOSTAŁA DZIAŁALNOŚĆ ZWIĄZANA Z KULTURĄ;0.3270348960042672;8.0
51;TRANSPORT LOTNICZY;0.32411001819080676;9.0
77;WYNAJEM I DZIERŻAWA;0.32047408992009185;10.0
69;DZIAŁALNOŚĆ PRAWNICZA, RACHUNKOWO-KSIĘGOWA I DORADZTWO PODATKOWE;0.3139594973926709;11.0
37;ODPROWADZANIE I OCZYSZCZANIE ŚCIEKÓW;0.3080789379556365;12.0
59;DZIAŁALNOŚĆ ZWIĄZANA Z PRODUKCJĄ FILMÓW, NAGRAŃ WIDEO, PROGRAMÓW TELEWIZYJNYCH, NAGRAŃ DŹWIĘKOWYCH I MUZYCZNYCH;0.3032043861594929;13.0
03;RYBACTWO;0.29820269921213877;14.0
55;ZAKWATEROWANIE;0.29596835138204525;15.0
58;DZIAŁALNOŚĆ WYDAWNICZA;0.29592607686920674;16.0
02;LEŚNICTWO I POZYSKIWANIE DREWNA;0.2937034278393941;17.0
15;PRODUKCJA SKÓR I WYROBÓW ZE SKÓR WYPRAWIONYCH, PRODUKCJA PODOBNYCH WYROBÓW Z INNYCH MATERIAŁÓW;0.2915054108738951;18.0
61;TELEKOMUNIKACJA;0.2802044335695584;19.0
53;DZIAŁALNOŚĆ POCZTOWA I KURIERSKA;0.2752024506378928;20.0
50;TRANSPORT WODNY;0.27504146398103063;21.0
96;DZIAŁALNOŚĆ USŁUGOWA INDYWIDUALNA;0.2749113584074954;22.0
08;POZOSTAŁE GÓRNICTWO I WYDOBYWANIE;0.27241438483550945;23.0
56;DZIAŁALNOŚĆ USŁUGOWA ZWIĄZANA Z WYŻYWIENIEM;0.2700540239091098;24.0
35;WYTWARZANIE I ZAOPATRYWANIE W ENERGIĘ ELEKTRYCZNĄ, GAZ, PARĘ WODNĄ I POWIETRZE DO UKŁADÓW KLIMATYZACYJNYCH;0.2682236682803547;25.0
01;UPRAWY ROLNE, CHÓW I HODOWLA ZWIERZĄT, ŁOWIECTWO, W TYM DZIAŁALNOŚĆ USŁUGOWA;0.26798704240918286;26.0
36;POBÓR, UZDATNIANIE I DOSTARCZANIE WODY;0.267828424931476;27.0
68;DZIAŁALNOŚĆ ZWIĄZANA Z OBSŁUGĄ RYNKU NIERUCHOMOŚCI;0.26760452536458806;28.0
73;DZIAŁALNOŚĆ W ZAKRESIE REKLAMY, BADANIA RYNKU I PUBLIC RELATIONS;0.2665067476453235;29.0
63;DZIAŁALNOŚĆ USŁUGOWA W ZAKRESIE INFRASTRUKTURY OBLICZENIOWEJ, PRZETWARZANIA DANYCH, ZARZĄDZANIA STRONAMI INTERNETOWYMI (HOSTING) I POZOSTAŁA DZIAŁALNOŚĆ USŁUGOWA W ZAKRESIE INFORMACJI;0.26624095070016646;30.0
17;PRODUKCJA PAPIERU I WYROBÓW Z PAPIERU;0.26537758774106807;31.0
23;PRODUKCJA WYROBÓW Z POZOSTAŁYCH MINERALNYCH SUROWCÓW NIEMETALICZNYCH;0.2639908239699041;32.0
74;POZOSTAŁA DZIAŁALNOŚĆ PROFESJONALNA, NAUKOWA I TECHNICZNA;0.262652515271985;33.0
88;POMOC SPOŁECZNA BEZ ZAKWATEROWANIA;0.261289351324066;34.0
28;PRODUKCJA MASZYN I URZĄDZEŃ, GDZIE INDZIEJ NIESKLASYFIKOWANA;0.2607915685876158;35.0
62;DZIAŁALNOŚĆ ZWIĄZANA Z PROGRAMOWANIEM, DORADZTWEM W ZAKRESIE INFORMATYKI I DZIAŁALNOŚCI POWIĄZANE;0.2600663689749508;36.0
14;PRODUKCJA ODZIEŻY;0.25992874050147413;37.0
60;NADAWANIE PROGRAMÓW OGÓLNODOSTĘPNYCH I ABONAMENTOWYCH, DZIAŁALNOŚĆ AGENCJI INFORMACYJNYCH I POZOSTAŁA DZIAŁALNOŚĆ ZWIĄZANA Z DYSTRYBUCJĄ TREŚCI;0.25858268452544275;38.0
20;PRODUKCJA CHEMIKALIÓW I WYROBÓW CHEMICZNYCH;0.25806039120717544;39.0
87;POMOC SPOŁECZNA Z ZAKWATEROWANIEM;0.25779420149934174;40.0
19;WYTWARZANIE I PRZETWARZANIE KOKSU I PRODUKTÓW RAFINACJI ROPY NAFTOWEJ;0.25686905050955944;41.0
18;POLIGRAFIA I REPRODUKCJA ZAPISANYCH NOŚNIKÓW INFORMACJI;0.25645350127243094;42.0
71;"DZIAŁALNOŚĆ W ZAKRESIE ARCHITEKTURY I INŻYNIERII; BADANIA I ANALIZY TECHNICZNE";0.2501849424739914;43.0
66;DZIAŁALNOŚĆ WSPOMAGAJĄCA USŁUGI FINANSOWE, UBEZPIECZENIA I FUNDUSZE EMERYTALNE;0.24993087690958335;44.0
72;BADANIA NAUKOWE I PRACE ROZWOJOWE;0.24832908363461698;45.0
32;POZOSTAŁA PRODUKCJA WYROBÓW;0.24683032687348155;46.0
65;DZIAŁALNOŚĆ W ZAKRESIE UBEZPIECZEŃ, REASEKURACJI ORAZ FUNDUSZY EMERYTALNYCH, Z WYŁĄCZENIEM OBOWIĄZKOWEGO UBEZPIECZENIA SPOŁECZNEGO;0.24667766103858985;47.0
84;"ADMINISTRACJA PUBLICZNA I OBRONA NARODOWA; OBOWIĄZKOWE UBEZPIECZENIA SPOŁECZNE";0.24660659896096787;48.0
30;PRODUKCJA POZOSTAŁEGO SPRZĘTU TRANSPORTOWEGO;0.24374611722091877;49.0
07;GÓRNICTWO RUD METALI;0.24300965097155824;50.0
49;TRANSPORT LĄDOWY ORAZ TRANSPORT RUROCIĄGOWY;0.2420915206544136;51.0
11;PRODUKCJA NAPOJÓW;0.24207886952341295;52.0
21;PRODUKCJA PODSTAWOWYCH SUBSTANCJI FARMACEUTYCZNYCH ORAZ LEKÓW I POZOSTAŁYCH WYROBÓW FARMACEUTYCZNYCH;0.24157527902233814;53.0
22;PRODUKCJA WYROBÓW Z GUMY I TWORZYW SZTUCZNYCH;0.2412139661234882;54.0
38;DZIAŁALNOŚĆ ZWIĄZANA ZE ZBIERANIEM, ODZYSKIEM I UNIESZKODLIWIANIEM ODPADÓW;0.23930851727090235;55.0
06;GÓRNICTWO ROPY NAFTOWEJ I GAZU ZIEMNEGO;0.23853166204153378;56.0
98;GOSPODARSTWA DOMOWE PRODUKUJĄCE WYROBY I ŚWIADCZĄCE USŁUGI NA WŁASNE POTRZEBY;0.23696189634427836;57.0
97;GOSPODARSTWA DOMOWE ZATRUDNIAJĄCE PRACOWNIKÓW;0.23696158270515164;58.0
99;ORGANIZACJE I ZESPOŁY EKSTERYTORIALNE;0.2368481537768765;59.0
43;ROBOTY BUDOWLANE SPECJALISTYCZNE;0.23657506519519608;60.0
31;PRODUKCJA MEBLI;0.2353759423075679;61.0
16;"PRODUKCJA WYROBÓW Z DREWNA I KORKA, Z WYŁĄCZENIEM MEBLI; PRODUKCJA WYROBÓW ZE SŁOMY I MATERIAŁÓW UŻYWANYCH DO WYPLATANIA";0.2352074497997452;62.0
25;PRODUKCJA METALOWYCH WYROBÓW GOTOWYCH, Z WYŁĄCZENIEM MASZYN I URZĄDZEŃ;0.234689268333451;63.0
33;NAPRAWA, KONSERWACJA I INSTALOWANIE MASZYN I URZĄDZEŃ;0.23385735879583422;64.0
13;PRODUKCJA WYROBÓW TEKSTYLNYCH;0.2326487200858367;65.0
85;EDUKACJA;0.23071975798700592;66.0
81;DZIAŁALNOŚĆ USŁUGOWA ZWIĄZANA Z UTRZYMANIEM PORZĄDKU W BUDYNKACH I ZAGOSPODAROWANIEM TERENÓW ZIELENI;0.22905535369179048;67.0
79;DZIAŁALNOŚĆ ORGANIZATORÓW TURYSTYKI, AGENTÓW TURYSTYCZNYCH ORAZ POZOSTAŁA DZIAŁALNOŚĆ USŁUGOWA W ZAKRESIE REZERWACJI I DZIAŁALNOŚCI Z NIĄ ZWIĄZANE;0.22784311733087761;68.0
41;ROBOTY BUDOWLANE ZWIĄZANE ZE WZNOSZENIEM BUDYNKÓW MIESZKALNYCH I NIEMIESZKALNYCH;0.2249558556845824;69.0
10;PRODUKCJA ARTYKUŁÓW SPOŻYWCZYCH;0.22408484223778544;70.0
12;PRODUKCJA WYROBÓW TYTONIOWYCH;0.22105284365080397;71.0
24;PRODUKCJA METALI;0.21945757185203407;72.0
26;PRODUKCJA KOMPUTERÓW, WYROBÓW ELEKTRONICZNYCH I OPTYCZNYCH;0.2176531515941511;73.0
42;ROBOTY ZWIĄZANE Z BUDOWĄ OBIEKTÓW INŻYNIERII LĄDOWEJ I WODNEJ;0.21646264008174085;74.0
29;PRODUKCJA POJAZDÓW SILNIKOWYCH, PRODUKCJA PRZYCZEP I NACZEP;0.21471574360662177;75.0
47;HANDEL DETALICZNY;0.21409937719299024;76.0
86;OPIEKA ZDROWOTNA;0.2124079032387019;77.0
90;DZIAŁALNOŚĆ TWÓRCZA I DZIAŁALNOŚĆ ZWIĄZANA Z WYSTAWIANIEM PRZEDSTAWIEŃ ARTYSTYCZNYCH;0.2107995623528459;78.0
46;HANDEL HURTOWY;0.21073215729873632;79.0
52;MAGAZYNOWANIE, PRZECHOWYWANIE I DZIAŁALNOŚĆ USŁUGOWA WSPOMAGAJĄCA TRANSPORT;0.21060012131395875;80.0
95;NAPRAWA I KONSERWACJA KOMPUTERÓW, ARTYKUŁÓW UŻYTKU OSOBISTEGO I DOMOWEGO ORAZ POJAZDÓW SILNIKOWYCH, W TYM MOTOCYKLI;0.2099349698200606;81.0
39;DZIAŁALNOŚĆ ZWIĄZANA Z REKULTYWACJĄ I POZOSTAŁA DZIAŁALNOŚĆ USŁUGOWA ZWIĄZANA Z GOSPODARKĄ ODPADAMI;0.20681700662792868;82.0
80;DZIAŁALNOŚĆ DETEKTYWISTYCZNA I OCHRONIARSKA;0.2030489658879156;83.0
27;PRODUKCJA URZĄDZEŃ ELEKTRYCZNYCH;0.19585592234715687;84.0
78;DZIAŁALNOŚĆ ZWIĄZANA Z ZATRUDNIENIEM;0.19148150461816138;85.0
82;DZIAŁALNOŚĆ ZWIĄZANA Z ADMINISTRACYJNĄ OBSŁUGĄ BIURA I POZOSTAŁA DZIAŁALNOŚĆ WSPOMAGAJĄCA PROWADZENIE DZIAŁALNOŚCI GOSPODARCZEJ;0.1900577733409795;86.0
93;DZIAŁALNOŚĆ SPORTOWA, ROZRYWKOWA I REKREACYJNA;0.15568585839290605;87.0
