alternative_id;nazwa;topsis_score;topsis_rank
64;FINANSOWA DZIAŁALNOŚĆ USŁUGOWA, Z WYŁĄCZENIEM UBEZPIECZEŃ I FUNDUSZY EMERYTALNYCH;0.5312636204827051;1.0
94;DZIAŁALNOŚĆ ORGANIZACJI CZŁONKOWSKICH;0.5241698704838782;2.0
02;LEŚNICTWO I POZYSKIWANIE DREWNA;0.511285135923899;3.0
58;DZIAŁALNOŚĆ WYDAWNICZA;0.4519809482635399;4.0
87;POMOC SPOŁECZNA Z ZAKWATEROWANIEM;0.45136418503280507;5.0
77;WYNAJEM I DZIERŻAWA;0.44709918345670074;6.0
39;DZIAŁALNOŚĆ ZWIĄZANA Z REKULTYWACJĄ I POZOSTAŁA DZIAŁALNOŚĆ USŁUGOWA ZWIĄZANA Z GOSPODARKĄ ODPADAMI;0.44011341050864794;7.0
19;WYTWARZANIE I PRZETWARZANIE KOKSU I PRODUKTÓW RAFINACJI ROPY NAFTOWEJ;0.437667036789549;8.0
03;RYBACTWO;0.4360022447475717;9.0
21;PRODUKCJA PODSTAWOWYCH SUBSTANCJI FARMACEUTYCZNYCH ORAZ LEKÓW I POZOSTAŁYCH WYROBÓW FARMACEUTYCZNYCH;0.4344886252702704;10.0
08;POZOSTAŁE GÓRNICTWO I WYDOBYWANIE;0.4303997495510781;11.0
69;DZIAŁALNOŚĆ PRAWNICZA, RACHUNKOWO-KSIĘGOWA I DORADZTWO PODATKOWE;0.4272358412383876;12.0
90;DZIAŁALNOŚĆ TWÓRCZA I DZIAŁALNOŚĆ ZWIĄZANA Z WYSTAWIANIEM PRZEDSTAWIEŃ ARTYSTYCZNYCH;0.42552120230736123;13.0
70;DZIAŁALNOŚĆ CENTRAL (HEAD OFFICES) ORAZ DORADZTWO ZWIĄZANE Z ZARZĄDZANIEM;0.42481868114292143;14.0
79;DZIAŁALNOŚĆ ORGANIZATORÓW TURYSTYKI, AGENTÓW TURYSTYCZNYCH ORAZ POZOSTAŁA DZIAŁALNOŚĆ USŁUGOWA W ZAKRESIE REZERWACJI I DZIAŁALNOŚCI Z NIĄ ZWIĄZANE;0.42125612361156034;15.0
63;DZIAŁALNOŚĆ USŁUGOWA W ZAKRESIE INFRASTRUKTURY OBLICZENIOWEJ, PRZETWARZANIA DANYCH, ZARZĄDZANIA STRONAMI INTERNETOWYMI (HOSTING) I POZOSTAŁA DZIAŁALNOŚĆ USŁUGOWA W ZAKRESIE INFORMACJI;0.42051220631295005;16.0
85;EDUKACJA;0.42044418412448;17.0
01;UPRAWY ROLNE, CHÓW I HODOWLA ZWIERZĄT, ŁOWIECTWO, W TYM DZIAŁALNOŚĆ USŁUGOWA;0.41672909080312476;18.0
96;DZIAŁALNOŚĆ USŁUGOWA INDYWIDUALNA;0.4151492211914199;19.0
51;TRANSPORT LOTNICZY;0.41393814818474206;20.0
62;DZIAŁALNOŚĆ ZWIĄZANA Z PROGRAMOWANIEM, DORADZTWEM W ZAKRESIE INFORMATYKI I DZIAŁALNOŚCI POWIĄZANE;0.40330793027258194;21.0
14;PRODUKCJA ODZIEŻY;0.4029825831931176;22.0
38;DZIAŁALNOŚĆ ZWIĄZANA ZE ZBIERANIEM, ODZYSKIEM I UNIESZKODLIWIANIEM ODPADÓW;0.40201989347474876;23.0
59;DZIAŁALNOŚĆ ZWIĄZANA Z PRODUKCJĄ FILMÓW, NAGRAŃ WIDEO, PROGRAMÓW TELEWIZYJNYCH, NAGRAŃ DŹWIĘKOWYCH I MUZYCZNYCH;0.39888326389660483;24.0
36;POBÓR, UZDATNIANIE I DOSTARCZANIE WODY;0.3987704809698439;25.0
61;TELEKOMUNIKACJA;0.3979826557229015;26.0
91;DZIAŁALNOŚĆ BIBLIOTEK, ARCHIWÓW, MUZEÓW ORAZ POZOSTAŁA DZIAŁALNOŚĆ ZWIĄZANA Z KULTURĄ;0.3965580951525875;27.0
82;DZIAŁALNOŚĆ ZWIĄZANA Z ADMINISTRACYJNĄ OBSŁUGĄ BIURA I POZOSTAŁA DZIAŁALNOŚĆ WSPOMAGAJĄCA PROWADZENIE DZIAŁALNOŚCI GOSPODARCZEJ;0.3953242529301737;28.0
55;ZAKWATEROWANIE;0.39517678708141996;29.0
66;DZIAŁALNOŚĆ WSPOMAGAJĄCA USŁUGI FINANSOWE, UBEZPIECZENIA I FUNDUSZE EMERYTALNE;0.3920946365051876;30.0
37;ODPROWADZANIE I OCZYSZCZANIE ŚCIEKÓW;0.3916256766922417;31.0
81;DZIAŁALNOŚĆ USŁUGOWA ZWIĄZANA Z UTRZYMANIEM PORZĄDKU W BUDYNKACH I ZAGOSPODAROWANIEM TERENÓW ZIELENI;0.39081974274844755;32.0
43;ROBOTY BUDOWLANE SPECJALISTYCZNE;0.3904437540200285;33.0
56;DZIAŁALNOŚĆ USŁUGOWA ZWIĄZANA Z WYŻYWIENIEM;0.39038843679633073;34.0
53;DZIAŁALNOŚĆ POCZTOWA I KURIERSKA;0.3853618182837743;35.0
42;ROBOTY ZWIĄZANE Z BUDOWĄ OBIEKTÓW INŻYNIERII LĄDOWEJ I WODNEJ;0.3851740760989127;36.0
68;DZIAŁALNOŚĆ ZWIĄZANA Z OBSŁUGĄ RYNKU NIERUCHOMOŚCI;0.3824311401905886;37.0
52;MAGAZYNOWANIE, PRZECHOWYWANIE I DZIAŁALNOŚĆ USŁUGOWA WSPOMAGAJĄCA TRANSPORT;0.3824094815187825;38.0
26;PRODUKCJA KOMPUTERÓW, WYROBÓW ELEKTRONICZNYCH I OPTYCZNYCH;0.3810989659215009;39.0
11;PRODUKCJA NAPOJÓW;0.3810730423790332;40.0
60;NADAWANIE PROGRAMÓW OGÓLNODOSTĘPNYCH I ABONAMENTOWYCH, DZIAŁALNOŚĆ AGENCJI INFORMACYJNYCH I POZOSTAŁA DZIAŁALNOŚĆ ZWIĄZANA Z DYSTRYBUCJĄ TREŚCI;0.3800865764252741;41.0
93;DZIAŁALNOŚĆ SPORTOWA, ROZRYWKOWA I REKREACYJNA;0.37834872446563117;42.0
23;PRODUKCJA WYROBÓW Z POZOSTAŁYCH MINERALNYCH SUROWCÓW NIEMETALICZNYCH;0.37800832656658656;43.0
86;OPIEKA ZDROWOTNA;0.376882147434696;44.0
41;ROBOTY BUDOWLANE ZWIĄZANE ZE WZNOSZENIEM BUDYNKÓW MIESZKALNYCH I NIEMIESZKALNYCH;0.3768370016356531;45.0
30;PRODUKCJA POZOSTAŁEGO SPRZĘTU TRANSPORTOWEGO;0.3767478068179609;46.0
73;DZIAŁALNOŚĆ W ZAKRESIE REKLAMY, BADANIA RYNKU I PUBLIC RELATIONS;0.37528364092255634;47.0
80;DZIAŁALNOŚĆ DETEKTYWISTYCZNA I OCHRONIARSKA;0.37519602054112283;48.0
92;DZIAŁALNOŚĆ ZWIĄZANA Z GRAMI HAZARDOWYMI;0.37505039678317825;49.0
07;GÓRNICTWO RUD METALI;0.37373976999418906;50.0
74;POZOSTAŁA DZIAŁALNOŚĆ PROFESJONALNA, NAUKOWA I TECHNICZNA;0.37255587618088915;51.0
17;PRODUKCJA PAPIERU I WYROBÓW Z PAPIERU;0.37146199279605174;52.0
13;PRODUKCJA WYROBÓW TEKSTYLNYCH;0.3707298530687656;53.0
18;POLIGRAFIA I REPRODUKCJA ZAPISANYCH NOŚNIKÓW INFORMACJI;0.3706435667193905;54.0
65;DZIAŁALNOŚĆ W ZAKRESIE UBEZPIECZEŃ, REASEKURACJI ORAZ FUNDUSZY EMERYTALNYCH, Z WYŁĄCZENIEM OBOWIĄZKOWEGO UBEZPIECZENIA SPOŁECZNEGO;0.37009098509561816;55.0
71;"DZIAŁALNOŚĆ W ZAKRESIE ARCHITEKTURY I INŻYNIERII; BADANIA I ANALIZY TECHNICZNE";0.36994500039386485;56.0
31;PRODUKCJA MEBLI;0.36982512381695604;57.0
98;GOSPODARSTWA DOMOWE PRODUKUJĄCE WYROBY I ŚWIADCZĄCE USŁUGI NA WŁASNE POTRZEBY;0.36963741875850986;58.5
97;GOSPODARSTWA DOMOWE ZATRUDNIAJĄCE PRACOWNIKÓW;0.36963741875850986;58.5
99;ORGANIZACJE I ZESPOŁY EKSTERYTORIALNE;0.36959381042925304;60.0
06;GÓRNICTWO ROPY NAFTOWEJ I GAZU ZIEMNEGO;0.369421901892792;61.0
84;"ADMINISTRACJA PUBLICZNA I OBRONA NARODOWA; OBOWIĄZKOWE UBEZPIECZENIA SPOŁECZNE";0.3689888806615062;62.0
22;PRODUKCJA WYROBÓW Z GUMY I TWORZYW SZTUCZNYCH;0.36760010049965536;63.0
88;POMOC SPOŁECZNA BEZ ZAKWATEROWANIA;0.3672712966784891;64.0
10;PRODUKCJA ARTYKUŁÓW SPOŻYWCZYCH;0.3664875201239215;65.0
25;PRODUKCJA METALOWYCH WYROBÓW GOTOWYCH, Z WYŁĄCZENIEM MASZYN I URZĄDZEŃ;0.3656421581777041;66.0
20;PRODUKCJA CHEMIKALIÓW I WYROBÓW CHEMICZNYCH;0.3643120167877271;67.0
32;POZOSTAŁA PRODUKCJA WYROBÓW;0.3640859233557301;68.0
35;WYTWARZANIE I ZAOPATRYWANIE W ENERGIĘ ELEKTRYCZNĄ, GAZ, PARĘ WODNĄ I POWIETRZE DO UKŁADÓW KLIMATYZACYJNYCH;0.3640277686560124;69.0
15;PRODUKCJA SKÓR I WYROBÓW ZE SKÓR WYPRAWIONYCH, PRODUKCJA PODOBNYCH WYROBÓW Z INNYCH MATERIAŁÓW;0.3637765011514211;70.0
95;NAPRAWA I KONSERWACJA KOMPUTERÓW, ARTYKUŁÓW UŻYTKU OSOBISTEGO I DOMOWEGO ORAZ POJAZDÓW SILNIKOWYCH, W TYM MOTOCYKLI;0.3633701783673863;71.0
33;NAPRAWA, KONSERWACJA I INSTALOWANIE MASZYN I URZĄDZEŃ;0.3624483788156948;72.0
78;DZIAŁALNOŚĆ ZWIĄZANA Z ZATRUDNIENIEM;0.36047775315594066;73.0
28;PRODUKCJA MASZYN I URZĄDZEŃ, GDZIE INDZIEJ NIESKLASYFIKOWANA;0.35990453547669315;74.0
50;TRANSPORT WODNY;0.3596550085147622;75.0
16;"PRODUKCJA WYROBÓW Z DREWNA I KORKA, Z WYŁĄCZENIEM MEBLI; PRODUKCJA WYROBÓW ZE SŁOMY I MATERIAŁÓW UŻYWANYCH DO WYPLATANIA";0.3543960502784047;76.0
29;PRODUKCJA POJAZDÓW SILNIKOWYCH, PRODUKCJA PRZYCZEP I NACZEP;0.35259346275284115;77.0
47;HANDEL DETALICZNY;0.3503409673721503;78.0
46;HANDEL HURTOWY;0.34921670081272993;79.0
49;TRANSPORT LĄDOWY ORAZ TRANSPORT RUROCIĄGOWY;0.3485289633060391;80.0
72;BADANIA NAUKOWE I PRACE ROZWOJOWE;0.3457038222807875;81.0
27;PRODUKCJA URZĄDZEŃ ELEKTRYCZNYCH;0.3439523431649174;82.0
12;PRODUKCJA WYROBÓW TYTONIOWYCH;0.3412976722386856;83.0
09;DZIAŁALNOŚĆ USŁUGOWA WSPOMAGAJĄCA GÓRNICTWO I WYDOBYWANIE;0.34117434912667394;84.0
75;DZIAŁALNOŚĆ WETERYNARYJNA;0.33243699954789885;85.0
24;PRODUKCJA METALI;0.32031055875572717;86.0
05;WYDOBYWANIE WĘGLA KAMIENNEGO I WĘGLA BRUNATNEGO (LIGNITU);0.1052418204965869;87.0
