alternative_id;nazwa;monte_carlo_score;monte_carlo_rank
77;WYNAJEM I DZIERŻAWA;0.6272605284098637;1.0
64;FINANSOWA DZIAŁALNOŚĆ USŁUGOWA, Z WYŁĄCZENIEM UBEZPIECZEŃ I FUNDUSZY EMERYTALNYCH;0.5998670548548153;2.0
61;TELEKOMUNIKACJA;0.5412475266935663;3.0
96;DZIAŁALNOŚĆ USŁUGOWA INDYWIDUALNA;0.538028841703403;4.0
94;DZIAŁALNOŚĆ ORGANIZACJI CZŁONKOWSKICH;0.5348317002624637;5.0
37;ODPROWADZANIE I OCZYSZCZANIE ŚCIEKÓW;0.5289292638116043;6.0
58;DZIAŁALNOŚĆ WYDAWNICZA;0.5232799315545398;7.0
08;POZOSTAŁE GÓRNICTWO I WYDOBYWANIE;0.5204469601766175;8.0
36;POBÓR, UZDATNIANIE I DOSTARCZANIE WODY;0.5145958877710255;9.0
63;DZIAŁALNOŚĆ USŁUGOWA W ZAKRESIE INFRASTRUKTURY OBLICZENIOWEJ, PRZETWARZANIA DANYCH, ZARZĄDZANIA STRONAMI INTERNETOWYMI (HOSTING) I POZOSTAŁA DZIAŁALNOŚĆ USŁUGOWA W ZAKRESIE INFORMACJI;0.5143993342569103;10.0
21;PRODUKCJA PODSTAWOWYCH SUBSTANCJI FARMACEUTYCZNYCH ORAZ LEKÓW I POZOSTAŁYCH WYROBÓW FARMACEUTYCZNYCH;0.5014635576020522;11.0
93;DZIAŁALNOŚĆ SPORTOWA, ROZRYWKOWA I REKREACYJNA;0.4974919444258169;12.0
01;UPRAWY ROLNE, CHÓW I HODOWLA ZWIERZĄT, ŁOWIECTWO, W TYM DZIAŁALNOŚĆ USŁUGOWA;0.49345476375788694;13.0
90;DZIAŁALNOŚĆ TWÓRCZA I DZIAŁALNOŚĆ ZWIĄZANA Z WYSTAWIANIEM PRZEDSTAWIEŃ ARTYSTYCZNYCH;0.4845267662084071;14.0
12;PRODUKCJA WYROBÓW TYTONIOWYCH;0.4838705639000848;15.0
55;ZAKWATEROWANIE;0.48318311857675555;16.0
60;NADAWANIE PROGRAMÓW OGÓLNODOSTĘPNYCH I ABONAMENTOWYCH, DZIAŁALNOŚĆ AGENCJI INFORMACYJNYCH I POZOSTAŁA DZIAŁALNOŚĆ ZWIĄZANA Z DYSTRYBUCJĄ TREŚCI;0.4807163385509325;17.0
38;DZIAŁALNOŚĆ ZWIĄZANA ZE ZBIERANIEM, ODZYSKIEM I UNIESZKODLIWIANIEM ODPADÓW;0.48004677918201283;18.0
69;DZIAŁALNOŚĆ PRAWNICZA, RACHUNKOWO-KSIĘGOWA I DORADZTWO PODATKOWE;0.4795330717276861;19.0
39;DZIAŁALNOŚĆ ZWIĄZANA Z REKULTYWACJĄ I POZOSTAŁA DZIAŁALNOŚĆ USŁUGOWA ZWIĄZANA Z GOSPODARKĄ ODPADAMI;0.47898304499095745;20.0
56;DZIAŁALNOŚĆ USŁUGOWA ZWIĄZANA Z WYŻYWIENIEM;0.4770281535228154;21.0
35;WYTWARZANIE I ZAOPATRYWANIE W ENERGIĘ ELEKTRYCZNĄ, GAZ, PARĘ WODNĄ I POWIETRZE DO UKŁADÓW KLIMATYZACYJNYCH;0.47642831002013675;22.0
82;DZIAŁALNOŚĆ ZWIĄZANA Z ADMINISTRACYJNĄ OBSŁUGĄ BIURA I POZOSTAŁA DZIAŁALNOŚĆ WSPOMAGAJĄCA PROWADZENIE DZIAŁALNOŚCI GOSPODARCZEJ;0.47183517965607624;23.0
87;POMOC SPOŁECZNA Z ZAKWATEROWANIEM;0.4696933829589164;24.0
23;PRODUKCJA WYROBÓW Z POZOSTAŁYCH MINERALNYCH SUROWCÓW NIEMETALICZNYCH;0.46830321193288843;25.0
91;DZIAŁALNOŚĆ BIBLIOTEK, ARCHIWÓW, MUZEÓW ORAZ POZOSTAŁA DZIAŁALNOŚĆ ZWIĄZANA Z KULTURĄ;0.4667801494864026;26.0
19;WYTWARZANIE I PRZETWARZANIE KOKSU I PRODUKTÓW RAFINACJI ROPY NAFTOWEJ;0.466273953076785;27.0
17;PRODUKCJA PAPIERU I WYROBÓW Z PAPIERU;0.4658671840471517;28.0
59;DZIAŁALNOŚĆ ZWIĄZANA Z PRODUKCJĄ FILMÓW, NAGRAŃ WIDEO, PROGRAMÓW TELEWIZYJNYCH, NAGRAŃ DŹWIĘKOWYCH I MUZYCZNYCH;0.46470266501736823;29.0
11;PRODUKCJA NAPOJÓW;0.46194955630994006;30.0
66;DZIAŁALNOŚĆ WSPOMAGAJĄCA USŁUGI FINANSOWE, UBEZPIECZENIA I FUNDUSZE EMERYTALNE;0.45957326103402824;31.0
22;PRODUKCJA WYROBÓW Z GUMY I TWORZYW SZTUCZNYCH;0.4582182916853533;32.0
13;PRODUKCJA WYROBÓW TEKSTYLNYCH;0.4576069691099748;33.0
85;EDUKACJA;0.4572445502187119;34.0
20;PRODUKCJA CHEMIKALIÓW I WYROBÓW CHEMICZNYCH;0.457043195365351;35.0
86;OPIEKA ZDROWOTNA;0.45697409038053516;36.0
70;DZIAŁALNOŚĆ CENTRAL (HEAD OFFICES) ORAZ DORADZTWO ZWIĄZANE Z ZARZĄDZANIEM;0.45504223254948184;37.0
02;LEŚNICTWO I POZYSKIWANIE DREWNA;0.454200812130186;38.0
18;POLIGRAFIA I REPRODUKCJA ZAPISANYCH NOŚNIKÓW INFORMACJI;0.4529832566344825;39.0
14;PRODUKCJA ODZIEŻY;0.4507474326469742;40.0
68;DZIAŁALNOŚĆ ZWIĄZANA Z OBSŁUGĄ RYNKU NIERUCHOMOŚCI;0.45062976796447685;41.0
65;DZIAŁALNOŚĆ W ZAKRESIE UBEZPIECZEŃ, REASEKURACJI ORAZ FUNDUSZY EMERYTALNYCH, Z WYŁĄCZENIEM OBOWIĄZKOWEGO UBEZPIECZENIA SPOŁECZNEGO;0.4504938983604462;42.0
32;POZOSTAŁA PRODUKCJA WYROBÓW;0.4503709287380328;43.0
52;MAGAZYNOWANIE, PRZECHOWYWANIE I DZIAŁALNOŚĆ USŁUGOWA WSPOMAGAJĄCA TRANSPORT;0.4462946322482816;44.0
31;PRODUKCJA MEBLI;0.4460971857147485;45.0
53;DZIAŁALNOŚĆ POCZTOWA I KURIERSKA;0.44511263662419215;46.0
16;"PRODUKCJA WYROBÓW Z DREWNA I KORKA, Z WYŁĄCZENIEM MEBLI; PRODUKCJA WYROBÓW ZE SŁOMY I MATERIAŁÓW UŻYWANYCH DO WYPLATANIA";0.4447262657851614;47.0
74;POZOSTAŁA DZIAŁALNOŚĆ PROFESJONALNA, NAUKOWA I TECHNICZNA;0.4445438935502917;48.0
79;DZIAŁALNOŚĆ ORGANIZATORÓW TURYSTYKI, AGENTÓW TURYSTYCZNYCH ORAZ POZOSTAŁA DZIAŁALNOŚĆ USŁUGOWA W ZAKRESIE REZERWACJI I DZIAŁALNOŚCI Z NIĄ ZWIĄZANE;0.44437330863846847;49.0
75;DZIAŁALNOŚĆ WETERYNARYJNA;0.4433878160204582;50.0
03;RYBACTWO;0.4423884029231021;51.0
84;"ADMINISTRACJA PUBLICZNA I OBRONA NARODOWA; OBOWIĄZKOWE UBEZPIECZENIA SPOŁECZNE";0.441828609269178;52.0
42;ROBOTY ZWIĄZANE Z BUDOWĄ OBIEKTÓW INŻYNIERII LĄDOWEJ I WODNEJ;0.4409490699020965;53.0
62;DZIAŁALNOŚĆ ZWIĄZANA Z PROGRAMOWANIEM, DORADZTWEM W ZAKRESIE INFORMATYKI I DZIAŁALNOŚCI POWIĄZANE;0.4396529699327179;54.0
10;PRODUKCJA ARTYKUŁÓW SPOŻYWCZYCH;0.43961081702952765;55.0
43;ROBOTY BUDOWLANE SPECJALISTYCZNE;0.437620243754999;56.0
49;TRANSPORT LĄDOWY ORAZ TRANSPORT RUROCIĄGOWY;0.4354282609253325;57.0
81;DZIAŁALNOŚĆ USŁUGOWA ZWIĄZANA Z UTRZYMANIEM PORZĄDKU W BUDYNKACH I ZAGOSPODAROWANIEM TERENÓW ZIELENI;0.43458162021544366;58.0
15;PRODUKCJA SKÓR I WYROBÓW ZE SKÓR WYPRAWIONYCH, PRODUKCJA PODOBNYCH WYROBÓW Z INNYCH MATERIAŁÓW;0.43359985992461636;59.0
07;GÓRNICTWO RUD METALI;0.4320577153219615;60.0
06;GÓRNICTWO ROPY NAFTOWEJ I GAZU ZIEMNEGO;0.43124642564665344;61.0
26;PRODUKCJA KOMPUTERÓW, WYROBÓW ELEKTRONICZNYCH I OPTYCZNYCH;0.4310415823294922;62.0
99;ORGANIZACJE I ZESPOŁY EKSTERYTORIALNE;0.42767323674609925;63.0
97;GOSPODARSTWA DOMOWE ZATRUDNIAJĄCE PRACOWNIKÓW;0.42733311552337383;64.0
98;GOSPODARSTWA DOMOWE PRODUKUJĄCE WYROBY I ŚWIADCZĄCE USŁUGI NA WŁASNE POTRZEBY;0.4273006056102769;65.0
27;PRODUKCJA URZĄDZEŃ ELEKTRYCZNYCH;0.4261600782899667;66.0
25;PRODUKCJA METALOWYCH WYROBÓW GOTOWYCH, Z WYŁĄCZENIEM MASZYN I URZĄDZEŃ;0.4255241826379693;67.0
28;PRODUKCJA MASZYN I URZĄDZEŃ, GDZIE INDZIEJ NIESKLASYFIKOWANA;0.4243179542017094;68.0
29;PRODUKCJA POJAZDÓW SILNIKOWYCH, PRODUKCJA PRZYCZEP I NACZEP;0.4240383073011828;69.0
30;PRODUKCJA POZOSTAŁEGO SPRZĘTU TRANSPORTOWEGO;0.42158573214553363;70.0
71;"DZIAŁALNOŚĆ W ZAKRESIE ARCHITEKTURY I INŻYNIERII; BADANIA I ANALIZY TECHNICZNE";0.4212492604879499;71.0
95;NAPRAWA I KONSERWACJA KOMPUTERÓW, ARTYKUŁÓW UŻYTKU OSOBISTEGO I DOMOWEGO ORAZ POJAZDÓW SILNIKOWYCH, W TYM MOTOCYKLI;0.4205880513610801;72.0
92;DZIAŁALNOŚĆ ZWIĄZANA Z GRAMI HAZARDOWYMI;0.41768726626313446;73.0
51;TRANSPORT LOTNICZY;0.41535467628625095;74.0
33;NAPRAWA, KONSERWACJA I INSTALOWANIE MASZYN I URZĄDZEŃ;0.41477096462062174;75.0
41;ROBOTY BUDOWLANE ZWIĄZANE ZE WZNOSZENIEM BUDYNKÓW MIESZKALNYCH I NIEMIESZKALNYCH;0.413609522411495;76.0
73;DZIAŁALNOŚĆ W ZAKRESIE REKLAMY, BADANIA RYNKU I PUBLIC RELATIONS;0.411720811055494;77.0
50;TRANSPORT WODNY;0.4100509661385359;78.0
47;HANDEL DETALICZNY;0.40790943004989944;79.0
80;DZIAŁALNOŚĆ DETEKTYWISTYCZNA I OCHRONIARSKA;0.4069385800464459;80.0
78;DZIAŁALNOŚĆ ZWIĄZANA Z ZATRUDNIENIEM;0.4048180014309498;81.0
88;POMOC SPOŁECZNA BEZ ZAKWATEROWANIA;0.4046450501291212;82.0
46;HANDEL HURTOWY;0.40311271415930144;83.0
24;PRODUKCJA METALI;0.3938038693160705;84.0
72;BADANIA NAUKOWE I PRACE ROZWOJOWE;0.386163919992503;85.0
09;DZIAŁALNOŚĆ USŁUGOWA WSPOMAGAJĄCA GÓRNICTWO I WYDOBYWANIE;0.3670067804382037;86.0
05;WYDOBYWANIE WĘGLA KAMIENNEGO I WĘGLA BRUNATNEGO (LIGNITU);0.20727964618084269;87.0
