alternative_id;nazwa;ensemble_score;ensemble_rank
94;DZIAŁALNOŚĆ ORGANIZACJI CZŁONKOWSKICH;0.6197846630152244;1.0
09;DZIAŁALNOŚĆ USŁUGOWA WSPOMAGAJĄCA GÓRNICTWO I WYDOBYWANIE;0.5434905157575913;2.0
05;WYDOBYWANIE WĘGLA KAMIENNEGO I WĘGLA BRUNATNEGO (LIGNITU);0.37544322602105284;3.0
92;DZIAŁALNOŚĆ ZWIĄZANA Z GRAMI HAZARDOWYMI;0.3716628301913789;4.0
64;FINANSOWA DZIAŁALNOŚĆ USŁUGOWA, Z WYŁĄCZENIEM UBEZPIECZEŃ I FUNDUSZY EMERYTALNYCH;0.371541583470458;5.0
93;DZIAŁALNOŚĆ SPORTOWA, ROZRYWKOWA I REKREACYJNA;0.3548682526435427;6.0
55;ZAKWATEROWANIE;0.34385588722795196;7.0
91;DZIAŁALNOŚĆ BIBLIOTEK, ARCHIWÓW, MUZEÓW ORAZ POZOSTAŁA DZIAŁALNOŚĆ ZWIĄZANA Z KULTURĄ;0.3241652386577081;8.0
90;DZIAŁALNOŚĆ TWÓRCZA I DZIAŁALNOŚĆ ZWIĄZANA Z WYSTAWIANIEM PRZEDSTAWIEŃ ARTYSTYCZNYCH;0.3190289473329494;9.0
77;WYNAJEM I DZIERŻAWA;0.2954140998164234;10.0
85;EDUKACJA;0.2864555985929436;11.0
51;TRANSPORT LOTNICZY;0.28174151628091765;12.0
02;LEŚNICTWO I POZYSKIWANIE DREWNA;0.2803895357791936;13.0
19;WYTWARZANIE I PRZETWARZANIE KOKSU I PRODUKTÓW RAFINACJI ROPY NAFTOWEJ;0.2798250241588638;14.0
82;DZIAŁALNOŚĆ ZWIĄZANA Z ADMINISTRACYJNĄ OBSŁUGĄ BIURA I POZOSTAŁA DZIAŁALNOŚĆ WSPOMAGAJĄCA PROWADZENIE DZIAŁALNOŚCI GOSPODARCZEJ;0.2742584196677854;15.0
66;DZIAŁALNOŚĆ WSPOMAGAJĄCA USŁUGI FINANSOWE, UBEZPIECZENIA I FUNDUSZE EMERYTALNE;0.27321328080804236;16.0
43;ROBOTY BUDOWLANE SPECJALISTYCZNE;0.27177449057544995;17.0
18;POLIGRAFIA I REPRODUKCJA ZAPISANYCH NOŚNIKÓW INFORMACJI;0.265719893157156;18.0
56;DZIAŁALNOŚĆ USŁUGOWA ZWIĄZANA Z WYŻYWIENIEM;0.26281850160447284;19.0
96;DZIAŁALNOŚĆ USŁUGOWA INDYWIDUALNA;0.26176000759520335;20.0
01;UPRAWY ROLNE, CHÓW I HODOWLA ZWIERZĄT, ŁOWIECTWO, W TYM DZIAŁALNOŚĆ USŁUGOWA;0.2600642557173259;21.0
52;MAGAZYNOWANIE, PRZECHOWYWANIE I DZIAŁALNOŚĆ USŁUGOWA WSPOMAGAJĄCA TRANSPORT;0.25700024859628373;22.0
68;DZIAŁALNOŚĆ ZWIĄZANA Z OBSŁUGĄ RYNKU NIERUCHOMOŚCI;0.256332835764825;23.0
79;DZIAŁALNOŚĆ ORGANIZATORÓW TURYSTYKI, AGENTÓW TURYSTYCZNYCH ORAZ POZOSTAŁA DZIAŁALNOŚĆ USŁUGOWA W ZAKRESIE REZERWACJI I DZIAŁALNOŚCI Z NIĄ ZWIĄZANE;0.2552881836128387;24.0
70;DZIAŁALNOŚĆ CENTRAL (HEAD OFFICES) ORAZ DORADZTWO ZWIĄZANE Z ZARZĄDZANIEM;0.25294857026808704;25.0
03;RYBACTWO;0.2522724025847428;26.0
95;NAPRAWA I KONSERWACJA KOMPUTERÓW, ARTYKUŁÓW UŻYTKU OSOBISTEGO I DOMOWEGO ORAZ POJAZDÓW SILNIKOWYCH, W TYM MOTOCYKLI;0.2516772639210792;27.0
50;TRANSPORT WODNY;0.2508175728636179;28.0
59;DZIAŁALNOŚĆ ZWIĄZANA Z PRODUKCJĄ FILMÓW, NAGRAŃ WIDEO, PROGRAMÓW TELEWIZYJNYCH, NAGRAŃ DŹWIĘKOWYCH I MUZYCZNYCH;0.24886428096075042;29.0
11;PRODUKCJA NAPOJÓW;0.2484460982007797;30.0
80;DZIAŁALNOŚĆ DETEKTYWISTYCZNA I OCHRONIARSKA;0.24704923778116755;31.0
60;NADAWANIE PROGRAMÓW OGÓLNODOSTĘPNYCH I ABONAMENTOWYCH, DZIAŁALNOŚĆ AGENCJI INFORMACYJNYCH I POZOSTAŁA DZIAŁALNOŚĆ ZWIĄZANA Z DYSTRYBUCJĄ TREŚCI;0.24468654204275614;32.0
88;POMOC SPOŁECZNA BEZ ZAKWATEROWANIA;0.23984796336682607;33.0
84;"ADMINISTRACJA PUBLICZNA I OBRONA NARODOWA; OBOWIĄZKOWE UBEZPIECZENIA SPOŁECZNE";0.23940912060730396;34.0
07;GÓRNICTWO RUD METALI;0.23890266065338334;35.0
99;ORGANIZACJE I ZESPOŁY EKSTERYTORIALNE;0.2382634366255832;36.0
98;GOSPODARSTWA DOMOWE PRODUKUJĄCE WYROBY I ŚWIADCZĄCE USŁUGI NA WŁASNE POTRZEBY;0.23815972213635403;37.0
97;GOSPODARSTWA DOMOWE ZATRUDNIAJĄCE PRACOWNIKÓW;0.238084998109589;38.0
65;DZIAŁALNOŚĆ W ZAKRESIE UBEZPIECZEŃ, REASEKURACJI ORAZ FUNDUSZY EMERYTALNYCH, Z WYŁĄCZENIEM OBOWIĄZKOWEGO UBEZPIECZENIA SPOŁECZNEGO;0.2377397291521295;39.0
33;NAPRAWA, KONSERWACJA I INSTALOWANIE MASZYN I URZĄDZEŃ;0.237253366067892;40.0
06;GÓRNICTWO ROPY NAFTOWEJ I GAZU ZIEMNEGO;0.23719285381467006;41.0
49;TRANSPORT LĄDOWY ORAZ TRANSPORT RUROCIĄGOWY;0.23469304053176362;42.0
78;DZIAŁALNOŚĆ ZWIĄZANA Z ZATRUDNIENIEM;0.23436009762994664;43.0
41;ROBOTY BUDOWLANE ZWIĄZANE ZE WZNOSZENIEM BUDYNKÓW MIESZKALNYCH I NIEMIESZKALNYCH;0.2332045066444423;44.0
27;PRODUKCJA URZĄDZEŃ ELEKTRYCZNYCH;0.23281256743642997;45.0
10;PRODUKCJA ARTYKUŁÓW SPOŻYWCZYCH;0.2322977068179631;46.0
30;PRODUKCJA POZOSTAŁEGO SPRZĘTU TRANSPORTOWEGO;0.2322836272298644;47.0
62;DZIAŁALNOŚĆ ZWIĄZANA Z PROGRAMOWANIEM, DORADZTWEM W ZAKRESIE INFORMATYKI I DZIAŁALNOŚCI POWIĄZANE;0.23069743246772634;48.0
28;PRODUKCJA MASZYN I URZĄDZEŃ, GDZIE INDZIEJ NIESKLASYFIKOWANA;0.23036444156337063;49.0
24;PRODUKCJA METALI;0.22950017052343463;50.0
25;PRODUKCJA METALOWYCH WYROBÓW GOTOWYCH, Z WYŁĄCZENIEM MASZYN I URZĄDZEŃ;0.22923500315045697;51.0
31;PRODUKCJA MEBLI;0.22914536438501687;52.0
37;ODPROWADZANIE I OCZYSZCZANIE ŚCIEKÓW;0.22839793390222615;53.0
81;DZIAŁALNOŚĆ USŁUGOWA ZWIĄZANA Z UTRZYMANIEM PORZĄDKU W BUDYNKACH I ZAGOSPODAROWANIEM TERENÓW ZIELENI;0.2274302019957209;54.0
36;POBÓR, UZDATNIANIE I DOSTARCZANIE WODY;0.2257929473304084;55.0
53;DZIAŁALNOŚĆ POCZTOWA I KURIERSKA;0.22565848279556225;56.0
42;ROBOTY ZWIĄZANE Z BUDOWĄ OBIEKTÓW INŻYNIERII LĄDOWEJ I WODNEJ;0.22525872199206812;57.0
87;POMOC SPOŁECZNA Z ZAKWATEROWANIEM;0.22515501110178382;58.0
29;PRODUKCJA POJAZDÓW SILNIKOWYCH, PRODUKCJA PRZYCZEP I NACZEP;0.22509266722249371;59.0
46;HANDEL HURTOWY;0.22464299207621408;60.0
26;PRODUKCJA KOMPUTERÓW, WYROBÓW ELEKTRONICZNYCH I OPTYCZNYCH;0.22412248692257744;61.0
14;PRODUKCJA ODZIEŻY;0.22346840570333956;62.0
12;PRODUKCJA WYROBÓW TYTONIOWYCH;0.2221580929302957;63.0
71;"DZIAŁALNOŚĆ W ZAKRESIE ARCHITEKTURY I INŻYNIERII; BADANIA I ANALIZY TECHNICZNE";0.2220109311507527;64.0
38;DZIAŁALNOŚĆ ZWIĄZANA ZE ZBIERANIEM, ODZYSKIEM I UNIESZKODLIWIANIEM ODPADÓW;0.22135662902076852;65.0
47;HANDEL DETALICZNY;0.22134613501246503;66.0
35;WYTWARZANIE I ZAOPATRYWANIE W ENERGIĘ ELEKTRYCZNĄ, GAZ, PARĘ WODNĄ I POWIETRZE DO UKŁADÓW KLIMATYZACYJNYCH;0.22103952110235103;67.0
69;DZIAŁALNOŚĆ PRAWNICZA, RACHUNKOWO-KSIĘGOWA I DORADZTWO PODATKOWE;0.22021034182280264;68.0
13;PRODUKCJA WYROBÓW TEKSTYLNYCH;0.21941404555038357;69.0
08;POZOSTAŁE GÓRNICTWO I WYDOBYWANIE;0.21915306142147342;70.0
61;TELEKOMUNIKACJA;0.2190449641582358;71.0
22;PRODUKCJA WYROBÓW Z GUMY I TWORZYW SZTUCZNYCH;0.21864122247663179;72.0
72;BADANIA NAUKOWE I PRACE ROZWOJOWE;0.21749925071174128;73.0
73;DZIAŁALNOŚĆ W ZAKRESIE REKLAMY, BADANIA RYNKU I PUBLIC RELATIONS;0.21606848034353243;74.0
20;PRODUKCJA CHEMIKALIÓW I WYROBÓW CHEMICZNYCH;0.21594415683278895;75.0
32;POZOSTAŁA PRODUKCJA WYROBÓW;0.21459563089863062;76.0
21;PRODUKCJA PODSTAWOWYCH SUBSTANCJI FARMACEUTYCZNYCH ORAZ LEKÓW I POZOSTAŁYCH WYROBÓW FARMACEUTYCZNYCH;0.2132761565699519;77.0
16;"PRODUKCJA WYROBÓW Z DREWNA I KORKA, Z WYŁĄCZENIEM MEBLI; PRODUKCJA WYROBÓW ZE SŁOMY I MATERIAŁÓW UŻYWANYCH DO WYPLATANIA";0.2116512663159373;78.0
86;OPIEKA ZDROWOTNA;0.21111479480052184;79.0
23;PRODUKCJA WYROBÓW Z POZOSTAŁYCH MINERALNYCH SUROWCÓW NIEMETALICZNYCH;0.20879086865042035;80.0
17;PRODUKCJA PAPIERU I WYROBÓW Z PAPIERU;0.2084748858051497;81.0
74;POZOSTAŁA DZIAŁALNOŚĆ PROFESJONALNA, NAUKOWA I TECHNICZNA;0.2029169717811125;82.0
15;PRODUKCJA SKÓR I WYROBÓW ZE SKÓR WYPRAWIONYCH, PRODUKCJA PODOBNYCH WYROBÓW Z INNYCH MATERIAŁÓW;0.19382329226930126;83.0
75;DZIAŁALNOŚĆ WETERYNARYJNA;0.1915792741982842;84.0
58;DZIAŁALNOŚĆ WYDAWNICZA;0.18946667565835157;85.0
39;DZIAŁALNOŚĆ ZWIĄZANA Z REKULTYWACJĄ I POZOSTAŁA DZIAŁALNOŚĆ USŁUGOWA ZWIĄZANA Z GOSPODARKĄ ODPADAMI;0.18833787792131557;86.0
63;DZIAŁALNOŚĆ USŁUGOWA W ZAKRESIE INFRASTRUKTURY OBLICZENIOWEJ, PRZETWARZANIA DANYCH, ZARZĄDZANIA STRONAMI INTERNETOWYMI (HOSTING) I POZOSTAŁA DZIAŁALNOŚĆ USŁUGOWA W ZAKRESIE INFORMACJI;0.1662989582111382;87.0
